,Unnamed: 0,X,category,key,sentences,senti,score1,score2,score3
67801,67802,67802,단어,단어,' 영화 정보 서비스 ' △ 영어 단어 발음 스펠링 검색을 할 수 있는 ',중립,100,0,0
67914,67915,67915,데이터,데이터,카카오미니로 목소리가 인식되면 그 목소리를 연산하여기존 데이터 베이스에 비교해서 처리또는사람이 처리 하는 방식입니다,중립,100,0,0
67915,67916,67916,데이터,데이터,마쳤고 전에 측정한 프렌즈도 데이터가 있으니 한번 데이터 비교를 통해 출력과 스피커 성능의 상관관계를 확실하게,긍정,100,0.067398038962623,1.2175451482165
67916,67917,67917,데이터,데이터,파란색이 프렌즈의 데이터 빨간색이 카카오미니의 데이터입니다,중립,100,0,0
67917,67918,67918,데이터,데이터,그래서 핸드폰의 데이터 테더링을 켜서 핸드폰의 데이터를 써볼려고 했으나 실패,부정,100,-0.038682094577617,-0.46144781144781
67918,67919,67919,데이터,데이터,가장 기본적인 핵심 요소인 스피커의 성능 사용시간 데이터 사용,중립,100,0,0
67919,67920,67920,데이터,데이터,저는 무제한 데이터 요금제를 사용하기에 문제 없지만 데이터 사용은 누구,중립,100,0,0
67920,67921,67921,데이터,데이터,저는 무제한 데이터 요금제를 사용하기에 문제 없지만 데이터 사용은 누구 미니 사용시에 필수 요소이기에제한적 데이터요금제를,부정,100,-0.060730240596891,-0.89770909397244
67921,67922,67922,데이터,데이터,/ 앱 연동 / 비만도 확인 / 데이터 관리 믿을 수 없는 쇼핑 찬스,긍정,50.746268656716,0.087591678859032,0.34725587204579
67922,67923,67923,데이터,데이터,/ 앱 연동 / 비만도 확인 / 데이터 관리 : Home Appliances 싱가폴 일본 한국,중립,100,0,0
67923,67924,67924,데이터,데이터,대화형태가 저장되어 있는 누구 미니를 사용하려면 역시 데이터 부담없는 와이파이가 최고이지 않을까 싶네요,부정,66.336633663366,0.001579963401135,-0.20227478484088
67924,67925,67925,데이터,데이터,아직까지는 데이터,중립,100,0,0
67925,67926,67926,데이터,데이터,에그 등의 휴대용 데이터 공유기가 별도로 있어야 사용 가능하다,긍정,100,0.1376501461711,1.1420174958994
67926,67927,67927,데이터,데이터,카카오미니를 사용하려면스마트폰의 블루투스 데이터 연결이되어야 하므로 먼저 연결을 해주고,중립,100,0,0
67927,67928,67928,데이터,데이터,' 음악 틀어줘 ' 라고명령어를 던지면 멜론 데이터 기반으로 내가 좋아 할 만한 노래를 알아서,긍정,100,0.17541568891852,1.181282012299
67928,67929,67929,데이터,데이터,설치된 와이파이를 이용하기 때문에 데이터 걱정은없는데요,부정,100,-0.1946016247903,-0.99196692022414
67929,67930,67930,데이터,데이터,또한 향후에는 입주민 데이터 분석을 통해 생활패턴을 반영한 연계 서비스를 구현할것이라고,중립,100,0,0
67930,67931,67931,데이터,데이터,마지막으로 외부에서 테더링을 이용한 사용시 지출되는 데이터 사용량,중립,100,0,0
67931,67932,67932,데이터,데이터,또 멜론 음악 데이터 베이스와 카카오의 기술이 만나 카카오미니 이용자들의 음악,중립,100,0,0
67932,67933,67933,데이터,데이터,말이죠 ^ ^ 저희 같은 경우는 무제한 데이터 요금제로 맘껏 테더링하며 스마트 기능을 즐길 수,긍정,100,0.077886904105677,1.1382661198451
67933,67934,67934,데이터,데이터,잘 안되신다면 데이터 끄고 해보세요,중립,100,0,0
67934,67935,67935,데이터,데이터,데이터,NA,NA,NA,NA
67935,67936,67936,데이터,데이터,빅데이터,NA,NA,NA,NA
67937,67938,67938,데이터,데이터,인공지능스피커이니 전 무조건 마음에 쏙든답니다 세번째 - 데이터 사용에 대하여 사실 여러가지 기능을 활용하기 위해서는,중립,100,0,0
67938,67939,67939,데이터,데이터,와이파이 환경에 있는 곳이라면 어디서나 별도 데이터 걱정없이 사용활 수 있습니다,부정,100,-0.029049293456073,-0.6441596619356
67939,67940,67940,데이터,데이터,누구 미니의 경우에도 외부에서 사용 할 경우 데이터 사용은 필수인데요,중립,100,0,0
67940,67941,67941,데이터,데이터,때문에 데이터 사용량 걱정을 하는 분들이 있는데 음악을 스트리밍으로,부정,100,-0.060334476843911,-0.74919466175794
67941,67942,67942,데이터,데이터,하는 분들이 있는데 음악을 스트리밍으로 듣지만 않는다면 데이터 사용량은 생각보다 높지 않습니다,부정,100,-0.051403318745306,-1.1556004406246
67942,67943,67943,데이터,데이터,있다면 누구에게 말을 걸고 답변을 들을 때의 데이터 통화료가 부과되지 않는다고 하며 멜론 / 멜론,부정,100,-0.057899537357106,-1.0477759528555
67943,67944,67944,데이터,데이터,라디오 데일리 브리핑 ( 뉴스 ) 의 데이터 통화료는 부과가 된다고 합니다,중립,100,0,0
67944,67945,67945,데이터,데이터,익스트리밍 플러스 요금제를 사용하는 경우에는 해당 요금제의 데이터 통화료 정책과 동일하게 적용된다고 하네요,중립,100,0,0
67945,67946,67946,데이터,데이터,때문에 와이파이가 무료로 되지 않는 환경에서 데이터 걱정이 많이 된다면 데이터 무제한 요금제를 사용하거나,부정,100,-0.097894729764694,-0.91711615058039
67946,67947,67947,데이터,데이터,되지 않는 환경에서 데이터 걱정이 많이 된다면 데이터 무제한 요금제를 사용하거나 포켓파이나 에그 같은 별도의,부정,100,-0.081625811219349,-0.85218108564533
67947,67948,67948,데이터,데이터,이 또한 네이버의 방대한 외국어 사전 데이터 베이스 덕분인데요,긍정,100,0.11807184750733,1.2613636363636
67948,67949,67949,데이터,데이터,마찬가지로 카카오 ( 다음 ) 의 방대한 데이터 베이스를 통해 다양한 서비스를 제공합니다,중립,100,0,0
67949,67950,67950,데이터,데이터,활용한 다양한 컨텐츠 감상은 물론 핫스팟을 통한 데이터 공유기능 그리고 와이파이 활용까지,긍정,100,0.11806891259156,1.765664160401
67950,67951,67951,데이터,데이터,이럴땐 Wi-Fi 를 활용해서 데이터 걱정까지 노우,부정,100,-0.086336187966623,-1.0435445387063
67951,67952,67952,데이터,데이터,이 요금제와 더불어 KT LTE 스마트폰 요금제인 데이터 ON,중립,100,0,0
67954,67955,67955,데이터,데이터,데이터 사용은,중립,100,0,0
67955,67956,67956,데이터,데이터,데이터 요금 부분에서 가장,중립,100,0,0
67956,67957,67957,데이터,데이터,근데 신랑이 데이터 무제한 ㅋㅋㅋ 와이파이가 없는 곳에서는 신랑 무제한,부정,100,-0.017094017094017,-0.50904977375566
67957,67958,67958,데이터,데이터,구성품은 누구 미니 본체 데이터 케이블 간단 사용 설명서가들어있습니다,중립,100,0,0
67958,67959,67959,데이터,데이터,스피커이기 때문이지만 다양한 자료들을 인터넷환경에서 얻어오기 때문에 데이터 사용이 무조건 필요하기 때문이다,긍정,100,0.13040001946551,2.2256002725171
67959,67960,67960,데이터,데이터,데이터 사용이 무조건 필요하기 때문이다,중립,100,0,0
67960,67961,67961,데이터,데이터,+ 추가로 데이터 사용량이 사실 그렇게 많은 것은 아니다,중립,100,-0.00441441797374,0.14545454545455
67961,67962,67962,데이터,데이터,일반적인 사용자의 휴대폰 데이터 사용의 대부부은 FacebookYoutube 와 같은 영상이 재생되는,중립,100,0,0
67962,67963,67963,데이터,데이터,형식의 플래시파일들이 쉬도없이 데이터를 왔다갔다 하기 때문에 데이터 소모량이 많은 것이다,긍정,100,0.069985227932271,1.3251925785041
67963,67964,67964,데이터,데이터,이 제품은 LTE 기반인 만큼 데이터 요금제 가입이 필요하다,중립,100,0,0
67964,67965,67965,데이터,데이터,스마트폰 데이터를 공유해 쓸 수 있습니다,중립,100,0,0
67965,67966,67966,데이터,데이터,출시 가격은 26 만 4000 원이며 LTE 데이터 요금제 가입 후 공시지원금을 받으면 실 구매가는,중립,100,0,0
67966,67967,67967,데이터,데이터,월 1 만원대에 데이터 10GB 를 제공할 것으로 예상하고 있습니다,중립,100,0,0
70875,70876,70876,휴대,휴대,카카오미니와는 달리 내장배터리가 들어있어 휴대 가능하다는 장점,긍정,100,0.2256695915081,1.0478260869565
70876,70877,70877,휴대,휴대,무게는 약 219g 정도로 상당히 작은 사이즈로 휴대 또한 간편하게 할 수 있는데요,중립,100,0,0
70877,70878,70878,휴대,휴대,그래서 한손에 들어올만큼 가볍고 작아서 휴대 및 사용성이 좋은 제품입니다,긍정,100,0.12092627272878,1.3301890000166
70878,70879,70879,휴대,휴대,클로바 인공지능 스피커 프렌즈의 기능 휴대 가능이 카카오 미니에 비해선 가장 큰 장점이라,긍정,100,0.17220573966264,1.4804597701149
70879,70880,70880,휴대,휴대,배터리를 내장하지 않아 휴대 해서 사용할 수 없다,부정,100,-0.17408681898818,-0.93444666001994
70880,70881,70881,휴대,휴대,그리고 보이스 컨트롤 블루투스 연결 휴대 가능 등 휴대용 블루투스 스피커로도 사용할 수,긍정,100,0.068585665291515,1.1420174958994
70881,70882,70882,휴대,휴대,휴대,NA,NA,NA,NA
70882,70883,70883,휴대,휴대,휴대 불가능이 카카오 미니의 큰 단점인듯싶다 ㅜ 나중에,부정,100,-0.087460979086595,-0.92536773571256
70883,70884,70884,아들,아들,아들 녀석이 계속해서 이런 저런 음악을 찾아 듣는,중립,100,0,0
70884,70885,70885,아들,아들,봐요 ㅎㅎ 말귀를 못 알아 먹으니 울 아들 삐져서 가요 ㅎㅎㅎ 노래 틀어달라는거라 노래 꺼,중립,100,0,0
70885,70886,70886,아들,아들,내가 불러도 큰아들 둘째 아들 막내아들이 불러도 바로 응답한다,중립,100,0,0
70886,70887,70887,아들,아들,아침에 일어나자마자 누구를 찾고아리아 라고 부르는 아들 모습을보면서 무척 흐믓한 요즘이에요,중립,100,0,0
70887,70888,70888,아들,아들,아들 : 아빠,NA,NA,NA,NA
70888,70889,70889,아들,아들,아들 : 치 그게 뭐야,중립,100,0,0
70889,70890,70890,아들,아들,' ㅎㅎ 우리 아들 잘 부르죠,중립,100,0,0
70890,70891,70891,아들,아들,주문한지 하루만에 도착한 미니언 깔끔한 패키지 아들 유치원 하원후 직접 개봉하게 해주었지요 짜잔,부정,100,0.021100979681125,-0.077851501966218
70891,70892,70892,아들,아들,^ ^ 떨어지면 고장나니 조심하랬더니 미리부터 걱정하는 아들 고장나면 꼭 새로 사달랍니다,부정,66.105197891909,-0.067343839892452,-0.27584510736066
70892,70893,70893,아들,아들,밥 먹어야하는 경우가 있는데클로바가 동화를 읽어주네요 이건 아들 유치원 갔을때 저 혼자 소파에서 휴식을 취하며,부정,100,0.065771202593699,0.7872651053332
71032,71033,71033,설치,설치,위 사진은 LG 휘센 씽큐 에어컨 설치 당시에 흡입구 전체를 커버하는 풀 - 커버필터,중립,100,0,0
71033,71034,71034,설치,설치,앱스토어에서 헤이카카오앱 설치 후 카카오미니의 네트워크 및 카톡연동 설정해주면 모든,중립,100,0,0
71034,71035,71035,설치,설치,구매팁 공유해요멜론 - 카카오 계정 연동 필수카카오톡 설치 필수 ( 카카오미니가 판매되는 선물하기는 카카오톡에 있으니까요,긍정,100,0.035924369747899,1.0714285714286
71035,71036,71036,설치,설치,보니깐 스마트폰에서 ' 헤이 카카오 ' 앱을 설치 한 다음 카카오 미니와 연동해 사용하면 된다고,중립,100,0,0
71036,71037,71037,설치,설치,당황할 수 있음 ㅋ 사실 앱 설치 후에는진도가 쭉,중립,100,0,0
71037,71038,71038,설치,설치,직접 들어봐야 하기 때문에 동영상으로 언박싱 과정 설치 과정 그리고 미니언즈와 대화를 하는 모습을 담아봤습니다,중립,100,0,0
71038,71039,71039,설치,설치,누구 미니를 제대로 활용하려면 전용 어플리케이션을 설치 해야 합니다,중립,100,0,0
71039,71040,71040,설치,설치,스피커 설치 위치랑 노트북 사용하는 방이랑 좀 멀어서 그런가,부정,100,-0.039590200407859,-0.84567350579839
71040,71041,71041,설치,설치,단 제품 높이가 큰편이기때문에 설치 장소를 미리 확인해보시는것이 좋습니다,긍정,100,0.13594997856082,1.7673497212906
71041,71042,71042,설치,설치,아 귀찮아 ㅋㅋㅋㅋㅋ 굳이 설명서를 보지 않아도 설치 할 수 있어요,부정,100,-0.071810406272274,-0.8695652173913
71042,71043,71043,설치,설치,IoT 멀티탭이랑 열림알리미도 같이 받았어요열림알리미는 설치 안하고 보관만하고 있어요크게 필요성을 못느껴서요 어차피 양면테이프로,중립,100,0,0
71043,71044,71044,설치,설치,일단 앱 ' 헤이카카오 ' 검색 후 설치 2,중립,100,0,0
71044,71045,71045,설치,설치,비해 미니언즈는 정말 귀엽고 사랑스럽기까지 하네요 TV 설치 기사님께서도 미니언즈 때문에 꽤나 고생하고 있다고까지 이야기할,긍정,68.421052631579,0.11893168378462,0.53914865091336
71045,71046,71046,설치,설치,통해 실행 할 수 있기 때문에 반드시 설치 하시는게 굉장히 편리 합니다,긍정,100,0.125,1
71046,71047,71047,설치,설치,프로세서 / 4GB LPDDR3 RAM / 한국어 설치 가능,긍정,100,0.1449861613796,1.1967213114754
71048,71049,71049,설치,설치,' 헤이카카오 ' 라는 어플을 다운로드 받아 설치 후 실행하면 스마트폰과 카카오미니를 먼저 연동을 시키고,중립,100,0,0
71049,71050,71050,설치,설치,^ ^ 누구를 사용하기 위해서는 누구앱을 설치 해주셔야 됩니다,중립,100,0,0
71050,71051,71051,설치,설치,누구 ' 어플을 설치해야 한다,중립,100,0,0
71051,71052,71052,설치,설치,어플을 설치 후 SKT 회원 아이디로 로그인,중립,100,0,0
71052,71053,71053,설치,설치,이후 집에서 가까운 기사님 전화와서 설치 방문날짜 잡음,중립,100,0,0
71053,71054,71054,설치,설치,할 때 자세한 설명을 통해 진행되니 무리없이 설치 할 수 있습니다,중립,100,0,0
71054,71055,71055,설치,설치,카카오 앱을 설치 후 카카오에게 말을 시켰는데요 제가 ' 카카오,중립,100,0,0
71055,71056,71056,설치,설치,설치 후 카카오톡 사용자라면 카카오톡으로 시작 바로 연결이,긍정,100,0.065649303686804,1.1682961867087
71056,71057,71057,설치,설치,위해서는 와이파이 연결이 필요한데요 먼저 헤이카카오 앱 설치 후 와이파이 연결까지 모두 완료되었답니다 초기에는 헤이,중립,100,0,0
71057,71058,71058,설치,설치,꺅 기욥다카카오미니 설치 완성,긍정,100,0.13821138211382,1
71058,71059,71059,설치,설치,아직 뜯기 전 ㅋㅋㅋㅋㅋㅋㅋ 차에 설치 해야하는데 아직 안했어요 ㅋㅋㅋ 하게 되면 그,중립,100,0,0
71059,71060,71060,설치,설치,그리고 휴대폰에 어플 설치 후 휴대폰과 어플을 연동,중립,100,0,0
71060,71061,71061,설치,설치,헤이카카오앱 설치 3,중립,100,0,0
71061,71062,71062,설치,설치,설치 3,NA,NA,NA,NA
71062,71063,71063,설치,설치,설치 장소는 거실 테이블 / 침실 탁자 /,중립,100,0,0
71063,71064,71064,설치,설치,카카오 T 택시 또한 앱 설치 후 계정 연결이 되어 있어야 해요,중립,100,0,0
71064,71065,71065,설치,설치,또한 스마트폰에 헤이카카오 앱을 설치 및 와이파이를 이용해서 네트워크 연결까지 구성해야 합니다,중립,100,0,0
71065,71066,71066,설치,설치,딱 사실 제가 기계치인데그래도 썩힐 수는 없으니 설치 해 봤습니다 NUGU mini 누구미니 인공지능 스피커,부정,100,0.0048940434186336,-0.2671108383741
71066,71067,71067,설치,설치,우선 NUGU 어플을 설치합니다어플 설치 후 T 아이디 로그인을 해줍니당 ( *,중립,100,0,0
71067,71068,71068,설치,설치,그럼 일단 앱 설치 및 인식은 완료가 됩니다,긍정,100,0.11428571428571,1
71068,71069,71069,설치,설치,앱을 설치하고 나서야 음성인식이 가능해집니다,중립,100,0,0
71069,71070,71070,설치,설치,이제 미니언즈에 연결할 네이버클로바를 설치해야 합니다,중립,100,0,0
71070,71071,71071,설치,설치,ㅋㅋㅋ 설치 방법도 간단해요,긍정,100,0.22176647525294,1.0566037735849
71071,71072,71072,설치,설치,카카오 미니 스피커우선 아까 위에 아답터를 설치 합니다,중립,100,0,0
71072,71073,71073,설치,설치,' 하고 물어본답니다 ^ ^ 설치 완료하고 불러보았습니다,중립,100,0,0
71073,71074,71074,설치,설치,구성품은스피커 USB 케이블 충전 어댑터 간편 설치 가이드 및 품질보증서 서비스 이용 가이드 이렇게,중립,100,0,0
71074,71075,71075,설치,설치,휴대폰 어플인 헤이카카오를 설치,중립,100,0,0
71075,71076,71076,설치,설치,→ 설치,NA,NA,NA,NA
71077,71078,71078,설치,설치,헤이카카오 ' 를 설치하라는 음성안내가 나왔다헤이 카카오를 설치 중,중립,100,0,0
71078,71079,71079,설치,설치,' 를 설치하라는 음성안내가 나왔다 헤이 카카오를 설치 중,중립,100,0,0
71079,71080,71080,설치,설치,전용앱을 다운 받아 설치하시면 됩니다,중립,100,0,0
71080,71081,71081,설치,설치,설치 완료 후 실행했는데,중립,100,0,0
71081,71082,71082,설치,설치,불안한 마음에 설치 했는데,부정,100,-0.26499904159479,-0.80851063829787
71082,71083,71083,설치,설치,사용설명서 대로 설치하면 어려움 없이 설치 가능,중립,100,-0.0030148423005566,0
71083,71084,71084,설치,설치,스마트폰에 헤이카카오 앱 설치 후 와이파이를 이용해 네트워크 연결까지 한 이후에,중립,100,0,0
71084,71085,71085,설치,설치,헤이카카오 어플부터 설치,중립,100,0,0
71085,71086,71086,설치,설치,기계치이신 분들도 어렵지 않게 순서대로만 설치 버튼을 하나하나 눌러주시면 아주아주,부정,100,-0.13429230273493,-0.97162698412698
71086,71087,71087,설치,설치,Store 실행 ' NUGU ' 검색 ' 설치 ' 버튼 선택 iOSApp Store 실행 ',중립,100,0,0
71087,71088,71088,설치,설치,NUGU 앱을 설치해야 합니다,중립,100,0,0
71088,71089,71089,설치,설치,주요 음성 명령어와 어플 설치 QR 코드와 기기 사용설명서입니다,중립,100,0,0
71089,71090,71090,설치,설치,네이버 클로바 프렌즈 미니 설치 연결방법은 네이버클로바 앱을 먼저 설치하셔야되요,중립,100,0,0
71090,71091,71091,설치,설치,설치하시구요,NA,NA,NA,NA
71091,71092,71092,설치,설치,논산 전 답임야 유휴부지 공간 활용 태양광 설치,중립,100,0,0
71092,71093,71093,설치,설치,네이버 클로바앱을 설치 후 블루투스를,중립,100,0,0
71093,71094,71094,설치,설치,논에 태양광 설치,중립,100,0,0
71095,71096,71096,설치,설치,산에 태양광 설치,중립,100,0,0
71096,71097,71097,설치,설치,간단한 카카오미니 멜론 연동방법헤이카카오 앱을 설치 - > 멜론 ID 로그인 - >,긍정,100,0.051176878904525,1.0566037735849
71097,71098,71098,설치,설치,그러므로 처음에 헤이 카카오 앱을 설치 하셔야 합니다 헤이 카카오를 설치하면 주변에 있는,중립,100,0,0
71098,71099,71099,설치,설치,주변에 있는 카카오 미니를 찾아줍니다 헤이 카카오 설치 후 기기설정에 들어가면 여러가지 세팅을 바꿀수 있습니다,중립,100,0,0
71099,71100,71100,설치,설치,충전 전원 연결하기 전용 앱 설치 후 실해하기 제품의 명칭 등 읽어보시고 더,중립,100,0,0
71100,71101,71101,설치,설치,누구미니 전용 앱 설치 후 음성인식 기능을 사용할 수 있다,중립,100,0,0
71101,71102,71102,설치,설치,안내서가 같이 들어있습니다 : ) 전용 앱 설치 후 실행하는 방법과 전원 연결하는 방법이 나와있구,중립,100,0,0
71102,71103,71103,설치,설치,인공지능 클로바 앱을 스마트폰에 설치 후 스피커와 연동하여 사용하세요,중립,100,0,0
71103,71104,71104,설치,설치,앱스토어에서 Google Home 깔고 간단하게 동기화 시키니까 설치 끝,긍정,100,0.024726867335563,0.61384615384615
71104,71105,71105,설치,설치,화면을 보고 설치 과정을 진행하면 됩니다,중립,100,0,0
71105,71106,71106,설치,설치,어디에 설치해도 잘 어울리는 디자인을 보여줘서,긍정,100,0.22188986108183,1.5165243516762
71106,71107,71107,설치,설치,네이버 클로바 미니언즈 스마트 스피커와 함께 간편 설치 가이드 USB 충전 어댑터와 케이블이 포함되어 있었구요,중립,100,0,0
71107,71108,71108,설치,설치,둘다 와이파이 블루투스 망에서 헤이카카오와 CLOVA 앱이 설치 되어야 이용가능하답니다,중립,100,0,0
71108,71109,71109,설치,설치,되고 설치도 간단하더라고요 : - ) 순식간에 설치 완료,긍정,100,0.12173913043478,1
71109,71110,71110,설치,설치,맺었기 때문이며 최근 샤오미 스마트폰에마이크로소프트의 앱이 사전 설치 된 것 등으로도 예상이 가능합니다,긍정,100,0.1101979374755,1.4733895137121
71110,71111,71111,설치,설치,usb 단자가 있다일부 기기 충전 안될수도 있다 설치 방법은 간단하다전원을 연결하면 라이트 링이 켜지면서 부팅,긍정,100,0.055952774273244,1.2305959619247
71111,71112,71112,설치,설치,ㅋ 카카오 미니 설치 완료,중립,100,0,0
71112,71113,71113,사이트,사이트,바빠서 검색도 못해봤네요 ㅠㅠ 늦게나마카카오 ai 사이트 들어가보니까이런 공지가,부정,100,-0.069115352610776,-0.93395308924485
71113,71114,71114,사이트,사이트,메이커스 위드 카카오 사이트 에서 판매시작예약 구매자들은 10 월 중,중립,100,0,0
71114,71115,71115,사이트,사이트,대한민국 대표 포털 사이트 네이버와 카카오의 양자대결 현 주소 바로 AI,중립,100,0,0
71115,71116,71116,사이트,사이트,안했어도 1 분 매진이었을텐데 ; ) 한시간동안 사이트 접속이 안되원성이 어마무시,긍정,50.684931506849,-0.022917793655679,0.013704419448953
71116,71117,71117,사이트,사이트,카카오 사이트 주소는 아래,중립,100,0,0
71117,71118,71118,사이트,사이트,: ) ( 위 ) 카카오미니 공식 사이트 ( 아래 ) 카카오미니에 대해 더 알아보기,중립,100,0,0
71118,71119,71119,사이트,사이트,카카오 AI 브랜드 사이트 에서는 준비된 예약판매 물량이 매진 되었습니다 10,중립,100,0,0
71119,71120,71120,사이트,사이트,카카오 AI 브랜드 사이트 에 들어가셔서이것저것 확인해보시기 바랍니다 카카오 미니 ai,긍정,100,0.067215568314469,1.3375386518244
71121,71122,71122,사이트,사이트,카카오 AI 브랜드 사이트 에 들어가셔서 이것저것 확인해보시기 바랍니다,중립,100,0,0
71122,71123,71123,사이트,사이트,사이트,NA,NA,NA,NA
71124,71125,71125,사이트,사이트,jsp 자세한 사용 방법은 SKT NUGU 사이트 들어가면 확인할 수 있더라구요,중립,100,0,0
71125,71126,71126,사이트,사이트,동영상 보기 ( 클릭 ) 카카오미니 브랜드 사이트 ( 클릭 ) * 본 포스팅은 정보전달이,중립,100,0,0
71126,71127,71127,사이트,사이트,시작했습니다 가격은 11 만 9000 원으로 음악 사이트 ' 멜론 ' 정기결제 이용자의 경우 4,긍정,100,0.080523734112295,1.3319149213891
71127,71128,71128,사이트,사이트,판매가격은 11 만 9 천원으로 책정되었습니다 음원 사이트 멜론의 1 년 스트리밍 무제한 이용권과 카카오프렌즈,중립,100,0,0
71128,71129,71129,사이트,사이트,국내 제일 포털 사이트 네이버는 일본 지사의 자회사 라인에서도 AI 스피커를,긍정,100,0.052060577309633,0.90280572322826
71129,71130,71130,사이트,사이트,오늘 포스팅은 포털 사이트 두 곳에서 출시 한 스마트 스피커에 대해,중립,100,0,0
71130,71131,71131,사이트,사이트,넷플릭스 벅스 ( 인터넷 연결시 ) 등의 사이트 접속부터 일반적인 빔프로젝터의 모든 기능을 커서 이동이나,중립,100,0,0
71131,71132,71132,사이트,사이트,출처 : - 네이버 클로바 공식 사이트 ( https : / / clova,중립,100,0,0
71132,71133,71133,사이트,사이트,살려 카카오 미니는 국내 최고 인기 음악 사이트 중 하나인 멜론과 긴밀하게 협업합니다,긍정,100,0.23162106423007,1.1073030686543
71133,71134,71134,사이트,사이트,메신저 분야에선 카카오톡이 업계 1 위이지만 포털 사이트 분야에선 다음은 네이버의 그늘에 가려 만년 2,중립,100,0,0
71134,71135,71135,사이트,사이트,국내 최대 음원 사이트 멜론을 끼고 있다,중립,100,0,0
71135,71136,71136,사이트,사이트,음악 틀어줘 ' 라고만 해도 독보적인 음악포털 사이트 멜론으로 연동해서 듣고 싶은 노래를 바로바로 찾아줍니다,중립,100,0,0
71136,71137,71137,사이트,사이트,완판이 되며 판매한 날 기준으로 중고품 거래 사이트 ' 중고나라 ' 에는 50 여건이 넘는,중립,100,0,0
