,Unnamed: 0,X,category,key,sentences,senti,score1,score2,score3
47916,47917,47917,사용,사용,켜질 가능성이 있어서 완전히 끄는 기능이 없으니까 사용 안할때는 카카오미니의 마이크를 꺼주셔야합니다,부정,63.768928771733,-0.056694417101233,-0.42145259588685
47934,47935,47935,뒷면,뒷면,) 가 효과적일듯 누구 뒷면 조작부인데요블루투스 버튼 / 전원버튼이 보입니다아래쪽 단자는 라인아웃,중립,100,0,0
47935,47936,47936,뒷면,뒷면,바닥 보호 가능 심플한 뒷면 공기 순환구 등등 무난해보입니다,긍정,100,0.12423073145407,0.98709677419355
47936,47937,47937,뒷면,뒷면,박스 뒷면,NA,NA,NA,NA
47937,47938,47938,뒷면,뒷면,ㅎㅎ 미니언즈 몸통 뒷면 아랫쪽에충전단자가 있어요 ^ ^ 바닥면에 전원버튼이 있어용,중립,100,0,0
47938,47939,47939,뒷면,뒷면,차례로 앞면 뒷면 밑면을 찍어보았다,중립,100,0,0
47939,47940,47940,뒷면,뒷면,뒷면 버튼으로 wi-fi 설정 블루투스 연결 음량 조절을,중립,100,0,0
47940,47941,47941,뒷면,뒷면,미니언즈 뒷면 버튼,중립,100,0,0
47941,47942,47942,뒷면,뒷면,큐박스 블루투스 스피커 위에 올려두면 진행이 되는데요 뒷면 USB 포트를 이용해 유,중립,100,0,0
47942,47943,47943,뒷면,뒷면,앞면과 뒷면 모습,중립,100,0,0
47943,47944,47944,시작,시작,다운로드 코스를 선택하여 작동 시작,긍정,100,0.13048754062839,1.0985915492958
47944,47945,47945,시작,시작,하면 또잉 하는 소리와 함께 음성인식 시작 열었을때 구성품은 이러하다,긍정,100,0.083751123278095,1.2836650789348
47945,47946,47946,시작,시작,내가 좋아하는 노래로 하루를 시작 할 수 있어서 좋다 ( 물론 그렇다고,중립,100,0,0
47946,47947,47947,시작,시작,오는 18 일부터 예약판매 시작,긍정,100,0.19416781446082,1.2228251039971
47947,47948,47948,시작,시작,새로운 일상의 시작 카카오미니,긍정,100,0.31783137766189,1.0593220338983
47948,47949,47949,시작,시작,드디어 카카오미니 개봉기 시작,긍정,100,0.092307692307692,1
47949,47950,47950,시작,시작,이제 본격적으로 핸드폰과 카카오미니스피커 연결 시작,긍정,100,0.085350297850298,1.1289562289562
47950,47951,47951,시작,시작,않고 그냥 스피커로 쓸수있죠기능버튼은 짧게 누르면 카카오미니 시작 명령어인 ' 헤이카카오 ' 를 말하지 않고,부정,66.666666666667,-0.068257953440008,-0.65219764837626
47951,47952,47952,시작,시작,핸드폰이랑 연동 시작,긍정,100,0.1967365967366,1.0363636363636
47952,47953,47953,시작,시작,잇님들 : ) 한 주의 시작 잘 하셨나요,긍정,100,0.16971153846154,1.125
47953,47954,47954,시작,시작,카카오미니 시작 방법과 간단한 팁등,긍정,100,0.20319092993416,1.0283018867925
47954,47955,47955,시작,시작,저 노란불빛이 빙빙 돌아가면 카카오미니가 시작 된 거예요,긍정,100,0.097402914673446,1.3227800782149
47955,47956,47956,시작,시작,한 3 분 지나니 다시 정상적으로 작동되기 시작,긍정,100,0.23850177600178,1.0446428571429
47956,47957,47957,시작,시작,판매 시작 6 분만에 매진되던 그,긍정,100,0.12505494505495,1.0714285714286
47957,47958,47958,시작,시작,우리가 샐리를 만났을 때인공지능 비서는 이제 시작 단계다,긍정,100,0.078693015016813,1.3117770113388
47958,47959,47959,시작,시작,멘트가 나온 후 LED 조명이 타원형으로 회전하기 시작 합니다,긍정,100,0.073745762415685,1.0361199454793
47959,47960,47960,시작,시작,들어와요 : ) 색깔은 계속 바뀌구요 ㅎㅎㅎ 시작 명령어는 아직 4 가지 버전밖에 안되더라구요,긍정,100,0.11554673868701,1.601621233024
47962,47963,47963,시작,시작,사전예약이 본격 시작 되면 제일 위로 올라올 가능성도 있음,긍정,100,0.3318396713416,1.1078869047619
47963,47964,47964,시작,시작,카카오 미니가 드디어 오늘 출시가 아닌 사전예약 시작 입니다,중립,100,-0.020832782218191,0.08695652173913
47964,47965,47965,시작,시작,설치 후 카카오톡 사용자라면 카카오톡으로 시작 바로 연결이 가능하답니다 그럼 카카오미니 연결해 볼게요,긍정,100,0.14596035376613,1.0560987289029
47965,47966,47966,시작,시작,- > 앱에서 연결을 마치면 카카오미니 사용 시작,긍정,100,0.093648724157199,1.1016949152542
47966,47967,47967,시작,시작,누구 어플을 찾아서 등록을 시작,긍정,100,0.17117647058824,1.302036199095
47967,47968,47968,시작,시작,일시정지 1 초이상 누르면 호출명 없이 음성인식 시작 음악재생중 누르게 되면 2 번 연속눌러 다음곡,긍정,100,0.050592911764652,1.2556404343883
47968,47969,47969,시작,시작,충전기가 들어 있습니다 퀵 스타트 가이드를 보면서 시작,긍정,100,0.14406752667622,1.4546265328874
47969,47970,47970,시작,시작,시작 _ 었습니다 카카오미니란,긍정,100,0.11076923076923,1
47970,47971,47971,시작,시작,새로운 일상의 시작 카카오 미니,중립,100,0,0
47971,47972,47972,시작,시작,이제 시작 해볼까요,긍정,100,0.16160968660969,1.0925925925926
47972,47973,47973,시작,시작,│ │ │ 카카오톡으로 시작 누릅니다,긍정,100,0.1278232405892,0.95744680851064
47973,47974,47974,시작,시작,18 일 오전 11 시부터 모바일 주문 시작 ♡ ♡ 카카오미니의 예약 판매 가격은 5,긍정,100,0.10735352419491,1.6270426122979
47974,47975,47975,시작,시작,되었고 8 월 27 일부터는 한국 국내에서판매가 시작 되었어요스마트스피커 도라에몽 에디션 장점은크기가 작고 가벼워서 무게부피와,중립,100,0,0
47975,47976,47976,시작,시작,위에는 간략한 볼륨 버튼과 + - 명령어 시작 버튼 등이 있어요,긍정,100,0.1060892736296,1.2948680351906
47976,47977,47977,시작,시작,사전 주문으로 5 만 9000 원에 예약판매 시작,긍정,100,0.1122101062779,1.1194144838213
47977,47978,47978,시작,시작,' 라고 부르지 않아도 카카오미니를 깨워서 음성명령 시작,중립,100,-0.030235036916318,-0.045404208194906
47978,47979,47979,시작,시작,' 클로바 ' 를 부르지 않아도 음성인식 시작 2,중립,100,0.058572578030424,0.28053996257685
47979,47980,47980,시작,시작,동시에 켜지고 써지는 우리집 IOT 똑똑한 라이프의 시작,중립,100,0,0
47980,47981,47981,시작,시작,사이즈도 작고 앙증맞네요 얘는 뒷모습이 짱 카카오미니 시작 방법입니다먼저 카카오미니 스피커 밑에 어댑터 연결후스마트폰에 헤이카카오,긍정,100,0.056116798600061,0.92157863889452
47981,47982,47982,시작,시작,이제 본격적인 기기 연결 시작,긍정,100,0.12928774928775,1.0925925925926
47982,47983,47983,시작,시작,콘센트가 있고 이걸 본체랑 연결하면 이제 작동 시작,긍정,100,0.092348392348392,1.0925925925926
47983,47984,47984,시작,시작,( 무료 ) 에 꽂혀 하나씩 깔기 시작,긍정,100,0.11076923076923,1
47984,47985,47985,시작,시작,새로운 일상의 시작,긍정,100,0.52971896276981,1.0593220338983
47985,47986,47986,시작,시작,데일리 브리핑 주요소식브리핑으로 스마트한 하루의 시작,긍정,100,0.12681014769831,1.5874451754386
47986,47987,47987,시작,시작,' 시작 ' 단계라는 느낌이 안들지는 않아요,중립,100,-0.0041678641602393,0.065116279069767
47987,47988,47988,시작,시작,항상 게임 시작 전에 엄마나 아빠에게 스마트폰으로 타이머를 해달라고 하는데,긍정,100,0.19112984268881,1.3155555813737
47988,47989,47989,시작,시작,( 오전 11 시 부터 판매 시작 ) 해당 사이트에서 구매하기를 누르면 스마트폰에 카카오톡이,긍정,100,0.068094441540937,1.2632871446451
47989,47990,47990,시작,시작,후 준비가 되면헤이카카오라는 명령어를 통해 이제간편한 일상이 시작,중립,100,0,0
47990,47991,47991,시작,시작,재생하거나 다른 음악으로 바꿀 수 있고 길안내 시작 또는 재탐색을 시킬 수 있기 때문입니다,긍정,100,0.038428821852002,0.98415735208188
47992,47993,47993,시작,시작,그래서 포기하고 있었는데 12 월에 재판매 시작,중립,100,-0.073378993626034,0.017241379310345
47993,47994,47994,시작,시작,사진을 못찍어서 다시 집에 들고가 천천히 뜯어보기 시작,긍정,100,0.074635616664602,1.1178743961353
47994,47995,47995,시작,시작,구체성을 갖기 시작한 것 같다,긍정,100,0.21531468531469,1.5227272727273
47995,47996,47996,시작,시작,' 카카오미니 ' 가 18 일 예판 시작 40 분만에 매진을 기록한 가운데 제품의 사양,중립,100,0,0
47996,47997,47997,시작,시작,아직까지 인공지능이 완성된 기술이 아닌 시작 단계이기 때문에 예상하는 것보다 명령에 대한 이해도가,긍정,66.666666666667,0.029872920807737,0.3267445342917
47997,47998,47998,시작,시작,아직은 시작 단계이기 때문에 ai 의 데이타베이스가 약한 부분이,긍정,50.588235294118,-0.017977207977208,0.024448419797257
47998,47999,47999,시작,시작,버튼을 길게 눌러 네이버 클로바 미니 작동 시작,중립,100,0,0
47999,48000,48000,시작,시작,"KaKao MiNi "" 의 예약판매가 있었는데요 사전예약 시작 후 40 분만에 완판이 될만큼 많은 사람들의",긍정,100,0.1157643431837,1.0674731182796
48000,48001,48001,시작,시작,/ 7 토 첫 날은 1987 로 시작,긍정,100,0.11076923076923,1
48001,48002,48002,시작,시작,있어요카카오톡과 멜론 계정을 연동시켜주고 와이파이까지 연결되면카카오미니와의 만남이 시작 됩니다,긍정,100,0.052191413237925,1.0724508050089
48002,48003,48003,시작,시작,' 카카오 미니 ' 가 사전예약 판매 시작 약 40 분 만에 완판이 되는 기용을,긍정,100,0.081907526435828,1.2652291105121
48003,48004,48004,시작,시작,순식간에 결제가 완료되고 주문이 되어서 깜짝 놀랐어요아직 시작 단계라 가격비교까지 할 수 없다는 게 조금,긍정,50.746268656716,-0.021538761746422,-0.12683498084921
48004,48005,48005,시작,시작,충전 케이블을 꼽고 전원을 키고이제부터 시작,중립,100,0,0
48005,48006,48006,시작,시작,( 클로바 ) 를 부르지 않아도 음성인식 시작 브라운을 부르는 키워드,중립,100,0.0620268061744,0.41668337342956
48006,48007,48007,시작,시작,방법은 간단하다전원을 연결하면 라이트 링이 켜지면서 부팅 시작,긍정,100,0.17384445833995,1.2010291595197
48007,48008,48008,시작,시작,계정 로그인이용약관 동의하고 가입 완료되면 카카오미니와 연결 시작,긍정,100,0.046919118617232,0.9622641509434
48197,48198,48198,하단,하단,하단 면은 고무패킹 처리가 되어 있어서 미끄러지지 않도록,부정,100,-0.10070257611241,-1
48198,48199,48199,하단,하단,드라이버를 하단 방향으로 향하게 하고 하단에는 소리의 방향을 변경시켜줄,중립,100,0,0
48199,48200,48200,하단,하단,카카오 미니는 상단 버튼 하단 연결 단자 바디는 패브릭으로 처리되어 있습니다,중립,100,0,0
48200,48201,48201,하단,하단,참고로 설명서 하단 홈을 끼우면 세울 수 있다,중립,100,0,0
48201,48202,48202,하단,하단,하단 바닥은 고무패드를 적용 미끄럼 방지 기능을 더한,중립,100,0,0
48202,48203,48203,하단,하단,달려있고 하단,긍정,100,0.25797872340426,1
48203,48204,48204,하단,하단,제품 박스 하단 부분에는 제품의 시리얼 넘버를 비롯하여 제조관련 제품,중립,100,0,0
48204,48205,48205,하단,하단,단자와 전력 단자 그리고 usb 를 지원하는 하단,긍정,100,0.078891257995736,1
48205,48206,48206,하단,하단,제품의 하단,NA,NA,NA,NA
48206,48207,48207,하단,하단,하단 측면의 구멍들은 추측건대 소리가 나오는 구멍이기도 하고,중립,100,0,0
48207,48208,48208,하단,하단,제품을 사용하기 위해서는 하단 전원 단자에 어댑터를 연결해서 전원을 켜준다,중립,100,0,0
48208,48209,48209,하단,하단,; ; ; 명령어 말하기전에 클로바하고 부르면 하단 부분이 초록으로 바뀌면서 실행해 줍니다,중립,100,0,0
48209,48210,48210,하단,하단,만약 발견하지 못했다면 하단 메뉴에서 [ 디바이스 ] 를 누르고 연결하기를,중립,100,0,0
48210,48211,48211,하단,하단,카카오미니 하단 power 부분에 어댑터 연결후 콘센트에 꼽기스마트폰에 헤이카카오앱을,중립,100,0,0
48211,48212,48212,하단,하단,하단 부위에 나타나는 홈 화면을 통해 리모컨으로 커서를,중립,100,0,0
48212,48213,48213,하단,하단,하단 측면에는 연결고리를 걸 수 있게 구멍이 뚫려,중립,100,0,0
48213,48214,48214,하단,하단,먼저 하단 부분에 있는 전원 버튼을 켭니다,중립,100,0,0
48214,48215,48215,하단,하단,후면에 마이크 모양의 버튼을 길게 눌러주면 하단 LED 가 주황색 빛이 깜빡 거리는데요,긍정,100,0.098264280744217,1.7792087023489
48215,48216,48216,하단,하단,▼ 동영상 보기 하단 이미지 클릭 # 카카오미니가 보낸 카카오톡 메시지는,중립,100,0,0
48216,48217,48217,하단,하단,▼ 동영상 보기 하단 이미지 클릭 3,중립,100,0,0
48217,48218,48218,하단,하단,클로바가 명령을 받아들을 준비가 되면 하단 LED 가 초록빛으로 변한다,중립,100,0,0
48218,48219,48219,하단,하단,심지어 예전에 사용하던 포스팅 맨 하단 썸네일도 어피치 피규어로 만들었으니 말 다 _ㅇㅇ,중립,100,0,0
48219,48220,48220,하단,하단,하단,NA,NA,NA,NA
48220,48221,48221,하단,하단,부분을 하단에 배치새로운 느낌을 주고 있다,긍정,100,0.24166666666667,1.5333333333333
48221,48222,48222,하단,하단,상단에 버튼들이 위치해 있는데요 측면과 하단 부분에 마이크와 스피커가 설치되어 있을 것 같습니다,중립,100,0,0
48222,48223,48223,하단,하단,하단 5 개 탭 중 디바이스 탭 누르기,중립,100,0,0
48223,48224,48224,하단,하단,하단 부분의 전원을 키고 나니 이제 부터는클로바앱에서 연동하기,중립,100,0,0
48224,48225,48225,하단,하단,하단 전원 눌러 작동시키기 3,중립,100,0,0
48225,48226,48226,하단,하단,하단 부분에도 단 하나의 버튼이 있는데요 전원이 꺼진,부정,100,-0.10648438862725,-0.99935897435897
48226,48227,48227,하단,하단,연결된 와이파이가 잘못됐거나 네트워크 변경을 하려면 왼쪽 하단 버튼을 5 초 이상 길게 누르시면 되는데요,중립,100,0,0
48227,48228,48228,하단,하단,기가지니 조작버튼이 있고 밑면에는 유심꽂는 부분이 있어요 하단 전면부에는 기가지니의 자랑인 하만카돈스피커 탑재를 입증하는 로고가보이고후면에는,긍정,100,0.060669633396906,1.7097319347319
48228,48229,48229,채팅,채팅,채팅,NA,NA,NA,NA
48229,48230,48230,채팅,채팅,음성 채팅,NA,NA,NA,NA
48230,48231,48231,채팅,채팅,카톡 보내줘 하면그 누구 누구 한테 보내주는 채팅 새로운 신세계를 봤습니다,긍정,100,0.1268115942029,1.2246376811594
48231,48232,48232,채팅,채팅,연동 / 결합으로편리하게 친구 또는 ' 나와의 채팅 ' 에 저장하고음악을 편리하게 들을 수 있어서,긍정,100,0.22506030406981,1.6610336341263
48232,48233,48233,아웃,아웃,아웃 ㅠㅠㅠ10 월에 정식판매된다고하니그때까지 좀 더 고민을 해봐야겠어요,부정,100,-0.052697904915259,-0.66614103972781
48233,48234,48234,아웃,아웃,스마트폰 등을 충전할 수 있음 - 오디오 아웃 단자 : 다른 스피커와 연결해서 사용 가능,긍정,53.333333333333,0.038349942840101,0.1335087479497
48234,48235,48235,아웃,아웃,오디오 아웃 단자를 통해 다른 스피커를 연결 할 수도,중립,100,0,0
48235,48236,48236,아웃,아웃,역시 블로그는 아웃 오브 안중,부정,100,-0.1,-0.875
48236,48237,48237,아웃,아웃,후면 블루투스 페어링 버튼 전원 버튼 오디오 아웃 단자 USB 충전 단자,부정,100,-0.03833746898263,-0.87338709677419
48238,48239,48239,아웃,아웃,사서 번갈아 사용할수 있겠다 하단에는 전원과 라인 아웃 그리고 USB 포트가 하나 있다,부정,100,-0.039830508474576,-0.77330508474576
48239,48240,48240,아웃,아웃,스피커 뒷면에는 블루투스 버튼전원버튼 라인 아웃 단자그리고 USB 충전 단자로 구성되어 있습니다,중립,100,0,0
48240,48241,48241,아웃,아웃,후면부는 블루투스 연결 및 전원버튼 그리고 라인 아웃 단자 및 마이크로 5 핀 USB 충전단자를,부정,100,-0.031381906314345,-0.87711050102951
48241,48242,48242,아웃,아웃,전원 버튼 블루투스 페이링 버튼과 충전단자 라인 아웃 단자가 있습니다,부정,100,-0.040909090909091,-0.825
48242,48243,48243,아웃,아웃,충전단자 라인 아웃 단자가 있습니다,중립,100,0,0
48243,48244,48244,색상,색상,오로라 모닥불이 있었는데 큰 차이는 없고 미묘한 색상 차이였는데저런 아이디어를 내고 시스템화 했다는게 너무 귀엽다,긍정,50.746268656716,0.051464339843384,0.20050571180608
48244,48245,48245,색상,색상,휴 ( hue ) 의 조도와 조명 색상 등을 자유롭게 제어할 수 있는 신개념 스마트,긍정,100,0.10910900732429,1.4026414212249
48245,48246,48246,색상,색상,필립스 휴 앱을 통해 색상 선택 및 밝기 색온도 등을 설정할 때는,중립,100,0,0
48246,48247,48247,색상,색상,2mm 무게 390g 색상 Cozy BlackMaterialsPlastic Fabric 스피커 유닛 2 ',중립,100,0,0
48247,48248,48248,색상,색상,On Off 는 물론이고 밝기 조절과 다양한 색상 연출이 가능하다,긍정,100,0.25064868150443,1.4480701754386
48248,48249,48249,색상,색상,2mm 무게 : 390g 색상 : Cozy Black 스피커유닛 : 2 ',중립,100,0,0
48249,48250,48250,색상,색상,손바닥 만한 화이트 색상 ^ ^ 넘 귀욤귀욤 하죠,중립,100,0,0
48250,48251,48251,색상,색상,카카오미니 스피커 색상은완전 제스타일인 심플한블랙그레이 색상,중립,100,0,0
48251,48252,48252,색상,색상,카카오미니의 크기 및 무게 색상 등 정보입니다,중립,100,0,0
48252,48253,48253,색상,색상,2 ( mm ) / 390g 색상 : Cozy Black 요거는 카카오미니 전용 카카오프렌즈피규어인,중립,100,0,0
48253,48254,48254,색상,색상,< 제품 스펙 > 색상 : Cozy Black 스피커 유닛 : 2,중립,100,0,0
48254,48255,48255,색상,색상,다양한 색상 출시를 위해 레드 화이트 모델을 출시했으며 화이트,중립,100,0,0
48256,48257,48257,색상,색상,) 드롱기 전기주전자 KBO2001 / 3 가지 색상 / 전기포트 / 커피포트 / 관부가세 포함,중립,100,0,0
48257,48258,48258,색상,색상,드롱기 전기주전자 KBO2001 / 3 가지 색상 / 전기포트 / 커피포트 / 관부가세 포함,중립,100,0,0
48262,48263,48263,색상,색상,원 178080 원 TV 사운드바 HTL1193B [ 색상 : 블랙 / 돌비디지털 / 서라운드스피커 /,중립,100,0,0
48263,48264,48264,색상,색상,제품명 WAVE ( 웨이브 ) 모델명 NL-S500 색상 NAVY 스피커 20W 360 도 스피커 (,중립,100,0,0
48264,48265,48265,색상,색상,1 메모리 1GB / 8GB 색상,중립,100,0,0
48265,48266,48266,색상,색상,변화를 통해 배터리의 잔량이나 음성인식 상태 무드등의 색상 등을 자유롭게 변경 할 수 있습니다,긍정,100,0.094193548387097,1.2236559139785
48266,48267,48267,색상,색상,390g 색상 :,NA,NA,NA,NA
48267,48268,48268,색상,색상,박스 측면에는 제조년월과 모델명 색상 시리얼넘버 등이 표기 되어있다,중립,100,0,0
48268,48269,48269,교통,교통,♡ 심지어 어학사전 / 배달 주문 / 교통 / 라디오 / 정보검색 / 힐링사운드 /,중립,100,0,0
48269,48270,48270,교통,교통,카카오톡 메시지 발신 카카오택시 호출 배달음식 주문 교통 / 길 찾기 어학사전 라디오 팟캐스트 정보검색,중립,100,0,0
48270,48271,48271,교통,교통,이 외에도 음악을 듣거나 날씨 교통 오늘의 뉴스 등등 여러가지를 이용할 수 있었어요개인,중립,100,0,0
48271,48272,48272,교통,교통,카카오택시나 네비게이션 어플과 연동하여 택시를 부르기도 하고 교통 정보까지 알 수 있을거라고 하는데요,중립,100,0,0
48272,48273,48273,교통,교통,그 외 날씨 교통 등 생활 정보 검색 스마트홈 기능 음악,중립,100,0,0
48273,48274,48274,교통,교통,프렌즈 미니는 날씨 증시 교통 정보 등 생활 정보 검색과 음악 추천,중립,100,0,0
48274,48275,48275,교통,교통,그 이외에 음악 카카오톡 교통 정보 라디오 알람 날씨 시간 주문하기 어학,중립,100,0,0
48275,48276,48276,교통,교통,' 이러더군요 ㅋㅋㅋ 날씨 뉴스 교통 관련해서 물어볼 때 상황입니다,중립,100,0,0
48276,48277,48277,교통,교통,중계 카톡 보내기 음식 주문 택시 호출 교통 정보 음성 검색 게임 영화 추천 사전,중립,100,0,0
48277,48278,48278,교통,교통,이제는 날씨 교통 등 일반적인 궁금한 내용 외에 음식 및,중립,100,0,0
48278,48279,48279,교통,교통,네이버도 상당히 강력하지만 교통 은행 메신저 배달 음악 등의 서비스로 우리들의,중립,100,0,0
48279,48280,48280,교통,교통,ㅎㅎ 도라에몽 AI 스피커 출시날씨 교통 등 생활 정보 검색 스마트홈 음악 추천,중립,100,0,0
48280,48281,48281,교통,교통,교통,NA,NA,NA,NA
48281,48282,48282,교통,교통,고속도로 교통 상황과 드라이브에 어울리는 노래 선곡 등다양하게 활용해,긍정,100,0.15120192717609,1.6972044569461
48282,48283,48283,교통,교통,스케줄 관리 홈 IoT 교통 정보,중립,100,0,0
48283,48284,48284,교통,교통,- 교통 : 버스 시간부터 이동 시간까지 미리 물어보고,중립,100,0,0
49653,49654,49654,발매,발매,집에서 매일 사용하는 야마하 스피커도 있었고 발매 당시에 구입을 하긴 했으나 마음이 변하면 환불을,중립,100,0,0
49654,49655,49655,발매,발매,판매를 했던카카오미니가 11 월 7 일 정식 발매 확정이 되었습니다,중립,100,0,0
49655,49656,49656,발매,발매,월 18 일에 예약판매를 시작한다고 하는데 정확한 발매 일정은 나오지 않았네요 카카오 미니는 국내 AI,긍정,66.666666666667,0.075672756314714,0.44617380491191
49656,49657,49657,발매,발매,발매 인공지능 스마트스피커,중립,100,0,0
49657,49658,49658,발매,발매,발매,NA,NA,NA,NA
49658,49659,49659,발매,발매,발매 를 앞두고 있어요,중립,100,0,0
49659,49660,49660,발매,발매,정식 발매 전 미리 카카오미니 프렌즈 스마트 스피커를 만나,중립,100,0,0
49660,49661,49661,발매,발매,제품 발매 되자마자 구입해서 사용 하였으니깐요,중립,100,0,0
49661,49662,49662,발매,발매,: ) 카카오미니 발매 소식이 있어서 전해드려요,중립,100,0,0
49662,49663,49663,발매,발매,카카오 미니 정식 발매,중립,100,0,0
49663,49664,49664,발매,발매,아직 발매 전인 상황이구요다음 주 월요일 9 월 18,중립,100,0,0
49664,49665,49665,발매,발매,카카오 미니의 정식 발매 가격은 11 만 9 천원으로 네이버보다는 저렴한,중립,100,0,0
49665,49666,49666,발매,발매,음성 인식 인공지능인 이 작은 스피커에는 정식 발매 기념으로 스피커 상단에 부착할 수 있도록 카카오미니,긍정,100,0.03810464559387,0.94300766283525
49666,49667,49667,밝기,밝기,있는 활동에 맞게 편하게 조명을 켜고 끄고 밝기 조정 시간 조정 등 다양하게 활용할 수,긍정,100,0.19199605378541,1.4620289191813
49667,49668,49668,밝기,밝기,조명 켜줘 조명 꺼줘 조명 밝기 80 % 로 설정해줘 조명 밝기 올려줘,중립,100,0,0
49668,49669,49669,밝기,밝기,조명 밝기 80 % 로 설정해줘 조명 밝기 올려줘 조명 밝기 내려줘 조명 빨강으로 해줘,중립,100,0,0
49669,49670,49670,밝기,밝기,% 로 설정해줘 조명 밝기 올려줘 조명 밝기 내려줘 조명 빨강으로 해줘 등,중립,100,0,0
49670,49671,49671,밝기,밝기,필립스 휴 앱을 통해 색상 선택 및 밝기 색온도 등을 설정할 때는 매번 앱을 켜서,중립,100,0,0
49671,49672,49672,밝기,밝기,어플을 통해 단순하게는 On Off 는 물론이고 밝기 조절과 다양한 색상 연출이 가능하다,긍정,100,0.19280667808033,1.4480701754386
49672,49673,49673,밝기,밝기,클로바 미니 스피커를 통해 전구의 색 조절 밝기 조절 On / Off 조절이 가능하다,긍정,100,0.10170173103891,1.4646405610754
49673,49674,49674,밝기,밝기,' 이라고만 말해도 조명이 켜지고 ' 조명 밝기 80 % 로 해줘 ' ' 조명,중립,100,0,0
49674,49675,49675,밝기,밝기,OFF 가 가능하니 굿굿위 동영상처럼 무드등의 컬러나 밝기 등설정도 변경이 가능합니다,긍정,100,0.1758027769842,2.1912659768716
49675,49676,49676,밝기,밝기,가 가능하니 굿굿 위 동영상처럼 무드등의 컬러나 밝기 등 설정도 변경이 가능합니다,긍정,100,0.19284823152965,2.395811431417
49676,49677,49677,밝기,밝기,미니 영화관같다 ㅋㅋㅋㅋ ( 사진 밝기 조절햇어여,중립,100,0,0
49677,49678,49678,밝기,밝기,조명 밝기,NA,NA,NA,NA
49678,49679,49679,밝기,밝기,물론 밝기 조절도 음성으로 가능 하지요 요렇게,긍정,100,0.24489076814658,1
