,Unnamed: 0,X,category,key,sentences,senti,score1,score2,score3
99405,99406,99406,8,업데이트,일반 스피커와 연결할 수도 있으며자동으로 업데이트 되며 향후 택시 호출이나 음식,NA,NA,NA,NA
99406,99407,99407,8,업데이트,블루투스 목록에 뜹니다조금 불편하긴 해도 업데이트 해줘서 감사감사 ㅜㅜ < 제,NA,NA,NA,NA
99407,99408,99408,8,업데이트,카카오 미니도 같은 시스템이며 계속 업데이트 된답니다,NA,NA,NA,NA
99408,99409,99409,8,업데이트,완판된 인기많은 미니카카오다른 음성인식도 곧 업데이트 된다니,NA,NA,NA,NA
99409,99410,99410,8,업데이트,카카오택시등 다른 기능은 추후 업데이트 된다니더 유용하게 편하게 이용이 가능할걸로,NA,NA,NA,NA
99410,99411,99411,8,업데이트,보이지 않는다고 하면 네이버 앱을 업데이트 해주셔야 되요,NA,NA,NA,NA
99411,99412,99412,8,업데이트,어플을 종료 후 다시 들어와야 업데이트 됨,NA,NA,NA,NA
99413,99414,99414,8,업데이트,업데이트 바라는 점라인 ( LINE ),NA,NA,NA,NA
99414,99415,99415,8,업데이트,소리가 나면서 대기상태돌입한다 ㅎㅎ 아직 업데이트 됐으면 하는 것들이 많다 1,NA,NA,NA,NA
99415,99416,99416,8,업데이트,추후 업데이트 방향과 서비스의 확장성에서 미래가 결정될것이라고,NA,NA,NA,NA
99416,99417,99417,8,업데이트,우선 아직까진 무선이 안되서 아쉬워요아직 업데이트 중이라는게 많아서 더 활성화 됐으면,NA,NA,NA,NA
99417,99418,99418,8,업데이트,추가된 것처럼 새로운 기능이 꾸준히 업데이트 될 것이라고 하며 현재 여성,NA,NA,NA,NA
99418,99419,99419,8,업데이트,/ 28 보충설명 : 펌웨어 업데이트 덕분인지 위에서 적은 극단적인 배터리소모는,NA,NA,NA,NA
99419,99420,99420,8,업데이트,언젠가 업데이트 되겠죠,NA,NA,NA,NA
99422,99423,99423,8,업데이트,업데이트 할 예정이라고 해요 현재 흑정령미니는,NA,NA,NA,NA
99424,99425,99425,8,업데이트,앞으로 더 많은 서비스가 업데이트 되길 바라며 이상 포스팅을 마칩니다,NA,NA,NA,NA
99425,99426,99426,8,업데이트,더더욱 다양해진 서비스 ( 지속적 업데이트 진행 ) 기본제공서비스를 살펴보면음악감상 (,NA,NA,NA,NA
99426,99427,99427,8,업데이트,다양한 기능을 지원하며 꾸준히 진화하며 업데이트 되고 있다,NA,NA,NA,NA
99427,99428,99428,8,업데이트,굉장히 인식을 잘해요 그리고 계속해서 업데이트 되기에 기대가 많이 되네요,NA,NA,NA,NA
99428,99429,99429,8,업데이트,Google 홈 미니 펌웨어 업데이트 개인 정보 보호에 대해 이전에,NA,NA,NA,NA
99429,99430,99430,8,업데이트,업데이트 될예정이라도 친절하게 알려준다,NA,NA,NA,NA
99430,99431,99431,8,업데이트,기존에 되지않았던 기능들이 속속들이 업데이트 되고있으니 앞으로 기대해 볼만하죠,NA,NA,NA,NA
99431,99432,99432,8,업데이트,이번에는 업데이트 소식이 아닌,NA,NA,NA,NA
99432,99433,99433,8,업데이트,말해주는데 무슨 내용 왔냐고 하면그기능은 업데이트 될거라고 함,NA,NA,NA,NA
99433,99434,99434,8,업데이트,처음에는 이렇게 많은 기능은 없었는데기능들이 업데이트 됐네요,NA,NA,NA,NA
99434,99435,99435,8,업데이트,없었는데기능들이 업데이트 됐네요,NA,NA,NA,NA
99435,99436,99436,8,업데이트,입력은 추후 업데이트 예정이라고는 하더라전원과 usb 꽂는 포트,NA,NA,NA,NA
99436,99437,99437,8,업데이트,가능하지만 내가 공부중인 프랑스어는 안되고카톡읽기도 업데이트 준비중이라도 한다,NA,NA,NA,NA
99437,99438,99438,8,업데이트,두 서비스는 계속 업데이트 되면서 음악 외 기능을 키울,NA,NA,NA,NA
99438,99439,99439,8,업데이트,앞으로 다양한 기능들이 업데이트 된다고 하니,NA,NA,NA,NA
99439,99440,99440,8,업데이트,우아하게 아이 키우기를 구독하며 새로 업데이트 될 때마다 꼭 듣고 있는데요,NA,NA,NA,NA
99440,99441,99441,8,업데이트,정보들을더빠르고 간편하게 음성으로 확인 자동 업데이트,NA,NA,NA,NA
99441,99442,99442,8,업데이트,인공지능 스피커가 자주 업데이트 중이니더 똑똑하고 놀라운 기능 발견하면그때,NA,NA,NA,NA
99442,99443,99443,8,업데이트,계속 업데이트 된다고 하니까조금 더 똑똑해지길 기대하면서,NA,NA,NA,NA
99443,99444,99444,8,업데이트,앞으로 업데이트 되면서다양한 기능들이 추가될 것 같은데기다리는,NA,NA,NA,NA
99444,99445,99445,8,업데이트,청정원프렌즈전용딜은 매달 업데이트 되어 새롭게 신청할 수 있으니,NA,NA,NA,NA
99445,99446,99446,8,업데이트,카카오 미니 앞으로도 다양한 기능이 업데이트 된다고 하니 기대 되는 바,NA,NA,NA,NA
99446,99447,99447,8,업데이트,( 업데이트 될 기능까지 하면 은근 많죠,NA,NA,NA,NA
99447,99448,99448,8,업데이트,다나와요 ㅋㅋㅋㅋㅋㅋㅋㅋㅋ 그리고 앞으로 더 업데이트 되면서,NA,NA,NA,NA
99448,99449,99449,8,업데이트,앞으로 캐릭터도 다양해지고 많은 기능들이 업데이트 되는 것을 기대해보며 오늘의 포스팅,NA,NA,NA,NA
99449,99450,99450,8,업데이트,ㅠㅠ 이거 진짜 제발 빨리 업데이트 되었으면 좋겠다,NA,NA,NA,NA
99450,99451,99451,8,업데이트,8 + / X 시일내 업데이트 예정,NA,NA,NA,NA
99451,99452,99452,8,업데이트,MBC 라디오를 즐겨 듣는편이라서 향후 업데이트 해주겠죠,NA,NA,NA,NA
99452,99453,99453,8,컴퓨터,수 있다는 점인데 바쁘게 일하거나 컴퓨터 사용 중에 음성만으로 메시지 전송을,NA,NA,NA,NA
99453,99454,99454,8,컴퓨터,컴퓨터 게임하다가 혹은 열심히 시험 공부하다가,NA,NA,NA,NA
99454,99455,99455,8,컴퓨터,가장 오래 앉아있는 제 작업실 컴퓨터 책상 모니터 아래에 설치했습니다,NA,NA,NA,NA
99456,99457,99457,8,컴퓨터,맞춰놓고 이번에는 기필코 사리라 하여 컴퓨터 타임을 맞추고 스탠바이하고 있었다 카카오,NA,NA,NA,NA
99457,99458,99458,8,컴퓨터,는 14W 의 높은 출력으로 컴퓨터 스피커 빔프로젝터 스피커 등 다양하게,NA,NA,NA,NA
99458,99459,99459,8,컴퓨터,컴퓨터 모니터 옆쪽에 두고 쓰네요 ㅎㅎ,NA,NA,NA,NA
99459,99460,99460,8,컴퓨터,( 더 정확히 말하자면 설치할때는 컴퓨터 모니터 겸용 티비를 이용해서 설치는,NA,NA,NA,NA
99460,99461,99461,8,컴퓨터,엄청난 기능은 아니지만 컴퓨터 화면을 하루 종일 보며 일하는,NA,NA,NA,NA
99461,99462,99462,8,컴퓨터,추론능력 지각능력 자연언어의 이해능력 등을 컴퓨터 프로그램으로 실현한 기술입니다,NA,NA,NA,NA
99462,99463,99463,8,컴퓨터,컴퓨터 사이에,NA,NA,NA,NA
99463,99464,99464,8,컴퓨터,산업혁명은 1969 년 인터넷의 출현과 컴퓨터 정보화 자동 생산 기기 시스템이,NA,NA,NA,NA
99464,99465,99465,8,컴퓨터,' 나는 컴퓨터 소리도 듣고싶고 미니도 듣고 싶은데,NA,NA,NA,NA
99465,99466,99466,8,컴퓨터,컴퓨터 ( 데스크탑 노트북 ) AUX,NA,NA,NA,NA
99466,99467,99467,8,컴퓨터,그 다음 케이블의 반대쪽은 컴퓨터 본체 뒷면의 LINE-IN 단자 노트북은,NA,NA,NA,NA
99467,99468,99468,8,컴퓨터,컴퓨터 소리는 물론 미니랑 같이 나옵니다,NA,NA,NA,NA
99468,99469,99469,8,컴퓨터,/ 레노버 무선 마우스 / 컴퓨터 핸드폰 연결 지원 / 0b47189,NA,NA,NA,NA
99474,99475,99475,8,컴퓨터,스피커라고 하면 무척 신기해한답니다 대부분의 컴퓨터 USB 포트나 AC 어댑터를 이용해,NA,NA,NA,NA
99475,99476,99476,8,컴퓨터,simultaneous localization and mapping ) 컴퓨터 비전 음성 인식 및 자연어,NA,NA,NA,NA
99476,99477,99477,8,컴퓨터,하실 때는 휴대폰으로 결제하지 말고 컴퓨터 웹으로결제하시면 할인 혜택등을 받을 수,NA,NA,NA,NA
99477,99478,99478,8,컴퓨터,테이블 위에 올려두고 양손은 바삐 컴퓨터 자판을 두드리며 음성 명령으로 이런저런,NA,NA,NA,NA
99478,99479,99479,8,컴퓨터,컴퓨터 자판에 양손이 묶여있을 때 옷을,NA,NA,NA,NA
99480,99481,99481,8,컴퓨터,메시지를 보낼 수 있어서 편리했으며 컴퓨터 앞에 자주 앉아있는 필자뿐만 아니라,NA,NA,NA,NA
99481,99482,99482,8,컴퓨터,제 컴퓨터 옆에 책꽂이 위에다가 올려 놓았는데,NA,NA,NA,NA
99482,99483,99483,8,지금,ㅋㅋ 여기에 더해서 지금 다양한기능으로 이용자들을 유혹하고있죠,NA,NA,NA,NA
99483,99484,99484,8,지금,그래서 바로 주문해주었답니다출시한지 얼마안되어서 지금 네이버뮤직 1 개월과 클로바미니가 5,NA,NA,NA,NA
99484,99485,99485,8,지금,ㅋㅋ 지금 만나봅니다,NA,NA,NA,NA
99485,99486,99486,8,지금,' 헤이카카오 돼지슈에게 나 지금 이거 카카오미리로 보내는 거다 라고,NA,NA,NA,NA
99486,99487,99487,8,지금,예를 들어서 ' 릴라킹에게 ' 지금 뭐해,NA,NA,NA,NA
99487,99488,99488,8,지금,""" "" 지금 뭐해",NA,NA,NA,NA
99488,99489,99489,8,지금,지금 클로바 프렌즈와,NA,NA,NA,NA
99489,99490,99490,8,지금,일하다가 날씨가 궁금할 때 그리고 지금 몇 시인지 궁금할 때 바로,NA,NA,NA,NA
99490,99491,99491,8,지금,아내에게 밥은 먹었는지 지금 뭐 하는지 일하면서 동시에 말로,NA,NA,NA,NA
99491,99492,99492,8,지금,지금 2 주 넘게 스피커를 사용하고,NA,NA,NA,NA
99492,99493,99493,8,지금,지금 카카오미니를 사용해본 사용자들의 장단점을 살펴보면장점으로는,NA,NA,NA,NA
99493,99494,99494,8,지금,♪ ' 지금 듣고 있는 곡을 카톡으로 보내줘,NA,NA,NA,NA
99494,99495,99495,8,지금,난 멜론 신규가입자니까 신규가입자로 예약구매하기 지금 구매할 수 있는 날짜는 1,NA,NA,NA,NA
99495,99496,99496,8,지금,연결을 해주면핸드폰의 블루투스를 꺼도 된다나는 지금 멜론을 이용하고 있어서음악을 자유롭게 들을,NA,NA,NA,NA
99496,99497,99497,8,지금,포장 박박 풀고 테스트 ㅋㅋ 지금 자장가 틀어줘 해놓고 률이 재우고,NA,NA,NA,NA
99497,99498,99498,8,지금,란 생각이 들어서 ' 헤이카카오 지금 듣는 음악을 카톡으로 XX 친구에게,NA,NA,NA,NA
99498,99499,99499,8,지금,오늘 대구 날씨를 알려줘 ' 지금 내가 지정한 우리집 날씨 뿐,NA,NA,NA,NA
99499,99500,99500,8,지금,ㅎㅎ 원래는 포스팅을 하고 있는 지금 이 책상 위에 놓을 계획이었는데핑크퐁,NA,NA,NA,NA
99500,99501,99501,8,지금,재생이 됩니다 ▲ ▲ ▲ 지금 듣고 있는 노래 카톡으로 보내기그뿐만,NA,NA,NA,NA
99501,99502,99502,8,지금,있는 노래 카톡으로 보내기그뿐만 아니라 지금 듣고 있는 뮤직에 대한 정보와,NA,NA,NA,NA
99502,99503,99503,8,지금,바로 카톡으로 전송도 가능해요 이렇게 지금 듣고 있는 노래를카톡으로 스스로 보내는,NA,NA,NA,NA
99503,99504,99504,8,지금,지금 당장 만나보세요,NA,NA,NA,NA
99504,99505,99505,8,지금,혹시나 궁금하시면 지금 홈페이지에 나와있으니까 한번 봐보세욥,NA,NA,NA,NA
99506,99507,99507,8,지금,' 하와이는 지금 몇시야,NA,NA,NA,NA
99507,99508,99508,8,지금,사면 덤으로 준다니 어차피 사려면 지금 사는게 제일 좋겠죠,NA,NA,NA,NA
99508,99509,99509,8,지금,지금 한 1 주일정도 사용해보았는데정말 대만족이랍니다,NA,NA,NA,NA
99509,99510,99510,8,지금,보면 꼭 ai 스피커가 나옵니다그중에서 지금 카카오 미니 스피커를 예약판매합니다아직 정식판매는,NA,NA,NA,NA
99510,99511,99511,8,지금,꼭 ai 스피커가 나옵니다 그중에서 지금 카카오 미니 스피커를 예약판매합니다 아직,NA,NA,NA,NA
99511,99512,99512,8,지금,지금 중국 현지에서 내게 오고 있는,NA,NA,NA,NA
99512,99513,99513,8,지금,' ' 지금 몇시야,NA,NA,NA,NA
99513,99514,99514,8,지금,지금 주력 사용은 뭐 네이버로 집중되기는,NA,NA,NA,NA
99514,99515,99515,8,지금,네이버는 개방정책을 사용하는지 지금 들어가보시면 ( 클로바 앱은 누구나,NA,NA,NA,NA
99515,99516,99516,8,지금,지금 부모님은 ' 이선희 노래 틀어줘,NA,NA,NA,NA
99516,99517,99517,8,지금,지금 나 네이버블로그 쓰는거지 ㅋㅋ 요녀석이에요,NA,NA,NA,NA
99517,99518,99518,8,지금,지금 롯데월드까지 얼마나걸려,NA,NA,NA,NA
99518,99519,99519,8,지금,지금 노트북 모니터가 깨끗하지 않아 보이는,NA,NA,NA,NA
99519,99520,99520,8,지금,향후에는 지금 보이는 부족한부분들이 전부 보완되어 나오기도,NA,NA,NA,NA
99520,99521,99521,8,지금,향후에는 지금 보이는 부족한 부분들이 전부 보완되어,NA,NA,NA,NA
99521,99522,99522,8,지금,일상을 바꾸어 줄 누구 미니 지금 바로 불러보세요,NA,NA,NA,NA
99522,99523,99523,8,지금,그렇지만 지금 아이들은 스마트폰은 물론이고 노트북도 어렵지,NA,NA,NA,NA
99523,99524,99524,8,지금,저희 아이는 지금 학교에서도 영어 공부를 하기 때문에,NA,NA,NA,NA
99524,99525,99525,8,지금,노래 찾기추천받은 노래가 재생 중일때 지금 나오는 노래 제목을 물어보면 가수,NA,NA,NA,NA
99525,99526,99526,8,지금,앞다투어 새로운 소식을 쏟아내고 있는 지금 오히려 사회에서는 20,NA,NA,NA,NA
99526,99527,99527,8,지금,카카오미니를 지금 며칠 써보니까아직 미흡한 부분은 좀,NA,NA,NA,NA
99528,99529,99529,8,지금,이제 핸드폰과 연결하여 스피커를 깨워봅시다하려했으나 지금 밖에 나가봐야해서연동하는건 내일,NA,NA,NA,NA
99529,99530,99530,8,지금,지금,NA,NA,NA,NA
99530,99531,99531,8,지금,어차피 지금 판매하고있는 애들은 개발사들의 고객 구매도,NA,NA,NA,NA
99531,99532,99532,8,지금,바쁜 아침에 ' 지금 경의선 어디에있어,NA,NA,NA,NA
99532,99533,99533,8,지금,ㅎ 지금 프로야구 중계를 알려달라고 했더니 참,NA,NA,NA,NA
99533,99534,99534,8,지금,지금 네이버 사전에 들어가면 다양한 언어들을,NA,NA,NA,NA
99534,99535,99535,8,지금,우리는 지금 인공지능 ( AI ) 시대에,NA,NA,NA,NA
99535,99536,99536,8,지금,대한 관심이 그 어느때보다 높은 지금,NA,NA,NA,NA
99536,99537,99537,8,지금,AI 의 시대가 본격적으로 시작되는 지금,NA,NA,NA,NA
99537,99538,99538,8,지금,필요하다 하시는 분은 지금 바로 구입하세요,NA,NA,NA,NA
99538,99539,99539,8,지금,노래 들려줘 ' 같은 형식으로 지금 현재 상태와 노래 들려줘 라는,NA,NA,NA,NA
99539,99540,99540,8,지금,< br / > ' 지금 재생되는 노래 뭐야,NA,NA,NA,NA
99544,99545,99545,8,지금,지금 재미들려서 티비보다가 ' 클로바,NA,NA,NA,NA
99545,99546,99546,8,지금,캬캬캬캬 ) ' 지금 기분이 어때,NA,NA,NA,NA
99546,99547,99547,8,지금,없는 인텔의 데이터센터 이야기동아사이언스어떻게 보면 지금 우리나라에선 ' 4 차 산업혁명,NA,NA,NA,NA
99547,99548,99548,8,지금,동아사이언스 어떻게 보면 지금 우리나라에선 ' 4 차 산업혁명,NA,NA,NA,NA
99548,99549,99549,8,지금,다음으로는 나가기 전에 지금 학교까지 얼마나 걸리는지 ' 누구미니,NA,NA,NA,NA
99549,99550,99550,8,지금,지금 대략적으로 사용하기 좋은건 음악들려줘 미세먼지,NA,NA,NA,NA
99550,99551,99551,8,지금,설치하면 내 손안의 인공지능 비서 지금 만나보세요 라고 나옵니다,NA,NA,NA,NA
99551,99552,99552,8,지금,셀리야 지금 미세먼지 어때,NA,NA,NA,NA
99552,99553,99553,8,지금,스피커 기능이 엔터테인먼트와 비서기능이 기본이었다면 지금 소개해드리는 한영사전 기능과 위키피디아 검색기능은,NA,NA,NA,NA
99553,99554,99554,8,지금,주로 아침에 머리 만지면서 날씨나 지금 시간이 몇시인지 물어봐요,NA,NA,NA,NA
99554,99555,99555,8,지금,그래서 수시로 ' 헤이카카오 지금 몇시야,NA,NA,NA,NA
99555,99556,99556,8,지금,그럼 친절하게 지금 시간을 말해주니 매일 아침 출근,NA,NA,NA,NA
99556,99557,99557,8,지금,지금 몇시야,NA,NA,NA,NA
99557,99558,99558,8,지금,다음 곡 틀어줘 이전곡 틀어줘 지금 나오는 노래 제목이 뭐야,NA,NA,NA,NA
99558,99559,99559,8,지금,우리는 지금 스마트폰 / 태블릿으로 대변되는 모바일,NA,NA,NA,NA
99559,99560,99560,8,지금,헤이 카카오 지금 듣는 음악 카톡으로 언니에게 보내줘,NA,NA,NA,NA
99560,99561,99561,8,지금,전송하고 싶다면 ' 헤이 카카오 지금 듣고 있는 음악 아내에게 카톡으로,NA,NA,NA,NA
99562,99563,99563,8,지금,지금 수준의 기능으로도 전 충분히 즐기며,NA,NA,NA,NA
99563,99564,99564,8,지금,지금 몇 시야,NA,NA,NA,NA
99564,99565,99565,8,지금,/ 런던 지금 몇 시야,NA,NA,NA,NA
99565,99566,99566,8,지금,( 음악 재생 중 ) 지금 나오는 노래 제목이 뭐야,NA,NA,NA,NA
99566,99567,99567,8,지금,곡을 바로 재생할 수도 있고 지금 나오는 노래의 곡명도 알 수,NA,NA,NA,NA
99567,99568,99568,8,지금,아직 출시는 되지않았으며 지금 예약판매를 진행중이며 예판가격은 59000 원이라네요,NA,NA,NA,NA
99568,99569,99569,8,지금,지금 예약구매하시면 10 월중으로 받을수 있으며,NA,NA,NA,NA
99569,99570,99570,8,지금,지금 듣는 음악을 카톡으로 공유해달라고 했더니카톡,NA,NA,NA,NA
99570,99571,99571,8,지금,카카오미니 덕에 강제 음악감상 중날씨랑 지금 노래 뭐냐고 묻기 시전 :,NA,NA,NA,NA
99571,99572,99572,8,지금,하긴 스마트빔이라고는 지금 사용하는 아이코디스 제리빔과 sk 스마트빔,NA,NA,NA,NA
99572,99573,99573,8,지금,( 지금 사용하고 있는 젤리빔은 화면의 좌중우,NA,NA,NA,NA
99573,99574,99574,8,지금,) - 지금 사용하는 젤리빔은 화면의 촛점이 중앙과,NA,NA,NA,NA
99574,99575,99575,8,지금,좋은 노래 틀어줘 하면 틀어주구요 지금 노래 뭐야,NA,NA,NA,NA
99575,99576,99576,8,지금,노래를 틀어줘 ' 다음에 ' 지금 이 곡 제목은 뭐야,NA,NA,NA,NA
99576,99577,99577,8,지금,그리고 후기를 보내주겠다고 찍었었는데 정작 지금 3 개월 넘게 지났다 (,NA,NA,NA,NA
99577,99578,99578,8,지금,그래도 지금 가나에 와있어서 카카오미니를 안 데려왔는데,NA,NA,NA,NA
99578,99579,99579,8,지금,오빠도 기엽다며 ㅋㅋㅋㅋㅋ 그리고 지금 베라가서쿼터,NA,NA,NA,NA
99579,99580,99580,8,지금,지금 부터 이 제품 한번 알아봅시다,NA,NA,NA,NA
99580,99581,99581,8,지금,"♪ ♬ OOO 에게 "" 지금 뭐해",NA,NA,NA,NA
99581,99582,99582,8,지금,지금 이노래 보내줘 라고 하니까 미리듣기,NA,NA,NA,NA
99582,99583,99583,8,지금,그러니 지금 바로 연결해주세요 ㅎㅎ 카카오미니에 전원을,NA,NA,NA,NA
99583,99584,99584,8,지금,아직 AI 를 경험해보지 못했다면 지금 스마트폰을 꺼내 들고 ' 시리,NA,NA,NA,NA
99584,99585,99585,8,지금,첫 인공지능 스마트 스피커 카카오미니 지금 제 침대 옆에서 열심히 저와,NA,NA,NA,NA
99585,99586,99586,8,지금,움직이다가 시계를 볼 시간이 없다면 지금 몇시냐고 물어보면 되니 정말 좋아요,NA,NA,NA,NA
99586,99587,99587,8,지금,이렇게 이야기 하지 않아도 간단하게 지금 몇시,NA,NA,NA,NA
99587,99588,99588,8,지금,왔는지 확인도 친구에게 메세지를 보내거나 지금 듣고있는 음악전송까지 다양한 카톡대화를 카카오미니를,NA,NA,NA,NA
99588,99589,99589,8,지금,시간을남겨두고 정기결제를 신청하였다 ) 또한 지금 무제한 듣기 정기 결제를 하면,NA,NA,NA,NA
99591,99592,99592,8,지금,관심있는 소비자라면 지금 바로 확인해 보세요,NA,NA,NA,NA
99592,99593,99593,8,지금,뭔가 조약돌 같아서 필자가 지금 쓰고 있는 스마트와치가 떠올랐다,NA,NA,NA,NA
99593,99594,99594,8,지금,찰떡같이 알아듣고 바로 대답해줍니당 ' 지금 날씨 어때,NA,NA,NA,NA
99594,99595,99595,8,지금,빨리 오면 좋겠다 ( 지금 내 방을 IOT 홈으로 만들어볼,NA,NA,NA,NA
99595,99596,99596,8,지금,지금 빨리 알바가봐야해서 글은 이정도로만 쓰고,NA,NA,NA,NA
99596,99597,99597,8,지금,뿐만 아니라 새벽 시간이라면 ' 지금 시간에 어울리는 잔잔한 노래 틀어줘,NA,NA,NA,NA
99597,99598,99598,8,지금,' ' 뉴욕 시간은 지금 몇 시야,NA,NA,NA,NA
99598,99599,99599,8,지금,지금 이 포스팅을 하는 시점에는 택시까지,NA,NA,NA,NA
99599,99600,99600,8,지금,어디서 본건있어서 이웃소환 한번 따라해봤다가 지금 멘붕이랍니다 ㅋㅋㅋㅋㅋㅋ 무엇보다 기존 애정이웃님들께서이,NA,NA,NA,NA
99600,99601,99601,8,지금,역시 만능은 아니고 가령 ' 지금 얼마나 충전되어 있어,NA,NA,NA,NA
99601,99602,99602,8,지금,지금 현재까지는 이아이가 말귀를 잘 못알아,NA,NA,NA,NA
99602,99603,99603,8,지금,지금 현재 WEF ( 세계경제포럼 ),NA,NA,NA,NA
99603,99604,99604,8,지금,미니 2 는 지금 현재 미니 3 과 그,NA,NA,NA,NA
99604,99605,99605,8,지금,근데 지금 계속 안 들리던 베이스 음이,NA,NA,NA,NA
99605,99606,99606,8,지금,선정이 중요한데 충전도 해야 돼서 지금 사진과는 다른 곳에 스피커를 설치해놨는데,NA,NA,NA,NA
99607,99608,99608,8,지금,ㅋㅋ 그래도 매우 만족스럽네요 ㅋㅋ 지금 일시품절이라고 하니또 출시되면 득템들 하시기를,NA,NA,NA,NA
99608,99609,99609,8,지금,지금 스피커도 모양이 독특하긴 하죠,NA,NA,NA,NA
99609,99610,99610,8,지금,분에 취침예약해줘 ' ' 지금 몇 시야,NA,NA,NA,NA
99610,99611,99611,8,지금,지금 한 달 정도 사용한 후기로써는,NA,NA,NA,NA
99611,99612,99612,8,지금,정말 다 갖고 싶어지네요 ㅋㅋ 지금 클로바 스마트 스피커를 구입하면 네이버,NA,NA,NA,NA
99612,99613,99613,8,지금,사진이 이 모양이라 죄송해요 ㅠ_ㅠ 지금 스위처 앞에 가구가 놓여져 있어서,NA,NA,NA,NA
99613,99614,99614,8,지금,지금 쓰는 32G 용량이 부족한 것,NA,NA,NA,NA
99614,99615,99615,8,지금,""" "" 하와이 지금 몇시야",NA,NA,NA,NA
99615,99616,99616,8,지금,추가해서 지금 당장 주문하고아 맞다,NA,NA,NA,NA
99616,99617,99617,8,지금,제가 생각했을때 획기적인 기능인것 같네요하지만 지금 불편한점을 찾자면유선이라는 점과 멜론만 이용해야한다는점멜론,NA,NA,NA,NA
99618,99619,99619,8,지금,지금 저 부분에만 자석이 있어 딱,NA,NA,NA,NA
99619,99620,99620,8,지금,스피커가 제공해주는 서비스는 턱없이 부족하지만 지금 당장은 얼마나 한국어를 잘 인식하는지가,NA,NA,NA,NA
99620,99621,99621,8,지금,지금 BF 모바일 청라점에서는 원하시는 AI,NA,NA,NA,NA
99621,99622,99622,8,지금,보낼 수 있을까 하고 ' 지금 어디야라고 카카오톡 보내줘 ' 했더니,NA,NA,NA,NA
99622,99623,99623,8,지금,카카오톡 보내줘 ' 했더니 ' 지금 어디야라고 카카오톡 ' 라고 메세지를,NA,NA,NA,NA
99623,99624,99624,8,지금,노래를 모아서 재생해 주기도 하고 지금 나오는 노래 제목을 물어보면 대답도,NA,NA,NA,NA
99625,99626,99626,8,지금,하면 알람도 맞춰주고미국에 사는 언니 지금 몇시인지 알려달라고 해서 카톡도 보내고,NA,NA,NA,NA
99626,99627,99627,8,지금,있는줄 몰라서 참 신기했던 기억이나요 지금 사용한지 보름정도 _ 는데 저는,NA,NA,NA,NA
99629,99630,99630,8,지금,' 내 손안의 인공지능 비서 지금 만나보세요 ' ' 어플을 실행,NA,NA,NA,NA
99630,99631,99631,8,지금,지금 카카오미니 스피커를 구매하려면세가지 옵션이 있는데,NA,NA,NA,NA
99631,99632,99632,8,지금,엠넷은 해지해도 일할계산이 안되서 지금 의도치 않게 음악 스트리밍서비스를이번달에는 3,NA,NA,NA,NA
99632,99633,99633,8,지금,구글 홈 미니의 발매를 앞둔 지금 저는 구글 홈 미니를 지원하는,NA,NA,NA,NA
99633,99634,99634,8,지금,지금 말고,NA,NA,NA,NA
99634,99635,99635,8,지금,지금 바로 나만의 홈캉스 계획 or,NA,NA,NA,NA
99635,99636,99636,8,지금,내 방에 지금 유플러스에서 준 클로바 프렌즈가 있는데,NA,NA,NA,NA
99636,99637,99637,8,지금,그래서 지금 수준에서 많이 쓰는 기능은 정해져,NA,NA,NA,NA
99637,99638,99638,8,지금,추후 업데이트를 진행한다고는 하지만 분명히 지금 구매시 사용에는 서비스가 부족합니다,NA,NA,NA,NA
99638,99639,99639,8,지금,) ' 클로바 지금 몇시야 ' 내가 제일 많이,NA,NA,NA,NA
99639,99640,99640,8,지금,ㅠ 그래도 딱 삼일정도 써본 지금 꽤 만족스러워요 돈쓰는 재미,NA,NA,NA,NA
99640,99641,99641,8,지금,주문할수록 배송은 늦어집니다 ^ ^ 지금 확인결과 1 월 5 일상품까지,NA,NA,NA,NA
99641,99642,99642,8,지금,- 간략후기 - 일단 지금 한 일주일 함께 생활해본 결과장점,NA,NA,NA,NA
99642,99643,99643,8,지금,저는 지금 두달째 너무 만족하면서 사용하고 있습니다,NA,NA,NA,NA
99643,99644,99644,8,지금,_ 미니 _ 도라에몽 이더라고요우선은 지금 만날 수 있는게 아니라 8,NA,NA,NA,NA
99644,99645,99645,8,지금,지금 저에게는 우리집 상전 빵이 덕에동요,NA,NA,NA,NA
99645,99646,99646,8,지금,이것에 마음이 동해서 지금 구매할 수 있는 것을 찾아보았다,NA,NA,NA,NA
99646,99647,99647,8,지금,20 만개의 대화방식이 지금 중요한게 아니라 진짜 인공지능 스피커라면,NA,NA,NA,NA
