,Unnamed: 0,X,category,key,sentences,senti,score1,score2,score3
118805,118806,118806,8,실제,종이를 벗기니 나오는 누구 미니의 실제 물건이 담겨져 있는 박스사진입니다,NA,NA,NA,NA
118806,118807,118807,8,실제,^ ^ 제가 실제 캠핑 카라반 침대 위에서 인어,NA,NA,NA,NA
118807,118808,118808,8,실제,실제 전원을 켜본 모습입니다,NA,NA,NA,NA
118808,118809,118809,8,실제,실제 비교 화면입니다,NA,NA,NA,NA
118809,118810,118810,8,실제,라고 생각했는데 실제 무드등 기능이 있음,NA,NA,NA,NA
118810,118811,118811,8,실제,꽤 인식률이 높은 대화 기능은 실제 사용하면서 솔직히 놀란 부분중 하나다,NA,NA,NA,NA
118811,118812,118812,8,실제,실제 이용해보니 이 기능들은 꼭 필요했던,NA,NA,NA,NA
118812,118813,118813,8,실제,실제 아들과 함께 카카오미니를 이용하면서 아이기준에서,NA,NA,NA,NA
118813,118814,118814,8,실제,하지만 실제 사용의 빈도를 고려할때 얼마나 편의성을,NA,NA,NA,NA
118814,118815,118815,8,실제,실제 아마존 알렉사가 보급된 미국에서는 스마트,NA,NA,NA,NA
118815,118816,118816,8,실제,실제 도라에몽의 목소리와 대화할 수 있는,NA,NA,NA,NA
118816,118817,118817,8,실제,또 도라에몽 캐릭터 적용은 물론 실제 도라에몽 목소리와 대화할 수 있는,NA,NA,NA,NA
118817,118818,118818,8,실제,제공하던 기능은 물론 미니언즈에 맞게 실제 미니언즈 목소리로 대답이 가능하다,NA,NA,NA,NA
118818,118819,118819,8,실제,1400 안시루멘은 상당히 하이엔드급에 해당하고 실제 시청했을 때 외부 환경 요인에,NA,NA,NA,NA
118819,118820,118820,8,실제,실제 엘지 스마트 TV 를 사용하는,NA,NA,NA,NA
118820,118821,118821,8,실제,민트이고 살때의 상세페이지보다 실제 색상이 훨씬 예쁩니다,NA,NA,NA,NA
118821,118822,118822,8,실제,실제 사용해봤을때 선예도 부분이 정말 뛰어나다는게,NA,NA,NA,NA
118822,118823,118823,8,실제,실제 설명서한번 안봐도 너무 쉽고 간편하게,NA,NA,NA,NA
118823,118824,118824,8,실제,실제 사용은 음성명령어도 좀 익히고 다양한,NA,NA,NA,NA
118824,118825,118825,8,실제,작아진 누구 미니 다음 편에는 실제 기능 부분을 하나하나 살펴보도록 하겠습니다,NA,NA,NA,NA
118825,118826,118826,8,실제,기적을 실제로 볼 수 있는 실제 사용기를 포스팅으로 담아볼께요 : ),NA,NA,NA,NA
118826,118827,118827,8,실제,그 시대가 실제 도래하면 우리의 삶은 영화에서 그러내던,NA,NA,NA,NA
118827,118828,118828,8,실제,4 시간 사용이 가능하다 하나 실제 체감은 더 짧은듯 싶어요,NA,NA,NA,NA
118828,118829,118829,8,실제,완전 신이 났듬 실제 가격은 119000 원 스페셜피규어 라이언으로,NA,NA,NA,NA
118829,118830,118830,8,실제,그럼 실제 사용을 해볼까요 ^ ^ 거실,NA,NA,NA,NA
118830,118831,118831,8,실제,( Social Studio ) 의 실제 대시보드 정서 분석 카드로서 브랜드,NA,NA,NA,NA
118831,118832,118832,8,실제,지금 글을 쓰는 나 또한 실제 제품을 접하지 않았을 때는,NA,NA,NA,NA
118832,118833,118833,8,실제,신기한게 실제 스피커도 똑같이 윗부분에 노란선이 빙글빙글,NA,NA,NA,NA
118859,118860,118860,5,전원,음량 조절 버튼 등이 달려있고 전원 버튼은 바닥에 있어요,NA,NA,NA,NA
118860,118861,118861,5,전원,아니라 각 방 각 램프별 전원 온 / 오프 설정이 간편하게,NA,NA,NA,NA
118861,118862,118862,5,전원,하단부에는 전원 및 usb aux out 포트가,NA,NA,NA,NA
118862,118863,118863,5,전원,밑에 전원 버튼이 있어요,NA,NA,NA,NA
118863,118864,118864,5,전원,Off 3 초 이상 누르면 전원 On / Off 모드에요,NA,NA,NA,NA
118864,118865,118865,5,전원,하단으로 보이지 않게 숨겨져 있는 전원 단자로 더욱 깔끔한 외관을 자랑하는데요,NA,NA,NA,NA
118865,118866,118866,5,전원,전원 어댑터 3,NA,NA,NA,NA
118866,118867,118867,5,전원,없을 만큼 사용하기 편하게 되어있어요본품에 전원 어댑터를 연결해주시면 끝이에요 ' 카카오,NA,NA,NA,NA
118867,118868,118868,5,전원,설명서와 스피커 본체 전원 연결 코드,NA,NA,NA,NA
118868,118869,118869,5,전원,"사용법 매뉴얼에 따라 전원 꼽고 "" 헤이 카카오 """,NA,NA,NA,NA
118869,118870,118870,5,전원,어댑터 헤이카카오 스피커 하단에 보면 전원 연결 단자는 총 3 개,NA,NA,NA,NA
118870,118871,118871,5,전원,스피커 하단에 위치한 전원 단자에 어댑터를 연결한 후콘센트에 꽂아,NA,NA,NA,NA
118871,118872,118872,5,전원,전원 코드를 꽂을 수 있는 어느곳에서든,NA,NA,NA,NA
118872,118873,118873,5,전원,함께하니까훨씬 귀엽고 예뻐보이네요 그럼 바로 전원 연결해볼게요스피커 밑면에 케이블 꽂아주세요 전원에,NA,NA,NA,NA
118873,118874,118874,5,전원,Hey 카카오미니를 부를때 헤이카카오를 외치면된다 전원 설명서 카카오미니 피규어구성품은 세상 단촐,NA,NA,NA,NA
118874,118875,118875,5,전원,상자 속에는 사용설명서 카카오미니 본체 전원 어댑터그리고 카카오미니에 귀여움을 더해줄 피규어가,NA,NA,NA,NA
118875,118876,118876,5,전원,맨 먼저 카카오미니 하단의 전원 단자에 어댑터를 연결한 후콘센트에 꽂아주면,NA,NA,NA,NA
118876,118877,118877,5,전원,사진 오른쪽의 전원 어댑터와 크기를 비교해도 크다고 느낄,NA,NA,NA,NA
118877,118878,118878,5,전원,ㅋㅋ 스피커 하단에 전원 aux usb 단자가 있는데 usb,NA,NA,NA,NA
118878,118879,118879,5,전원,일찍샀네 하는 생각이 ㅋㅋ 일단 전원 연결합니다,NA,NA,NA,NA
118879,118880,118880,5,전원,연결해서 스피커로 쓰는 Aux out 전원 꼽는곳그리고 폰 충전 usb 꼽을,NA,NA,NA,NA
118880,118881,118881,5,전원,전원 연결 후카카오 미니는 컴퓨터 옆에,NA,NA,NA,NA
118881,118882,118882,5,전원,최대 5 시간까지 전원 없이 사용할 수 있다,NA,NA,NA,NA
118882,118883,118883,5,전원,2 ' Passive Radiator 사용 전원 12V / 2A 오디오 코덱,NA,NA,NA,NA
118883,118884,118884,5,전원,밑부분에는 USB / 전원 / AUX 전원 어댑터는 가운데에,NA,NA,NA,NA
118884,118885,118885,5,전원,USB / 전원 / AUX 전원 어댑터는 가운데에 꽂아주면 됩니당 이제,NA,NA,NA,NA
118885,118886,118886,5,전원,있어서 좋네요 ^ ^ 구성품으로는 전원 어댑터가 포함되어 있는데 전원 단자는,NA,NA,NA,NA
118886,118887,118887,5,전원,구성품으로는 전원 어댑터가 포함되어 있는데 전원 단자는 하단에 보이지 않게 숨겨져,NA,NA,NA,NA
118887,118888,118888,5,전원,전원 단자 옆에는 AUX 단자가 있는데,NA,NA,NA,NA
118888,118889,118889,5,전원,제품의 하단부 안쪽으로는 USB 포트와 전원 포트 그리고 AUX 단자가 위치해,NA,NA,NA,NA
118889,118890,118890,5,전원,카카오미니는 스피커와 전원 어뎁터 설명서가 기본 구성품,NA,NA,NA,NA
118890,118891,118891,5,전원,밑부부분에는 전원 버튼이 있고 미끄럼 방지 처리가,NA,NA,NA,NA
118891,118892,118892,5,전원,구성품을 보면 전원 어댑터와 케이블 그리고 설명서 외,NA,NA,NA,NA
118892,118893,118893,5,전원,제품 하단을 보면 전원 버튼을 확인할 있는데요,NA,NA,NA,NA
118893,118894,118894,5,전원,다시 전원 버튼을 누르면 슬림 모드에 들어가게,NA,NA,NA,NA
118894,118895,118895,5,전원,드리면스피커에 전원연결선이 있다면 앰프 내장형이구요 전원 연결선이 없다면 앰프가 없는것입니다이 제품을,NA,NA,NA,NA
118895,118896,118896,5,전원,측면에 위치한 전원 버튼과 블루투스 연결 ( 페어링,NA,NA,NA,NA
118896,118897,118897,5,전원,잘되진 않는데음악기능은 정말 잘되는 듯 전원 케이블은 최근 갤럭시거랑 같아요,NA,NA,NA,NA
118897,118898,118898,5,전원,전원 스위치는 하단에 있어요,NA,NA,NA,NA
118898,118899,118899,5,전원,단순히 말하면 전원 트로이달이 크면 클수록 좋다고 생각하시면,NA,NA,NA,NA
118899,118900,118900,5,전원,조작버튼은 간단해요어댑터 연결해 놓으면 그냥 전원 On 상태사운드 볼륨조정 버튼과 마이크,NA,NA,NA,NA
118900,118901,118901,5,전원,자리잡고 있으며 후면에는 블루투스 버튼 전원 버튼 라인아웃 단자 그리고 충전,NA,NA,NA,NA
118901,118902,118902,5,전원,전원 단자를 눌러 제품의 전원을 켜자,NA,NA,NA,NA
118902,118903,118903,5,전원,사이즈로 휴대성을 더한 모습이네요 측면 전원 블루투스 라인 아웃과 5 핀,NA,NA,NA,NA
118903,118904,118904,5,전원,전원버튼이 보입니다아래쪽 단자는 라인아웃 단자와 전원 단자구요자체 스피커 기능이 있지만 더,NA,NA,NA,NA
118904,118905,118905,5,전원,' 하고 부르며 쓸텐데 전원 ON,NA,NA,NA,NA
118905,118906,118906,5,전원,핵심인 스피커와 간단한 사용설명서 220v 전원 어댑터가 들어있다카카오미니는 아쉽게도 무선스피커가 아니기,NA,NA,NA,NA
118906,118907,118907,5,전원,Power 에 카카오미니 전원 어댑터를 꽂으면 전원이 켜진다두근두근 스피커,NA,NA,NA,NA
118907,118908,118908,5,전원,느낌무선이 아니라는 유일한 단점이 있지만 전원 어댑터가 길어서 큰 불편함은 없다,NA,NA,NA,NA
118908,118909,118909,5,전원,옆모습 ㅎㅎㅎㅎㅎㅎ 그리고 밑에 전원 버튼이 있어요,NA,NA,NA,NA
118909,118910,118910,5,전원,하단은 전원 버튼 등이 있습니다,NA,NA,NA,NA
118910,118911,118911,5,전원,마음에 드는 부분 : ) 전원 버튼은 맨 아래에 있어요,NA,NA,NA,NA
118911,118912,118912,5,전원,^ ^ 스피커 밑에 전원 연결하고헤이카카오앱을깔아야해요 이정도가 얘가 알아듣고 말할,NA,NA,NA,NA
118912,118913,118913,5,전원,뒤쪽으로는 전원 블루투스 버튼과 라인아웃 전원 단자가,NA,NA,NA,NA
118913,118914,118914,5,전원,뒤쪽으로는 전원 블루투스 버튼과 라인아웃 전원 단자가 보입니다,NA,NA,NA,NA
118914,118915,118915,5,전원,전원,NA,NA,NA,NA
118915,118916,118916,5,전원,전원 케이블을 연결해야만 사용할수있다는,NA,NA,NA,NA
118916,118917,118917,5,전원,오른쪽에는 usb 전원 단자가 보이고 왼쪽에는 스피커 출력단자가,NA,NA,NA,NA
118917,118918,118918,5,전원,2 채널 미니 스피커 USB 전원 사용다양한 기기 연결기존의 2 채널에서,NA,NA,NA,NA
118918,118919,118919,5,전원,전원 연결이 되면 이렇게 시작이 돼요,NA,NA,NA,NA
118919,118920,118920,5,전원,카카오미니는 하단에 있는 어댑터를 연결해사용하고 전원 USB AUX 단자를 연결할 수,NA,NA,NA,NA
118920,118921,118921,5,전원,뒷면에는 전원 버튼과 블루투스 충전단자와 라인 연결단자가,NA,NA,NA,NA
118922,118923,118923,5,전원,외부용 충전배터리를 이용하면 바깥에서도 사용가능해요 전원 케이블도 귀엽게 생겼네요 간단한 설명서와,NA,NA,NA,NA
118923,118924,118924,5,전원,종이를 들어내면 노란 설명서 패킷과 전원 케이블이 들어있다,NA,NA,NA,NA
118924,118925,118925,5,전원,카카오미니 본체 + 전원 케이블 + 설명서 패킷 설명서,NA,NA,NA,NA
118925,118926,118926,5,전원,아랫면에는 USB 단자와 전원 입력 단자 그리고 AUX 단자가,NA,NA,NA,NA
118926,118927,118927,5,전원,ㅋㅋ △ 누구 미니 처음 전원 켜고 등록 동영상정말 간단해요,NA,NA,NA,NA
118927,118928,118928,5,전원,ㅋㅋ △ 누구 미니 처음 전원 켜고 등록 동영상 정말 간단해요,NA,NA,NA,NA
118928,118929,118929,5,전원,제품 하단에는 전원 버튼이 있어 장시간 사용하지 않을,NA,NA,NA,NA
118929,118930,118930,5,전원,카카오미니가 젤 귀욥 ♡ ♡ 전원 어댑터를 항상 꼽고 있어야해서갖고 다니지는,NA,NA,NA,NA
118932,118933,118933,5,전원,후면에 있는 전원 버튼,NA,NA,NA,NA
118933,118934,118934,5,전원,꺼내보면 스피커 전원 어댑터 사용설명서가 있어요,NA,NA,NA,NA
118934,118935,118935,5,전원,ㅎㅎㅎ 전원 어댑터는 브라켓 안에 함께 고정시켰습니다,NA,NA,NA,NA
118936,118937,118937,5,전원,' ) - 전원 공급을 항상 해야함 - 가끔,NA,NA,NA,NA
118937,118938,118938,5,전원,^ ' 누구 ' 는 전원 어댑터를 이용해 사용이 가능했지만 누구,NA,NA,NA,NA
118938,118939,118939,5,전원,전원 블루투스,NA,NA,NA,NA
118939,118940,118940,5,전원,전원 버튼은 아래쪽에 이렇게 숨어 있어요,NA,NA,NA,NA
118940,118941,118941,5,전원,전원 버튼은 바닥에 있네요,NA,NA,NA,NA
118941,118942,118942,5,전원,버튼은 전원 On / Off 및 Bluetooth,NA,NA,NA,NA
118942,118943,118943,5,전원,본품과 전원 콘센트만이 있어요,NA,NA,NA,NA
118943,118944,118944,5,전원,카카오 미니의 전원 연결도 마치고 필요한 앱도 설치하고,NA,NA,NA,NA
118944,118945,118945,5,전원,무게는 390g 가볍죠 이제 전원 연결을 해주면 준비 완료랍니다 심플하게,NA,NA,NA,NA
118945,118946,118946,5,전원,카카오미니 스피커와 전원 어댑터로 구성돼 있습니다,NA,NA,NA,NA
118946,118947,118947,5,전원,외부 버튼은 마이크 음소거 전원 볼륨 조절 버튼이 제공되고 있는데요,NA,NA,NA,NA
118947,118948,118948,5,전원,1 카카오미니 하단의 전원 단자에어탭터를 연결한 후 콘센트에 꽃습니다,NA,NA,NA,NA
118948,118949,118949,5,전원,제품의 구성은 카카오미니 본체 전원 공급용 어댑터 사용설명서로 심플하게 이뤄져,NA,NA,NA,NA
118949,118950,118950,5,전원,제품을 사용하기 위해서는 하단 전원 단자에 어댑터를 연결해서 전원을 켜준다,NA,NA,NA,NA
118950,118951,118951,5,전원,카카오미니를 올려뒀어요 - 기기등록을 해두고 전원 / Wi-fi 연결이 되어있다면헤이카카오,NA,NA,NA,NA
118951,118952,118952,5,전원,^ ^ 스피커와 사용설명서 그리고 전원 어댑터카카오미니 하단의 전원 단자에 어댑터를연결해서,NA,NA,NA,NA
118952,118953,118953,5,전원,사용설명서 그리고 전원 어댑터카카오미니 하단의 전원 단자에 어댑터를연결해서 콘센트에 꽂아주면 되요,NA,NA,NA,NA
118953,118954,118954,5,전원,뭐 전원 연결하는 건 좋은데 일단 어댑터가,NA,NA,NA,NA
118954,118955,118955,5,전원,뒤쪽은 음량 블루투스 음소거 아래는 전원 버튼 - ( 물론 그,NA,NA,NA,NA
118955,118956,118956,5,전원,설명서에는 구성품 전원 및 버튼 설명 그리고 어플,NA,NA,NA,NA
118956,118957,118957,5,전원,뒷면의 아랫쪽에 전원 및 충전,NA,NA,NA,NA
118957,118958,118958,5,전원,전원이 들어와서 작은 전원불빛이 보이지만 전원 버튼이 있는 동글이는 전원버튼을 누르면,NA,NA,NA,NA
118958,118959,118959,5,전원,ㅋㅋ 전원 킨 모습 완전 간지 ^,NA,NA,NA,NA
118959,118960,118960,5,전원,아랫부분은 전원 어댑터를 연결하는 부분과 함께 USB,NA,NA,NA,NA
118960,118961,118961,5,전원,스피커 상단에 볼륨조절과 마이크 전원 4 가지 버튼이 있고 음성인식이나,NA,NA,NA,NA
118961,118962,118962,5,전원,전원 연결하니 저렇게 불빛이 쫙 들어옵니다,NA,NA,NA,NA
118962,118963,118963,5,전원,작동방법은 먼저 전원 온,NA,NA,NA,NA
118963,118964,118964,5,전원,사이즈 블루투스 스피커티 로고도 보이고 전원 버튼등이 있어요 nfc 기능도 있어요일반,NA,NA,NA,NA
118964,118965,118965,5,전원,전원 버튼을 꾸우욱 누르면 호옹,NA,NA,NA,NA
118965,118966,118966,5,전원,있답니다 ^ ^ 아래에 있는 전원 케이블과 USB 인식 단자전원 케이블을,NA,NA,NA,NA
118966,118967,118967,5,전원,위한 공간 한쪽은 MODE / 전원 / HDMI,NA,NA,NA,NA
118967,118968,118968,5,전원,한쪽은 음량 / 전원 / MHL HDMI 케이블을연결할 수,NA,NA,NA,NA
118968,118969,118969,5,전원,유선랜을 통한 연결시 별도에 전원 연결선 없이 POE 를 통한,NA,NA,NA,NA
118969,118970,118970,5,전원,음성인식을 못 해요 아래 면에는 전원 버튼이 있어요충전은 계속 시켜놓고 사용이,NA,NA,NA,NA
118970,118971,118971,5,전원,) 카카오 전원 꽂아봤어요 불 들어오는거 먼가 이쁘구,NA,NA,NA,NA
118971,118972,118972,5,전원,귀여운지 ㅋㅋㅋㅋㅋㅋ 카카오프렌즈 최애캐릭터예요 ㅋㅋㅋ 전원 어뎁터도 내장되어있어요건전지방식이 아닌 전원방식이라 배터리,NA,NA,NA,NA
118972,118973,118973,5,전원,간단 사용설명서 ● 품질보증서 뒤에 전원 버튼이 있고그 옆은 블루투스 버튼,NA,NA,NA,NA
118973,118974,118974,5,전원,전원 자체가 차단되는 전원이 아니라 대기상태이기,NA,NA,NA,NA
118974,118975,118975,5,전원,Radiator 전원,NA,NA,NA,NA
118976,118977,118977,5,전원,터치패드를 이용해서 전원 음성차단 볼륨 조절 같은 빠른,NA,NA,NA,NA
118977,118978,118978,5,전원,미니는 배터리 내장형이 아니어서 AC 전원 어댑터를 연결해줘야한답니다,NA,NA,NA,NA
118978,118979,118979,5,전원,Aux 전원 usb 이렇게 3 가지 단자로,NA,NA,NA,NA
118979,118980,118980,5,전원,티비 자체 전원 및 볼륨은,NA,NA,NA,NA
118980,118981,118981,5,전원,전원 버튼과 TV 와 연결할 수도,NA,NA,NA,NA
118981,118982,118982,5,전원,2 시간 30 분 동안 전원 연결 없이도 사용이 가능하다는 점,NA,NA,NA,NA
118982,118983,118983,5,전원,/ 2 Passive Radiator 사용 전원 : 12V / 2A 스피커,NA,NA,NA,NA
118983,118984,118984,5,전원,720USB 외부입력 블루투스 HDMI 일단 전원 공급을 이용한 상시 전원으로 스마트빔을,NA,NA,NA,NA
118984,118985,118985,5,전원,버튼들이있어요음소거 블루투스음량 키우고 줄이는 버튼 전원 버튼은 밑부분에 있습니다,NA,NA,NA,NA
118985,118986,118986,5,전원,케이블발화문 가이드퀵스터가이드 및 품질보증서 밑바닥에 전원 버튼이 있어요,NA,NA,NA,NA
118986,118987,118987,5,전원,무조건 전원 연결 필수,NA,NA,NA,NA
118987,118988,118988,5,전원,음량과 전원 버튼이 상단에 있구요,NA,NA,NA,NA
118988,118989,118989,5,전원,우선 카카오미니 하단의 전원 단자에 어댑터를 연결한 후콘센트에 꽂아주세용,NA,NA,NA,NA
118989,118990,118990,5,전원,- 버튼과 미끄럼 방지 패드와 전원 버튼이 제품의 하단에 위치해 있습니다,NA,NA,NA,NA
118990,118991,118991,5,전원,ㅋㅋㅋ 사용설명서 말고도 전용 전원 어댑터와 ( 전용 어댑터가 꽂아,NA,NA,NA,NA
118991,118992,118992,5,전원,귀여워 ㅠ3ㅠ 구성은 피규어 스피커 전원 어댑터 사용설명서요렇게 되어있구요,NA,NA,NA,NA
118992,118993,118993,5,전원,전원 어댑터는 아래 쪽에 연결해주면 돼요,NA,NA,NA,NA
118993,118994,118994,5,전원,전원 버튼을 똑 딱 하면 바로,NA,NA,NA,NA
118994,118995,118995,5,전원,스피커 + 전원 케이블 + 사용 설명서 Ai,NA,NA,NA,NA
118995,118996,118996,5,전원,음소거 버튼과 전원 버튼 볼륨 조절 버튼이 있습니다,NA,NA,NA,NA
118996,118997,118997,5,전원,왼쪽부터 외부 출력 - 전원 - USB 포트입니다,NA,NA,NA,NA
118997,118998,118998,5,전원,알아듣더라구요 스피커 밑부분에는 AUX OUT 전원 USB 단자들이 있네요그럼 전원을 연결해줍니다,NA,NA,NA,NA
118998,118999,118999,5,전원,굉장히 단순하고 깔끔하게 생겼습니다음소거 / 전원 / 소리 + - 이것이,NA,NA,NA,NA
118999,119000,119000,5,전원,사용방법은 아래쪽에 있는 전원 버튼을 누르고 켜서헤이 클로바 하고,NA,NA,NA,NA
119000,119001,119001,5,전원,전원 코드 외에도 AUX USB 단자가,NA,NA,NA,NA
119001,119002,119002,5,전원,후면을 보면 전원 버튼과 블루투스 버튼 외부기기 (,NA,NA,NA,NA
119002,119003,119003,5,전원,구성품은 스피커 본체와 전원 아답터 그리고 사용설명서 였습니다,NA,NA,NA,NA
119003,119004,119004,5,전원,뒷부분에 있어요특히 클로바 프렌즈 플러스의 전원 버튼은 바닥에 있답니다,NA,NA,NA,NA
119004,119005,119005,5,전원,전원 : 전용 어댑터 연결 7,NA,NA,NA,NA
119005,119006,119006,5,전원,전원 및 충전확인 LED - 흰색,NA,NA,NA,NA
119006,119007,119007,5,전원,전원 버튼 - 짧게 : 전원,NA,NA,NA,NA
119007,119008,119008,5,전원,전원 버튼 - 짧게 : 전원 켜기 - 길게 : 3,NA,NA,NA,NA
119008,119009,119009,5,전원,: 3 초 이상 누르면 전원 끄기만약 3 번과 6 번을,NA,NA,NA,NA
119009,119010,119010,5,전원,★ 카카오 미니는 반드시 콘센트에 전원 어댑터를 연결해야만 작동가능해요,NA,NA,NA,NA
119010,119011,119011,5,전원,구성품은스피커 마그넷 피규어 전원 공급용 어댑터 사용설명서 ' 이렇게,NA,NA,NA,NA
119011,119012,119012,5,전원,USB 케이블과 충전어댑터는카카오 미니는 일체형이며 전원 단자가 동그라미 모양이예요,NA,NA,NA,NA
119012,119013,119013,5,전원,프렌즈 플러스는 케이블과 어댑터가 분리형이며 전원 단자가 갤럭시 S9 과 똑같은,NA,NA,NA,NA
119013,119014,119014,5,전원,있으시던데참고하세욥 필요 권한 모두 승인 전원 연결하고연결기기 찾고동일한 와이파이 선택하기 그럼,NA,NA,NA,NA
119014,119015,119015,5,전원,바로 이 파워 메인 전원 선이 없다면구동조차 되지 않는다는거,NA,NA,NA,NA
119015,119016,119016,5,전원,배터리나 전원 기능에 대해 비판을 하는 사람들도,NA,NA,NA,NA
119016,119017,119017,5,전원,전원 공급장치와 사용설명서가 있네용,NA,NA,NA,NA
119017,119018,119018,5,전원,이고 무게는 약 600g ( 전원 어댑터 제외 ) 입니다,NA,NA,NA,NA
119018,119019,119019,5,전원,제품의 옆으로는 전원 USB 그리고 HDMI 연결 단자를,NA,NA,NA,NA
119019,119020,119020,5,전원,그리고 배터리 내장으로 일정 시간 전원 케이블 필요 없이 사용이 가능하다는,NA,NA,NA,NA
119020,119021,119021,5,전원,mm ) 무게 1030g 219g 전원 15W ( DC ) 2A,NA,NA,NA,NA
119021,119022,119022,5,전원,아쉽게도 따로 전원 어댑터는 들어 있지 않지만 기존에,NA,NA,NA,NA
119022,119023,119023,5,전원,않는다는 점 ㅠ 요렇게 연결하고 전원 꽂고 헤이카카오 앱을 설치하면 준비,NA,NA,NA,NA
119023,119024,119024,5,전원,구성품은 카카오 미니 전원 공급용 어댑터 사용설명서로 구성되어 있어요,NA,NA,NA,NA
119024,119025,119025,5,전원,배터리 수준을 보고 싶을 경우 전원 버튼을 누르면,NA,NA,NA,NA
119025,119026,119026,5,전원,전원 단자에 어댑터를 연결한 후 콘센트에,NA,NA,NA,NA
119026,119027,119027,5,전원,전원 단자에 어댑터 연결 후 콘센트에,NA,NA,NA,NA
119027,119028,119028,5,전원,카카오 미니의 설명서가 나온다설명서의 아래에는 전원 케이블이,NA,NA,NA,NA
119028,119029,119029,5,전원,미끄러짐 방지를 위해 고무로 되었고가운데 전원 케이블과 연결할 수 있다,NA,NA,NA,NA
119029,119030,119030,5,전원,전원 케이블을 항상 이용해야 하는점,NA,NA,NA,NA
119030,119031,119031,5,전원,미니의 설명서가 나온다 설명서의 아래에는 전원 케이블이,NA,NA,NA,NA
119031,119032,119032,5,전원,방지를 위해 고무로 되었고 가운데 전원 케이블과 연결할 수 있다,NA,NA,NA,NA
119033,119034,119034,5,전원,ㅎㅎ 가운데 위 전원 버튼을 약 3 초,NA,NA,NA,NA
119034,119035,119035,5,전원,LED 표시램프 등 DC 전원 USB,NA,NA,NA,NA
119035,119036,119036,5,전원,바닥면에 전원 버튼이 있습니다,NA,NA,NA,NA
119036,119037,119037,5,전원,바닥부분 LED 가 빨간색충전 중이거나 전원 켜질때 명령어에 대답해 줄 때는,NA,NA,NA,NA
119037,119038,119038,5,전원,화장대 옆에다가 두었내요 ㅋ 바닥에는 전원 버튼이 있어요꾹,NA,NA,NA,NA
119038,119039,119039,5,전원,3 초간 누르면 전원 On / off 가 가능합니다뒷면에는,NA,NA,NA,NA
119039,119040,119040,5,전원,음성으로 채널 음량 조절과 전원 온오프 기능까지,NA,NA,NA,NA
119040,119041,119041,5,전원,수 있으며 타이머 기능 예약 전원 온 오프 기능을 이용할 수,NA,NA,NA,NA
119041,119042,119042,5,전원,카카오 미니 본체 전원 케이블 설명서 상단은 4 개의,NA,NA,NA,NA
119042,119043,119043,5,전원,하단에는 전원 그리고 페어링을 할 수 있는,NA,NA,NA,NA
119043,119044,119044,5,전원,전원 버튼을 길게 누르면 주변에 등록한,NA,NA,NA,NA
119044,119045,119045,5,전원,후면부에는 블루투스를 켜고 끄는 버튼과 전원 버튼이 있습니다,NA,NA,NA,NA
119045,119046,119046,5,전원,버튼과 전원 버튼이 있습니다,NA,NA,NA,NA
119046,119047,119047,5,전원,상자를 개봉하면 본체와 사용설명서 전원 어댑터가,NA,NA,NA,NA
119047,119048,119048,5,전원,카카오미니 스피커 멜론은 전원 연결하고 핸드폰에 앱설치 해주고 블루투스로,NA,NA,NA,NA
119048,119049,119049,5,전원,구성은 저렇고 이제 본격적으로 스피커 전원 연결 및 어플 사용방법에 대해,NA,NA,NA,NA
119049,119050,119050,5,전원,보면 저렇게 되어있는데 POWER 부분에 전원 어댑터를 연결하기만 하면 끝 ㅋㅋㅋ,NA,NA,NA,NA
119050,119051,119051,5,전원,네이버 스피커는 전원 어댑터 연결없이도 언제 어디서든 사용할수있다는게,NA,NA,NA,NA
119051,119052,119052,5,전원,제일 큰 장점 카카오 스피커는 전원 공급이 돼야 사용 가능하다는게 단점,NA,NA,NA,NA
119052,119053,119053,5,전원,옆면에는 전원 버튼이 있어요 위에는 볼륨 버튼,NA,NA,NA,NA
