,Unnamed: 0,X,category,key,sentences,senti,score1,score2,score3
43511,43512,43512,8,정도,신기하더라고요 음성인식률은 90 % 이상 정도 되는 것 같아요,NA,NA,NA,NA
43512,43513,43513,8,정도,정도 ㅋ 블랙색상,NA,NA,NA,NA
43513,43514,43514,8,정도,위하여 USB-C 타입으로 하고 젠더 정도 넣어 주는 것도 바람직한 방향이,NA,NA,NA,NA
43514,43515,43515,8,정도,개인적으로 KT 지니 정도 되어야 사용에 불편함이 없을 듯,NA,NA,NA,NA
43515,43516,43516,8,정도,지역 케이블 방송을 7 년 정도 가입해서 TV + 인터넷을 사용해,NA,NA,NA,NA
43516,43517,43517,8,정도,업데이트를 해요대략 한 5 분 정도 시간이 걸렸던 것 같아요설치부터 인증까지,NA,NA,NA,NA
43517,43518,43518,8,정도,기온 오늘 최고 기온 미세먼지 정도 등을 알려줍니다,NA,NA,NA,NA
43518,43519,43519,8,정도,설치를 모두 완료하는데 10 분 정도 소모가 되더군요,NA,NA,NA,NA
43519,43520,43520,8,정도,' 를 한 두번 정도 들으면 그냥 리모컨 찾게 된다,NA,NA,NA,NA
43520,43521,43521,8,정도,4 분 정도 소요될 예정이예요 두근 두근한 마음에,NA,NA,NA,NA
43521,43522,43522,8,정도,70 % 정도 성능이 늘어나는것에 불과합니다 다들 이상하게,NA,NA,NA,NA
43522,43523,43523,8,정도,ddr 256 이나 ddr 8192 정도 되야죠 그리고 윈도우나 리눅스도 이런,NA,NA,NA,NA
43523,43524,43524,8,정도,그냥 티비 소리가 깨끗하게 난다 정도,NA,NA,NA,NA
43524,43525,43525,8,정도,음성인식은 좀 70 % 정도 된다고 해야하나 크게 기대를 안하는,NA,NA,NA,NA
43525,43526,43526,8,정도,이용자와 대화한 채팅기록을 15 일 정도 애플리케이션에 저장합니다,NA,NA,NA,NA
43526,43527,43527,8,정도,알아서 척척 음악을 들려줘서 편하다 정도,NA,NA,NA,NA
43527,43528,43528,8,정도,완료되면 레드불빛이 꺼져요 2 시간 정도 충전하면 6,NA,NA,NA,NA
43528,43529,43529,8,정도,관심 있는 분은 한 번 정도 보는 것도 나쁘지 않아 보입니다,NA,NA,NA,NA
43529,43530,43530,8,정도,집에 보편화 되기까진 그래도 어느 정도 기간이 좀 걸리겠지라고 생각했었는데 어느,NA,NA,NA,NA
43547,43548,43548,8,구입,만 있으면 별도의 기기나 교재 구입 없이도 교육 콘텐츠를 이용할 수,NA,NA,NA,NA
43548,43549,43549,8,구입,ktShop 에서 만나보실 수 있답니다 구입 조건을 확인해 보세요,NA,NA,NA,NA
43549,43550,43550,8,구입,말라가시는 분 - 블루투스 스피커 구입 예정이신 분,NA,NA,NA,NA
43550,43551,43551,8,구입,우선 멤버십 포인트로 스마트폰 구입 시 최대 5 만원 추가,NA,NA,NA,NA
43551,43552,43552,8,구입,# 네이버클로바 구입 & 설치기 / # 클로바앱,NA,NA,NA,NA
43552,43553,43553,8,구입,그렇게 찾아보다가가성비 좋은 # 지니블루투스마이크로 구입,NA,NA,NA,NA
43620,43621,43621,8,인테리어,알루미늄 마감으로 고급스러운 느낌이 생겨 인테리어 효과도 기대할 수 있죠,NA,NA,NA,NA
43622,43623,43623,8,인테리어,전체적으로 고급스러운 인테리어 스피커가 아닐까 해요,NA,NA,NA,NA
43623,43624,43624,8,인테리어,디자인은 우주선에서 모티브를 얻어 미래지향적이면서 인테리어 소품으로 활용하기 손색이 없게 디자인,NA,NA,NA,NA
43624,43625,43625,8,인테리어,모티브를 얻은 미래지향적 디자인으로 제작해 인테리어 소품으로 활용해도 손색이 없구요 색상은,NA,NA,NA,NA
43625,43626,43626,8,인테리어,시선을 사로잡는 인상적인 디자인으로 집안 인테리어 소품으로도 제격이더라구요,NA,NA,NA,NA
43626,43627,43627,8,인테리어,수 있었는데 실제 생활과 동일한 인테리어 분위기에서 체험하게 하려는 노력을 엿볼,NA,NA,NA,NA
43627,43628,43628,8,인테리어,인테리어 요소를 지나칠 수 없다는 이야기입니다,NA,NA,NA,NA
43628,43629,43629,8,인테리어,인테리어 효과 면에서는 무척 후한 점수를,NA,NA,NA,NA
43629,43630,43630,8,인테리어,TV 셋톱박스를 치우고 두니 거실 인테리어 효과도 좋더라고요,NA,NA,NA,NA
43630,43631,43631,8,인테리어,모티브를 얻은 미래지향적 디자인으로 제작해 인테리어 소품으로 활용해도 손색이 없다,NA,NA,NA,NA
43631,43632,43632,8,인테리어,분위기에 맞게 인테리어 룩을 연출할 수 있어요,NA,NA,NA,NA
43632,43633,43633,8,인테리어,사용하시다가 벽에 걸어 깔끔하고 정돈된 인테리어 효과를 내시는 고객분들이 많아 지셨습니다,NA,NA,NA,NA
43633,43634,43634,8,인테리어,고가의 인테리어 보다,NA,NA,NA,NA
43634,43635,43635,8,인테리어,알루미늄 메탈과 작은 크기 덕에 인테리어 소품으로 역할을 톡톡히 해냅니다,NA,NA,NA,NA
43635,43636,43636,8,인테리어,우주선에서 모티브를 얻은 미래지향적 디자인으로 인테리어 소품으로 손색이 없는 기가지니,NA,NA,NA,NA
43639,43640,43640,8,인테리어,우아한 볼륨라인으로어디에도 너무나 잘 어울리는 인테리어 룩으로 탈바꿈,NA,NA,NA,NA
43640,43641,43641,8,인테리어,중 개인 취향 혹은 집안 인테리어 등을 고려해서 골라보시면 좋을 것,NA,NA,NA,NA
43641,43642,43642,8,인테리어,ㅎ 인테리어 소품으로도 꽤 보기 좋다,NA,NA,NA,NA
43643,43644,43644,8,인테리어,선사하며 우주선에서 모티브를 얻은 미래지향적인디자인으로 인테리어 소품으로 활용해도 손색이 없답니다,NA,NA,NA,NA
43644,43645,43645,8,인테리어,우주선에서 모티브를 얻은 미래지향적 디자인으로 인테리어 소품으로 활용해도 손색이 없습니다,NA,NA,NA,NA
43646,43647,43647,8,인테리어,컴팩트하면서 미니멀한 디자인때문에 실내에 두면 인테리어 효과도 있네요,NA,NA,NA,NA
43647,43648,43648,8,인테리어,가지 컬러로 집과 어울리는 색으로 인테리어 룩을 완성할 수 있답니다,NA,NA,NA,NA
43648,43649,43649,8,인테리어,셋탑박스와 스피커 기능을 갖춘 기가지니는 인테리어 소품으로도 훌륭한 역할을 해냅니다,NA,NA,NA,NA
43649,43650,43650,8,인테리어,인테리어 측면에서도 더 좋고요,NA,NA,NA,NA
43650,43651,43651,8,인테리어,스피커블랙 컬러를 선택하니 심플하고 멋있네요 인테리어 효과에도 참 좋아요,NA,NA,NA,NA
43651,43652,43652,8,인테리어,비트에따라 나타나는 은은한 조명효과로 집안의 인테리어 효과까지 업그레이드 시켜주는 전혀 다른,NA,NA,NA,NA
43652,43653,43653,8,인테리어,집안의 다른 가구들과 이루며 멋진 인테리어 소품이 된다,NA,NA,NA,NA
43653,43654,43654,8,인테리어,이처럼 인테리어 소품으로 훌륭한 역할을 해내는 기가지니의,NA,NA,NA,NA
43654,43655,43655,8,인테리어,세련된 디자인과 하만 카돈의 로고로 인테리어 효과도 좋고요,NA,NA,NA,NA
43655,43656,43656,8,인테리어,해내지만디자인 적으로도 잘 만들어져 집 인테리어 소품으로도잘 어울리는데요,NA,NA,NA,NA
43656,43657,43657,8,인테리어,인테리어 디자인 소품 중 하나로 보일,NA,NA,NA,NA
43657,43658,43658,8,인테리어,♡ 더욱 미니멀해지고 세련되어진 덕에 인테리어 효과는 업,NA,NA,NA,NA
43658,43659,43659,8,인테리어,동글한 디자인에 블랙과 실버라서 튀지않으면서도 인테리어 효과 업업,NA,NA,NA,NA
43659,43660,43660,8,카카오,기가 지니에 이어 카카오 미니 출시 소식을 들을 때도,NA,NA,NA,NA
43660,43661,43661,8,카카오,카카오 미니는미니미하게 변한 라이언과 어피치 피규어가,NA,NA,NA,NA
43661,43662,43662,8,카카오,그렇게 연결하고 휴대폰에서 ' 헤이 카카오 ' 앱을 깔고 연동시키면 작동한다,NA,NA,NA,NA
43662,43663,43663,8,카카오,나는 카카오 미니의 목소리가 너무너무 궁금했는데 네비게이션에서,NA,NA,NA,NA
43663,43664,43664,8,카카오,예전에 카카오 미니랑 아무 대화나 해보다가 알게,NA,NA,NA,NA
43664,43665,43665,8,카카오,여기서부터 몇 주 동안 카카오 미니를 사용하면서 알게 된 미세한,NA,NA,NA,NA
43666,43667,43667,8,카카오,/ cliplink / 376815821 카카오미니는 카카오 AI 페이지나 공식 카카오채널에서 볼,NA,NA,NA,NA
43667,43668,43668,8,카카오,ID 로 로그인이 가능하며 휴대폰번호 카카오 네이버페이스북의 SNS 아이디로 로그인을 하실,NA,NA,NA,NA
43668,43669,43669,8,카카오,저는 원래 카카오 것을 구입할 생각이였는데요 마침 구매를,NA,NA,NA,NA
43671,43672,43672,8,카카오,카카오,NA,NA,NA,NA
43674,43675,43675,8,카카오,모닝 알람 받기 실시간 소요시간 카카오 택시 부르기물어보기 등 다양한 기능들이,NA,NA,NA,NA
43675,43676,43676,8,카카오,모닝 알람 받기 실시간 소요시간 카카오 택시 부르기 물어보기 등 다양한,NA,NA,NA,NA
43676,43677,43677,8,카카오,경쟁제품으로 카카오 인공지능 스피커와 SK LG 의,NA,NA,NA,NA
43677,43678,43678,8,카카오,대상 ) 음원서비스 인수합병 동향 카카오 M 의 멜론 인수 지니뮤직은,NA,NA,NA,NA
43678,43679,43679,8,카카오,하면 카카오 택시도 불러주는 인공지능 비서 기가,NA,NA,NA,NA
43679,43680,43680,8,카카오,버스나 지하철 지도 정보를 확인하고 카카오 택시로 연동해 콜택시 호출을 지원하고,NA,NA,NA,NA
43680,43681,43681,8,카카오,' 를 그리고 카카오는 ' 카카오 미니 ' 와 같은 AI,NA,NA,NA,NA
43681,43682,43682,8,카카오,이용자 ( 승객 ) 는 카카오 계정으로 로그인해 이용자 정보를 카카오택시에,NA,NA,NA,NA
43682,43683,43683,8,카카오,카카오 계정으로 연동하여 사용한다는 점 전국,NA,NA,NA,NA
43683,43684,43684,8,카카오,카카오택시새롭게 느껴졌던 기능은 기가지니의 카카오 택시였는데요,NA,NA,NA,NA
43684,43685,43685,8,카카오,라고 명령을 내리면 자신의 휴대폰으로 카카오 택시와 연동이 되는 서비스를 이용할,NA,NA,NA,NA
43685,43686,43686,8,카카오,카카오 ' 미니 ' - 카카오의,NA,NA,NA,NA
43686,43687,43687,8,카카오,' 카카오 아이 ( I ) ',NA,NA,NA,NA
43687,43688,43688,8,카카오,홈 비서 서비스로 일정관리 음식배달 카카오 택시호출도,NA,NA,NA,NA
43688,43689,43689,8,카카오,어플을 사용해서 택시를 잡는데요 주로 카카오 택시를 사용합니다,NA,NA,NA,NA
43690,43691,43691,8,카카오,' 하면 지니가 알아서 카카오 택시를 이용해 택시를 집까지 불러다줍니다,NA,NA,NA,NA
43691,43692,43692,8,카카오,' 카카오 택시 호출 ' 기능입니다 ㅎㅎ,NA,NA,NA,NA
43692,43693,43693,8,카카오,기능도 탑재되어 있습니다등록된 정보를 통해 카카오 택시도 호출이 가능하죠가까운 야식집에서 야식도,NA,NA,NA,NA
43693,43694,43694,8,카카오,카카오 택시와 연동되어 있어 택시 호출도,NA,NA,NA,NA
43694,43695,43695,8,카카오,' 라고만 하면 카카오 택시와 연동되서 택시를 자동으로 불러준답니다,NA,NA,NA,NA
43695,43696,43696,8,카카오,클로바 ' 카카오의 인공지능 ' 카카오 I ',NA,NA,NA,NA
43696,43697,43697,8,카카오,"택시 불러줘 "" 라고 하면 카카오 택시로 연동해 콜택시 호출을 지원한다고",NA,NA,NA,NA
43697,43698,43698,8,카카오,참조 ) 네이버 지니뮤직 반 카카오 동맹 결성이 뉴스 제목이 어찌나,NA,NA,NA,NA
43698,43699,43699,8,카카오,AI 스피커라고 부르는 누구 클로바 카카오 미니 KT 지니를 비롯해 아마존,NA,NA,NA,NA
43699,43700,43700,8,카카오,국내에는 클로바의 네이버 카카오미니의 카카오 SKT 의 뉴규 KT 의,NA,NA,NA,NA
43700,43701,43701,8,카카오,= 카카오 미니 > > NUGU Mini,NA,NA,NA,NA
43701,43702,43702,8,카카오,음성인식은네이버 프렌즈 > 카카오 미니 > > > KT,NA,NA,NA,NA
43702,43703,43703,8,카카오,> > > > > 카카오 미니 ( 배터리 없음 ),NA,NA,NA,NA
43703,43704,43704,8,카카오,카카오 미니에는 배터리가 없는게 치명적이죠,NA,NA,NA,NA
43704,43705,43705,8,카카오,"택시 불러줘 "" 라고 하면 카카오 택시로 연동해 콜택시 호출을 지원하는",NA,NA,NA,NA
43705,43706,43706,8,카카오,기능을 이용하면 배달 음식 주문과 카카오 택시 호출도 할 수 있으며,NA,NA,NA,NA
43706,43707,43707,8,카카오,) 킥 ( 봇숍 ) 카카오 ( 카카오톡 카카오뱅크 ) 네이버,NA,NA,NA,NA
43707,43708,43708,8,카카오,: 웨이브 ( 샐리 ) 카카오 : 카카오미니 ( 헤이 카카오,NA,NA,NA,NA
43708,43709,43709,8,카카오,카카오 : 카카오미니 ( 헤이 카카오 ) ▶ 테크 리포트 애드마켓플레이스,NA,NA,NA,NA
43710,43711,43711,8,카카오,카카오 5,NA,NA,NA,NA
43712,43713,43713,8,카카오,한 마디면 바로 카카오 택시와 연동하여 택시가 온답니다,NA,NA,NA,NA
43713,43714,43714,8,카카오,버스뿐 아니라 카카오 택시까지 호출할 수 있다,NA,NA,NA,NA
43714,43715,43715,8,카카오,카카오 프렌즈 캐릭터와 종종 비교되곤 하는,NA,NA,NA,NA
43715,43716,43716,8,카카오,캐릭터들이 인기가 정말 많지만아직 우리나라에서는 카카오 프렌즈의 인기에 못미치는 듯 하다,NA,NA,NA,NA
43716,43717,43717,8,카카오,저번에 마트에서 카카오 인공지능을 본 적이 있는데요,NA,NA,NA,NA
43717,43718,43718,8,카카오,카카오 미니의 경우 소형 AI 스피커로써,NA,NA,NA,NA
43718,43719,43719,8,카카오,알수 있다고 하더라구요 ㅋㅋㅋㅋㅋㅋ 그리고 카카오 택시도 부를 수 있어요,NA,NA,NA,NA
43719,43720,43720,8,카카오,카카오 택시로 호출해우리집 앞까지 택시를 손쉽게,NA,NA,NA,NA
43721,43722,43722,8,카카오,' ' 일정관리 ' ' 카카오 택시 호출 ' 에 관심이,NA,NA,NA,NA
43722,43723,43723,8,카카오,나갈 준비를 하고 지니가 호출해준 카카오 택시를 타고 약속 장소로 나간다면,NA,NA,NA,NA
43776,43777,43777,8,광고,그 광고 그대로 구나 싶어서 같이 읽고,NA,NA,NA,NA
43777,43778,43778,8,광고,조회수 높은 음악 영상을 유튜브에서 광고 없이 재생하게 하거나 가위바위보 로봇을,NA,NA,NA,NA
43778,43779,43779,8,광고,people technology KT 막 이러면서 광고 했죠,NA,NA,NA,NA
43779,43780,43780,8,광고,요즘 한 창 광고 많이 하고 있는 ' 지니,NA,NA,NA,NA
43780,43781,43781,8,광고,대한민국에서는 광고 송출량이 그렇게 많은 거 같지는,NA,NA,NA,NA
43781,43782,43782,8,광고,게 구글 홈의 OOH 버스셸터 광고 때문인데요,NA,NA,NA,NA
43782,43783,43783,8,광고,광고 상에서도 이 모든 기능을 하나로,NA,NA,NA,NA
43783,43784,43784,8,광고,먼저 기가지니 광고 몇 편 보면 좋을거 같습니다,NA,NA,NA,NA
43784,43785,43785,8,광고,라는 광고 입니다,NA,NA,NA,NA
43785,43786,43786,8,광고,♡ kt 기기지니 광고 에서 처럼,NA,NA,NA,NA
43786,43787,43787,8,광고,/ 1486838 TV 로 이 광고 많이 보셨을텐데요,NA,NA,NA,NA
43787,43788,43788,8,광고,여러분 혹시 티브이 광고 중에서,NA,NA,NA,NA
43788,43789,43789,8,광고,한 눈에 알 수 있는 광고 영상 하나 보여드릴게요,NA,NA,NA,NA
43789,43790,43790,8,광고,위 광고 영상에서 보여준 기능 외에도 다양한,NA,NA,NA,NA
43790,43791,43791,8,광고,지니가 나왔는데 TV 에서 하는 광고 다들 보신 적 있으시겠죠,NA,NA,NA,NA
43791,43792,43792,8,광고,스마트기기를 이용해아이를 길러가는 과정을 담은해당 광고 영상은 서비스가 주는 가치를 자연스럽게,NA,NA,NA,NA
43792,43793,43793,8,광고,CCTV 와는 차원이 다른 기가아이즈 광고 영상인데뜬금없지만 저 광고에 나오는 BGM,NA,NA,NA,NA
43793,43794,43794,8,광고,혹시 광고 영상 중간에 지니의 몸에 ',NA,NA,NA,NA
43794,43795,43795,8,광고,이미 미니쿠퍼에 커넥티드 시스템을 적용한 광고 영상을 2011 년도에 공개하면 큰,NA,NA,NA,NA
43795,43796,43796,8,광고,ㅋㅋㅋㅋ 요거 완전 신기 ㅋㅋㅋ 광고 보고 정말 신기하다고 느꼈는데 실제로,NA,NA,NA,NA
43796,43797,43797,8,광고,리포트 애드마켓플레이스 : 인공지능과 온라인 광고 코인플러그 : 비트코인과 사물인터넷 더알파랩스,NA,NA,NA,NA
43797,43798,43798,8,광고,가끔 드라마 광고 속 음악이 궁금할때가 있죠,NA,NA,NA,NA
43798,43799,43799,8,광고,기가지니 광고 ] [ 출처,NA,NA,NA,NA
43801,43802,43802,8,광고,요즘 엄청 광고 때리고 있는 기가 지니 ',NA,NA,NA,NA
43802,43803,43803,8,광고,한 눈에 알 수 있는 광고 영상을 먼저 보고오도록 합시당 영상,NA,NA,NA,NA
43803,43804,43804,8,광고,광고 속에 나온 기능들을 간단히 정리해,NA,NA,NA,NA
43804,43805,43805,8,아래,관심 있는 분들은 아래 링크를 참고하면 된답니다,NA,NA,NA,NA
43805,43806,43806,8,아래,하기 때문에 발열이 있을텐에 이는 아래 쪽을 뛰움으로써 발열을 잡았구요,NA,NA,NA,NA
43806,43807,43807,8,아래,각 사용하는 서비스마다 차이가 있기에 아래 상세 페이지를 보시면 도움이 되실,NA,NA,NA,NA
43807,43808,43808,8,아래,보다 자세한 내용과 혜택은 아래 링크를 통해서 확인해보시길 바랍니다,NA,NA,NA,NA
43809,43810,43810,8,아래,아래 표를 참조하세요,NA,NA,NA,NA
43810,43811,43811,8,아래,무선자동설정 버튼 아래 쪽으로,NA,NA,NA,NA
43811,43812,43812,8,아래,해결해 줄거에요 KT 기가지니 이벤트를 아래 클릭해서 확인해 보세요 KT 기가지니,NA,NA,NA,NA
43812,43813,43813,8,아래,아래 세번째 사진처럼 불이 들어와 있으면,NA,NA,NA,NA
43813,43814,43814,8,아래,: ) 아래 링크를 클릭하면 KT 샵으로 슝,NA,NA,NA,NA
43814,43815,43815,8,아래,아래 영상을 한 번 보시죠,NA,NA,NA,NA
43815,43816,43816,8,아래,사항과 제품별 특징이 궁금한 분들은 아래 공식 사이트를 참고 하시길 바래요,NA,NA,NA,NA
43816,43817,43817,8,아래,기가 지니가 궁금하시면 아래 링크로,NA,NA,NA,NA
43817,43818,43818,8,아래,ㅎㅎ 버튼 이예 _ 아래 영상들 참고 하세요 ^ ^,NA,NA,NA,NA
43818,43819,43819,8,아래,아래 광고를 보시면 기가 아이즈가 일반,NA,NA,NA,NA
43819,43820,43820,8,아래,자세한 정보는 아래 링크를 클릭 : ),NA,NA,NA,NA
43820,43821,43821,8,아래,지니에 대해 더 알고 싶으시다면 아래 링크를 타고 들어가 더 많은,NA,NA,NA,NA
43821,43822,43822,8,아래,( 아래 영상을 재생해주세요,NA,NA,NA,NA
43822,43823,43823,8,아래,가입하실 분들은 아래 링크 확인하시고요,NA,NA,NA,NA
43823,43824,43824,8,아래,전원을 켜면사용에 따라 아래 쪽에 조명 색상이 바뀝니다,NA,NA,NA,NA
43824,43825,43825,8,아래,감사합니다 ^ ^ 자세한 정보는 아래 링크 클릭,NA,NA,NA,NA
43825,43826,43826,8,아래,아래 영상으로 확인해주세요 : - ),NA,NA,NA,NA
43826,43827,43827,8,아래,두 가지만으로도 근사하지만 KT 직영점에서는 아래,NA,NA,NA,NA
43827,43828,43828,8,아래,단말기만 구입도 가능하니 자세한 정보는 아래 이벤트 페이지를 참조하세요,NA,NA,NA,NA
43828,43829,43829,8,아래,자세한 정보는 아래 링크를 클릭,NA,NA,NA,NA
43829,43830,43830,8,아래,( 아래 이미지 참조 ) 네이버 지니뮤직,NA,NA,NA,NA
43830,43831,43831,8,아래,번가에서 전문가도움을 받아서 진행하게 되었는데 아래 소개를 남겨뒀으니 필요하신분들은 문의하면 좋을듯,NA,NA,NA,NA
43831,43832,43832,8,아래,아래 그림과 같이 기가지니 뒷편에 있는,NA,NA,NA,NA
43832,43833,43833,8,아래,딩동댕동 ' 이라고 음이 들리면서 아래 LED 가 껌뻑껌뻑한다,NA,NA,NA,NA
43833,43834,43834,8,아래,아래 이미지 클릭 시 KT 기가지니,NA,NA,NA,NA
43834,43835,43835,8,아래,아래 쪽으로 터치로 지원되는 전원과 볼륨,NA,NA,NA,NA
43835,43836,43836,8,아래,출력의 네오디뮴 마그네틱 트위터가 아래 쪽으론 20W,NA,NA,NA,NA
43836,43837,43837,8,아래,보다 자세한 내용은 아래 링크를 통해 확인하실 수 있습니다,NA,NA,NA,NA
43837,43838,43838,8,아래,기가 지니의 주요 서비스는 아래 사진을 참고하시기 바랍니다,NA,NA,NA,NA
43838,43839,43839,8,아래,사은품도 많이 드리고 친절하게 상담해드리는 아래 싸이트를 이용해보시기 바랍니다 ^ ^,NA,NA,NA,NA
43935,43936,43936,8,효과,LG 유플러스의 시너지 효과 본격화로 실적 턴어라운드가 가속화 될,NA,NA,NA,NA
43936,43937,43937,8,효과,인테리어 효과 면에서는 무척 후한 점수를 받아야,NA,NA,NA,NA
43937,43938,43938,8,효과,기가지니가 문장을 인식해 상황에 맞는 효과 / 배경음을 들려줍니다,NA,NA,NA,NA
43938,43939,43939,8,효과,상황에 맞게 나오는 효과 / 배경음 덕분에 아이들은 독서를,NA,NA,NA,NA
43939,43940,43940,8,효과,내 읽으면 문장을 인식해 알맞은 효과 / 배경음을 재생해 주니 책을,NA,NA,NA,NA
43940,43941,43941,8,효과,디자인에 블랙과 실버라서 튀지않으면서도 인테리어 효과 업업,NA,NA,NA,NA
43941,43942,43942,8,효과,기능만큼 모닝 알림 받기 기능의 효과 또한 한층 더 높아질 것,NA,NA,NA,NA
44035,44036,44036,8,마이크,상단에는 전원버튼 볼륨버튼 음성차단버튼 블루투스 마이크 등이 있어요 ^ ^ 마이크가,NA,NA,NA,NA
44036,44037,44037,8,마이크,한번 눌러주면일시정지 기능 본체 뒷면에는 마이크 / 블루투스 / 볼륨 버튼으로수동으로도,NA,NA,NA,NA
44037,44038,44038,8,마이크,영상의 단어나 문장을 먼저 읽어주고 마이크 표시가 나올 때 아이들이 따라,NA,NA,NA,NA
44038,44039,44039,8,마이크,제어하는 입출력장치인 ' GPIO ' 마이크 등으로 구성된다,NA,NA,NA,NA
44040,44041,44041,8,마이크,확인해 볼 수 있었는데요볼륨 버튼 마이크 버튼 마이크 홀에,NA,NA,NA,NA
44041,44042,44042,8,마이크,수 있었는데요볼륨 버튼 마이크 버튼 마이크 홀에,NA,NA,NA,NA
44046,44047,44047,8,마이크,볼 수 있었는데요 볼륨 버튼 마이크 버튼 마이크 홀에 블루투스 버튼도,NA,NA,NA,NA
44047,44048,44048,8,마이크,있었는데요 볼륨 버튼 마이크 버튼 마이크 홀에 블루투스 버튼도 있다는 걸,NA,NA,NA,NA
44048,44049,44049,8,마이크,들어와있으나 페어링이 되지 않을 때에는 마이크 버튼을 누르시고 음성으로 ' 기가지니,NA,NA,NA,NA
44051,44052,44052,8,마이크,마이크 표시가 나올 때 따라하면 됩니다,NA,NA,NA,NA
44052,44053,44053,8,마이크,음소거 버튼과 4 개의 마이크 그리고,NA,NA,NA,NA
44053,44054,44054,8,마이크,부르면 TV 화면에는소리가 조금 작아지면서 마이크 모양이 나오구요셋탑박스에는 길게 빛이 나옵니다그러면,NA,NA,NA,NA
44054,44055,44055,8,마이크,그리고 마이크 표시가 될 때 아이가 단어를,NA,NA,NA,NA
44055,44056,44056,8,마이크,그리고 마이크 방향도 위쪽으로 하고 있기 때문에,NA,NA,NA,NA
44056,44057,44057,8,마이크,버튼설명 음성인식 모드 설정할 때가운데 마이크 모양버튼을 꾸욱,NA,NA,NA,NA
44057,44058,44058,8,마이크,방향 ( 360 도 무지향성 마이크 ) 으로 울려 퍼지는 사운드는,NA,NA,NA,NA
44058,44059,44059,8,마이크,수 있도록 도와주는 역할을 합니다그리고 마이크 버튼을 이용해서 음성인식 기능을 켜고,NA,NA,NA,NA
44059,44060,44060,8,마이크,후면에는 전원스위치 마이크 스위치 HDMI 유선랜 ( RJ-45,NA,NA,NA,NA
44060,44061,44061,8,마이크,상단부에 내장된 7 개의 마이크 에레이가 360 도로 음성을 인식해,NA,NA,NA,NA
44061,44062,44062,8,마이크,기준 가격도 세고 스피커 출력이나 마이크 수 등 기능적으로 좀 더,NA,NA,NA,NA
44062,44063,44063,8,마이크,뒷면에는 마이크 / 블루투스연결 / 볼륨버튼이 자리,NA,NA,NA,NA
44063,44064,44064,8,마이크,개의 마이크가 위치합니다,NA,NA,NA,NA
44064,44065,44065,8,마이크,사용 상시음성 모드를 키고 가운데 마이크 모양을 3 초정도 눌러주면 상시음성모드가,NA,NA,NA,NA
44065,44066,44066,8,마이크,끊긴 상태에서는 기기 후면의 [ 마이크 ] 버튼을 5 초 이상,NA,NA,NA,NA
44066,44067,44067,8,마이크,제품 상단에는 음성 인식 마이크 버튼과 음 조절 버튼 LTE,NA,NA,NA,NA
44067,44068,44068,8,마이크,바로 마이크 버튼을 3 초간 누르고 있으면,NA,NA,NA,NA
44068,44069,44069,8,마이크,이때 마이크 주변으로 원형 LED 가 들어오기,NA,NA,NA,NA
44069,44070,44070,8,마이크,방식으로 된 전원버튼 블루투스 볼륨조절 마이크 버튼으로 되어 있어서 조작성이 간결합니다,NA,NA,NA,NA
44070,44071,44071,8,마이크,off 버튼 블루투스 페어링 버튼 마이크 on / off 버튼 무선자동연결,NA,NA,NA,NA
44071,44072,44072,8,마이크,Genie 에는 LED 가 화면에는 마이크 표시가 뜹니다,NA,NA,NA,NA
44072,44073,44073,8,마이크,D 기가지니 LTE 의 중앙 마이크 모양의 음성인식 버튼을,NA,NA,NA,NA
44073,44074,44074,8,마이크,방향에서든 정확한 음성인식을 위해 무지향성 마이크 4 개를 탑재했으며 스피커 역시,NA,NA,NA,NA
44074,44075,44075,8,마이크,( 난 마이크 꺼버렸음 ) 애들 말은 거의,NA,NA,NA,NA
44075,44076,44076,8,마이크,마이크 센서를 통해 음성을 인식하며 연결,NA,NA,NA,NA
44076,44077,44077,8,마이크,원 무료배송 ) 지니 103 마이크 색상은 레드 / 골드 /,NA,NA,NA,NA
