,Unnamed: 0,X,category,key,sentences,senti,score1,score2,score3
50532,50533,50533,8,스마트,) 가상과 현실을 넘나드는 비즈니스 스마트 글래스 주요업체 : 오큘러스 HTC,NA,NA,NA,NA
50533,50534,50534,8,스마트,스마트 워크 플레이스를 통한 생산성과 효율성,NA,NA,NA,NA
50534,50535,50535,8,스마트,스마트 자동차 오토와 카의 미래 주목해야,NA,NA,NA,NA
50535,50536,50536,8,스마트,가스안전기 열림감지기 디지털도어락 스마트 플러그 에어닥터 에어컨 공기청정기 세탁기,NA,NA,NA,NA
50537,50538,50538,8,스마트,IoT 기기는 가스안전기 열림감지기 디지털도어락 스마트 플러그 에어닥터 에어컨 공기청정기 세탁기,NA,NA,NA,NA
50538,50539,50539,8,스마트,아마존에서는 스마트 스피커 아마존 에코 ( Amazon,NA,NA,NA,NA
50539,50540,50540,8,스마트,애플 아이폰의 Siri 와 스마트 TV 등을 들 수 있겠다,NA,NA,NA,NA
50541,50542,50542,8,스마트,요즘 바쁜 현대인들에게 꼭 필요한 스마트 기기라고 할 수 있죠,NA,NA,NA,NA
50542,50543,50543,8,스마트,기술을 살리면서 올레 TV 로 스마트 TV 시장의,NA,NA,NA,NA
50543,50544,50544,8,스마트,더 자세한 내용은 KT 스마트 블로그의 기사를 하나 보시면 더욱,NA,NA,NA,NA
50544,50545,50545,8,스마트,올레 스마트 블로그 GiGA Genie 살펴보기 =,NA,NA,NA,NA
50545,50546,50546,8,스마트,소비하는 주 소비층이 젊은 세대이고 스마트 디바이스 등 특수한 분야에만 연결되어,NA,NA,NA,NA
50546,50547,50547,8,스마트,또한 스마트 디바이스에 낯선 어르신들도 음성만으로 사용할,NA,NA,NA,NA
50547,50548,50548,8,스마트,데이터투게더 혹은 스마트 디아비스 요금제를 통해 더욱 저렴한,NA,NA,NA,NA
50548,50549,50549,8,스마트,스마트 디바이스 전용이랍니다,NA,NA,NA,NA
50549,50550,50550,8,스마트,그리고 최대 20GB 까지 제공하는 스마트 디바이스도 있어요,NA,NA,NA,NA
50550,50551,50551,8,스마트,스마트 가전 컨트롤과 함께 목소리로 결제하고,NA,NA,NA,NA
50551,50552,50552,8,스마트,원래 스마트 기기가 다 그렇듯이 이렇게 포장상태,NA,NA,NA,NA
50552,50553,50553,8,스마트,가스안전기 열림 감지기 디지털 도어록 스마트 플러그 에어 닥터 에어컨 공기청정기,NA,NA,NA,NA
50553,50554,50554,8,스마트,우리의 기가지니 정말 스마트 하지 않나요,NA,NA,NA,NA
50554,50555,50555,8,스마트,( AI ) 탑재로 새로운 스마트 시대를 선두하는 기가지니 ( GiGa,NA,NA,NA,NA
50555,50556,50556,8,스마트,없었는데 실제로 보니 무척 탐났더 스마트 바이크,NA,NA,NA,NA
50556,50557,50557,8,스마트,스포티파이는 이번 계약으로 갤럭시 스마트 스피커를 포함해 모든 삼성 기기에,NA,NA,NA,NA
50557,50558,50558,8,스마트,특히 삼성전자는 스마트 TV 나 다른 기기에도 음악,NA,NA,NA,NA
50558,50559,50559,8,스마트,연동만 시켜놓으면 스마트 라이프 기능을 통해서 별다른 설정이,NA,NA,NA,NA
50559,50560,50560,8,스마트,바로 스마트 홈의 핵심기기라는 것,NA,NA,NA,NA
50560,50561,50561,8,스마트,줄 플랫폼은 자율주행자동차의 인포테인먼트 기기 스마트 홈의 AI 스피커 개인의 스마트폰,NA,NA,NA,NA
51257,51258,51258,8,라이프,아무래도 ' 뮤직 인 마 라이프,NA,NA,NA,NA
51258,51259,51259,8,라이프,반신반의했으나 밑져야 본전이라는 마음으로 시작한 라이프 스타일이다,NA,NA,NA,NA
51259,51260,51260,8,라이프,알람 및 홈매니저와 연동해 스마트 라이프 기능을 추가로 사용할 수 있답니다,NA,NA,NA,NA
51260,51261,51261,8,라이프,이런 IoT 기술을 기반으로 우리의 라이프 스타일과 패턴을 바꿔주는 기술이 집약된,NA,NA,NA,NA
51261,51262,51262,8,라이프,음성비서를 집에서 편안히 쓰는 새로운 라이프 스타일 고화질의 UHD TV 와,NA,NA,NA,NA
51262,51263,51263,8,라이프,기능 갖춘 셋톱박스로 스마트한 미디어 라이프,NA,NA,NA,NA
51263,51264,51264,8,라이프,갖춘 셋탑 박스로 스마트한 미디어 라이프 - 국내 No,NA,NA,NA,NA
51264,51265,51265,8,라이프,기가지니 ' 서비스로 한층 업된 라이프 생활 하세요,NA,NA,NA,NA
51266,51267,51267,8,라이프,좀 더 자동차 라이프 스타일에 맞는 컨텐츠와 운전자의 드라이빙을,NA,NA,NA,NA
51267,51268,51268,8,라이프,환경과 그것들을 활용한 비즈니스가 새로운 라이프 스타일을 만들어가고 있는데,NA,NA,NA,NA
51268,51269,51269,8,라이프,라이프 스타일인지 오늘 소개해 드릴게요,NA,NA,NA,NA
51271,51272,51272,8,라이프,신 생태주의 라이프 스타일의 확산 붐을 타고 가장,NA,NA,NA,NA
51272,51273,51273,8,라이프,선곡 날씨 등의 정보를 제공해주는 라이프 스타일 인공지능 디바이스입니다,NA,NA,NA,NA
51273,51274,51274,8,라이프,연동만 시켜놓으면 스마트 라이프 기능을 통해서 별다른 설정이 없어도,NA,NA,NA,NA
51274,51275,51275,8,매력,활용을 못하지만유려한 디자인에 하만카톤 스피커만으로도 매력 뿜뿜,NA,NA,NA,NA
51275,51276,51276,8,매력,그럼 저와 함께 기가지니의 매력 속으로 들어가볼까요,NA,NA,NA,NA
51276,51277,51277,8,매력,사운드를 감상할 수 있는 점이 매력 포인트랍니다,NA,NA,NA,NA
51299,51300,51300,8,현실,이렇게 금새 우리의 현실 속에 인공지능 매장이 자리할 것으로,NA,NA,NA,NA
51301,51302,51302,8,현실,기기와 헤드셋을 장착만 하면 가상 현실 속에서 신나게 즐길 수 있으니,NA,NA,NA,NA
51586,51587,51587,8,통신사,제가 #kt 통신사 를 사용하믄서 # 지니뮤직 을,NA,NA,NA,NA
51587,51588,51588,8,통신사,저는 통신사 KT 사용자거든요 : - ),NA,NA,NA,NA
51588,51589,51589,8,통신사,그런데 KT 를 이용하는 분들은 통신사 혜택으로 거의 무료로 지니뮤직을 이용할,NA,NA,NA,NA
51589,51590,51590,8,통신사,통신사 상관없이 키즈 서비스를 이용할 수,NA,NA,NA,NA
51590,51591,51591,8,통신사,재미나게 지낼 수 있어 좋고무엇보다 통신사 상관없이 키즈서비스를 즐길 수 있어,NA,NA,NA,NA
51591,51592,51592,8,통신사,모든 통신사 인터넷 회선으로 이용가능한 기가지니 2,NA,NA,NA,NA
51592,51593,51593,8,통신사,다만 다른 통신사 회선이라 전화나 티비 셋탑 박스,NA,NA,NA,NA
51593,51594,51594,8,통신사,우리집 공기의 상태를 알려주는 에어닥터와 통신사 상관 없이 사용 가능한 홈캠,NA,NA,NA,NA
51594,51595,51595,8,통신사,통신사라도 이용이 가능합니다,NA,NA,NA,NA
51595,51596,51596,8,통신사,보통 통신사 변경으로 인한 지원금등이 문제가 되기에,NA,NA,NA,NA
51596,51597,51597,8,통신사,단순히 빠른 네트워크를 위한 통신사 경쟁에서 벗어나 실질적인 삶의 질을,NA,NA,NA,NA
51597,51598,51598,8,통신사,ㅎ 단순히 빠른 네트워크를 위한 통신사 경쟁에서 벗어나 실질적인 삶의 질을,NA,NA,NA,NA
51598,51599,51599,8,통신사,복잡한 통신사 홈페이지에서 원하는 메뉴를 스마트톡을 통해,NA,NA,NA,NA
51599,51600,51600,8,통신사,스피커인 기가지니 LTE 부터 우리나라 통신사 최초인 인공지능 챗봇 기반 서비스인,NA,NA,NA,NA
51600,51601,51601,8,통신사,통신사 KT 를 사용하고 있기 때문에집에,NA,NA,NA,NA
51601,51602,51602,8,통신사,컨트롤 기능이 그다지 중요하지 않고 통신사 상관없이 사용할 수 있는 스피커,NA,NA,NA,NA
51602,51603,51603,8,통신사,SKT 에서 출시된 제품으로 다른 통신사 사용자에게 불리한 점이 있지 않을까,NA,NA,NA,NA
51603,51604,51604,8,통신사,나가자니 추워서 싫고 심심하던 참에 통신사 요금할인되는 것 때문에집에 놓은 GIGA,NA,NA,NA,NA
51604,51605,51605,8,통신사,알았거든요 ㅎㅎ 그런데 핸드폰 바꾸면서 통신사 아저씨가 알려주시더라고요 이런 혜택들도 있으니까,NA,NA,NA,NA
51605,51606,51606,8,통신사,통신사 할인 혜택이 정말 잘 들여다보면,NA,NA,NA,NA
51606,51607,51607,8,통신사,통신사 어디냐고 물어보니까 KT,NA,NA,NA,NA
51607,51608,51608,8,통신사,통신사 혜택을 모르더라고요 그래서 친구도 제말듣고,NA,NA,NA,NA
51608,51609,51609,8,통신사,끝 ^ - ^ KT 통신사,NA,NA,NA,NA
51609,51610,51610,8,통신사,여러 통신사 중에 우리집은 아주아주 오랫동안 KT,NA,NA,NA,NA
51610,51611,51611,8,통신사,그런 면에서 통신사 KT 와 만난 기가지니 LTE,NA,NA,NA,NA
51611,51612,51612,8,통신사,정말 통신사 상관없이 사용할 수 있더라구요,NA,NA,NA,NA
51612,51613,51613,8,통신사,※ AI 스피커와 loT 앱은 통신사 상관없이 서비스 이용이 가능하지만 IPTV,NA,NA,NA,NA
51613,51614,51614,8,통신사,되어지며차이점은 안드로이드 A + 상품은 통신사 관계없이 ( SK LG KT,NA,NA,NA,NA
51614,51615,51615,8,통신사,통신사 연결해서 사용할 수 있는 스피커,NA,NA,NA,NA
51615,51616,51616,8,통신사,; ; 그런데 이번제품은 모든 통신사 인터넷 회선으로 이용이 가능하다고 하길래,NA,NA,NA,NA
51616,51617,51617,8,통신사,이렇게 하면 타 통신사 인터넷회선 사용해도 작동됩니다,NA,NA,NA,NA
51617,51618,51618,8,통신사,저는 다른 통신사 였는데도 일부 기능을 사용해보니 이렇게나,NA,NA,NA,NA
51618,51619,51619,8,통신사,KT 도 나름 국내 굴지의 통신사 인데 나름 생각을 하였을 겁니다,NA,NA,NA,NA
51619,51620,51620,8,통신사,통신사 쪽과 기사님의 연결이 오고 가더니,NA,NA,NA,NA
51620,51621,51621,8,통신사,이와 관련하여 각 통신사 및 포털업체들은 AI 음성인식 분야,NA,NA,NA,NA
51621,51622,51622,8,통신사,LG U + 통신사 할인 혜택엘지 유플러스 고객이라면누리는 파격적인,NA,NA,NA,NA
51622,51623,51623,8,업그레이드,기가지니 2 를 무료로 업그레이드 해준다고 하네요,NA,NA,NA,NA
51623,51624,51624,8,업그레이드,혹시 업그레이드 돼서 나온다면 곰돌이 표정 다양하게,NA,NA,NA,NA
51624,51625,51625,8,업그레이드,현재 기가 지니 2 는 업그레이드 프로모션을 진행하고 있습니다,NA,NA,NA,NA
51625,51626,51626,8,업그레이드,하만카돈과의 협업으로 한 단께 더 업그레이드 된 사운드를 들을 수 있네요,NA,NA,NA,NA
51626,51627,51627,8,업그레이드,2 는 미니멀하면서 세련된 디자인으로 업그레이드 되었답니다 * ㅁ * 콤팩트한,NA,NA,NA,NA
51627,51628,51628,8,업그레이드,1 보다 더욱 미니멀해지고세련된 디자인으로 업그레이드 됐으면서,NA,NA,NA,NA
51630,51631,51631,8,업그레이드,보다 더욱 미니멀해지고 세련된 디자인으로 업그레이드 됐으면서 기능은 더 강화돼서 출시가,NA,NA,NA,NA
51631,51632,51632,8,업그레이드,기가지니 2 로 업그레이드 하세요,NA,NA,NA,NA
51632,51633,51633,8,업그레이드,인공지능 기가지니 2 로 무료 업그레이드 가능합니다,NA,NA,NA,NA
51633,51634,51634,8,업그레이드,1 에 비해기가지니 2 가 업그레이드 된 부분,NA,NA,NA,NA
51634,51635,51635,8,업그레이드,색상 출시와 더불어서 서비스도 대폭 업그레이드 되었는데요,NA,NA,NA,NA
51635,51636,51636,8,업그레이드,서비스가 업그레이드 되면서 기가지니에 제공되던 음악 서비스,NA,NA,NA,NA
51636,51637,51637,8,업그레이드,' 기가지니 2 업그레이드 프로모션이 있는데요,NA,NA,NA,NA
51637,51638,51638,8,업그레이드,매달 + 1000 만 내면 업그레이드 해준다기에 냉큼바꾼 적이 있는데요 집전화기가,NA,NA,NA,NA
51638,51639,51639,8,업그레이드,제품으로 음악과 함께 하는 생활을 업그레이드 시켜보는 것은 어떨까 생각이 드네요,NA,NA,NA,NA
51639,51640,51640,8,업그레이드,컬러 출시로 교체할 수 있도록 업그레이드 되어더욱 유니크하고 색다른 감각적인 디자인을,NA,NA,NA,NA
51640,51641,51641,8,업그레이드,거죠확실히 기존보다 한 층 강력하게 업그레이드 되어 돌아온 듯이제는 망설이지 말고,NA,NA,NA,NA
51641,51642,51642,8,업그레이드,색상부터 다양한 콘텐츠까지 많은 부분들이 업그레이드 되었는데요,NA,NA,NA,NA
51642,51643,51643,8,업그레이드,색상 출시와 더불어 서비스도 대폭 업그레이드 되었습니다,NA,NA,NA,NA
51643,51644,51644,8,업그레이드,^ ^ ㅎㅎ 더더 지니가 업그레이드,NA,NA,NA,NA
51644,51645,51645,8,업그레이드,펜 탑재로 원격조종이 가능하고 배터리도 업그레이드 그리고 인텔리전트 카메라에 메모리와 용량도,NA,NA,NA,NA
51645,51646,51646,8,업그레이드,색상 출시와 더불어 서비스도 대폭 업그레이드 되었는데요 우선 동요,NA,NA,NA,NA
51646,51647,51647,8,업그레이드,저 역시 이번에 업그레이드 하면서 기가지니 2 로 3,NA,NA,NA,NA
51647,51648,51648,8,업그레이드,멋지게 변하고 AI 기능도 훌륭하게 업그레이드 되었으니 이제는 집에서 TV 도,NA,NA,NA,NA
51648,51649,51649,8,업그레이드,셋탑박스 역할을더욱 업그레이드 하여 대체할 수 있고티비 주변을,NA,NA,NA,NA
51649,51650,51650,8,업그레이드,고객이 원할 경우 기가 지니로 업그레이드 해줄 예정이다 ' 고 말했다고,NA,NA,NA,NA
51650,51651,51651,8,업그레이드,한층 더 업그레이드,NA,NA,NA,NA
51651,51652,51652,8,업그레이드,은은한 조명효과로 집안의 인테리어 효과까지 업그레이드 시켜주는 전혀 다른 모습과 성능을,NA,NA,NA,NA
51652,51653,51653,8,업그레이드,음성인식 인공지능으로 한층 업그레이드 되는,NA,NA,NA,NA
51653,51654,51654,8,업그레이드,몇 가지 업그레이드 된 특징이 있는데요,NA,NA,NA,NA
51654,51655,51655,8,업그레이드,음성인식 기술이 적용되어 품질은 더욱 업그레이드 되었고요,NA,NA,NA,NA
51655,51656,51656,8,업그레이드,업그레이드 하면서 파닉스와 워드파워 핑크퐁 퀴즈,NA,NA,NA,NA
51656,51657,51657,8,업그레이드,있는데요 KT 기가지니에서는 이번에 새롭게 업그레이드 되면서 국내유일의 LTE 기반으로,NA,NA,NA,NA
51657,51658,51658,8,업그레이드,AS 를 받으면서한 단계 더 업그레이드 된패키지 요금제로 변경하니네이버 클로바가 딱,NA,NA,NA,NA
51658,51659,51659,8,업그레이드,가전제품을 제어하는 홈 IoT 기능도대폭 업그레이드 되엇다는데 쓰시는 분들께서는 편한가요,NA,NA,NA,NA
51660,51661,51661,8,업그레이드,) 에게인공지능 기가지니 2 무료 업그레이드 프로모션 중,NA,NA,NA,NA
51661,51662,51662,5,무선,LTE 라우터 기능을 가지고 있는 무선 인공지능스피커입니다,NA,NA,NA,NA
51662,51663,51663,5,무선,11ac 무선 네트워크를 지원하며 와이파이 접속이 빠르고,NA,NA,NA,NA
51663,51664,51664,5,무선,버튼인터넷 연결 전원 버튼 음소거 무선 자동 설정 블루투스 기기 연결하단,NA,NA,NA,NA
51664,51665,51665,5,무선,인터넷 연결 전원 버튼 음소거 무선 자동 설정 블루투스 기기 연결,NA,NA,NA,NA
51665,51666,51666,5,무선,또한 WPS ( 무선 자동설정 ) 및 Soft-AP 기능을,NA,NA,NA,NA
51666,51667,51667,5,무선,OFF 버튼과 블루투스 버튼 음소거와 무선 자동 설정 버튼이 구비되어 있습니다,NA,NA,NA,NA
51667,51668,51668,5,무선,연결을 지원하기 때문에 더 빠른 무선 연결이 가능합니다,NA,NA,NA,NA
51668,51669,51669,5,무선,빠른 무선 연결이 가능합니다,NA,NA,NA,NA
51669,51670,51670,5,무선,연결 또한 사용하는 공유기에 WPS 무선 자동 설정 버튼이 있다면 기가,NA,NA,NA,NA
51670,51671,51671,5,무선,있다면 기가 지니 스피커 후면의 무선 자동 설정 버튼을 누름으로써 간단하게,NA,NA,NA,NA
51671,51672,51672,5,무선,전원 버튼과 음소거 블루투스 버튼과 무선 자동 설정 WPS 버튼이 위치해,NA,NA,NA,NA
51672,51673,51673,5,무선,유선 인터넷으로도 사용 가능하고 무선 인터넷 연결로도 사용할 수 있습니다,NA,NA,NA,NA
51673,51674,51674,5,무선,TV 로 화상 통화를 하고 무선 연결된 팩스,NA,NA,NA,NA
51674,51675,51675,5,무선,DTS:X 음장 FM 라디오 고속 무선 충전,NA,NA,NA,NA
51675,51676,51676,5,무선,하기도 - 내장 배터리 있어 무선 사용 가능 - 음성 명력으로,NA,NA,NA,NA
51676,51677,51677,5,무선,무선,NA,NA,NA,NA
51677,51678,51678,5,무선,이어폰 포트 그리고 블루투스 페어링과 무선 자동 설정 버튼이 이렇게 있답니다,NA,NA,NA,NA
51678,51679,51679,5,무선,전원 음소거 버튼 블루투스 버튼 무선 자동 설정 버튼이 위치해 있습니다,NA,NA,NA,NA
51679,51680,51680,5,무선,지니 101 LED 램프 & 무선 스피커입니다,NA,NA,NA,NA
51680,51681,51681,5,무선,효율적인 연결이 가능하고 WPS ( 무선 자동 설정 ) 및 Soft-AP,NA,NA,NA,NA
51681,51682,51682,5,무선,이용할 수 있지만 국내에서 유일하게 무선 데이터망도 이용할 수 있답니다,NA,NA,NA,NA
51682,51683,51683,5,무선,무선 데이터 활용을 위한,NA,NA,NA,NA
51683,51684,51684,5,무선,디자인 + 높은 휴대성 + 무선 지원 + 괜찮은 수준의 오디오,NA,NA,NA,NA
51684,51685,51685,5,무선,기가지니의 연결은 유선과 무선 모두사용합니다,NA,NA,NA,NA
51685,51686,51686,5,무선,이제 포터블 스피커의 대세는 단순히 무선 스피커를 넘어선 인공지능 스피커로 넘어왔으며,NA,NA,NA,NA
51686,51687,51687,5,무선,출시된 대부분의 AI 스피커는 와이파이 무선 공간에서 웹과 연동하여 작동하는 방식이며,NA,NA,NA,NA
51687,51688,51688,5,무선,세로형 무선 충전 크래들에 가볍게 얹는 방식으로,NA,NA,NA,NA
51688,51689,51689,5,무선,촬영하기 위해 해당 부분은 카메라로 무선 LTE 중계 방식을 이용했습니다,NA,NA,NA,NA
51689,51690,51690,5,무선,메뉴를 3 초 이상 눌러 무선 인증 모드를 설정해주면 됩니다,NA,NA,NA,NA
51690,51691,51691,5,무선,인터넷 연결 LED 좌측으로 음소거와 무선 자동설정 버튼 우측으로 본체 전원,NA,NA,NA,NA
51691,51692,51692,5,무선,& 샌디스크 SD 16GB 로지텍 무선 콤보 고사리 보조배터리 마블 5,NA,NA,NA,NA
51692,51693,51693,5,무선,' 블루투스 버튼 ' ' 무선 자동연결 버튼 ' ' 전원,NA,NA,NA,NA
51693,51694,51694,5,무선,' 기가지니 버디 ' 는 무선 와이파이로 연결하며 작고 가벼운 사이즈를,NA,NA,NA,NA
51694,51695,51695,5,무선,서비스를 가입하지 않고기기 구매 후 무선 와이파이로 연결해 이용 가능하기 때문에셋톱박스나,NA,NA,NA,NA
51695,51696,51696,5,기기,처음 기기 인증 할때는 보라색 불빛이 깜빡깜빡,NA,NA,NA,NA
51696,51697,51697,5,기기,기가지니 버디 기기 인증 완료,NA,NA,NA,NA
51697,51698,51698,5,기기,인공지능 기기 기가지니는 올레 TV 지니뮤직과 연동되어,NA,NA,NA,NA
51698,51699,51699,5,기기,인공지능 기기 기가지니로,NA,NA,NA,NA
51699,51700,51700,5,기기,또한 인공지능 기기 기가지니는 세계적으로 인정받는 ' 하만카돈,NA,NA,NA,NA
51700,51701,51701,5,기기,일정관리 정보제공 ) 또한 인공지능 기기 기가지니는 단순 대화만이 아닌 일정,NA,NA,NA,NA
51701,51702,51702,5,기기,인공지능 기기 기가지니의,NA,NA,NA,NA
51702,51703,51703,5,기기,인공지능 기기 기가지니는,NA,NA,NA,NA
51703,51704,51704,5,기기,마지막으로 인공지능 기기 기가지니는 올레 TV 와 연동되는,NA,NA,NA,NA
51705,51706,51706,5,기기,인공지능 기기 기가지니를 보면 우리 곁으로 다가온,NA,NA,NA,NA
51712,51713,51713,5,기기,커뮤니케이션 마지막으로 인공지능 기기 기가지니는 올레 TV 와 연동되는,NA,NA,NA,NA
51715,51716,51716,5,기기,로 로그인 한 뒤기가지니 2 기기 인증 해주고나면 설치 끝,NA,NA,NA,NA
51716,51717,51717,5,기기,디자인이 더 마음에 드네요 ㅎ 기기 윗면엔 기가지니 호출어 인식을 잠시,NA,NA,NA,NA
51717,51718,51718,5,기기,블루투스 버튼이 있어요 기기 뒷면엔 HDMI 케이블을 연결하는 HDMI,NA,NA,NA,NA
51718,51719,51719,5,기기,좋은걸요 ^ ^ 연결 후에는 기기 상단의 마이크를 켜서 음성인식 준비를,NA,NA,NA,NA
51719,51720,51720,5,기기,KT 는 기존 UHD 셋톱박스와 기기 인터넷에 웹캠을 추가하여 시스템을 구축한,NA,NA,NA,NA
51720,51721,51721,5,기기,kt 기기 지니 뒷면의 케이블 정리커버를 밀어,NA,NA,NA,NA
51721,51722,51722,5,기기,기기 아랫면의 전원단자에 전원 어댑터를 연결하고,NA,NA,NA,NA
51722,51723,51723,5,기기,' 11 종 홈 IOT 기기 연동하 기가 지니 하나로 집안,NA,NA,NA,NA
51723,51724,51724,5,기기,11 종 홈 IoT 기기 연동 … 기가 지니 하나로,NA,NA,NA,NA
51724,51725,51725,5,기기,듀얼 OS 를 탑재한 스마트 기기 수는 8700 만 대 수준이다,NA,NA,NA,NA
51725,51726,51726,5,기기,TV 스마트폰 아동용 스마트 기기 AI 스피커 자동차에 이르는 바이두의,NA,NA,NA,NA
51726,51727,51727,5,기기,기기,NA,NA,NA,NA
51727,51728,51728,5,기기,불러서 대화를 할 수 있답니다 기기 전면 하얀색 LED 를 확인,NA,NA,NA,NA
51728,51729,51729,5,기기,기가지니앱을 다운로드하신 후 기기 목록에서 ' 기가지니 LTE ',NA,NA,NA,NA
51730,51731,51731,5,기기,' 기가지니 ' 어플을 설치해서 기기 인증을 하고 사용하면 됩니다 지니뮤직,NA,NA,NA,NA
51731,51732,51732,5,기기,음소거 무선 자동 설정 블루투스 기기 연결하단 커버를 제거하면 다양한 연결,NA,NA,NA,NA
51732,51733,51733,5,기기,를 불러보기 전에 기기 인증 과정을 거쳐보겠습니다,NA,NA,NA,NA
51733,51734,51734,5,기기,간단한 기기 인증 과정을 거쳐볼까요,NA,NA,NA,NA
51734,51735,51735,5,기기,음소거 무선 자동 설정 블루투스 기기 연결 하단 커버를 제거하면 다양한,NA,NA,NA,NA
51737,51738,51738,5,기기,기기 연동 … 기가 지니 하나로,NA,NA,NA,NA
51738,51739,51739,5,기기,지시 가능한 부탁 가능한 서비스를 기기 화면에 띄워놓고 음성으로 명령을 내릴,NA,NA,NA,NA
51739,51740,51740,5,기기,기가지니 2 기기 / 전원공급어댑터 / 리모컨 /,NA,NA,NA,NA
51740,51741,51741,5,기기,기기 인증할 때는 기가지니 2 뒷면,NA,NA,NA,NA
51741,51742,51742,5,기기,앱 설치 로그인 - 앱으로 기기 인증 - 대표자 본인인증 지금은,NA,NA,NA,NA
51742,51743,51743,5,기기,데 프리미엄 스피커로 세계적인 음향 기기 전문그룹인 Harman / Kardon 엔지니어,NA,NA,NA,NA
51743,51744,51744,5,기기,위해서는 스마트폰 기가지니 앱을 사용하여 기기 인증을 해야 합니다,NA,NA,NA,NA
51744,51745,51745,5,기기,만날 수 있는 다양한 IT 기기 생활가전등 을 만나고 체험할 수,NA,NA,NA,NA
51745,51746,51746,5,기기,사운드에 만족하지 못하면 기기 사용률이 떨어질 수도 있기 때문입니다,NA,NA,NA,NA
51746,51747,51747,5,기기,가전제품별로 기기 상태 확인 원격 제어 상태,NA,NA,NA,NA
51748,51749,51749,5,기기,- 11 종 홈 IoT 기기 연동 … 기가 지니 하나로,NA,NA,NA,NA
51749,51750,51750,5,기기,감상 일정관리 교통안내 홈 IOT 기기 제어 영상통화 등등 다양한 기능을,NA,NA,NA,NA
51750,51751,51751,5,기기,감상 일정관리 교통안내 홈 IoT 기기 제어 영상통화 등 똑똑한 기능을,NA,NA,NA,NA
51751,51752,51752,5,기기,- 크롬캐스트 연동해 다양한 스마트홈 기기 컨트롤,NA,NA,NA,NA
51752,51753,51753,5,기기,데 묶어 쓰는 복합 서비스 기기,NA,NA,NA,NA
51753,51754,51754,5,기기,) ' 가 적용된 스마트 기기 - 최근 카카오미니 예약판매 당시,NA,NA,NA,NA
51754,51755,51755,5,기기,도 있어서 최대 10 개의 기기 연결이 가능합니다,NA,NA,NA,NA
51755,51756,51756,5,기기,) 가성비 짱짱통신 서비스 가입없이 기기 구매후 간단하게 이용할 수 있으니주부,NA,NA,NA,NA
51756,51757,51757,5,기기,하만카돈은 미국의 세계적인 음향 기기 브랜드 및 업체들이 모여있는 기업이라고,NA,NA,NA,NA
51757,51758,51758,5,기기,다 해줍니다 ㅎㅎ 제가 스마트 기기 전문가가 아니라 더 활용할수 있는,NA,NA,NA,NA
51758,51759,51759,5,기기,블루투스 스피커 연결하기 기기 윗면에 블루투스 버튼을 3 초만,NA,NA,NA,NA
51759,51760,51760,5,기기,- 11 종 홈 IoT 기기 연동 기가 지니 하나로 집안,NA,NA,NA,NA
51760,51761,51761,5,기기,- 11 종 홈 IoT 기기 연동,NA,NA,NA,NA
51761,51762,51762,5,기기,앱에서 기기인증을 하셔야 해요,NA,NA,NA,NA
51762,51763,51763,5,기기,"또한 어려운 기기 작동 대신에 "" 지니야 핑크퐁",NA,NA,NA,NA
51763,51764,51764,5,기기,들었는데 직접 사용해보니 그렇지 않더라고요 기기 윗면을 보면 터치로 작동할 수,NA,NA,NA,NA
51764,51765,51765,5,기기,기가 지니 ' 라고 부르면 기기 전면에 하얀색 LED 가 켜지면서,NA,NA,NA,NA
51765,51766,51766,5,기기,리모컨 페어링과 기가지니앱을 통한 간단한 기기 등록을 마친 후 본격적으로 기가지니를,NA,NA,NA,NA
51766,51767,51767,5,기기,앱 다운로드 및 설치 후 기기 인증을 해야 합니다,NA,NA,NA,NA
51767,51768,51768,5,기기,애플이 IT 기기 포장방식을 바꿔놨죠,NA,NA,NA,NA
51768,51769,51769,5,기기,기기의 와이파이 연결이 끊긴 상태에서는 기기 후면의 [ 마이크 ] 버튼을,NA,NA,NA,NA
