,Unnamed: 0,X,category,key,sentences,senti,score1,score2,score3
41212,41213,41213,8,음악,똑똑한 기가지니는 음악 꺼줄 시간도 알아 들을 수,NA,NA,NA,NA
41213,41214,41214,8,음악,음악 감상 시에는 분위기 까지 내주는,NA,NA,NA,NA
41214,41215,41215,8,음악,집에서 음악 듣는 것을 좋아하는 저에게는 지니는,NA,NA,NA,NA
41215,41216,41216,8,음악,들어와서 피곤할 때 음성으로 ' 음악 틀어줘 ' 아침에 ' 날씨,NA,NA,NA,NA
41216,41217,41217,8,음악,수 있는 것처럼 지니뮤직을 통한 음악 스트리밍 LTE 라우터 알람 타이머,NA,NA,NA,NA
41217,41218,41218,8,음악,먼저 기가지니 LTE 모델은 음악 감상용으로 활용을 했는데요,NA,NA,NA,NA
41218,41219,41219,8,음악,Wifi bluetooth 클로바의 특징을 검색해보면 음악 추천 기능이 있습니다,NA,NA,NA,NA
41219,41220,41220,8,음악,사용하는 가장 큰 이유는 바로 음악 감상을 위함입니다,NA,NA,NA,NA
41220,41221,41221,8,음악,하지만 덜컥 구입만 하신다면 음악 재생 서비스를 온전히 누릴 수,NA,NA,NA,NA
41221,41222,41222,8,음악,음원 사이트 가입만 되어있으면 자유로운 음악 감상은 물론 다양한 검색 기능,NA,NA,NA,NA
41222,41223,41223,8,음악,켜면 초기 화면에서 올레 tv 음악 통화 홈캠 캘린더 교통 생활,NA,NA,NA,NA
41223,41224,41224,8,음악,사용하게 됩니다 KT 유저라면 KT 음악 유료 가입시실시간으로 들을 수 있습니다,NA,NA,NA,NA
41224,41225,41225,8,음악,생활 통화 티비 음악 홈 IOT 날씨 교통 뭐든,NA,NA,NA,NA
41225,41226,41226,8,음악,티몰 지니 X1 는 음악 스트리밍과 뉴스캐스트 일정 관리 등을,NA,NA,NA,NA
41226,41227,41227,8,음악,AI 스피커의 ' 음악 재생 ' 이 스피커의 핵심,NA,NA,NA,NA
41227,41228,41228,8,음악,가전제품 부터 쇼핑 날씨정보 및 음악 그리고 아이들에게 유용한 영어학습 콘텐츠,NA,NA,NA,NA
41228,41229,41229,8,음악,사운드청량하고 깨끗한 음성 재생이 가능하여 음악 감상 뿐아니라 영상 통화 등에도,NA,NA,NA,NA
41229,41230,41230,8,음악,Launcher ) 화면에 올레 TV 음악 통화 홈캠 캘린더 교통 생활,NA,NA,NA,NA
41230,41231,41231,8,음악,기가지니 음악 서비스는 1 천만곡 이상의 음원을,NA,NA,NA,NA
41231,41232,41232,8,음악,음악을 선택하거나 재즈 클래식과 같이 음악 장르별 선택도 가능하다,NA,NA,NA,NA
41232,41233,41233,8,음악,관심을 끌었던 기능은 바로 ' 음악 듣기 ' 기능입니당,NA,NA,NA,NA
41233,41234,41234,8,음악,를 융합한 서비스로 TV 및 음악 감상 스케줄 홈 loT 허브,NA,NA,NA,NA
41235,41236,41236,8,음악,유무선 네트워크를 바탕으로 TV 및 음악 감상 일정관리 교통안내 홈 IOT,NA,NA,NA,NA
41236,41237,41237,8,음악,지니 스트리밍 음악 서비스와 연동돼 듣고 싶은 음악을,NA,NA,NA,NA
41237,41238,41238,8,음악,유무선 네트워크를 바탕으로 TV 및 음악 감상 일정관리 교통안내 홈 IoT,NA,NA,NA,NA
41239,41240,41240,8,음악,영화 그리고 음원서비스 지니와 연동한 음악 재생 기능 2,NA,NA,NA,NA
41240,41241,41241,8,음악,중요하고 유용하다고 생각되는 기능은 ' 음악 재생 ' 기능입니다,NA,NA,NA,NA
41241,41242,41242,8,음악,바빴던 우리들이이제는 ' 지니야 OO 음악 틀어 줘 ',NA,NA,NA,NA
41242,41243,41243,8,음악,기가지니는 단순한 음악 재생 뿐만이 아니라 분위기나 장르에,NA,NA,NA,NA
41243,41244,41244,8,음악,위한 기술인 기가지니제가 자세하게 설명드린 음악 재생 & 추천 기능 버스,NA,NA,NA,NA
41244,41245,41245,8,음악,일 오늘 날짜로 KT 의 음악 부가서비스인 ' 지니팩 ' 의,NA,NA,NA,NA
41245,41246,41246,8,음악,음악을 들을 수 있는 유무선 음악 스트리밍 서비스입니다,NA,NA,NA,NA
41246,41247,41247,8,음악,를 통해서 한 후에 지니뮤직 음악 사이트에서 KT 휴대폰 본인인증을 거쳐,NA,NA,NA,NA
41247,41248,41248,8,음악,무제한 음악감상 + 휴대폰에 무제한 음악 다운로드 ( 스마트 다운로드 ),NA,NA,NA,NA
41248,41249,41249,8,음악,지원 불가능 와이파이 지원 - 음악 재생은 스포티파이 유튜브 뮤직 판도라,NA,NA,NA,NA
41249,41250,41250,8,음악,- Btv 연동해 사용 가능하며 음악 재생 시 멜론 지원 -,NA,NA,NA,NA
41250,41251,41251,8,음악,청소기 등 음성으로 컨트롤하고 스마트폰 음악 재생 - 와이파이 블루투스 지그비,NA,NA,NA,NA
41251,41252,41252,8,음악,우퍼 탑재 - 디스플레이 배제하고 음악 기능에 충실한 - 블랙 화이트,NA,NA,NA,NA
41252,41253,41253,8,음악,스피커가 눈 올 때 어울리는 음악 틀어주는데 완전 심쿵,NA,NA,NA,NA
41253,41254,41254,8,음악,스피커 본연의 사운드가 뛰어나 음악 감상에도 좋습니다,NA,NA,NA,NA
41254,41255,41255,8,음악,번 틀어줘 ' ' 신나는 음악 틀어줘 ' 등등명령을 하면 수행합니다,NA,NA,NA,NA
41255,41256,41256,8,음악,지니뮤직 사용하는 분들은 KT 기가지니로 음악 듣기 편하실 겁니당,NA,NA,NA,NA
41256,41257,41257,8,음악,기능은 누워서 지니야 부르고 좋아하는 음악 틀어줘 하면 지니뮤직 기반 제,NA,NA,NA,NA
41257,41258,41258,8,음악,음악 틀어 주고 볼륨 올려줘,NA,NA,NA,NA
41258,41259,41259,8,음악,음악 감상이나 라디오 청취에 활용되던 스피커가,NA,NA,NA,NA
41259,41260,41260,8,음악,함께 파티를 준비하면서 ' 지니야 음악 틀어줘,NA,NA,NA,NA
41260,41261,41261,8,음악,이렇게 기가 지니는 음악 추천도 해주구요,NA,NA,NA,NA
41261,41262,41262,8,음악,음악 플레이리스트가 지겨워지셨다고요,NA,NA,NA,NA
41262,41263,41263,8,음악,지니 ' 와 연동하여우리에게 다양한 음악 감상 서비스를 제공해줍니다,NA,NA,NA,NA
41263,41264,41264,8,음악,TV 생활 교통 홈캠 캘린더 음악,NA,NA,NA,NA
41264,41265,41265,8,음악,음성으로 TV 컨트롤은 물론 음악 통화 음식 주문까지정말 다양한 기능들을,NA,NA,NA,NA
41265,41266,41266,8,음악,지니 스트리밍 음악 서비스와 연동으로 듣고싶은 노래 기분에,NA,NA,NA,NA
41266,41267,41267,8,음악,음악 애호가들로부터 호평을 받은 하만카돈 (,NA,NA,NA,NA
41267,41268,41268,8,음악,서비스가 업그레이드 되면서 기가지니에 제공되던 음악 서비스 ' 지니뮤직 ' 은,NA,NA,NA,NA
41268,41269,41269,8,음악,또한 음악 종료 예약 기능도 추가되면서 ',NA,NA,NA,NA
41269,41270,41270,8,음악,# 지니야 _ 음악 _ 추천해줘 갑자기 뜬금없이 일렉트로,NA,NA,NA,NA
41270,41271,41271,8,음악,만들어 깨끗한 음성 재생이 가능해 음악 감상과 영상 통화도 뛰어나다고 합니다,NA,NA,NA,NA
41271,41272,41272,8,음악,센티해지는 날 이럴 때야말로 야외에서 음악 듣기 참 좋은 날이죠,NA,NA,NA,NA
41272,41273,41273,8,음악,음악 틀어줘 ' 한마디만 해도 내가,NA,NA,NA,NA
41273,41274,41274,8,음악,할 때 ' 지니야 감성 음악 틀어줘 ' 한마디 하면 지니가,NA,NA,NA,NA
41274,41275,41275,8,음악,싶을땐 조용한 음악을 알아서선곡해줍니다,NA,NA,NA,NA
41275,41276,41276,8,음악,실내뿐 아니라 야외에서도 풍부한 음질로 음악 감상이 가능하는 점,NA,NA,NA,NA
41276,41277,41277,8,음악,국내 음악 스트리밍 사업자 최초로,NA,NA,NA,NA
41277,41278,41278,8,음악,함께 지니뮤직 모바일 애플리케이션으로 무제한 음악 감상이 가능한 ' 마음껏 듣기,NA,NA,NA,NA
41278,41279,41279,8,음악,신나는 음악 들려줘,NA,NA,NA,NA
41279,41280,41280,8,음악,KT 에서 출시한 TV 및 음악 감상 스케줄 홈 IoT 허브,NA,NA,NA,NA
41280,41281,41281,8,음악,단순하게는 셋톱박스 조절부터 음악 스트리밍 서비스인 ' 지니 ',NA,NA,NA,NA
41281,41282,41282,8,음악,지니가 갖추고 있는 빅데이터 기반 음악 추천 서비스는,NA,NA,NA,NA
41282,41283,41283,8,음악,저는 특히 좋은건 특정 음악 틀어달라고하면 기가막히게 찾아서 바로 틀어주는게,NA,NA,NA,NA
41283,41284,41284,8,음악,TV 음악 날씨 등 사용해본 기능은 여기까지이고,NA,NA,NA,NA
41284,41285,41285,8,음악,음악 추천 하만카돈 스피커를 통해 지니,NA,NA,NA,NA
41285,41286,41286,8,음악,재생부터 내가 좋아하는 음악을 통해 음악 추천까지 해줍니다또한 노래 재생시 우퍼라이팅이,NA,NA,NA,NA
41286,41287,41287,8,음악,ㅎㅎ 그래도 저 같이 음악 잘 모르는 사람은딱 제목알고 듣는,NA,NA,NA,NA
41287,41288,41288,8,음악,기가지니기가지니 새벽에 듣기 좋은 음악 틀어줘,NA,NA,NA,NA
41288,41289,41289,8,음악,수 많은 기능 가운데 ' 음악 ' 을,NA,NA,NA,NA
41290,41291,41291,8,음악,울 때 ' 기가지니 뽀로로 음악 들려줘,NA,NA,NA,NA
41291,41292,41292,8,음악,재생됩니다 ) 노래 외에도 신나는 음악 째즈 빗소리 등등 여러 가지,NA,NA,NA,NA
41292,41293,41293,8,음악,아제가 사용하는 음악 어플은 지니 뮤직이에요 Kt 멤버쉽으로,NA,NA,NA,NA
41293,41294,41294,8,음악,' 지니야 신나는 음악 틀어줘 ' 라고 이야기하면 연결되어,NA,NA,NA,NA
41294,41295,41295,8,음악,음악 애호가들로부터 호평을 받았던 세계적 고급,NA,NA,NA,NA
41295,41296,41296,8,음악,예를 들면 지니 앱과 연동해서 음악 감상이 가능하고 알람 날씨와 교통정보,NA,NA,NA,NA
41296,41297,41297,8,음악,아마 가장 많이 활용하는 부분이 음악 감상이 아닐까요,NA,NA,NA,NA
41297,41298,41298,8,음악,기분 좋은 음악 틀어줘,NA,NA,NA,NA
41298,41299,41299,8,음악,음악 감상을 가장 많이 하는데 무려,NA,NA,NA,NA
41299,41300,41300,8,음악,[ 3 대기획사 음악 유통권만료 ],NA,NA,NA,NA
41300,41301,41301,8,음악,사업 영역은 1 ) B2C 음악 사업 ( ' 지니뮤직 ',NA,NA,NA,NA
41301,41302,41302,8,음악,) 과 2 ) B2B 음악 사업으로 나누어짐,NA,NA,NA,NA
41303,41304,41304,8,음악,음악을 만날 수 있도록 오늘의 음악 TV 속 음악 시대별 음악,NA,NA,NA,NA
41304,41305,41305,8,음악,있도록 오늘의 음악 TV 속 음악 시대별 음악 부분을 다양한 장르와,NA,NA,NA,NA
41305,41306,41306,8,음악,음악 TV 속 음악 시대별 음악 부분을 다양한 장르와 리스너들의 취향을,NA,NA,NA,NA
41306,41307,41307,8,음악,다양한 이벤트 및 매거진에는 최신 음악 트랜드 및 소식들을 읽을 수도,NA,NA,NA,NA
41307,41308,41308,8,음악,수도 있어 음악을 들으며 한권의 음악 잡지를 보는 기분을 느낄 수,NA,NA,NA,NA
41308,41309,41309,8,음악,이라는 모토를 전면에 내세웠듯 ' 음악 듣는 스피커 본연의 기능 ',NA,NA,NA,NA
41310,41311,41311,8,음악,지니뮤직과 연동하게 되면 LTE 로 음악 스트리밍 서비스를 받을 수 있는,NA,NA,NA,NA
41311,41312,41312,8,음악,음악 제목 인식률 좋음 ( 다만,NA,NA,NA,NA
41312,41313,41313,8,음악,아직까지 기가지니앱에서 음악 찾기 기능이없음,NA,NA,NA,NA
41313,41314,41314,8,음악,있으며리모컨이 아닌 음성으로 TV 와 음악,NA,NA,NA,NA
41314,41315,41315,8,음악,TV 부터 음악 생활 전반에 걸쳐깊숙하고 밀접하게 관계,NA,NA,NA,NA
41315,41316,41316,8,음악,저희 집 음악 담당이자 뭐든지 물어보면 척척 알려주는,NA,NA,NA,NA
41316,41317,41317,8,음악,편리하게 궁금한 거 물어보면 알려주며 음악 팟캐스트 미디어 서비스 요리레시피생활편의에 리모컨,NA,NA,NA,NA
41317,41318,41318,8,음악,인공지능 스피커 클로바의 추천 기능은 음악 / 팟캐스트 / 오디오클립 /,NA,NA,NA,NA
41318,41319,41319,8,음악,가장 아쉬운 건 음성인식으로 음악 재생이 될 경우 네이버 뮤직,NA,NA,NA,NA
41319,41320,41320,8,음악,지능 서비스가 확대되어 기가지니에 제공되는 음악 서비스 ' 지니뮤직 ' 을,NA,NA,NA,NA
41320,41321,41321,8,음악,음악 재생 중 음성 명령을 통해,NA,NA,NA,NA
41321,41322,41322,8,음악,음악 종료를 예약할 수 있는 ',NA,NA,NA,NA
41322,41323,41323,8,음악,"들으면서 "" 지니야 10 분뒤에 음악 꺼줘 "" 라고 말하면 재생되던",NA,NA,NA,NA
41323,41324,41324,8,음악,추게 한 지니뮤직 ' 핑크퐁 음악 들려줘 ' 한 마디에 신났어요,NA,NA,NA,NA
41324,41325,41325,8,음악,복잡하게 스마트폰으로 음악 스트리밍 앱에 접속하고 검색하지 않고도,NA,NA,NA,NA
41325,41326,41326,8,음악,알려주는 날씨와 밤에 듣기 좋은 음악 추천을 확인해보세요,NA,NA,NA,NA
41326,41327,41327,8,음악,이거 등록하기 전에는 원하는 음악 틀어달라고 하면 1 분 듣기만,NA,NA,NA,NA
41327,41328,41328,8,음악,예를 들어 음악 듣던 중 기가지니 볼륨 높여줘,NA,NA,NA,NA
41328,41329,41329,8,음악,엔지니어의 특화된 튜닝 기술이 적용되어 음악 듣기에 상당히 좋으며 출력도 높아,NA,NA,NA,NA
41329,41330,41330,8,음악,있어서 스피커 역활을 하기도 해요그래서 음악 감상할때 따로 스피커를 준비하지 않아도,NA,NA,NA,NA
41330,41331,41331,8,음악,기가지니는 사용자의 음성 명령만으로 원하는 음악 일정관리 홈제어 영상통화 서비스를 제공합니다,NA,NA,NA,NA
41331,41332,41332,8,음악,바란다면 빨래 개고 청소하면서 편하게 음악 틀어보려는 것이 단 하나의 목적이었다,NA,NA,NA,NA
41332,41333,41333,8,음악,저장된 음원이나 지니 같은 다른 음악 어플이 아예 사용이 안될 줄은,NA,NA,NA,NA
41335,41336,41336,8,음악,어차피 음악 듣는 기능이 주된 기능이면 이전곡이나,NA,NA,NA,NA
41336,41337,41337,8,음악,아직은 요원한 AI 특히 음악 재생중에는 음악소리에 사람 명령어가 묻혀서,NA,NA,NA,NA
41337,41338,41338,8,음악,잘 했다고 생각이 드는 건 음악 감상은 물론 영화 어른들을 위한,NA,NA,NA,NA
41338,41339,41339,8,음악,메뉴 내 < 최근 요청한 음악 > 섹션 추가,NA,NA,NA,NA
41339,41340,41340,8,음악,뮤직 메뉴에 최근 요청한 음악 섹션이 추가되었습니다,NA,NA,NA,NA
41340,41341,41341,8,음악,이상 길게 눌러 재설정을 진행해주세요 음악 재생 기능 개선 지니 뮤직을,NA,NA,NA,NA
41341,41342,41342,8,음악,원하는 기기에서 음악 재생하기,NA,NA,NA,NA
41342,41343,41343,8,음악,지니 뮤직으로 재생 중인 음악 플레이 화면에는 지니 뮤직 로고가,NA,NA,NA,NA
41343,41344,41344,8,음악,하만카돈에서 제작한 스피커를 탑재했고영화 및 음악 감상을 위한 돌비 사운드까지 갖춘,NA,NA,NA,NA
41344,41345,41345,8,음악,후 엄마 아빠를 위한영어회화나 영화 음악 등도 함께 사용이 가능하니온 가족에게,NA,NA,NA,NA
41345,41346,41346,8,음악,알려주면서 키즈 게임 학습거기에 영화 음악 검색까지 모두 해주는 똑똑한인공지능 셋톱박스,NA,NA,NA,NA
41346,41347,41347,8,음악,드라마를 틀어놓는다는지 방에 있는데 스피커로 음악 듣고싶을때 리모컨이 없을때도 매우 편리합니다,NA,NA,NA,NA
41347,41348,41348,8,음악,아쉬울 따름이네요아맞다 음악 듣는거요 지니음악 유료로 해야되며 월정액으로,NA,NA,NA,NA
41348,41349,41349,8,음악,또한 기가지니에 제공되던 음악 서비스 ' 지니뮤직 ' 은,NA,NA,NA,NA
41349,41350,41350,8,음악,미디어팩은 음악 TV 에 TV 포인트까지 즐길,NA,NA,NA,NA
41350,41351,41351,8,음악,지니팩을 이용하면 음악 스트리밍 무제한 + LTE 무제한,NA,NA,NA,NA
41351,41352,41352,8,음악,기본적인 것뿐 아니라 지니 뮤직 음악 주식어플 등 다양한 콘텐츠를 다운로드할,NA,NA,NA,NA
41352,41353,41353,8,음악,TV 를 켜면 초 화면에 음악 통화 홈캠 캘린더 교통 생활등,NA,NA,NA,NA
41353,41354,41354,8,음악,이상의 음원인 지니뮤직과 연동할수 있어서원하는 음악 다 들으실수 있답니당,NA,NA,NA,NA
41357,41358,41358,8,음악,KT 뮤직의 스트리밍 음악 서비스 ' 지니뮤직 ' 과,NA,NA,NA,NA
41358,41359,41359,8,음악,출시 당시에는 음악 재생 날씨정보 검색 등 5,NA,NA,NA,NA
41359,41360,41360,8,음악,손으로 요리하면서 음성으로 식재료 주문 음악 감상과 뉴스 검색이 가능하다,NA,NA,NA,NA
41360,41361,41361,8,음악,이 회사는 음악 애플리케이션 ' 지니뮤직 ' 의,NA,NA,NA,NA
41361,41362,41362,8,음악,기가지니 버디는 대화 음악 정보 등 기본적인 기가지니의 AI,NA,NA,NA,NA
41364,41365,41365,8,음악,유무선 네트워크를 바탕으로 TV 및 음악 감상 일정관리 교통안내도 가능하고요,NA,NA,NA,NA
41368,41369,41369,8,음악,를 켜면 초기화면에 올레 TV 음악 통화 홈캠 캘린더 교통 생활,NA,NA,NA,NA
41369,41370,41370,8,음악,그리고 음악 감상은 지니뮤직을 통해서 동작하기 때문에지니뮤직도,NA,NA,NA,NA
41371,41372,41372,8,음악,켜면 초기 화면에 올레 TV 음악 통화 홈캠 캘린더 교통 생활등,NA,NA,NA,NA
41372,41373,41373,8,음악,남아 있는데 바쁜 집안일을 하면서도 음악 듣고 싶을때 지니야,NA,NA,NA,NA
41373,41374,41374,8,음악,별도 이벤트를 진행하고 있어서 가입자는 음악 서비스인 지니 뮤직을 90 일,NA,NA,NA,NA
41374,41375,41375,8,음악,들려줘 ' ' 기가지니 최신 음악 들려줘 ' ' 기가지니 라디오,NA,NA,NA,NA
41375,41376,41376,8,음악,가구 뒤편 ㅋㅋ ) 엄마의 음악 감상이 필요 : 스피커 절실,NA,NA,NA,NA
41376,41377,41377,8,음악,등원 시키고 자유시간 때 음악 들으면서 집안일 자주 하거든요 음질도,NA,NA,NA,NA
41377,41378,41378,8,음악,자주 하거든요 음질도 참 좋아요 음악 감상시 우퍼 라이팅 효과로 밤에는,NA,NA,NA,NA
41378,41379,41379,8,음악,음악 재생이 가능한데도이정도,NA,NA,NA,NA
41379,41380,41380,8,음악,의 유무선 네트워크를 바탕으로 TV 음악 감상 일정관리 교통안내 홈 IoT,NA,NA,NA,NA
41381,41382,41382,8,음악,지니뮤직의 음악 컨텐츠들을 곧바로 기가 지니에서 플레이하는,NA,NA,NA,NA
41382,41383,41383,8,음악,음악 청취도 명령어로 불러서 지니 뮤직을,NA,NA,NA,NA
41383,41384,41384,8,음악,가장 좋아하는 기능은 바로 Genie 음악 듣기인데요 그날의 기분에 따라 듣고싶은,NA,NA,NA,NA
41384,41385,41385,8,음악,음량 변경 ) 부터 날씨 음악 스트리밍 서비스인 지니 ( Genie,NA,NA,NA,NA
41385,41386,41386,8,음악,스피커를 이용해서 가장 많이 활용하는 음악 감상의 경우 하만카돈의 섬세한 사운드,NA,NA,NA,NA
41386,41387,41387,8,음악,기술을 이용해서 진화될 예정이지만 스트리밍 음악 재생 뉴스 생활정도 등 유용하게,NA,NA,NA,NA
41387,41388,41388,8,음악,깨워주고 ' 지금 듣기 좋은 음악 틀어줘 ' 나 ' 내일,NA,NA,NA,NA
41388,41389,41389,8,음악,고르는 재미도 있구요 그리고 추가 음악 파일을 다운 받을 수 있게,NA,NA,NA,NA
41389,41390,41390,8,음악,단순한 TV 틀어줘 음악 틀어줘누구 노래 틀어줘 이런 것들이,NA,NA,NA,NA
41390,41391,41391,8,음악,음악 감상할 때도 깔끔한 느낌의음질이었습니다,NA,NA,NA,NA
41391,41392,41392,8,음악,배터리 용량 ( LTE 음악 재생 7 시간 / 와아파이,NA,NA,NA,NA
41392,41393,41393,8,음악,< 인공지능 스피커 > 음악 감상이나 라디오 청취에 활용되던 스피커가,NA,NA,NA,NA
41393,41394,41394,8,음악,""" 지니야 음악 좀 틀어줘",NA,NA,NA,NA
41394,41395,41395,8,음악,비오는 날 들을만한 음악 좀 틀어줄래,NA,NA,NA,NA
41395,41396,41396,8,음악,이렇게 음성으로 음악 서비스를 사용한다면 기존과 음악 소비,NA,NA,NA,NA
41396,41397,41397,8,음악,음성으로 음악 서비스를 사용한다면 기존과 음악 소비 패턴이 많이 달라지지 않을까,NA,NA,NA,NA
41397,41398,41398,8,음악,' 5 위 ' 잔잔한 음악 ' 순이었습니다,NA,NA,NA,NA
41398,41399,41399,8,음악,분위기 있는 음악 좀 들려줘어,NA,NA,NA,NA
41399,41400,41400,8,음악,TV 및 음악 감상 스케줄 홈 IoT 허브,NA,NA,NA,NA
41400,41401,41401,8,음악,켜면 초기 화면에 올레 TV 음악 옹화 홈캠 캘린더 교통 생활,NA,NA,NA,NA
41401,41402,41402,8,음악,음악 추천해줘,NA,NA,NA,NA
41404,41405,41405,8,음악,실시간 가사 30 분 후에 음악 끄기 이런 기능도 있더라고요,NA,NA,NA,NA
41405,41406,41406,8,음악,음악 재생도 유용하고 명령어도 잘 알아듣는다,NA,NA,NA,NA
41406,41407,41407,8,음악,지니 음악 듣기 날씨 물어보기 뉴스 검색,NA,NA,NA,NA
41407,41408,41408,8,음악,사람의 음성을 인식해 TV / 음악 / 전화 / 홈 캠,NA,NA,NA,NA
41408,41409,41409,8,음악,날씨 일정관리 음악 재생 등을 알려주는 개인비서와 같은,NA,NA,NA,NA
41409,41410,41410,8,음악,수행할 수 있게 되죠 사실 음악 좋아하시는분들은 하만카돈 브랜드 하나로도 구매를,NA,NA,NA,NA
41410,41411,41411,8,음악,음원을 가진 지니뮤직과 연동하여 스마트한 음악 감상까지 가 to the 능,NA,NA,NA,NA
41411,41412,41412,8,음악,하고리모콘 필요없이 TV 시청 및 음악 청취도 가능하다고 하니까집안일 하면서 말로만,NA,NA,NA,NA
41412,41413,41413,8,음악,후에 사용설명서와기가지니 설치하면 주는 상품권인데지니 음악 사용권도 챙겨주셨어요,NA,NA,NA,NA
41413,41414,41414,8,음악,하만카돈 스피커가 같이 되어 있어서지니야 음악 틀어줘 했을 때하만카돈 음질로 음악을,NA,NA,NA,NA
41414,41415,41415,8,음악,' 지니야 음악틀어줘 ' 이러면 음악 틀어주고 거기다가 또 추가해서 지니야,NA,NA,NA,NA
41415,41416,41416,8,음악,명령어가 바로 ' 클로바 팝 음악 틀어줘,NA,NA,NA,NA
41416,41417,41417,8,음악,음악 틀어줘,NA,NA,NA,NA
41417,41418,41418,8,음악,일정 정리검색 IOT 상품 제어 음악 등등시켜만 달라,NA,NA,NA,NA
41418,41419,41419,8,음악,미지원되는 음악 스트리밍,NA,NA,NA,NA
41419,41420,41420,8,음악,음악 날씨는 이용하기 편하고,NA,NA,NA,NA
41420,41421,41421,8,음악,리모컨 없이 TV 를 컨트롤하고 음악 생활정보 등을 즐길 수 있는,NA,NA,NA,NA
41421,41422,41422,8,음악,음악 선곡 날씨 등의 정보를 제공해주는,NA,NA,NA,NA
41422,41423,41423,8,음악,바탕으로 멜론 어플에서 진행중인 맞춤 음악 추천 서비스인 ' For:U ',NA,NA,NA,NA
41423,41424,41424,8,음악,Genie 음악 듣기 기능 - 기가 지니를,NA,NA,NA,NA
41424,41425,41425,8,음악,- 기가 지니를 통해 지니에서 음악 듣기가 가능합니다,NA,NA,NA,NA
41425,41426,41426,8,음악,이렇게 말을 하면 기가 지니가 음악 추천을 해주며,NA,NA,NA,NA
41426,41427,41427,8,음악,미니의 경우 소형 AI 스피커로써 음악 추천 기능에 집중하였다고 합니다,NA,NA,NA,NA
41427,41428,41428,8,음악,기가지니에는 이처럼 ' 음악 듣기 대화하기 라디오 듣기 ',NA,NA,NA,NA
41428,41429,41429,8,음악,음악 추천 기가지니와 함께라면 원할 때,NA,NA,NA,NA
41431,41432,41432,8,음악,이외에도 영상통화 음악 감상 등 기능을 이용할 수,NA,NA,NA,NA
41432,41433,41433,8,음악,음악 추천 좀 해줘,NA,NA,NA,NA
41433,41434,41434,8,음악,OO 음악 좀 틀어줘,NA,NA,NA,NA
41434,41435,41435,8,음악,않는 경우 ' 지니야 조용한 음악 좀 틀어줘,NA,NA,NA,NA
41435,41436,41436,8,음악,이런 변화가 음악 시장에 어떤 영향을 줄까요,NA,NA,NA,NA
41436,41437,41437,8,음악,삼성전자와 제휴로 AI 스피커 제조사나 음악 스트리밍 서비스 업체인 판도라와 경쟁에서,NA,NA,NA,NA
41437,41438,41438,8,음악,스피커를 포함해 모든 삼성 기기에 음악 서비스를 공급할 수 있다,NA,NA,NA,NA
41438,41439,41439,8,음악,스마트 TV 나 다른 기기에도 음악 서비스를 추가하고 삼성 음성인식 서비스,NA,NA,NA,NA
41439,41440,41440,8,음악,멤버이시라면방송에 나오는 다양한 고퀄리티 음질의 음악 서비스기분좋게 할인해서 들으세요난 한곡도 놓치지,NA,NA,NA,NA
41524,41525,41525,8,크기,25 인치 크기 15W 출력의 트위터를 탑재해 총,NA,NA,NA,NA
41525,41526,41526,8,크기,기가지니 버디는 한손에 잡히는 작은 크기 ( 너비 85ⅹ 65,NA,NA,NA,NA
41526,41527,41527,8,크기,한 손에 착 감기는 크기 ( 85mm X 65,NA,NA,NA,NA
41527,41528,41528,8,크기,크기 : 72 ( 둘레 ),NA,NA,NA,NA
41528,41529,41529,8,크기,25 인치 크기 15W 출력의 트위터를 탑재하여 총,NA,NA,NA,NA
41529,41530,41530,8,크기,25 인치 크기 15W 출력의 트위터 ) 를,NA,NA,NA,NA
41533,41534,41534,8,크기,조작 등 - 에코닷 ( 크기 작은 버전 ) 에코쇼 (,NA,NA,NA,NA
41534,41535,41535,8,크기,알루미늄 메탈과 작은 크기 덕에 인테리어 소품으로 역할을 톡톡히,NA,NA,NA,NA
41535,41536,41536,8,크기,가정에서 기가지니를 사용하던 분들은 깜놀할 크기,NA,NA,NA,NA
41536,41537,41537,8,크기,23 인치 크기 15W 출력의 트위터를 탑재해서 총,NA,NA,NA,NA
41537,41538,41538,8,크기,25 인치 크기 15W 출력의 트위터를,NA,NA,NA,NA
41538,41539,41539,8,크기,무엇보다 눈에 띄는 것은 컴팩트한 크기,NA,NA,NA,NA
41539,41540,41540,8,크기,할인폭이 상당히 크기 때문에 잘 활용하면 매월 내야하는,NA,NA,NA,NA
41540,41541,41541,8,크기,두께와 전체적은 크기 등을 고려해 평가하자면 패션을 위한,NA,NA,NA,NA
41544,41545,41545,8,크기,미포함 ) 무게 : 1800g 크기 : 182 * 279,NA,NA,NA,NA
