,Unnamed: 0,X,category,key,sentences,senti,score1,score2,score3
20164,20165,20165,5,에어컨,때문에 외부에서 미리 세탁기를 돌리거나 에어컨 공기청정기 등을 켜고 로봇청소기에게 미리,NA,NA,NA,NA
20165,20166,20166,5,에어컨,활용해보고자 13 년된 에어컨을 스마트 에어컨 부럽지,NA,NA,NA,NA
20166,20167,20167,5,에어컨,음성 & 스마트폰으로 에어컨 제어외출하고 집에 들어오기 전에 틀어놓으면,NA,NA,NA,NA
20167,20168,20168,5,에어컨,계절적 요인이 있긴 하지만 개인적으로 에어컨 원격제어가 가장 좋았으며 그 이후,NA,NA,NA,NA
20168,20169,20169,5,에어컨,"전자 가전 제품으로는 세탁기 냉장고 에어컨 공기청정기 오븐 등이 있으며 """,NA,NA,NA,NA
20169,20170,20170,5,에어컨,같은 방법으로 냉장고 세탁기 건조기 에어컨 공기청정기 로봇청소기 오븐 등 다양한,NA,NA,NA,NA
20170,20171,20171,5,에어컨,LG 전자는 냉장고 세탁기 건조기 에어컨 공기청정기 로봇청소기 오븐 등 7,NA,NA,NA,NA
20171,20172,20172,5,에어컨,이후 미국에서 냉장고와 세탁기 건조기 에어컨 로봇청소기 공기청정기 오븐 등 생활가전,NA,NA,NA,NA
20172,20173,20173,5,에어컨,로봇은 와이파이를 통해 TV 냉장고 에어컨 조명 등의 가전과 보안시스템을 컨트롤할,NA,NA,NA,NA
20173,20174,20174,5,에어컨,예를 들어 LG 에어컨 WHISEN ' ThinQ ' 와,NA,NA,NA,NA
20175,20176,20176,5,에어컨,지금 사진촬영으로 인해 스마트씽큐가 에어컨 앞에 놓여있지만 실제로 사용할 때는,NA,NA,NA,NA
20177,20178,20178,5,에어컨,이건 외출해서 집안에 들어오기 전에 에어컨 작동을 시켜두면 집안에 들어왔을 때,NA,NA,NA,NA
20178,20179,20179,5,에어컨,지원하지 않는 기존의 세탁기 냉장고 에어컨 등의 제품이라도 이 센서를 부착하면,NA,NA,NA,NA
20180,20181,20181,5,에어컨,사용시 지인에게 문자 전송 ) 에어컨 자동 운전 -,NA,NA,NA,NA
20181,20182,20182,5,에어컨,내가 저장해두고 사용할 수도 있는데요 에어컨 켜는 것과 끄는 건 기본이고,NA,NA,NA,NA
20182,20183,20183,5,에어컨,' 하이 엘지 에어컨 켜줘 ' ' 하이 엘지,NA,NA,NA,NA
20183,20184,20184,5,에어컨,- Zigbee 통신 - 세탁기 에어컨 냉장고 로봇청소기 제어 - 적외선을,NA,NA,NA,NA
20184,20185,20185,5,에어컨,알려줍니다 연동되는 제품은 세탁기 냉장고 에어컨 건조기 로봇청소기 공기청정기 오븐 등,NA,NA,NA,NA
20185,20186,20186,5,에어컨,를 비롯해 ' 휘센 씽큐 에어컨 ' ' LG 올레드 TV,NA,NA,NA,NA
20186,20187,20187,5,에어컨,여기에 냉장고 문이 열려 있다거나 에어컨 또는 공기청정기의 필터를 교환하라고 말해주는,NA,NA,NA,NA
20627,20628,20628,5,시간,씽큐 허브에서 네이버 클로바를 만날 시간,NA,NA,NA,NA
20628,20629,20629,5,시간,요청했는데 순번대기가 좀 길어 2 시간 후 도움 전화를 받을 수,NA,NA,NA,NA
20629,20630,20630,5,시간,날씨나 시간 알림 구글 일정과 연동하면 일정,NA,NA,NA,NA
20630,20631,20631,5,시간,경험해 볼 수 있으니 여러분도 시간 날 때 꼭 방문해 보세요,NA,NA,NA,NA
20631,20632,20632,5,시간,바로 실행할 수 있어보다 빠른 시간 내 집안 확인이 가능해요,NA,NA,NA,NA
20632,20633,20633,5,시간,바탕 화면에서는 보시는 것처럼 요일 시간 그리고 날씨를 보여줍니다,NA,NA,NA,NA
20633,20634,20634,5,시간,알람 타이머 설정 날씨 확인 시간 확인 및 다양한 정보까지 음성으로,NA,NA,NA,NA
20634,20635,20635,5,시간,만들고 가족의 식사를 준비하느라 분주한 시간,NA,NA,NA,NA
20635,20636,20636,5,시간,알 수 있고 오늘의 날짜와 시간 그리고 날씨까지 알 수 있으니,NA,NA,NA,NA
20636,20637,20637,5,시간,221078755519 버튼을 누르지 않아도간편하게 음성인식으로날씨 시간 타이머 알람뿐 아니라정보나 상식 검색도,NA,NA,NA,NA
20638,20639,20639,5,시간,내솥 교체 시기가 되었거나 10 시간 이상 보온 모드가 지속돼 밥의,NA,NA,NA,NA
20639,20640,20640,5,시간,사용기 작성이 늦어졌습니다회사에서 개발업무를 맡다보니 시간 여유가 없네요지난번 스마트 씽큐 개봉기에,NA,NA,NA,NA
20640,20641,20641,5,시간,머신 러닝 기능을 활용해 지연 시간 개선 개인정보 · 보안 이슈,NA,NA,NA,NA
20641,20642,20642,5,시간,경우에는 상태확인 켜기와 끄기 남은 시간 안내 등이 가능합니다,NA,NA,NA,NA
20642,20643,20643,5,시간,상단 부분에 디스플레이가 탑재되어 있어 시간 및 날씨 각종 프로그램 화면을,NA,NA,NA,NA
20643,20644,20644,5,시간,시간,NA,NA,NA,NA
20644,20645,20645,5,시간,것이 허브인데 냉장고의 특성상 24 시간 작동해야 하므로 스마트홈 허브로 활용하기에,NA,NA,NA,NA
20645,20646,20646,5,시간,건조시킨 후 시계를 보니 외출할 시간,NA,NA,NA,NA
20646,20647,20647,5,시간,업데이트까지 모두 완료되니 현재 날짜와 시간 그리고 와이파이 연결을 통해 얻은,NA,NA,NA,NA
20647,20648,20648,5,시간,잠든 시간 외에는 음악을 물고 (,NA,NA,NA,NA
20648,20649,20649,5,시간,' 라고 질문하면 시간 별로 기록된 일정을 또박또박 알려준답니다,NA,NA,NA,NA
20685,20686,20686,5,온도,온도 / 운전 모드 / 바람세기,NA,NA,NA,NA
20686,20687,20687,5,온도,매일의 미세먼지 / 초미세먼지 / 온도 / 습도 이력을 모아서 확인할,NA,NA,NA,NA
20687,20688,20688,5,온도,필요한 공간에 부착해 놓고 실시간으로 온도 및 습도를 체크할 수 있고,NA,NA,NA,NA
20688,20689,20689,5,온도,나면 스마트폰을 통해서 현재 집안의 온도 / 습도를 바로 확인할 수,NA,NA,NA,NA
20689,20690,20690,5,온도,분들은 에어컨 운전 시작 정지 온도 / 운전 모드 선택 바람세기,NA,NA,NA,NA
20690,20691,20691,5,온도,실내 온도 변화를 감지해 스스로 냉방에 집중하거나,NA,NA,NA,NA
20691,20692,20692,5,온도,온도로 설정을 해주니 무더위에 일일이 온도 및 바람 세기를 신경 쓰지,NA,NA,NA,NA
20692,20693,20693,5,온도,온도와 습도를 지속적으로 모니터링하여 지정 온도 도달 시 에어컨을 원격으로 제어하는,NA,NA,NA,NA
20693,20694,20694,5,온도,LG 에어스테이션은 온도 습도뿐만 아니라 미세먼지 CO2 농도까지,NA,NA,NA,NA
20694,20695,20695,5,온도,문 시스템에는 온도 습도 조도 이산화탄소 등의 센서가,NA,NA,NA,NA
20695,20696,20696,5,온도,바탕의 링커는 탑재된 조도 사운드 온도 센서가 가전제품의 작동 상태를 감지하여,NA,NA,NA,NA
20696,20697,20697,5,온도,온도 날씨 미세먼지 등 주요 정보는,NA,NA,NA,NA
20697,20698,20698,5,온도,있으며집 밖에서는 스마트씽큐 앱을 통해집안 온도 / 습도 공기질 등을 확인하고스마트,NA,NA,NA,NA
20698,20699,20699,5,온도,상태 확인뿐 아니라가전제품을 끄고 켜기 온도 조절모드 변경 등을 음성으로제어가 가능하답니다,NA,NA,NA,NA
20699,20700,20700,5,온도,설정한 온도 이상이 되면 알아서 에어컨이 켜지고,NA,NA,NA,NA
20700,20701,20701,5,온도,이는 온도 습도 센서와 도어 창문 센서,NA,NA,NA,NA
20701,20702,20702,5,온도,먼저 센서의 기능인 온도 습도 센서와 도어 창문 센서에,NA,NA,NA,NA
20702,20703,20703,5,온도,이러한 활용 이외에도 특히나 온도 습도 센서는 별도로 사용하기에도 안성맞춤인데요,NA,NA,NA,NA
20703,20704,20704,5,온도,온도,NA,NA,NA,NA
20704,20705,20705,5,온도,자주 살펴보게 되는 시간과 날씨 온도 등을 보여주고 있는 것은 대형,NA,NA,NA,NA
20705,20706,20706,5,온도,집 에어컨이 연결되어 있어 실내 온도 정도나 미세먼지 수치를 파악할 수,NA,NA,NA,NA
20706,20707,20707,5,온도,가전 라인업은 현재 ▲ 내부 온도 변화를 감지해 스스로냉각 세기를 조절하는,NA,NA,NA,NA
20707,20708,20708,5,온도,온도 / 습도 센서 6,NA,NA,NA,NA
20708,20709,20709,5,온도,센서 세탁기 센서 냉장고 센서 온도 습도 센서 등 다양한 용도로,NA,NA,NA,NA
20709,20710,20710,5,온도,시 원격 작동 또는 설정 온도 도달 시 자동 운전시킬 수,NA,NA,NA,NA
20710,20711,20711,5,온도,귀가 시 원격 작동 설정 온도 도달 시 자동 운전 로봇,NA,NA,NA,NA
21594,21595,21595,5,블루투스,인공지능 ( AI ) 기능 블루투스 스피커 일정 확인 타이머 등,NA,NA,NA,NA
21595,21596,21596,5,블루투스,그리고 블루투스 스피커까지 쓸 수 있다는 점에서,NA,NA,NA,NA
21596,21597,21597,5,블루투스,그렇지만 일단 기본은 블루투스 인공지능 스피커에 속하는 이 녀석,NA,NA,NA,NA
21597,21598,21598,5,블루투스,고음질로 짱짱한 음악을 즐기게 해주는 블루투스 스피커 기능이 깔려 있어서 하루종일,NA,NA,NA,NA
21598,21599,21599,5,블루투스,ㅎ 스마트폰에 저장된 음악은 요렇게 블루투스 기능으로 연결해서 들을 수 있는데,NA,NA,NA,NA
21599,21600,21600,5,블루투스,몸통 전체가 스피커이기 때문에 블루투스 스피커로도 많이 활용했었는데요,NA,NA,NA,NA
21600,21601,21601,5,블루투스,스마트씽큐 허브 제품의 디자인 그리고 블루투스 스피커 음성인식을 기반으로 다양한 정보를,NA,NA,NA,NA
21601,21602,21602,5,블루투스,블루투스 스피커 기능을 더해서 두루두루 아주,NA,NA,NA,NA
21602,21603,21603,5,블루투스,동영상에는 음성인식 기능을 사용하는 모습과 블루투스 모드로 음악을 켜고 꺼는 (,NA,NA,NA,NA
21603,21604,21604,5,블루투스,0 의 블루투스 모드 설정도 아주 간편한데,NA,NA,NA,NA
21604,21605,21605,5,블루투스,스마트씽큐 허브로의 기능 뿐만 아니라 블루투스 스피커로써의 음질 또한 아주 훌륭한,NA,NA,NA,NA
21605,21606,21606,5,블루투스,다만 일반 블루투스 스피커와 다른 점은 음성지원을 하기,NA,NA,NA,NA
21606,21607,21607,5,블루투스,ㅎ 프리미엄 음질을 구현해주는 블루투스 스피커 기능에 알기 쉬운 지능형,NA,NA,NA,NA
21607,21608,21608,5,블루투스,무선 랜 블루투스 등 다양한 통신 기술이 탑재되어,NA,NA,NA,NA
21608,21609,21609,5,블루투스,포터블 스피커 수준의 뛰어난 음질로 블루투스 스피커로 사용해도 손색없으며 구글 캘린더와,NA,NA,NA,NA
21609,21610,21610,5,블루투스,공중 부양 블루투스 스피커와 동일하게 자기장 방식을 통해,NA,NA,NA,NA
21610,21611,21611,5,블루투스,360 도 방향으로 적용되는 고음질의 블루투스 스피커 기능을 기본으로 탑재하고 있어,NA,NA,NA,NA
21611,21612,21612,5,블루투스,기능은 짱짱한 고음질을 선사하는 LG 블루투스 스피커로 네이버 뮤직을 감상할 수,NA,NA,NA,NA
21612,21613,21613,5,블루투스,ㅎㅎ 고음질의 블루투스 스피커가 생겼다고 좋아했던 것이 엊그제,NA,NA,NA,NA
21613,21614,21614,5,블루투스,적어도 스마트폰과 연결되는 인공지능 블루투스 스피커의 역할만으로도 유용하게 사용할 수,NA,NA,NA,NA
21614,21615,21615,5,블루투스,가능하며 자체적으로 스마트폰과 연결하여 무선 블루투스 스피커로 활용도 가능하기에 우리의 삶을,NA,NA,NA,NA
21615,21616,21616,5,블루투스,기기를 제어가 가능하며 와이파이 및 블루투스 통신 제어 방식도 가능하기 때문에,NA,NA,NA,NA
21616,21617,21617,5,블루투스,소개를 해드린 것처럼 이 제품은 블루투스 스피커 역할 인공지능 그리고 홈,NA,NA,NA,NA
21617,21618,21618,5,블루투스,연동 그리고 대부분의 가정에서 거실에 블루투스 스피커를 두고 싶어 하기 때문이라고,NA,NA,NA,NA
21618,21619,21619,5,블루투스,들을 수 있는 원통형 디자인의 블루투스 스피커 기능을 제공하고 있습니다,NA,NA,NA,NA
21619,21620,21620,5,블루투스,허브가 제공하고 있는 음성인식 기능 블루투스 스피커 일정과 타이머 기능 등을,NA,NA,NA,NA
21620,21621,21621,5,블루투스,스마트홈 기능도 제공하고 있기 때문에 블루투스 스피커와 스마트홈 허브 기능을 동시에,NA,NA,NA,NA
21621,21622,21622,5,블루투스,덕분에 블루투스 스피커로 활용하기도 좋습니다,NA,NA,NA,NA
21622,21623,21623,5,블루투스,스마트한 우리 집을 완성해주고 따로 블루투스 스피커로 활용하거나 날씨 스케쥴 등도,NA,NA,NA,NA
21623,21624,21624,5,블루투스,평상시에는 사용 중인 스마트폰과 연결하여 블루투스 스피커로 많이 활용하고 있는데요,NA,NA,NA,NA
21624,21625,21625,5,블루투스,것은 바로 LG 스마트씽큐 허브를 블루투스 기반의 스피커로 사용할 때 입니다,NA,NA,NA,NA
21625,21626,21626,5,블루투스,먼저 블루투스 페어링 과정이 필요한데요,NA,NA,NA,NA
21626,21627,21627,5,블루투스,낯익은 블루투스 로고와 함께 페어링 모드라고 큼지막하게,NA,NA,NA,NA
21628,21629,21629,5,블루투스,블루투스 활성화가 된 상태에서 스마트 씽큐,NA,NA,NA,NA
21629,21630,21630,5,블루투스,한 번만 페어링하면 다음부터는 블루투스 기능만,NA,NA,NA,NA
21630,21631,21631,5,블루투스,원통형 디자인의 블루투스 스피커로 활용할 수 있습니다,NA,NA,NA,NA
21631,21632,21632,5,블루투스,특히 음성인식 기능과 블루투스 스피커의 만남은 저한테는 상당히 유용했습니다,NA,NA,NA,NA
21632,21633,21633,5,블루투스,LG 스마트 씽큐 허브는프리미엄 블루투스 스피커로도사용할 수 있는데요,NA,NA,NA,NA
21633,21634,21634,5,블루투스,핸드폰에 블루투스 모드에서간단하게 기기를 선택해주면 끝,NA,NA,NA,NA
21634,21635,21635,5,블루투스,성능 좋은 블루투스 스피커까지 겸용이니까온 가족이 사랑할만하죠,NA,NA,NA,NA
21635,21636,21636,5,블루투스,허브 기능에 블루투스 스피커로의 기능까지 갖추고 있어 상당히,NA,NA,NA,NA
21636,21637,21637,5,블루투스,블루투스 스피커로 스마트씽큐 허브를 사용하고자 한다면,NA,NA,NA,NA
21637,21638,21638,5,블루투스,3 인치 우퍼를 장착해 어지간한 블루투스 스피커 보다 훌륭한 재생을 보여줍니다,NA,NA,NA,NA
21639,21640,21640,5,블루투스,제품 검색을 해보니 스피커형은 블루투스 스피커로음악 재생민 통화 기능,NA,NA,NA,NA
21640,21641,21641,5,블루투스,이 외에도스마트씽큐 허브는 블루투스 스피커로도사용할 수 있답니다,NA,NA,NA,NA
21641,21642,21642,5,블루투스,블루투스 기능까지 있어 스마트폰의 음악을 프리미엄,NA,NA,NA,NA
21642,21643,21643,5,블루투스,수준의 풍부한 음량과 음질을 자랑하는 블루투스 스피커 기능으로 늘 음악과 함께,NA,NA,NA,NA
21643,21644,21644,5,블루투스,연결해서 음성으로 컨트롤할 수 있으며 블루투스 스피커로도 사용할 수 있고 다양한,NA,NA,NA,NA
21644,21645,21645,5,블루투스,온도습도음성영상동작적외선신체정보통신반도체 : 무선통신 와이파이 블루투스 Zigbee,NA,NA,NA,NA
21645,21646,21646,5,블루투스,블루투스 스피커가 한창 유행하던 시기를 넘어,NA,NA,NA,NA
21646,21647,21647,5,블루투스,일반적인 블루투스 스피커가 아닌 스마트 기기인 만큼,NA,NA,NA,NA
21647,21648,21648,5,블루투스,일반 블루투스 스피커가 아니라 인공지능을 갖춘 개인,NA,NA,NA,NA
21648,21649,21649,5,블루투스,블루투스 스피커의 역할은 물론이고여러 가지 디바이스를,NA,NA,NA,NA
21649,21650,21650,5,블루투스,기본적으로 블루투스 스피커로 사용이 가능하지만 아마존의 독자,NA,NA,NA,NA
21650,21651,21651,5,블루투스,통신 기능으로 와이파이만을 지원하기 때문에 블루투스 스피커로 사용은 불가합니다,NA,NA,NA,NA
21651,21652,21652,5,블루투스,에 원뿔형 기기로 와이파이뿐만 아니라 블루투스 연결도 지원합니다,NA,NA,NA,NA
21652,21653,21653,5,블루투스,블루투스 스피커로 즐거운 음악감상 -,NA,NA,NA,NA
21653,21654,21654,5,블루투스,프리미엄 포터블 ( 블루투스 ) 스피커 수준의 뛰어난 음질로,NA,NA,NA,NA
21654,21655,21655,5,블루투스,스마트 씽큐 허브는 블루투스 스피커 겸용이라 좋아하는 음악도 아주,NA,NA,NA,NA
21655,21656,21656,5,블루투스,연결하려는 블루투스 기기에서 스마트 씽큐 허브를 선택하면,NA,NA,NA,NA
21656,21657,21657,5,블루투스,기존에는 스마트폰에 있는 음악을 연동해서 블루투스 기능으로 음악을 들을 수 있었는데요,NA,NA,NA,NA
21657,21658,21658,5,블루투스,▲ 스피커형 허브는 블루투스 스피커로도 활용할 수 있음,NA,NA,NA,NA
21658,21659,21659,5,블루투스,스마트씽큐 스피커형의 경우 블루투스 스피커로도 활용 가능하고 출력이 상당하기에,NA,NA,NA,NA
21659,21660,21660,5,블루투스,고음질의 블루투스 스피커로 요즘 편리하게 음악을 듣고,NA,NA,NA,NA
21660,21661,21661,5,블루투스,있고 고품질 음악 감상이 가능한 블루투스 방식의 프리미엄 무선 스피커로도 활용할,NA,NA,NA,NA
21661,21662,21662,5,블루투스,지원 스마트폰과 손쉽게 태그 방식으로 블루투스 연결이 가능하다는 점도 확인할 수,NA,NA,NA,NA
21662,21663,21663,5,블루투스,기본적으로 블루투스 스피커 기능을 지원하고 있어 평소,NA,NA,NA,NA
21663,21664,21664,5,블루투스,최근 블루투스 스피커는 남녀노소,NA,NA,NA,NA
21664,21665,21665,5,블루투스,실제로 LG 스마트씽큐 허브는 프리미엄 블루투스 스피커 급의 성능을 내장하고 있으며,NA,NA,NA,NA
21665,21666,21666,5,블루투스,LG 스마트씽큐 허브를 블루투스 스피커로 사용하기 위해서는 페어링이 필요한데,NA,NA,NA,NA
21666,21667,21667,5,블루투스,할 별 단계도 없이 일반 블루투스 기기처럼 바로 연결되는 모습을 보여,NA,NA,NA,NA
21667,21668,21668,5,블루투스,블루투스,NA,NA,NA,NA
21670,21671,21671,5,블루투스,언제든 음악을 듣기 위해선 블루투스 페어링이 필요한데요,NA,NA,NA,NA
21671,21672,21672,5,블루투스,개를 꾸욱 3 초간 누르면 블루투스 페어링 모드가 되어요,NA,NA,NA,NA
21672,21673,21673,5,블루투스,블루투스 스피커 겸용 허브가 있으니 음성,NA,NA,NA,NA
21673,21674,21674,5,블루투스,블루투스 기능까지 지원되는 씽큐 허브는당신에게 음악이,NA,NA,NA,NA
21674,21675,21675,5,블루투스,- 날씨와 일정 전달 - 블루투스 스피커 * 스마트씽큐센서 - 스마트씽큐,NA,NA,NA,NA
21675,21676,21676,5,애플,애플 앱스토어 또는 구글 플레이에서 직접,NA,NA,NA,NA
21676,21677,21677,5,애플,애플,NA,NA,NA,NA
21677,21678,21678,5,애플,읽거나 혹은 구글 플레이스토어 / 애플 앱스토어에서 ' 스마트씽큐 ' 어플을,NA,NA,NA,NA
21678,21679,21679,5,애플,스피커에다가 음성명령을 내릴 필요 없이 애플 아이폰을 사용한다면 시리에게 명령하고 구글,NA,NA,NA,NA
21679,21680,21680,5,애플,lOT 를 구축하기 위해 구글이나 애플 혹은 우리나라 통신 3 사의,NA,NA,NA,NA
21682,21683,21683,5,애플,아마존 에코를 시작으로 구글 홈 애플 홈팟 등 메이저 업체들이 너도나도,NA,NA,NA,NA
21683,21684,21684,5,애플,인수하면서 시리를 탑재한 스피커 방식의 애플 스마트홈 서비스가 곧 시작 될거라는,NA,NA,NA,NA
21684,21685,21685,5,애플,아마도 9 월 7 일 애플 키노트에서 애플 시리 기반의 음성인식,NA,NA,NA,NA
21685,21686,21686,5,애플,월 7 일 애플 키노트에서 애플 시리 기반의 음성인식 명령 기반의,NA,NA,NA,NA
21686,21687,21687,5,애플,애플 앱 스토어 또는 구글 플레이,NA,NA,NA,NA
21687,21688,21688,5,애플,애플 홈팟출시일 : 2018 년 2,NA,NA,NA,NA
21688,21689,21689,5,애플,제품인 구글 어시스턴트 아마존 알렉사 애플 시리와 비교하면 많이 부족하다는 점이다,NA,NA,NA,NA
21690,21691,21691,5,애플,애플 구글 삼성 마이크로소프트 많은 음성,NA,NA,NA,NA
21691,21692,21692,5,애플,아마존 구글 애플 삼성 등 글로벌 기업들 중,NA,NA,NA,NA
21692,21693,21693,5,애플,애플의 시리는 애플 홈키트를 지원해서 홈키트용 가전제품을 제어할,NA,NA,NA,NA
21693,21694,21694,5,기술,미국은 우리나라에 비해 더 빠른 기술 발전과 상용화를 이뤘다,NA,NA,NA,NA
21694,21695,21695,5,기술,기술 덕분에 엄마는 오늘도 아이만 두고,NA,NA,NA,NA
21695,21696,21696,5,기술,예정 KT 5G 에서의 AI 기술 표준화 나서 KT 는 국제전기통신연합,NA,NA,NA,NA
21696,21697,21697,5,기술,음성인식 기술 인공지능 ( AI ) 스피커는,NA,NA,NA,NA
21697,21698,21698,5,기술,때로는 친구로 영화 속의 음성인식 기술 액션 영화를 좋아하는 분들이라면 음성인식,NA,NA,NA,NA
21699,21700,21700,5,기술,포털기업들의 인공지능 ( AI ) 기술 고도화 대결이 치열하기 벌어지고 있는,NA,NA,NA,NA
21700,21701,21701,5,기술,기술 소식에 익숙한 독자라면 최근 타이젠,NA,NA,NA,NA
21701,21702,21702,5,기술,상태를 실시간 반영해 자율주행을 돕는 기술 인공지능 스피커 NUGU 의 경량화,NA,NA,NA,NA
21703,21704,21704,5,기술,전자는 독자 개발한 딥 러닝 기술 ' 딥씽큐 ' 를 탑재한,NA,NA,NA,NA
21704,21705,21705,5,기술,다른 기업들이 사용하고 있는 AI 기술 ( 구글 어시스턴트 아마존 알렉사,NA,NA,NA,NA
21705,21706,21706,5,기술,▣ 인공지능 ( AI ) 기술 스마트 시대의 중심 집 내부에서는,NA,NA,NA,NA
21706,21707,21707,5,기술,: 자사 인공지능 기술 빅스비 ( Bixby ) 탑재,NA,NA,NA,NA
21707,21708,21708,5,기술,MS ' 코타나 ' 기술 기반으로 하만카돈의 스피커를 선보일 예정,NA,NA,NA,NA
21708,21709,21709,5,기술,아마존에서 개발한 AI 기반 음성인식 기술 Alexa 는 음성인식과 인공지능을 지원하는,NA,NA,NA,NA
21709,21710,21710,5,기술,서버에서 최적화된 답을 찾아주는 인공지능 기술 사용자가 고급영어로 말하지 않더라도 영어발음,NA,NA,NA,NA
21710,21711,21711,5,기술,개발 플랫폼으로 핵심은 5G 통신 기술,NA,NA,NA,NA
21711,21712,21712,5,기술,/ 디스플레이 밸류체인 기업 자율주행 기술 상용화 지원 기술 보유 nVidia,NA,NA,NA,NA
21712,21713,21713,5,기술,기업 자율주행 기술 상용화 지원 기술 보유 nVidia : 그래픽 처리,NA,NA,NA,NA
21713,21714,21714,5,기술,자율주행의 필수 기술 Qualcomm : 커넥티드카 구현에 적합한,NA,NA,NA,NA
21714,21715,21715,5,기술,이해능력 등을 컴퓨터 프로그램으로 실현한 기술,NA,NA,NA,NA
21715,21716,21716,5,기술,가 붙고 다른 기업들의 AI 기술 ( 구글 어시스턴트 아마존 알렉사,NA,NA,NA,NA
21723,21724,21724,5,출시,출시 할지지켜보는 것도 재미있는 부분이 되지,NA,NA,NA,NA
21724,21725,21725,5,출시,AI 플랫폼 탑재된 AI 스피커 출시 LG 전자는 네이버의 AI 플랫폼,NA,NA,NA,NA
21725,21726,21726,5,출시,스마트 스피커 ' 홈팟 ' 출시 내년 초로 연기애플이 홈팟 출시,NA,NA,NA,NA
21726,21727,21727,5,출시,출시 내년 초로 연기애플이 홈팟 출시 일정을 내년 초로 연기함애플 측은,NA,NA,NA,NA
21727,21728,21728,5,출시,시리를 탑재한 인공지능 스피커를 개발했으며 출시 전 준비 단계라고 말해준다,NA,NA,NA,NA
21728,21729,21729,5,출시,신한 ) 인공지능 AI 셋톱박스 출시 ( 127 / 01 /,NA,NA,NA,NA
21729,21730,21730,5,출시,레노버 스마트 어시스턴트의 출시 일정은 올해 하반기로 다소 여유,NA,NA,NA,NA
21730,21731,21731,5,출시,다소 여유 있게 잡혀있지만 국내 출시 여부는 알 수 없다,NA,NA,NA,NA
21731,21732,21732,5,출시,알렉사 연동 서비스를 지원하고 곧 출시 될 웹 OS 스마트 TV,NA,NA,NA,NA
21732,21733,21733,5,출시,부분들이 있다는 점에서 스마트 스피커 출시 의사를 직접 밝힌 건 문제점들을,NA,NA,NA,NA
21733,21734,21734,5,출시,출시,NA,NA,NA,NA
21734,21735,21735,5,출시,인공지능을 탑재한 가정용 로봇 출시 가속,NA,NA,NA,NA
21735,21736,21736,5,삼성,사용한다면 시리에게 명령하고 구글 어스던트나 삼성 스마트폰을 사용한다면 박스비 등에게 명령을,NA,NA,NA,NA
21736,21737,21737,5,삼성,비롯해 네이버와 카카오가 출사표를 던졌고 삼성 LG 등의 주요 전자회사도 AI,NA,NA,NA,NA
21737,21738,21738,5,삼성,삼성 및,NA,NA,NA,NA
21738,21739,21739,5,삼성,삼성 2020 년까지 전제품 탑재 ·,NA,NA,NA,NA
21739,21740,21740,5,삼성,스마트 스피커를 개발 중이라는 얘기가 삼성 측에서 나왔다,NA,NA,NA,NA
21740,21741,21741,5,삼성,역량까지 갖춘 다른 존재가 될지 삼성 하기 나름이다,NA,NA,NA,NA
21741,21742,21742,5,삼성,: OS 윈도우 탑재 ( 삼성 패밀리허브는 자체 OS 인 타이젠,NA,NA,NA,NA
21742,21743,21743,5,삼성,압도적인 점유율을 가지고 있는 회사는 삼성 뿐입니다,NA,NA,NA,NA
21743,21744,21744,5,삼성,년까지 모든분야의 가전에 빅스비를 접목하겠다는 삼성,NA,NA,NA,NA
21744,21745,21745,5,삼성,삼성,NA,NA,NA,NA
21746,21747,21747,5,삼성,: Google AI 의 어시스턴스 삼성 갤 S8,NA,NA,NA,NA
21747,21748,21748,5,삼성,삼성 전자 또한 카카오와 제휴 계약을,NA,NA,NA,NA
