,Unnamed: 0,X,category,key,sentences,senti,score1,score2,score3
25495,25496,25496,0,음악,인식한다는 특징 덕분에 스피커에게 음성으로 음악 켜,NA,NA,NA,NA
25496,25497,25497,0,음악,스피커에게 음성으로 음악 켜,NA,NA,NA,NA
25497,25498,25498,0,음악,음악 소리도 한결 더 선명하고 맑고,NA,NA,NA,NA
25498,25499,25499,0,음악,등에 사용할 수 있고 고품질 음악 감상이 가능한 블루투스 방식의 프리미엄,NA,NA,NA,NA
25500,25501,25501,0,음악,비가 올 때 듣기 좋은 음악 테마나 지니 라디오 DJ 기능을,NA,NA,NA,NA
25501,25502,25502,0,음악,음악이 플레이 되는 동안 음악 정보를 보여주기도 합니다,NA,NA,NA,NA
25503,25504,25504,0,음악,인공지능 스피커는 카카오톡 전송 음악 추천 외에도 네이버 검색 일정관리,NA,NA,NA,NA
25504,25505,25505,0,음악,통해 물건을 주문하고 알람 설정 음악 재생 가전제품 제어 등의 기능을,NA,NA,NA,NA
25505,25506,25506,0,음악,날씨정보 음악 재생 스피커 등 여러가지 기능을,NA,NA,NA,NA
25506,25507,25507,0,음악,생긴 듯 ㅋㅋ ' 나 음악 좀 틀어줘,NA,NA,NA,NA
25507,25508,25508,0,음악,나 음악 틀어줘 ' 이제 음성명령으로 내가,NA,NA,NA,NA
25508,25509,25509,0,음악,네이버 클로바는음성명령으로 네이버 지식 검색 음악 추천 한국어 번역 ( 영어,NA,NA,NA,NA
25509,25510,25510,0,음악,' 하이 엘지 신나는 음악 틀어줘 ' 라고 명령해주세요,NA,NA,NA,NA
25510,25511,25511,0,음악,있습니다 ' 하이 엘지 로맨틱한 음악 틀어줘 ' 라고말하면 네이버 클로바가,NA,NA,NA,NA
25511,25512,25512,0,허브,플랫폼을 탑재하고 출시된 ' 씽큐 허브 ( ThinQ Hub ) ',NA,NA,NA,NA
25512,25513,25513,0,허브,' 클로바 ' 의 씽큐 허브 탑재입니다,NA,NA,NA,NA
25513,25514,25514,0,허브,가전 생태계를 모두 아우르는 통합 허브 역할을 할 것으로 기대됩니다,NA,NA,NA,NA
25514,25515,25515,0,허브,스마트씽큐 앱을 다운로드 하거나 스마트씽큐 허브 초기 셋팅 시 알림창에 나오는,NA,NA,NA,NA
25515,25516,25516,0,허브,이번 포스트에서는 LG 스마트씽큐 허브 연동을 통한 에어컨 음성명령 중심으로,NA,NA,NA,NA
25516,25517,25517,0,허브,위와 같이 대시보드에 에어컨과 스마트씽큐 허브 ( ThinQ Hub 6D0A ),NA,NA,NA,NA
25517,25518,25518,0,허브,LG 스마트씽큐 허브 LCD 화면 밑에 있는 버튼을,NA,NA,NA,NA
25518,25519,25519,0,허브,이런 상황에서 스마트씽큐 허브 음성인식 기능을 이용하면,NA,NA,NA,NA
25519,25520,25520,0,허브,역할까지 톡톡히 해주는 LG 씽큐 허브 덕분에 베스언니네 집은 요즘 바야흐로,NA,NA,NA,NA
25520,25521,25521,0,허브,기존 LG 씽큐 허브 자체 음성지원일 때와 클로바를 연동했을,NA,NA,NA,NA
25521,25522,25522,0,허브,스마트씽큐 ' 앱을 실행하고 SmartThinQ 허브 ( 스피커형 ) 을 선택하면,NA,NA,NA,NA
25522,25523,25523,0,허브,LG 씽큐 허브 가전 연동의 경우 현재 냉장고,NA,NA,NA,NA
25523,25524,25524,0,허브,스마트씽큐 ) 허브를 먼저 등록하고 허브 안에 센서를 등록해야 해요,NA,NA,NA,NA
25524,25525,25525,0,허브,일전에 보여드렸던 스마트씽큐 허브 스피커형 기억하시죠,NA,NA,NA,NA
25525,25526,25526,0,허브,허브 등록의 경우 앞서 말씀드린 스마트씽큐,NA,NA,NA,NA
25526,25527,25527,0,허브,IoT 게이트웨이 카테고리 내 SmartThinQ 허브 ( 일반형 ) 을 선택하고,NA,NA,NA,NA
25527,25528,25528,0,허브,허브 등록 후 IoT 기기 등록,NA,NA,NA,NA
25528,25529,25529,0,허브,앞서 설명한 스마트씽큐 허브 내에서 이지세이버 플러그 선택 후,NA,NA,NA,NA
25529,25530,25530,0,허브,두차례의 리뷰를 통해서 LG 스마트씽큐 허브 제품의 디자인 그리고 블루투스 스피커,NA,NA,NA,NA
25530,25531,25531,0,허브,못 보신 분들이라면 LG 스마트씽큐 허브 제품이 어떤 기능을 제공하는지 위,NA,NA,NA,NA
25531,25532,25532,0,허브,스마트씽큐 허브 2,NA,NA,NA,NA
25532,25533,25533,0,허브,전자에서 새롭게 출시한 LG 스마트씽큐 허브 2,NA,NA,NA,NA
25534,25535,25535,0,허브,LG 스마트씽큐 허브 2,NA,NA,NA,NA
25535,25536,25536,0,허브,ㅎ 스마트 씽큐 어플이나 허브 등이 전 설치 과정을 차근차근,NA,NA,NA,NA
25536,25537,25537,0,허브,스마트 씽큐 허브 2,NA,NA,NA,NA
25537,25538,25538,0,허브,허브 본체와 전원 아답터 사용설명서로 구성된,NA,NA,NA,NA
25538,25539,25539,0,허브,전원 아답터 사용설명서로 구성된 씽큐 허브 2,NA,NA,NA,NA
25539,25540,25540,0,허브,ㅎ 허브 2,NA,NA,NA,NA
25540,25541,25541,0,허브,저렇게 허브 상단에 표시된 코드를 읽어도 되고,NA,NA,NA,NA
25541,25542,25542,0,허브,ㅎ 등록이 완료되면 스마트씽큐 허브 2,NA,NA,NA,NA
25544,25545,25545,0,허브,주세요 ' 만 인식한 스마트씽큐 허브,NA,NA,NA,NA
25547,25548,25548,0,허브,ㅋㅋㅋㅋ ; 스마트씽큐 허브 2,NA,NA,NA,NA
25548,25549,25549,0,허브,활용할 수 있는 LG 스마트씽큐 허브 2,NA,NA,NA,NA
25549,25550,25550,0,허브,ThinQ 및 G7 ThinQ 씽큐 허브 등의 인공지능 기술이 적용된 제품을,NA,NA,NA,NA
25550,25551,25551,0,허브,허브,NA,NA,NA,NA
25551,25552,25552,0,허브,ThinQ ) 는 LG 스마트씽큐 허브 LG 스마트씽큐 센서 LG 에어스테이션,NA,NA,NA,NA
25552,25553,25553,0,허브,LG 전자의 인공지능 스피커 스마트씽큐 허브 2,NA,NA,NA,NA
25553,25554,25554,0,허브,제품 + 앱 - > 허브 + 앱 - > 허브,NA,NA,NA,NA
25554,25555,25555,0,허브,허브 + 앱 - > 허브 + 제품 페어링 ' 순으로,NA,NA,NA,NA
25555,25556,25556,0,허브,허브를 스마트씽큐 어플에 등록 후 허브 와 제품을 연결해,NA,NA,NA,NA
25556,25557,25557,0,허브,허브 ( ThinQ Hub ) ',NA,NA,NA,NA
25557,25558,25558,0,허브,허브 ' 와 함께씽큐,NA,NA,NA,NA
25558,25559,25559,0,허브,허브 ' 를 통해서목소리만으로도 공기청정기,NA,NA,NA,NA
25559,25560,25560,0,허브,허브 ' 에 연결된,NA,NA,NA,NA
25560,25561,25561,0,허브,허브 ' 는 에어컨,NA,NA,NA,NA
25561,25562,25562,0,허브,허브 ' 는 다양한 가전과의 연동,NA,NA,NA,NA
25562,25563,25563,0,허브,허브 ' 는 가전과의,NA,NA,NA,NA
25563,25564,25564,0,허브,씽큐 허브 네이버 클로바로 더 똑똑해졌다,NA,NA,NA,NA
25564,25565,25565,0,허브,LG 인공지능 스피커 LG 씽큐 허브 역시 t 사물인터넷 서비스를 포괄적으로,NA,NA,NA,NA
25565,25566,25566,0,허브,업데이트 전이라면 씽큐 허브 본체를 켜면 바로 업데이트 알림이,NA,NA,NA,NA
25566,25567,25567,0,허브,ㅎ 제 경우 허브 본체가 알려주는 업데이트 알림을 한,NA,NA,NA,NA
25568,25569,25569,0,허브,기존 허브 음성지원과 클로바 음성지원의 차이점이 뭐지,NA,NA,NA,NA
25569,25570,25570,0,허브,그 동안 허브 자체의 음성지원으로 인해 말로써 가전제품,NA,NA,NA,NA
25570,25571,25571,0,허브,허브와 클로바가 연동이 되면 이제 허브 본체와 스마트폰 모두에서 더 많은,NA,NA,NA,NA
25571,25572,25572,0,허브,기능을 보여주는 LG 인공지능스피커 씽큐 허브,NA,NA,NA,NA
25572,25573,25573,0,허브,있었는데 이제는 거실에 놓아둔 스마트씽큐 허브 2,NA,NA,NA,NA
25573,25574,25574,0,허브,홈팟 HomePod 등은 lOT 의 허브 역할을 하는 제품으로 작게는 10,NA,NA,NA,NA
25574,25575,25575,0,허브,제품은 전 세계의 lOT 의 허브 역할을 하는 AI 스피커를 얼마나,NA,NA,NA,NA
25575,25576,25576,0,허브,기본적으로 음성인식을 바탕으로 한 lOT 허브 제품은 아닙니다,NA,NA,NA,NA
25576,25577,25577,0,허브,존재하고 있는데도 불구하고 각기 lOT 허브 제품을 내놓는 것은 결국 새로운,NA,NA,NA,NA
25577,25578,25578,0,허브,새로운 기술이라는 미명 아래 lOT 허브 제품의 주도권을 잡으려는 소리 없는,NA,NA,NA,NA
25578,25579,25579,0,허브,AI 스피커의 lOT 허브 역할을 하는 링커는 어떤 제품인지,NA,NA,NA,NA
25579,25580,25580,0,허브,음성인식 AI 스피커나 IOT 허브 제품들보다 합리적이고 실용적인 제품이 링커라는,NA,NA,NA,NA
25580,25581,25581,0,허브,이 스피커는 시연 장소에도 있는 허브 역할을 하는 중요한 장치입니다,NA,NA,NA,NA
25581,25582,25582,0,허브,연동이 이루어져 있는 LG 씽큐 허브 단말기에서 바로 업데이트를 진행해도 되고,NA,NA,NA,NA
25582,25583,25583,0,허브,설치가 정상적으로 끝나면 LG 씽큐 허브 디스플레이 창을 통해 ' 이제,NA,NA,NA,NA
25583,25584,25584,0,허브,있다고 하니 기존 LG 씽큐 허브 모델을 사용하고 있는 유저 입장에서는,NA,NA,NA,NA
25584,25585,25585,0,허브,LG IoT 디바이스인 스마트씽큐 허브 덕분에요,NA,NA,NA,NA
25585,25586,25586,0,허브,그리고 허브 스피커형 선택한 뒤 Wi-Fi 네트워크를,NA,NA,NA,NA
25586,25587,25587,0,허브,네트워크 비밀번호 작성 후 SmartThinQ 허브 전원을 연결한 뒤하단의 버튼을 3,NA,NA,NA,NA
25587,25588,25588,0,허브,바로 스마트홈 LG 스마트씽큐 허브,NA,NA,NA,NA
25588,25589,25589,0,허브,지난 포스팅에서 LG 스마트씽큐 허브 개봉기와인공지능 스피커 기능을 보여드렸는데요,NA,NA,NA,NA
25589,25590,25590,0,허브,스마트하면서도 디자인도 이쁜 LG 스마트씽큐 허브,NA,NA,NA,NA
25590,25591,25591,0,허브,전자가 선보인 AI 스피커 스마트씽큐 허브 제품의 개봉기를 전해드렸는데요,NA,NA,NA,NA
25591,25592,25592,0,허브,역할 인공지능 그리고 홈 IoT 허브 기능을 가지고 있는 제품입니다,NA,NA,NA,NA
25592,25593,25593,0,허브,LG 스마트씽큐 허브 제품 역시 전방향에서 음악을 들을,NA,NA,NA,NA
25593,25594,25594,0,허브,LG 전자 인공지능 스피커 스마트씽큐 허브 바탕 화면에서는 보시는 것처럼 요일,NA,NA,NA,NA
25594,25595,25595,0,허브,있기 때문에 블루투스 스피커와 스마트홈 허브 기능을 동시에 하는 제품이라는 차별점을,NA,NA,NA,NA
25595,25596,25596,0,허브,시작으로 쭉 사용해왔던 LG 씽큐 허브,NA,NA,NA,NA
25596,25597,25597,0,허브,LG 씽큐 허브 인공지능 스피커는 집안에서 사용하는 여러,NA,NA,NA,NA
25597,25598,25598,0,허브,인공지능 AI 스피커 ' 스마트씽큐 허브 ' 를 발표했습니다,NA,NA,NA,NA
25598,25599,25599,0,허브,활성화가 된 상태에서 스마트 씽큐 허브 기기를 쉽게 찾을 수 있었습니다,NA,NA,NA,NA
25599,25600,25600,0,허브,AI 허브,NA,NA,NA,NA
25600,25601,25601,0,허브,' 를 탑재한 ' 스마트씽큐 허브 ( SmartThinQ Hub ) ',NA,NA,NA,NA
25601,25602,25602,0,허브,탑재한 스마트 냉장고 및 가정용 허브 로봇을 공개한 바 있다,NA,NA,NA,NA
25602,25603,25603,0,허브,출시한 인공지능 스피커 ' 스마트씽큐 허브 ' 를 비롯 7 월,NA,NA,NA,NA
25609,25610,25610,0,허브,스마트 기기들까지 조작하는 일종의 ' 허브 디바이스 ' 라는 점입니다,NA,NA,NA,NA
25610,25611,25611,0,허브,물을 받아놓는 등 음성인식을 바탕으로 허브 디바이스의 역할을 가진 인공지능 스피커로,NA,NA,NA,NA
25611,25612,25612,0,허브,인공지능 AI 스피커 LG 스마트씽큐 허브 소개해 드릴게요 ^ ^ 지난번,NA,NA,NA,NA
25612,25613,25613,0,허브,만들 때인공지능 스피커 LG 스마트씽큐 허브 덕분에타이밍 놓치는 일 없답니다 ^,NA,NA,NA,NA
25613,25614,25614,0,허브,범위를 초과하였을 경우 나타나는데 스마트씽큐 허브 일반형만 되어있으면 앱으로만 나타나며 스피커,NA,NA,NA,NA
25614,25615,25615,0,허브,허브 기능에 블루투스 스피커로의 기능까지 갖추고,NA,NA,NA,NA
25615,25616,25616,0,허브,틀어주는 장난감 역할을 해주던 말만 허브,NA,NA,NA,NA
25616,25617,25617,0,허브,AI 스피커 & 허브 그리고 가전 제품첫 사용기 끝,NA,NA,NA,NA
25617,25618,25618,0,허브,IoT 허브 클로버,NA,NA,NA,NA
25618,25619,25619,0,허브,패키지로 함께 받아 본 IoT 허브 ' IoT 스위치 IoT 가전제품,NA,NA,NA,NA
25619,25620,25620,0,허브,오리지널 에코와 닮은 스마트 홈 허브 역할을 담당할 에코 플러스 작은,NA,NA,NA,NA
25620,25621,25621,0,허브,제어할 수 있는 스마트 홈 허브 기능을 탑재했습니다,NA,NA,NA,NA
25621,25622,25622,0,허브,LG 전자 ' 씽큐 허브 ' 인공지능 스피커가 네이버의 인공지능,NA,NA,NA,NA
25622,25623,25623,0,허브,또 기존 씽큐 허브 사용자는 펌웨어 업데이트를 통해 신제품과,NA,NA,NA,NA
25625,25626,25626,0,허브,IoT ( 사물인터넷 ) 의 허브 역할을 할 수 있기 때문에,NA,NA,NA,NA
25626,25627,25627,0,허브,삼성은 빅스비를 스마트폰 외에 패밀리 허브 2,NA,NA,NA,NA
25627,25628,25628,0,허브,커넥티드 홈 시나리오에서 조명 시스템이나 허브 와이파이 메시 ( mesh ),NA,NA,NA,NA
25628,25629,25629,0,허브,사용하기 쉬운 작동 방식으로 스마트홈의 허브 역할을 톡톡히 할 것으로 기대를,NA,NA,NA,NA
25629,25630,25630,0,허브,전문 블로거 세아향님은 LG 스마트씽큐 허브 리뷰를 통해 직접 언박싱 (,NA,NA,NA,NA
25630,25631,25631,0,허브,때 인공지능 스피커인 LG 스마트씽큐 허브 덕분에 음성으로 편하게 음악을 켜고,NA,NA,NA,NA
25631,25632,25632,0,허브,행복을 주는 똑똑한 LG 스마트씽큐 허브 파워블로거분들의 리뷰를 통해 알아보았는데 어떠셨나요,NA,NA,NA,NA
25632,25633,25633,0,허브,' 에서 출시한 ' 스마트씽큐 허브 ' 라는 인공지능 스피커를 통해서,NA,NA,NA,NA
25633,25634,25634,0,허브,' 스마트씽큐 허브 ' 같은 경우는 말 한마디로,NA,NA,NA,NA
25634,25635,25635,0,허브,사물인터넷 ( IoT ) 의 허브 ( Hub ) AI 스피커,NA,NA,NA,NA
25635,25636,25636,0,허브,사물인터넷 ( IoT ) 플랫폼의 허브 ( Hub ) 가 될,NA,NA,NA,NA
25636,25637,25637,0,허브,허브 상단 우측에 있는 볼륨 버튼,NA,NA,NA,NA
25637,25638,25638,0,허브,탑재한 AI 스피커 ' 씽큐 허브 ' 출시씽큐 허브는 LG 전자가,NA,NA,NA,NA
25638,25639,25639,0,허브,( IoT ) 을 제어하는 허브 디바이스 AI 스피커 음악 청취,NA,NA,NA,NA
25639,25640,25640,0,허브,시대에 이들을 연결해 제어까지 하는 허브 역할을 수행하기 때문입니다,NA,NA,NA,NA
25640,25641,25641,0,허브,허브 역할을 수행하기 때문입니다,NA,NA,NA,NA
25641,25642,25642,0,허브,LG 스마트홈 씽큐 허브 2,NA,NA,NA,NA
25642,25643,25643,0,허브,체험하게 된 LG 스마트 씽큐 허브 2,NA,NA,NA,NA
25643,25644,25644,0,허브,LG 스마트 씽큐 허브 2,NA,NA,NA,NA
25644,25645,25645,0,허브,^ ^ LG 스마트 씽큐 허브 2,NA,NA,NA,NA
25645,25646,25646,0,허브,켜고 스마트폰 와이파이를 켠후 씽큐 허브 본체 아랫부분에 버튼을 누르면 안내에,NA,NA,NA,NA
25646,25647,25647,0,허브,이번 LG 전자 스마트 씽큐 허브 2,NA,NA,NA,NA
25647,25648,25648,0,허브,우리집 스마트 씽큐 허브 2,NA,NA,NA,NA
25648,25649,25649,0,허브,ㅋㅋ LG 스마트 씽큐 허브 2,NA,NA,NA,NA
25649,25650,25650,0,허브,스마트씽큐 허브 덕분에 일상이 정말 편해졌답니다,NA,NA,NA,NA
25650,25651,25651,0,허브,애플의 Homekit 삼성의 스마트 허브 LG 의 스마트씽큐 허브가 있다,NA,NA,NA,NA
25651,25652,25652,0,허브,스마트씽큐 허브 LG 에서 내놓은 AI 스피커이다,NA,NA,NA,NA
25652,25653,25653,0,허브,바로 LG 씽큐 허브 제품입니다,NA,NA,NA,NA
25653,25654,25654,0,허브,제가 사용하고 있는 LG 씽큐 허브 제품에서 펌웨어 업데이트가 진행된 것을,NA,NA,NA,NA
25654,25655,25655,0,허브,이번 업데이트를 통해 씽큐 허브 제품에서 클로바 서비스를 사용할 수,NA,NA,NA,NA
25655,25656,25656,0,허브,이러한 부분에서 LG 씽큐 허브 모델이 가지는 특징이 있는데요,NA,NA,NA,NA
25656,25657,25657,0,허브,클로바 서비스가 업데이트된 LG 씽큐 허브 제품이 타 인공지능 스피커와 가지는,NA,NA,NA,NA
25657,25658,25658,0,허브,이번 업데이트를 통해서 홈 IoT 허브 기능과 함께 업그레이드된 인공지능 기능을,NA,NA,NA,NA
25658,25659,25659,0,허브,네이버의 협업으로 만들어진 LG 씽큐 허브 제품은 각자 아쉬움이었던 홈 IoT,NA,NA,NA,NA
25659,25660,25660,0,허브,모델들이 인공지능 스피커 ' 씽큐 허브 ' 를 비롯해 다양한 제품을,NA,NA,NA,NA
25660,25661,25661,0,허브,의 인공지능 스피커 스마트 씽큐 허브 또한 마찬가지라 그 특징이 확실합니다,NA,NA,NA,NA
25661,25662,25662,0,허브,LG 의 생활 가전과 연결되는 허브 역할을 한다는 것입니다,NA,NA,NA,NA
25662,25663,25663,0,허브,LG 씽큐 허브 본체에서 바로 업데이트를 해도 되며,NA,NA,NA,NA
25663,25664,25664,0,허브,스마트폰 상의 스마트씽큐 앱에서 스마트씽큐 허브 를 클릭하면 바로 네이버 클로바,NA,NA,NA,NA
25664,25665,25665,0,허브,( LG 씽큐 허브 본체의 알림이 사라진 분들은 저,NA,NA,NA,NA
25665,25666,25666,0,허브,) 과 각 가전제품으로 연결되는 허브 역할을 중심으로 본격적인 IOT 의,NA,NA,NA,NA
25666,25667,25667,0,허브,확인으로 업그레이드 된 LG 스마트씽큐 허브 앞으로 더 멋진 모습이 기대,NA,NA,NA,NA
25667,25668,25668,0,허브,개발한 음성인식 인공지능 플랫폼인 스마트씽큐 허브 역시 관심의 대상이었죠,NA,NA,NA,NA
25668,25669,25669,0,허브,따라 원하는 기능을 수행하는 가정용 허브 로봇,NA,NA,NA,NA
25669,25670,25670,0,허브,마지막으로 LG 스마트씽큐 허브 2,NA,NA,NA,NA
25670,25671,25671,0,허브,원통형 스피커 모양의 스마트 씽큐 허브 2,NA,NA,NA,NA
25671,25672,25672,0,허브,스마트 씽큐 허브 측면에 위치한볼륨 + - 버튼을,NA,NA,NA,NA
25672,25673,25673,0,허브,받기 위해 네이버 공식 깃 허브 주소로 이동합니다,NA,NA,NA,NA
25673,25674,25674,0,허브,있는 LG 스마트홈 IoT 스마트씽큐 허브,NA,NA,NA,NA
25675,25676,25676,0,허브,허브 ',NA,NA,NA,NA
25676,25677,25677,0,허브,허브 ' 와,NA,NA,NA,NA
25677,25678,25678,0,허브,가전제품을 제어할 수 있는 스마트 허브 ' 스마트씽큐 ' 에 클로바,NA,NA,NA,NA
25678,25679,25679,0,허브,칩을 쓰는 스마트 스피커 스마트홈 허브 로봇 등 하드웨어에서 클로바를 손쉽게,NA,NA,NA,NA
25679,25680,25680,0,허브,엘지에서 출시된 모델인 스마트 싱큐 허브 모델입니다,NA,NA,NA,NA
25680,25681,25681,0,허브,휘센 인공지능 에어컨 LG 씽큐 허브 스타벅스 기프티콘이 선물로 준비되어 있습니다,NA,NA,NA,NA
25681,25682,25682,0,허브,첫 번째는 ' 허브 ' 이다,NA,NA,NA,NA
25682,25683,25683,0,허브,삼성은 차세대 냉장고인 ' 패밀리 허브 ' 를 공개했다,NA,NA,NA,NA
25683,25684,25684,0,허브,그러나 패밀리 허브 냉장고 중 가장 저렴한 제품의,NA,NA,NA,NA
25684,25685,25685,0,허브,스마트 스피커 경쟁에서 밀렸을 때 허브 분야에서 어떤 상황이 벌어질 수,NA,NA,NA,NA
25685,25686,25686,0,허브,허브 역할을 자처한 네스트가 에코라는 허브,NA,NA,NA,NA
25686,25687,25687,0,허브,허브 역할을 자처한 네스트가 에코라는 허브 아래로 들어간 것이다,NA,NA,NA,NA
25687,25688,25688,0,허브,수 없기에 커넥트 홈도 결과적으로는 허브 역할에서 손을 떼야 할 가능성이,NA,NA,NA,NA
25688,25689,25689,0,허브,삼성은 허브 역할을 통해서 가전제품의 판매를 끌어올리려는,NA,NA,NA,NA
25689,25690,25690,0,허브,스피커는 지금까지 불투명할 뿐이었던 패밀리 허브 등의 시도와는 달리 플랫폼 서열을,NA,NA,NA,NA
25690,25691,25691,0,허브,중요한 건 경쟁사인 아마존이나 구글은 허브 역할에 참여하지 못하더라도 직접 가전제품을,NA,NA,NA,NA
25691,25692,25692,0,허브,밝기 조절 ) LG ThinQ 허브 : ThinQ 가 적용된 가전제품을,NA,NA,NA,NA
25692,25693,25693,0,허브,아마존 애플과 달리 가정집의 ' 허브 ' 를 냉장고로 잡은 듯,NA,NA,NA,NA
25693,25694,25694,0,허브,허브 ' 에,NA,NA,NA,NA
25694,25695,25695,0,허브,허브 ( ThinQ,NA,NA,NA,NA
25695,25696,25696,0,허브,허브 ' 는,NA,NA,NA,NA
25699,25700,25700,0,허브,허브 ' 에는,NA,NA,NA,NA
25701,25702,25702,0,허브,를 탑재한 인공지능스피커 ' 씽큐 허브 ( ThinQ Hub ) ',NA,NA,NA,NA
25702,25703,25703,0,허브,이에 따라 ' 씽큐 허브 ' 는 가전 모니터링 및,NA,NA,NA,NA
25703,25704,25704,0,허브,또 ' 씽큐 허브 ' 는 연동된 가전제품들을 관리할,NA,NA,NA,NA
25705,25706,25706,0,허브,허브 ' 를,NA,NA,NA,NA
25708,25709,25709,0,허브,허브 ' 가,NA,NA,NA,NA
25710,25711,25711,0,허브,에서 알렉사 탑재 ' 스마트씽큐 허브 ( SmartThinQ Hub ) ',NA,NA,NA,NA
25714,25715,25715,0,허브,AI ) 스피커 ' 씽큐 허브 ' 에게 명령하자 에어컨이 작동을,NA,NA,NA,NA
25715,25716,25716,0,허브,월 인공지능 스피커 ' 씽큐 허브 ' 를 시작으로 올해 상반기에만,NA,NA,NA,NA
25716,25717,25717,0,허브,ㆍLG 씽큐 허브 : LG 씽큐 허브는 가전,NA,NA,NA,NA
25717,25718,25718,0,허브,음성인식 허브 _ 가전을 스마트하게 제어 -,NA,NA,NA,NA
25718,25719,25719,0,허브,전자의 인공지능 스피커 ' 씽큐 허브 ( ThinQ Hub ) ',NA,NA,NA,NA
25719,25720,25720,0,허브,전자의 인공지능 스피커 ' 씽큐 허브 ' 를 통해 음성만으로도 간편하게,NA,NA,NA,NA
25720,25721,25721,0,허브,""" 라고 말하면 ' 씽큐 허브 ' 에 연결된 공기청정기가 작동하기",NA,NA,NA,NA
25721,25722,25722,0,허브,고객들은 또 ' 씽큐 허브 ' 를 통해 음악 교통,NA,NA,NA,NA
25722,25723,25723,0,허브,""" 라고 말하면 ' 씽큐 허브 ' 가 주변 맛집의 상호와",NA,NA,NA,NA
25723,25724,25724,0,허브,특히 ' 씽큐 허브 ' 는 냉장고 문이 열려있다고,NA,NA,NA,NA
25724,25725,25725,0,허브,LG 스마트 씽큐 허브 덕분에 스파게티 면도 아주 잘,NA,NA,NA,NA
25725,25726,25726,0,허브,작년 초 인공지능 스피커 스마트씽큐 허브 ( SmartThinQ Hub ) 2,NA,NA,NA,NA
25726,25727,25727,0,허브,제품들의 상태를 확인할 수 있는 허브 역할을 하게 됩니다,NA,NA,NA,NA
25727,25728,25728,0,허브,작은 소녀와 LG 허브 로봇 입니다,NA,NA,NA,NA
25728,25729,25729,0,허브,LG 허브 로봇 입니다,NA,NA,NA,NA
25729,25730,25730,0,허브,가족들은 허브 로봇을 통해 각종 정보를 얻고,NA,NA,NA,NA
25730,25731,25731,0,허브,소녀는 허브 로봇과 장난을 치며 놀기도 하고,NA,NA,NA,NA
25731,25732,25732,0,허브,이를 테면 허브 로봇에게 이야기를 해서 오빠가 샤워하고,NA,NA,NA,NA
25732,25733,25733,0,허브,허브 로봇과 형태는 다르지만 이 동그란,NA,NA,NA,NA
25733,25734,25734,0,허브,' 스마트씽큐 허브 2,NA,NA,NA,NA
25734,25735,25735,0,허브,전자가 지난해 선보인 ' 스마트씽큐 허브 ' 의 2 세대 제품입니다,NA,NA,NA,NA
25735,25736,25736,0,허브,보다 발전된 형태의 스마트씽큐 허브 2,NA,NA,NA,NA
25736,25737,25737,0,허브,LG 스마트홈의 중심이 되는 허브 로봇이나 스마트씽큐 허브 2,NA,NA,NA,NA
25737,25738,25738,0,허브,중심이 되는 허브 로봇이나 스마트씽큐 허브 2,NA,NA,NA,NA
25739,25740,25740,0,허브,야심차게 준비한 인공지능 스피커 스마트씽큐 허브 2,NA,NA,NA,NA
25740,25741,25741,0,허브,LG 씽큐 허브,NA,NA,NA,NA
25741,25742,25742,0,허브,편리하게 스마트홈을 실현해주는 LG 스마트씽큐 허브,NA,NA,NA,NA
25742,25743,25743,0,허브,) 스피커 ' LG 스마트씽큐 허브 ' 입니다,NA,NA,NA,NA
25743,25744,25744,0,허브,스마트씽큐 허브 ( 일반형 ) 과 스마트씽큐,NA,NA,NA,NA
25744,25745,25745,0,허브,( 일반형 ) 과 스마트씽큐 허브 ( 스피커형 ) 입니다,NA,NA,NA,NA
25745,25746,25746,0,허브,제가 이번에 리뷰한 제품은 스마트씽큐 허브 ( 스피커형 ) 로 2017,NA,NA,NA,NA
25747,25748,25748,0,허브,일단 스마트씽큐 허브 2,NA,NA,NA,NA
25748,25749,25749,0,허브,그럼 본격적으로 스마트씽큐 허브 2,NA,NA,NA,NA
25749,25750,25750,0,허브,이 중에서 Smart ThinQ 허브 ( 스피커형 ) 을 선택하시면,NA,NA,NA,NA
25750,25751,25751,0,허브,와이파이 기능을 켜 놓고 스마트씽큐 허브 2,NA,NA,NA,NA
25751,25752,25752,0,허브,켜 놓고 스마트씽큐 허브 2,NA,NA,NA,NA
25752,25753,25753,0,허브,그 전에 먼저 LG 스마트씽큐 허브 제품 광고 영상을 보시면 홈,NA,NA,NA,NA
25753,25754,25754,0,허브,허브 설치앱 설치 후 제품등록을 통해허브를,NA,NA,NA,NA
25754,25755,25755,0,허브,뜬다면 업데이트를해야 진행됨 ) 스마트씽큐 허브 아래는 U + 홈 IoT,NA,NA,NA,NA
25755,25756,25756,0,허브,2016 에서 알렉사를 탑재한 스마트씽크 허브 CES 2017 에서 스마트 냉장고,NA,NA,NA,NA
25756,25757,25757,0,허브,2017 에서 스마트 냉장고 가정용 허브 로봇 등을 공개하며 예고되었던 부분인데요,NA,NA,NA,NA
25757,25758,25758,0,허브,월에 선보인 인공지능 스피커 스마트씽큐 허브 ( SmartThinQ Hub ) 2,NA,NA,NA,NA
25758,25759,25759,0,허브,블루투스를 통해 스마트씽큐 허브 ( SmartThinQ Hub ) 2,NA,NA,NA,NA
25759,25760,25760,0,허브,음악을 재생하고 뉴스를 들려주며 스마트홈의 허브 기능을 담당하면서 집안 내 각종,NA,NA,NA,NA
25760,25761,25761,0,허브,' 스마트홈의 허브 ' 와 휴머노이드 로봇의 대중화가,NA,NA,NA,NA
