,Unnamed: 0,X,category,key,sentences,senti,score1,score2,score3
60249,60250,60250,1,스피커,저는 실제 구매가로 네이버 인공지능 스피커 프렌즈를 산 것은 아니고기존 엠넷에,부정,100,-0.049862565211925,-0.78282167567882
60250,60251,60251,1,스피커,네이버 인공지능 스피커 프렌즈를 받아 본 후 이렇게,중립,100,0,0
60251,60252,60252,1,스피커,어려웠다고 들었는데이에 반해 네이버 인공지능 스피커 프렌즈는 휴대성이 높았습니다,부정,100,-0.031513753758369,-0.48609420854037
60252,60253,60253,1,스피커,넘나 좋아하기에 4 점네이버 인공지능 스피커 프렌즈 말고웨이브를 사용한 적이 없어,부정,66.336633663366,-0.021962751118027,-0.23313393153872
60253,60254,60254,1,스피커,네이버에서 두 번째로 출시한 인공지능 스피커 프렌즈입니다,중립,100,0,0
60254,60255,60255,1,스피커,블루투스 스피커 측정을 위한 구성입니다,중립,100,0,0
60255,60256,60256,1,스피커,스피커 정면에서 측정한 데이터입니다,중립,100,0,0
60256,60257,60257,1,스피커,인공지능 스피커 중 가장 좋은 성능을 보인,중립,100,0,0
60257,60258,60258,1,스피커,네이버에서 두 번째로 출시한 인공지능 스피커 프렌즈의 스피커 성능을 테스트해봤습니다,중립,100,0,0
60258,60259,60259,1,스피커,번째로 출시한 인공지능 스피커 프렌즈의 스피커 성능을 테스트해봤습니다,중립,100,0,0
60259,60260,60260,1,스피커,또한 중간 생산처가 스피커 생산에 대한 노하우보다,중립,100,0,0
60260,60261,60261,1,스피커,년 이용권 구매 시 인공지능 스피커 WAVE 를 파격 할인가로 구매하실,중립,100,0,0
60261,60262,60262,1,스피커,나온 skt 누구가 나온 ai 스피커 시장을 판도를 바꿔었는데그이후 카카오미니누구누구 mini,중립,100,0,0
60268,60269,60269,1,스피커,네이버가 클로바를 탑재한 스마트 스피커 ' 웨이브 ( WAVE ),긍정,100,0.14857098477788,1.4137931034483
60271,60272,60272,1,스피커,3 시에오픈한 네이버 웨이브 인공지능 스피커 신작클로바 ' 프렌즈 ' 구매,중립,100,0,0
60272,60273,60273,1,스피커,기존 인공지능 스피커 모델과 달라진 점이 있다면크기가 매우,중립,100,0,0
60274,60275,60275,1,스피커,ㅎㅎ 네이버 인공지능 스피커 웨이브를 사용한지 한달이 다 되어가는,중립,100,0,0
60275,60276,60276,1,스피커,다 비슷할 거라는 생각에 단순히 스피커 출력으로 결정,중립,100,0,0
60276,60277,60277,1,스피커,스피커보다 네이버 웨이브가 더 큰 스피커 출력을 가지고 있더라구요,중립,100,0,0
60277,60278,60278,1,스피커,앞에도 말했듯 스피커 성능이 맘에 들어요,중립,100,0,0
60279,60280,60280,1,스피커,네이버 AI 스마트 스피커 웨이브 ( Wave ) 라인프렌즈,중립,100,0,0
60280,60281,60281,1,스피커,이런 AI 스마트 스피커 제품은 사용할 수록 정확도와 기능,중립,100,0,0
60281,60282,60282,1,스피커,웨이브 ( Wave ) 스마트 스피커 제품 박스 구성은 꽤 디자인이,중립,100,0,0
60282,60283,60283,1,스피커,스피커 사용기음,중립,100,0,0
60286,60287,60287,1,스피커,네이버 웨이브 인공지능 스피커이상 인공지능 스피커 후기 였습니다,긍정,100,0.035757575757576,0.85542168674699
60288,60289,60289,1,스피커,학기 조별과제로 진행한네이버 < 인공지능 스피커 웨이브 > ppt 를 공유합니다,중립,100,0,0
60289,60290,60290,1,스피커,웨이브 스피커 모형을 그대로 사용하시면 됩니다,중립,100,0,0
60290,60291,60291,1,스피커,네이버 ppt < 인공지능 스피커 웨이브 > 다운로드 받아주세요,중립,100,0,0
60291,60292,60292,1,스피커,스피커를 만나보세요,중립,100,0,0
60292,60293,60293,1,스피커,^ ^ 사실 네이버 인공지능 스피커 이전에웨이브라고 있었는데요,중립,100,0,0
60293,60294,60294,1,스피커,동영상네이버 웨이브 인공지능 스피커 생생리뷰 ( NAVER WAVE Ai,중립,100,0,0
60294,60295,60295,1,스피커,추천드립니다 현재 국내에서 나온 Ai 스피커 중에서 가장 고급스럽고 깔끔한 것,중립,100,0,0
60296,60297,60297,1,스피커,be 동영상네이버 웨이브 인공지능 스피커 생생리뷰 ( NAVER WAVE Ai,중립,100,0,0
60298,60299,60299,1,스피커,be 동영상 네이버 웨이브 인공지능 스피커 생생리뷰 ( NAVER WAVE Ai,중립,100,0,0
60299,60300,60300,1,스피커,be 네이버 웨이브 인공지능 스피커 생생리뷰 ( NAVER WAVE Ai,중립,100,0,0
60301,60302,60302,1,스피커,네이버 인공지능 스피커 프렌즈가 드디어 출시 되었네요,중립,100,0,0
60302,60303,60303,1,스피커,인공지능 스피커 프렌즈는,중립,100,0,0
60303,60304,60304,1,스피커,세련된 멋만 추구했다면네이버 클로바 AI 스피커 프렌즈는 ' 귀여움 ' 까지,긍정,100,0.16612195275988,1.1921906693712
60304,60305,60305,1,스피커,기존 네이버 스피커 ' 웨이브 ' 는 5000mAh,중립,100,0,0
60305,60306,60306,1,스피커,하지만 네이버 클로바 AI 스피커 프렌즈는 300g 대의 가벼운 무게를,중립,100,0,0
60307,60308,60308,1,스피커,더 똘똘한 모습을 보여주고 있지만인공지능 스피커 프렌즈는 오로지 ' 말 ',중립,100,0,0
60308,60309,60309,1,스피커,일 네이버 인공지능 스피커 프렌즈와 놀 수 있었어요,중립,100,0,0
60309,60310,60310,1,스피커,그래서 인공지능 스피커 프렌즈를 사용해보기 전에는 ' 에이,중립,100,0,0
60312,60313,60313,1,스피커,네이버 인공지능 스피커 웨이브 Wave 더 나아지지 못하는,중립,100,0,0
60313,60314,60314,1,스피커,구입 동기 초창기 스피커 출시 이벤트로 99000 원에서 스피커와,중립,100,0,0
60314,60315,60315,1,스피커,카카오미니 ' 나 ' 네이버 스피커 프렌즈 ' 와 달리 전형적인,중립,100,0,0
60315,60316,60316,1,스피커,기능상 아쉬운 점 * 스피커 블루투스 아웃 기능 부재 *,부정,100,-0.0625,-0.875
60316,60317,60317,1,스피커,블루투스를 지원하면서도 외부 입력만 지원하는 스피커,긍정,100,0.15778251599147,2
60317,60318,60318,1,스피커,제품들 예를 들어 아마존 인공지능 스피커 에코도 지원하고 있고 나중에 출시한,긍정,100,0.075148038343503,0.87403691316735
60318,60319,60319,1,스피커,현재 사용하는 캔스톤 R25 북쉘프 스피커 ( 25W ) 와 달리,중립,100,0,0
60319,60320,60320,1,스피커,문제는 잘못알아들은 명령어를 사용자와 스피커 사이에서 피드백할 기회가 없음,긍정,67.056245434624,0.091745556220515,0.39535415198965
60321,60322,60322,1,스피커,나오는 것 중 네이버 인공지능 스피커 사용법 대해서 알아봤어요 네이버 인공지능,중립,100,0,0
60323,60324,60324,1,스피커,음악인데 1 년 무제한 감상권에 스피커 포함 9 만원이면 나쁘지 않다는,부정,100,-0.11367210644073,-0.72396603193925
60324,60325,60325,1,스피커,스피커 사양은 아래와 같고 좀 더,중립,100,0,0
60325,60326,60326,1,스피커,스피커 충전기 설명서 구성은 간단,중립,100,0,0
60326,60327,60327,1,스피커,우선 음악을 재생한 결과 스피커 소리는 매우 만족스러웠고 음성인식 또한,중립,100,0,0
60327,60328,60328,1,스피커,네이버 인공지능 스피커 - 웨이브 WAVE 사용후기인공지능 스피커가,중립,100,0,0
60328,60329,60329,1,스피커,현재까지 국내에 나온 인공지능 스피커 중에는 번역기능을 가진 것이 없었습니다,부정,100,0.023743191296543,-0.07028532435099
60329,60330,60330,1,스피커,스피커 답게 디자인은 단순합니다,중립,100,0,0
60330,60331,60331,1,스피커,10W 의 강력한 스피커로 인공지능 스피커 중에서는 좋은 편이라고 보인다,긍정,100,0.1119257086999,1.2311827956989
60331,60332,60332,1,스피커,스피커 구멍 아래에는 전원을 연결할 수,중립,100,0,0
60332,60333,60333,1,스피커,또한 프렌즈 스피커 출시일에 맞춰 네이버 뮤직 무제한,긍정,100,0.077083333333333,1
60333,60334,60334,1,스피커,의 NUGU 와 기가지니로 인공지능 스피커 시장이 열려져 있어서인지 일본시장을 먼저,중립,100,0,0
60334,60335,60335,1,스피커,음악을 듣기 위한 스피커 용도만으로도 제값은 하지 않나 싶네요,부정,100,-0.034244685487726,-0.56903945111492
60335,60336,60336,1,스피커,' 가격으로 제공된 네이버의 AI 스피커 네이버 웨이브 ( WAVE ),중립,100,0,0
60336,60337,60337,1,스피커,WAVE ) with Clova360 도 스피커 2 개의,중립,100,0,0
60338,60339,60339,1,스피커,스피커 외형은 크게 할 얘기가 없다,부정,100,-0.075619295958279,-0.7333000997009
60339,60340,60340,1,스피커,재질의 마감재가 둘러진 원뿔형 모양의 스피커,중립,100,0,0
60340,60341,60341,1,스피커,스피커 후면에는 마이크 On / Off,중립,100,0,0
60341,60342,60342,1,스피커,하는 카테고리부터 거창한 ' AI 스피커 ' 이다,중립,100,0,0
60343,60344,60344,1,스피커,WAVE 를 소개합니다 네이버의 인공지능 스피커 웨이브는스마트폰에 클로바 ( CLOVA ),중립,100,0,0
60344,60345,60345,1,스피커,아래 사진 처럼이런 느낌입니다 인공지능 스피커 웨이브는먼저 이름을 불러주고 사용자가 원하는,중립,100,0,0
60345,60346,60346,1,스피커,사용자가 원하는 대화가 가능합니다가장 기본적인 스피커 이름은샐리야 라고 부르고 시작 합니다,긍정,100,0.1788328434209,1.3164821468676
60346,60347,60347,1,스피커,네이버 AI 스피커 - 클로바 ㅡ 네이버 AI,중립,100,0,0
60347,60348,60348,1,스피커,- 클로바 ㅡ 네이버 AI 스피커 웨이브에 이어 클로바 출시 소식,중립,100,0,0
60348,60349,60349,1,스피커,이번엔 아에 스피커 형태에 캐릭터를 입혀서 나왔네요,중립,100,0,0
60349,60350,60350,1,스피커,보기만 해도 캐릭터라 귀엽기까지 해서 스피커 느낌이 나지 않네요,중립,100,0.077582250509934,0.18064516129032
60350,60351,60351,1,스피커,네이버 AI 스피커 클로바는 한손 크기의 프렌즈로 언제,중립,100,0,0
60351,60352,60352,1,스피커,AI 스피커 시장이 핫하기에 미리 선점하기 위해,중립,100,0,0
60352,60353,60353,1,스피커,네이버 AI 스피커 클로바에는 블루투스 기능도 연결이 가능해,긍정,100,0.15255297521307,1.4137931034483
60353,60354,60354,1,스피커,네이버 AI 스피커 클로바 아직 출시 일정은 나오지,중립,100,0,0
60354,60355,60355,1,스피커,웨이브도 좋지만 캐릭터로 된 AI 스피커 어떠신가요,긍정,100,0.1832773422919,1.2829413960433
60355,60356,60356,1,스피커,마넌인가 15 마넌 됐었삼사버린 인공지능 스피커 WAVE 샐리,부정,100,-0.058490566037736,-1
60357,60358,60358,1,스피커,인공지능 스피커 가격이 오만구천원,중립,100,0,0
60358,60359,60359,1,스피커,무엇보다 스피커 음질이 좋습미다 T-T,중립,100,0.004746835443038,0
60363,60364,60364,1,스피커,15 마넌 됐었삼 사버린 인공지능 스피커 WAVE 샐리,부정,100,-0.058490566037736,-1
60366,60367,60367,1,스피커,때 자장가 선곡도 너무좋고 무엇보다 스피커 음질이 좋습미다 T-T,긍정,66.666666666667,0.066196563746584,0.41129032258065
60367,60368,60368,1,스피커,꽤나 좋은 평가를 받고있는 스마트 스피커 네이버 웨이브에 이어 다방면으로 사업을,긍정,100,0.12177929022849,1.3395721925134
60368,60369,60369,1,스피커,년후 매월 자동결제 ) + 스피커 40000 원으로 총 130000 원에,중립,100,0,0
60371,60372,60372,1,스피커,인공지능 스피커 비교 ① SKT 의,중립,100,0,0
60378,60379,60379,1,스피커,근래 출시된 인공지능 스피커 중에 가장 핫한 디자인으로 꼽히는,중립,100,0,0
60379,60380,60380,1,스피커,ㅋㅋ ) 보시다시피 인공지능 스피커 프렌즈에는 ' 디스플레이 ' 가,중립,100,0,0
60380,60381,60381,1,스피커,저희 집에서는 인공지능 스피커 프렌즈 클로바 외에 웨이브도 사용하고,중립,100,0,0
60381,60382,60382,1,스피커,네이버 인공지능 스피커 프렌즈와 웨이브의 크기 차이는 이렇습니다,중립,100,0,0
60382,60383,60383,1,스피커,늘씬한 프렌즈 스피커 옆에 있으니 웨이브의 덩치가 둔탁해,중립,100,0,0
60383,60384,60384,1,스피커,무게에 있어서도 인공지능 스피커 프렌즈는,중립,100,0,0
60384,60385,60385,1,스피커,인공지능 스피커 플렌즈 클로바를,긍정,100,0.21396766224352,1.5090311986864
60385,60386,60386,1,스피커,의문은 저 역시도 가지고 있었지만인공지능 스피커 프렌즈를 직접 사용해보고 나니 ',중립,100,0,0
60386,60387,60387,1,스피커,프렌즈를 직접 사용해보고 나니 ' 스피커 ' 라는 것만 같을 뿐,중립,100,0,0
60387,60388,60388,1,스피커,실제로 제가 프렌즈 스피커 클로바를 만난 뒤로도중요한 기능들이 몇,긍정,100,0.092637066774998,1.3368700265252
60388,60389,60389,1,스피커,알려주는 클로버 얼마전 네이버뮤직에서이벤트로 인공지능 스피커 프렌즈를선물로 준다고 해서가입을 하고 선물로,긍정,100,0.16390201856351,1.7109941944848
60389,60390,60390,1,스피커,말을 해야 하지만 ㅎㅎㅎ 인공지능 스피커,중립,100,0,0
60390,60391,60391,1,스피커,덕분에우리집에 노래가 끊이질 않고 인공지능 스피커 라인프렌즈의귀염둥이 곰돌이 브라운의뒷부분에 볼륨조절 하는,중립,100,0,0
60391,60392,60392,1,스피커,바닥면에는전원버튼이 있어조작하기도 무척 쉬웠다봐도봐도 신기한인공지능 스피커 프렌즈클로버이게 정말 현실에서 가능하구나이제 인공지능,중립,100,0,0
60392,60393,60393,1,스피커,프렌즈클로버이게 정말 현실에서 가능하구나이제 인공지능 스피커 프렌즈는우리집에 온 새 식구이자우리집 똑똑한,중립,100,0,0
60393,60394,60394,1,스피커,두 회사의 기술을 담는 그릇이 스피커 형태의 AI 비서일 수도 있지만,중립,100,0,0
60398,60399,60399,1,스피커,8 월쯤에는 인공지능 스피커 ' 웨이브 ( Wave ),중립,100,0,0
60399,60400,60400,1,스피커,시작으로 최근 두 달간 인공지능 스피커 ' 웨이브 ' 차량용 인공지능,중립,100,0,0
60400,60401,60401,1,스피커,웨이브는 미국 아마존의 AI 스피커 ' 에코 ' 처럼 이용자의,중립,100,0,0
60401,60402,60402,1,스피커,소프트웨어를 개발하고 이를 활용해 인공지능 스피커 등 각종 신규 서비스를 선보일,중립,100,0,0
60402,60403,60403,1,스피커,v / 20170322121605819 한국의 AI 스피커 경쟁 SK 텔레콤 누가 KT,중립,100,0,0
60403,60404,60404,1,스피커,) 를 예정으로 국내 AI 스피커 경쟁이 진행될 예정,중립,100,0,0
60404,60405,60405,1,스피커,v / 20170323105411673 한국의 AI 스피커 경쟁 SK 텔레콤 누가 KT,중립,100,0,0
60405,60406,60406,1,스피커,) 를 예정으로 국내 AI 스피커 경쟁이 진행될 예정 당신의 집에는,중립,100,0,0
60406,60407,60407,1,스피커,탑재된 네이버 x 라인의 스마트 스피커,중립,100,0,0
60407,60408,60408,1,스피커,스마트 스피커,중립,100,0,0
60408,60409,60409,1,스피커,화면이 있는 스마트 스피커,중립,100,0,0
60409,60410,60410,1,스피커,스피커 아랫쪽의 작은 박스와 처음 시작을,긍정,100,0.085123784261715,0.95689655172414
60410,60411,60411,1,스피커,좀 더 세심한 느낌의 스마트 스피커,중립,100,0,0
60411,60412,60412,1,스피커,제법 들을만한 스피커,중립,100,0,0
60412,60413,60413,1,스피커,들을만한 스피커 그렇다고 보스급은 아님,부정,100,-0.20490051584377,-0.90434782608696
60413,60414,60414,1,스피커,비밀리에 Ai 스피커 비밀 테스트한 개를 준비중인 것이있어서,중립,100,0,0
60414,60415,60415,1,스피커,스피커 ' 사용안내 ' 메뉴 위치,중립,100,0,0
60415,60416,60416,1,스피커,국내 인공지능 ( AI ) 스피커 시장 경쟁에 인터넷 기업 네이버와,중립,100,0,0
60416,60417,60417,1,스피커,■ 네이버 AI 스피커 ' 웨이브 ' 日 선출시,중립,100,0,0
60417,60418,60418,1,스피커,월 14 일부터 일본에 AI 스피커 ' 웨이브 ' 를 선보였다,중립,100,0,0
60418,60419,60419,1,스피커,· 4 분기 중으로 AI 스피커 ' 카카오 미니 ' 를,중립,100,0,0
60427,60428,60428,1,스피커,1030g 스피커,NA,NA,NA,NA
60431,60432,60432,1,스피커,' 인공지능 ( AI ) 스피커 ' 경쟁이 달아오르고 있다,중립,100,0,0
60432,60433,60433,1,스피커,스피커 ' 누구 ' 를 출시하며,중립,100,0,0
60433,60434,60434,1,스피커,스피커 겸 인터넷 TV ( IPTV,중립,100,0,0
60434,60435,60435,1,스피커,스피커 개발을 서두르고 있어 국내,중립,100,0,0
60435,60436,60436,1,스피커,스피커 경쟁은 5 파전으로 확대될 전망이다,중립,100,0,0
60436,60437,60437,1,스피커,기술을 담은 스피커 ' 웨이브 ' 를 개발해,중립,100,0,0
60437,60438,60438,1,스피커,스피커 웨이브는 외부 협력사에 생산을 맡길,중립,100,0,0
60438,60439,60439,1,스피커,스피커 발표 AI,중립,100,0,0
60439,60440,60440,1,스피커,기술인 코타나를 기반으로 한 스마트 스피커 ' 인보크 ' 를 미국에서,중립,100,0,0
60440,60441,60441,1,스피커,스피커 시장은 아마존의 에코 알파벳 (,중립,100,0,0
60441,60442,60442,1,스피커,스피커 전쟁은 결국,부정,100,-0.28992106860959,-1.129022465088
60442,60443,60443,1,스피커,"선점 경쟁 "" 이라며 "" 스피커 시장을 놓고 업체 간 경쟁이",중립,100,0,0
60467,60468,60468,1,스피커,클로바 ' 를 적용한 AI 스피커 웨이브 · 프렌즈 이미지 인식,중립,100,0,0
60468,60469,60469,1,스피커,ㅋㅋ 치열한 AI 스피커 경쟁속에 나의 선택은 네이버 웨이브,중립,100,0,0
60469,60470,60470,1,스피커,웨이브 스피커 정가로 사면 노래가 1 년,중립,100,0,0
60470,60471,60471,1,스피커,암튼 생각보다 편리하고 재미난 AI 스피커,긍정,100,0.30907664992364,1.0340909090909
60471,60472,60472,1,스피커,확대 보기 확대 보기 블루투스 스피커 사운드드럼 와이드 ( BTS-D5W ),중립,100,0,0
60472,60473,60473,1,스피커,nhn 네이버의 인공지능 스피커 웨이브가 출시되기전 네이버 뮤직에서 무제한,중립,100,0,0
60473,60474,60474,1,스피커,사진보다는 실물이 나은 스피커 입니다,중립,100,0,0
60474,60475,60475,1,스피커,AI 인공지능 스피커 요즘 정말 핫한 제품인데요,중립,100,0,0
60475,60476,60476,1,스피커,네이버 웨이브 스피커 프렌즈 혜택이 좋은만큼빠르게 판매가되어 소진,긍정,100,0.13598901098901,1.3598901098901
60476,60477,60477,1,스피커,인공지능 스피커 네이버 웨이브 프렌즈는브라운과 샐리 2,중립,100,0,0
60477,60478,60478,1,스피커,음성이나 버튼으로 블루투스 연결이 가능하며홈 스피커 카 오디오와 연동하여 음악을 재생할,긍정,100,0.10088323065075,1.2514150943396
60478,60479,60479,1,스피커,일에 네이버에서 얼마전 출시한 인공지능 스피커 웨이브를 친구한테 선물받았습니다,긍정,100,0.13731255835318,1.2454439775701
60479,60480,60480,1,스피커,단순히 블루투스 스피커 역할뿐 아니라 지능이 있다는군요,부정,100,-0.13402385436284,-0.88888888888889
60480,60481,60481,1,스피커,사실은 포터블 스피커 기능도 제대로 작동시키기 어렵습니다,부정,100,-0.10656775656776,-1.0234987234987
60481,60482,60482,1,스피커,성공해야 다음 기능으로 넘어가 블루투스 스피커 연결도 하고 할텐데,긍정,100,0.15328676273377,1.1087216248507
60482,60483,60483,1,스피커,스피커입니다,NA,NA,NA,NA
60483,60484,60484,1,스피커,을 인수한 카카오 역시 AI 스피커 ' 카카오 미니 ' 를,중립,100,0,0
60484,60485,60485,1,스피커,X 지니뮤직 KT 는 AI 스피커 ' 기가지니 ' 를 개발해,중립,100,0,0
60485,60486,60486,1,스피커,네이버뮤직네이버는 자사의 네이버뮤직 서비스를 AI 스피커 ' 웨이브 ' 와 연동시켰습니다,중립,100,0,0
60486,60487,60487,1,스피커,AI 스피커 기술은 아직 초기 단계로 실제,중립,100,0,0
60487,60488,60488,1,스피커,네이버 AI 스피커 ' 웨이브 ' 일본서 10,중립,100,0,0
60488,60489,60489,1,스피커,( Clova ) 를 탑재한 스피커 ' 웨이브 ' 의 사전,중립,100,0,0
60490,60491,60491,1,스피커,우연히 카카오 프렌즈에서 나온 인공지능 스피커 사전예약 프로모션을 보게되었다,중립,100,0,0
60491,60492,60492,1,스피커,사무실에서 AI 스피커 등을 통해 노래를 듣는 용도로,중립,100,0,0
60492,60493,60493,1,스피커,간 AI ( 인공지능 ) 스피커 경쟁이 펼쳐진다,중립,100,0,0
60493,60494,60494,1,스피커,물리적으로는 스피커 출력과 무게 면에서 차이를 보인다,중립,100,0,0
60494,60495,60495,1,스피커,쇼핑 검색 스피커 등 자사의 다양한 사업 분야에,중립,100,0,0
60495,60496,60496,1,스피커,네이버는 오는 하반기에 AI 스피커 야심작인 ' 웨이브 ' 를,중립,100,0,0
60496,60497,60497,1,스피커,[ 네이버 프렌즈 인공지능 스피커 ] 얘 이름은 클로버,중립,100,0,0
60497,60498,60498,1,스피커,데리고 들어오심 [ 네이버 웨이브 스피커 ] 얘 이름은 쌜리,중립,100,0,0
60498,60499,60499,1,스피커,[ 네이버 AI 인공지능 스피커 - 웨이브 ] 네이버 뮤직을,중립,100,0,0
60499,60500,60500,1,스피커,하부에 간접조명이 있어서 밤에도 은은하니 스피커 + 조명의 조합으로도좋을듯 합니다,긍정,100,0.11416921508665,1.0275229357798
60500,60501,60501,1,스피커,스피커 근처에서 샐리라고 외치면주황색 불이,중립,100,0,0
60501,60502,60502,1,스피커,그렇지만 저 스피커 값이 12 만원 상당의 것을로,중립,100,0,0
60502,60503,60503,1,스피커,인공지능 스피커 ㅎㅎ 구성은 설명서 본품 충전기,중립,100,0,0
60503,60504,60504,1,스피커,오늘은 네이버 인공지능 스피커 프렌즈 후기를 들고 왔습니다,중립,100,0,0
60504,60505,60505,1,스피커,로 많이 불리는데요저는 귀여운 인공지능 스피커 프렌즈 브라운으로 선택했습니다,긍정,100,0.093258202413132,1.0615545122587
60505,60506,60506,1,스피커,원래 스피커 가격이 129000 원인데지금은 네이버 뮤직,중립,100,0,0
60506,60507,60507,1,스피커,) 그럼 본격적으로 네이버 인공지는 스피커 프렌즈 후기를 써보도록 하겠습니다,긍정,100,0.1022633744856,1.1203703703704
60507,60508,60508,1,스피커,네이버 인공지능 스피커 프렌즈 브라운 후기진짜 너무 귀엽게,긍정,100,0.13642857142857,1.4
60509,60510,60510,1,스피커,삶의 질을 높여주는 인공지능 스피커,긍정,100,0.095238095238095,1
60510,60511,60511,1,스피커,nhn 네이버 뮤직 X 프렌즈 스피커 특별 패키지프렌즈 스피커 최대 61,중립,100,0,0
60511,60512,60512,1,스피커,X 프렌즈 스피커 특별 패키지프렌즈 스피커 최대 61 % 특별 할인가로,중립,100,0,0
60522,60523,60523,1,스피커,많이 불리는데요 저는 귀여운 인공지능 스피커 프렌즈 브라운으로 선택했습니다,중립,100,0,0
60523,60524,60524,1,스피커,원래 스피커 가격이 129000 원인데 지금은 네이버,중립,100,0,0
60525,60526,60526,1,스피커,네이버 인공지능 스피커 프렌즈 브라운 후기 진짜 너무,중립,100,0,0
60528,60529,60529,1,스피커,) 삶의 질을 높여주는 인공지능 스피커,긍정,100,0.095238095238095,1
60531,60532,60532,1,스피커,com 네이버 뮤직 X 프렌즈 스피커 특별 패키지프렌즈 스피커 최대 61,긍정,100,0.11799390915571,0.97916666666667
60537,60538,60538,1,스피커,com 네이버 뮤직 X 프렌즈 스피커 특별 패키지 프렌즈 스피커 최대,긍정,100,0.11799390915571,0.97916666666667
60538,60539,60539,1,스피커,프렌즈 스피커 특별 패키지 프렌즈 스피커 최대 61 % 특별 할인가로,긍정,100,0.26263402821049,1.733534241789
60539,60540,60540,1,스피커,네이버 스피커 ( 브라운 ) 구매후기 +,중립,100,0,0
60542,60543,60543,1,스피커,가진 컴팩트한 크기의 클로버 인공지능 스피커 프렌즈 Clova AI Speaker Friends,중립,100,0,0
60543,60544,60544,1,스피커,많은 분들이 그동안 클로바 인공지능 스피커 Friends 를 기다려왔고 어떤 제품인지에,긍정,100,0.083064789392678,1.6613564562748
60544,60545,60545,1,스피커,기본에 충실한 스피커 단순히 밖으로 보이는 디자인에만 치중한,중립,100,0,0
60545,60546,60546,1,스피커,이렇게 지금까지 클로바 인공지능 스피커 프렌즈 Clova AI Speaker Friends,중립,100,0,0
60547,60548,60548,1,스피커,뒤처진다 ) 타 사이 인공지능 스피커 중 최고 사운드 ^ ^,긍정,100,0.12054485953504,1.1030855539972
60548,60549,60549,1,스피커,스피커 분석 - 두 제품 모두,중립,100,0,0
60549,60550,60550,1,스피커,- 두 제품 모두 본질이 스피커 인만큼 음질도 매우 중요하겠죠,긍정,100,0.10931550301481,1.17738791423
60550,60551,60551,1,스피커,이번 리뷰는 다른 플렛폼의 AI 스피커 비교는 많았으나 네이버의 AI 스피커,긍정,100,0.041576605212969,0.87272727272727
