,Unnamed: 0,X,category,key,sentences,senti,score1,score2,score3
77501,77502,77502,7,경우,언론사의 정보가 제공된다고해요 제휴 방송사의 경우 음성 콘텐츠가 스피커를 통해 나오고,중립,100,0,0
77502,77503,77503,7,경우,매우 중요한 부분이어서 초기 제품의 경우 성능보다 출시에 그 목적을 많이,중립,100,0,0
77503,77504,77504,7,경우,HDMI 로 연결이 되어져 있는 경우 모델에 따라 다르지만 TV 만,중립,100,0,0
77504,77505,77505,7,경우,경우,NA,NA,NA,NA
77506,77507,77507,7,경우,저 같은 경우 3 개의 조명을 형광색 가장,중립,100,0,0
77507,77508,77508,7,경우,특징으로는음성으로 명령을 내려 제어가 가능하고배터리의 경우 최대 5 시간 사용이 가능합니다,긍정,100,0.21508423097713,1.5713579442774
77508,77509,77509,7,경우,발생할 때 상용 제품을 쓸 경우 제공 업체가 제시하는 로드맵이 ㅣㅇㅆ,중립,100,0,0
77509,77510,77510,7,경우,전반적으로 인간의 음성을 이해하지 못할 경우 ' 모른다 ' 는 답변을,부정,50.152954435679,0.088789386401327,0.35592384519351
77510,77511,77511,7,경우,AI 가 지속적으로 알아듣지 못할 경우,긍정,100,0.13018867924528,1.1509433962264
77511,77512,77512,7,경우,기능적으로 다른 점은 카카오의 경우 ' 국민메신저 ' 카카오톡의 메시지,중립,100,0,0
77512,77513,77513,7,경우,가장 사용률이 높은 음악 서비스의 경우 웨이브는 네이버 뮤직을 카카오는 멜론을,중립,100,0,0
77513,77514,77514,7,경우,음악 서비스의 경우 정교한 추천을 위해 사용 데이터가,중립,100,0,0
77514,77515,77515,7,경우,다만 음악 사용률이 크지 않은 경우 네이버 뮤직이 건당 결제 등을,부정,100,0.0064423050750343,-0.2177743063127
77515,77516,77516,7,경우,몇가지 있었는데 예를들어 클로바 프렌즈의 경우 성경읽기를 지원해서 성경을 읽어달라고 하면,긍정,100,0.16194163477812,1.5133433283358
77516,77517,77517,7,경우,- 클로바 프렌즈의 경우 10W 클로바 웨이브의 경우 20W,중립,100,0,0
77517,77518,77518,7,경우,프렌즈의 경우 10W 클로바 웨이브의 경우 20W 로 소리 크기는 프렌즈보다,중립,100,0,0
77518,77519,77519,7,사용,Radiator 사용,NA,NA,NA,NA
77519,77520,77520,7,사용,60 x 45mm Passive Radiator 사용 전원 : 5V 통신 :,중립,100,0,0
77520,77521,77521,7,사용,본체와 간단 사용 설명서와 무엇이 가능한지에 대한 내용들,긍정,100,0.1368125968147,1.2721296978629
77521,77522,77522,7,사용,스피커는 이용자가 많을수록 또 이들의 사용 횟수가 늘수록 데이터베이스 ( DB,긍정,100,0.11263102998696,1.5416949152542
77522,77523,77523,7,사용,직접 구매하여 사용 후 작성한 포스팅 입니다,중립,100,0,0
77523,77524,77524,7,사용,이상으로네이버 AI 스피커 웨이브 사용 후기였습니다,긍정,100,0.061878531073446,0.95711660200123
77524,77525,77525,7,사용,웨이브 사용 후기였습니다,중립,100,0,0
77525,77526,77526,7,사용,# 네이버 # 클로바 # 사용 # 방법 # 설정 #,중립,100,0,0
77526,77527,77527,7,사용,충전만 해두면 전선 연결 없이도 사용 가능해서 좋더라고요,긍정,67.326732673267,0.19276376372809,0.47349552672465
77527,77528,77528,7,사용,저는 컴퓨터 책상 위에 두고 사용 중인데 목소리만을 이용해 샐리에게 명령만,중립,100,0,0
77528,77529,77529,7,사용,구성품은 사용 방법과 충전기 프렌즈 스피커로 구성되어,중립,100,0,0
77529,77530,77530,7,사용,구성 박스를 당겨서 오픈하면 먼저 사용 설명서 2 장이 보입니다,중립,100,0,0
77530,77531,77531,7,사용,무게는 378g 으로 줄이면서 배터리 사용 시간은 웨이브와 같이 최대 5,긍정,100,0.058850898274299,0.9508796499625
77531,77532,77532,7,사용,여러분들도 미리 알고 계세요 웨이브 사용 TIP 참고하세요 웨이브는 네이버와 연동되어,중립,100,0,0
77532,77533,77533,7,사용,후블루투스 연결해주기 업데이트 후 바로 사용 가능,긍정,100,0.10288781748596,1.0049207217059
77533,77534,77534,7,사용,소리조절 ) 프로그램에서 T2 리모컨 사용 활성화를 해줘야 합니다,긍정,100,0.10341117604633,1.2363803174615
77535,77536,77536,7,사용,프렌즈 스피커와 충전기 그리고 간단 사용 설명서 명령어카드 입니다,중립,100,0,0
77536,77537,77537,7,사용,네이버 크로바 앱과 연동을 하면 사용 준비는 마무리가 됩니다,중립,100,0,0
77537,77538,77538,7,사용,등네이버에서 제공하는 다양한 서비스를 그대로 사용 가능합니다,긍정,100,0.22987895763638,1.8798479876217
77538,77539,77539,7,사용,기회가 된다면 사용 시간을 리뷰로,긍정,100,0.20276747881356,1.1773046713518
77539,77540,77540,7,사용,용량 2850MAH 최대 5 시간 사용 가능,긍정,100,0.24968960050021,1.0800141242938
77540,77541,77541,7,사용,그 이후 사용 가능해요 ' 클로바,긍정,100,0.25075373974009,1.5453387649712
77541,77542,77542,7,사용,네이버 인공지능 스피커 사용 설명서입니다 버튼 기능이 상세하게 나와있으니,중립,100,0,0
77542,77543,77543,7,사용,사용 설명서도 필요한 내용만 간략하게 되어있고대략적인,중립,100,0,0
77543,77544,77544,7,사용,- - - - - 사용 4 일째 저녁에 노래듣는데 또,중립,100,0,0
77544,77545,77545,7,사용,핸드폰없이도 그냥 와이파이만 연결되면 사용 가능하다는 것도 좋습니다,긍정,67.326732673267,0.16465084552252,0.38915677210792
77545,77546,77546,7,사용,사용,NA,NA,NA,NA
77546,77547,77547,7,사용,언제 어디서든 들고 다니면서 유용하게 사용 가능해요,긍정,100,0.14672151774338,1.2145884684776
77547,77548,77548,7,사용,프렌즈를 야외에서도 충분히 사용 가능하다는 점,긍정,100,0.33566130559581,1.1034790365745
77550,77551,77551,7,사용,자세한 비교 사용 느낌들은 사용기를 한번 더 포스팅해보기로,중립,100,0,0
77552,77553,77553,7,사용,b / g / n 사용,NA,NA,NA,NA
77553,77554,77554,7,사용,두어도 5 시간 정도 무선으로 사용 할 수 있어 좋고,긍정,100,0.19090147140995,1.3363102998696
77554,77555,77555,7,사용,또한 안드로이드 아이폰 모두 사용 가능한 전용 앱을 블루투스로 연결해,긍정,100,0.12012294659166,1.2420457924472
77555,77556,77556,7,사용,구성품은 사용 설명서 전용 충전기 웨이브 이렇게,중립,100,0,0
77556,77557,77557,7,사용,클로바 3 일 사용 후기 였습니다,중립,100,0,0
77557,77558,77558,7,사용,호기심으로 말 걸어보다가 잘 안되어서 사용 안하는 사람들도 많다,긍정,100,0.12331231284879,1.5251954310237
77558,77559,77559,7,사용,서비스의 경우 정교한 추천을 위해 사용 데이터가 필수인 만큼 이미 멜론을,중립,100,0,0
77559,77560,77560,7,사용,사용할 수 있다,중립,100,0,0
77560,77561,77561,7,사용,네이버 클로바의 앱을 설치해야지 사용 가능한 점 미리 알아두세요,긍정,100,0.13801363209468,1.5589662795721
77561,77562,77562,7,사용,배터리로 최대 5 시간의 여유로운 사용 시간을 보여줍니다,긍정,100,0.23872293807072,1.2673917522829
77562,77563,77563,7,사용,고려해 여타 기능에 대해서는 간단한 사용 후기로 대신한다,중립,100,0,0
77563,77564,77564,7,사용,on / off 음성명령 기능 사용 / 차단 bluetooth3 초 이상,긍정,100,0.025693301049233,0.71902136390599
77564,77565,77565,7,사용,와 연결하면 좀 더 다양하게 사용 가능하지만굳이 이 기능을 쓰자고 IOT,긍정,100,0.11313251102342,1.5115389698351
77565,77566,77566,7,경쟁,그런데 ' AI 스피커 경쟁 점화 ' 라는 기사를 보고,중립,100,0,0
77566,77567,77567,7,경쟁,/ 20170322121605819 한국의 AI 스피커 경쟁 SK 텔레콤 누가 KT 기가지니에,중립,100,0,0
77567,77568,77568,7,경쟁,/ 20170323105411673 한국의 AI 스피커 경쟁 SK 텔레콤 누가 KT 기가지니에,중립,100,0,0
77568,77569,77569,7,경쟁,"플랫폼 선점 경쟁 "" 이라며 "" 스피커 시장을",중립,100,0,0
77571,77572,77572,7,필요,할 수 있으니 리모콘이 그다지 필요 없어지게 된다,부정,100,-0.023629385964912,-0.54876893939394
77572,77573,77573,7,필요,( 아직 더 많은 업데이트 필요 ) 행복감,긍정,100,0.16254006410256,1.390625
77573,77574,77574,7,필요,스위치를 찾을 필요 없이 말만 하면 해줍니다,중립,100,0,0
77574,77575,77575,7,필요,한번 사용해보면 ㅋㅋㅋㅋ 따로 설명서는 필요 없음이 느껴진답니다 버튼에 대한 상세한,부정,100,0.014074471452128,-0.18630996248396
77575,77576,77576,7,플랫폼,네이버는 라인과 협업한 AI 플랫폼 ' 클로버 ' 를 탑재한,중립,100,0,0
77576,77577,77577,7,플랫폼,AI 스피커인 프렌즈는 네이버 인공지능 플랫폼 클로바를 적용한 인공지능 스마트 스피커인데요,긍정,100,0.079237858548203,1.4137931034483
77577,77578,77578,7,플랫폼,모바일 주문생산 플랫폼 ' 메이커스 위드 카카오 ',중립,100,0,0
77578,77579,77579,7,플랫폼,카카오미니는 카카오의 통합 인공지능 플랫폼 ' 카카오 아이 ( 카카오,중립,100,0,0
77579,77580,77580,7,플랫폼,국내 인공지능 ( AI ) 플랫폼 선점을 위한 양대 포털 간,중립,100,0,0
77580,77581,77581,7,플랫폼,경쟁에 나서는 것은 향후 AI 플랫폼 선점을 위한 의지로 풀이된다,중립,100,0,0
77581,77582,77582,7,플랫폼,IT 업계 관계자는 ' AI 플랫폼 주도권을 누가 잡느냐에 따라 광고와,중립,100,0,0
77582,77583,77583,7,플랫폼,서비스를 제공하고 pc 나 스마트폰의 플랫폼 이상으로 나아가기 위해선 피할 수,긍정,100,0.030430359937402,0.82725267266248
77583,77584,77584,7,플랫폼,우측면 네이버가 인공지능 플랫폼 ' 클로바 ' 로 구동,중립,100,0,0
77584,77585,77585,7,플랫폼,오늘은 오감 인식 AI 플랫폼 ' 클로바 ' 에 대해,중립,100,0,0
77585,77586,77586,7,플랫폼,대표가 라인과 네이버를 아우르는 AI 플랫폼 ' 클로바 ' 를 공개했습니다,중립,100,0,0
77586,77587,77587,7,플랫폼,지금까지 오감 인식 AI 플랫폼 ' 클로바 ' 에 대해서,중립,100,0,0
77587,77588,77588,7,플랫폼,카카오 미니가 삼성전자와 손을 잡고 플랫폼 확장을 노리는 모양새라면 네이버는 음악에,긍정,100,0.077555288484294,1.4748854169625
77588,77589,77589,7,플랫폼,볼 수 있어요 인공지능 AI 플랫폼 ' 클로버 ' 가 탑재된,중립,100,0,0
77589,77590,77590,7,플랫폼,AI 플랫폼 ' 클로바 ' 를 탑재한,중립,100,0,0
77590,77591,77591,7,플랫폼,스피커 카카오미니는 카카오의 통합 인공지능 플랫폼 ' 카카오 아이 ( I,중립,100,0,0
77591,77592,77592,7,플랫폼,네이버의 인공지능 플랫폼 ' 클로바 ( Clova ),중립,100,0,0
77592,77593,77593,7,플랫폼,기능을 다음 ' 스마트 오디오 플랫폼 ' 을 선보였습니다,중립,100,0,0
77593,77594,77594,7,플랫폼,네이버와 퀄컴의 협력을 통해 AI 플랫폼 생태계 조성이 더욱 촉진될 것을,중립,100,0,0
77594,77595,77595,7,플랫폼,있겠습니다 카카오미니는 카카오의 통합 인공지능 플랫폼 카카오아이 ( I ) 가,중립,100,0,0
77595,77596,77596,7,플랫폼,네이버와 라인이 공동 개발한 인공지능 플랫폼 ' 클로바 ( Clova ),중립,100,0,0
77596,77597,77597,7,플랫폼,' 전시회에서 오감을 활용한 AI 플랫폼 ' 클로바 ' 와 이를,중립,100,0,0
77599,77600,77600,7,플랫폼,플랫폼,NA,NA,NA,NA
77600,77601,77601,7,플랫폼,네이버와 라인이 함께 개발한 AI 플랫폼 클로바가 탑재된다 ' 며 ',중립,100,0,0
77603,77604,77604,7,플랫폼,"플랫폼 선점 경쟁 "" 이라며 """,중립,100,0,0
77606,77607,77607,7,플랫폼,서비스 콘텐츠와 기술을 아우르는 종합 플랫폼 기업으로 거듭날 전망이다,중립,100,0,0
77607,77608,77608,7,플랫폼,미니는 갤럭시와 연합해서 카카오의 인공지능 플랫폼 I ( 아이 ) 를,중립,100,0,0
77608,77609,77609,7,플랫폼,빅스비와 연동하기로 했고 네이버의 인공지는 플랫폼 클로바는 LG 전자와 연합해서 LG,중립,100,0,0
77609,77610,77610,7,플랫폼,웨이브는 네이버의 AI 플랫폼 ' 클로바 ' 가 탑재된,중립,100,0,0
77610,77611,77611,7,플랫폼,카카오는 통합 AI 플랫폼 ' 카카오아이 ( I ),중립,100,0,0
77611,77612,77612,7,플랫폼,카카오는 올 하반기에 타깃형 광고 플랫폼 ' 카카오 모멘트 ' 를,중립,100,0,0
77612,77613,77613,7,플랫폼,* 인공지능 플랫폼 Clova 를 통해 더욱 스마트하게,중립,100,0,0
77613,77614,77614,7,플랫폼,통해 유저들과의 접점을 마련한네이버의 인공지능 플랫폼 ' 클로바 ' 는정보 검색,중립,100,0,0
77614,77615,77615,7,플랫폼,네이버는 네이버 - 라인의 인공지능 플랫폼 ' 클로바 ' 가 탑재된,중립,100,0,0
77615,77616,77616,7,휴대,스피킹 정보검색 블루투스 OUT 지원 휴대 가능,긍정,100,0.19577437487885,1
77630,77631,77631,7,클로버,언제든지 실행 가능한 음성 클로버 옷까지 챙겨주셔서 입혀봤는데 딱 좋아요매끈해서,긍정,100,0.21447144647333,1.3072368421053
77631,77632,77632,7,클로버,아직도 모르시는 분들 많이 계셔서 클로버 동작 시킬 때마다,부정,100,-0.098035330100809,-1.2490421764615
77632,77633,77633,7,클로버,' 클로버 ' 라고,NA,NA,NA,NA
77633,77634,77634,7,클로버,' 클로버 ' 로,NA,NA,NA,NA
77634,77635,77635,7,클로버,굳이 깨우는 말 그러니까 ' 클로버 ' 라고 말하지 않고도 바로,부정,100,-0.063991947080817,-0.80701754385965
77635,77636,77636,7,클로버,' 라는 말 대신 ' 클로버 ' 로 음성명령 명령어를 바꿨다,중립,100,0,0
77636,77637,77637,7,클로버,라인과 협업한 AI 플랫폼 ' 클로버 ' 를 탑재한 AI 스피커를,중립,100,0,0
77637,77638,77638,7,클로버,역할을 하고 있는 이 녀석 클로버 AI 스피커입니다,중립,100,0,0
77638,77639,77639,7,클로버,녀석 클로버 AI 스피커입니다,중립,100,0,0
77639,77640,77640,7,클로버,연동은 네이버 클로버 앱을 통해서 진행하면 됩니다,중립,100,0,0
77640,77641,77641,7,클로버,( 또는 클로버 크로바도 가끔 알아들음 ) 하고,중립,100,0,0
77641,77642,77642,7,클로버,) 에 연결이 되었다면 이제 클로버 앱과 필립스 휴를 다시 연동해줘야,중립,100,0,0
77642,77643,77643,7,클로버,다 해보았습니다만 결론은 그래서 그냥 클로버 앱만 사용해 보았습니다,중립,100,0,0
77643,77644,77644,7,클로버,클로버 프렌즈 + 스피커는 샐리와 브라운이,중립,100,0,0
77644,77645,77645,7,클로버,클로버 프렌즈 + 를 사용하는 방법은,중립,100,0,0
77645,77646,77646,7,클로버,달 넘게 사용하게 된 네이버 클로버 clova,중립,100,0,0
77646,77647,77647,7,클로버,등 ㅎㅎㅎㅎㅎ ) 이런 식으로 클로버 어플에 질문에 대한 원하는 대답을,중립,100,0,0
77647,77648,77648,7,클로버,ㅎㅎㅎ 클로버 이름도 제가 저장해서 부를 수,중립,100,0,0
77648,77649,77649,7,클로버,^ ^ 그럼 이만 우리집 클로버 소개 끝,긍정,100,0.1821164021164,1.4748148148148
77649,77650,77650,7,클로버,ㅎㅎㅎ 여튼 제돈주고 써본 네이버 클로버 후기 끝,중립,100,0,0
77650,77651,77651,7,클로버,저의 경우는 아침에 일어나서 ' 클로버 아침 음악 틀어줘 ' 라고,중립,100,0,0
77651,77652,77652,7,클로버,빨리 연결하고 싶다 ㅠㅠ 클로버 넘 좋다 ㅠㅠ ioT 집에다,긍정,100,0.17118644067797,1.3694915254237
77652,77653,77653,7,클로버,다 깔고 싶다 ㅠㅠ 그럼 클로버 후기 끝조타조아 -,긍정,100,0.095,0.96
77653,77654,77654,7,클로버,버튼들이 있고 전원은 밑에 있다 클로버,중립,100,0,0
77654,77655,77655,7,클로버,클로버,NA,NA,NA,NA
77657,77658,77658,7,클로버,핸폰에 클로버 어플을 설치한후 사용하실수 있습니다,중립,100,0,0
77658,77659,77659,7,클로버,클로버 밑부분에 전원 장치가 있는데 그걸,중립,100,0,0
77659,77660,77660,7,클로버,클로버 & 벅스에 관한 리뷰는 새로,긍정,100,0.18333333333333,1
77660,77661,77661,7,클로버,됩니다 생각보다 어렵진 않네요 부를땐 클로버,부정,100,-0.21445778169949,-0.87639266418336
77661,77662,77662,7,클로버,하고부르면 얘가 들을준비를 합니다 클로버 말고 다른이름으로 설정할수도 있네요 똑똑아,긍정,100,0.18519369139303,1.6667432225373
77664,77665,77665,7,클로버,사용에 앞서서 클로버 앱을 다운받아야 한다,중립,100,0,0
77665,77666,77666,7,클로버,왜냐면 클로버 앱으로 웨이브 스피커가 제어되기 때문,중립,100,0,0
77666,77667,77667,7,클로버,하면 블라블라 말은 해주지만 결국엔 클로버 앱으로 보라는 말만 되뇌인다,중립,100,0,0
77667,77668,77668,7,클로버,특이한건 클로버 옷이,중립,100,0,0
77668,77669,77669,7,클로버,여러 예시 질문이많지만네이버 클로버 홈페이지에서 확인 하면 더 많은,중립,100,0,0
77669,77670,77670,7,클로버,저때만 해도 우리 클로버 똑순이라고 좋아했는데좀 쓰다보니 바부팅이 ㅠㅠ,긍정,100,0.085722819593787,0.94295101553166
77670,77671,77671,7,클로버,찍어둠 ㅎ 네이버 인공지능스피커 프렌즈 클로버 세팅방법은 위와같고사용하는 팁 버튼설명은 아래와,부정,100,-0.01651399678067,-0.50845471772148
77672,77673,77673,7,클로버,2 탄 # 브라운스피커 # 클로버 By Galaxy S8,중립,100,0,0
77673,77674,77674,7,클로버,프렌즈 스피커의 초기 이름 ' 클로버 ' 에서 친근한 다른 이름으로,긍정,100,0.1264367816092,1.1379310344828
77674,77675,77675,7,클로버,발하는게 바로 AI 블루투스 스피커 클로버 입니다,중립,100,0,0
77675,77676,77676,7,클로버,스피커인 WAVE 는 핸드폰에서 네이버 클로버 앱을 다운받은 다음 연동할 수,중립,100,0,0
77676,77677,77677,7,클로버,클로버 어플을 실행한 다음 새기기 추가,중립,100,0,0
77677,77678,77678,7,클로버,잠자리 위 책장에 올려 놓아도 클로버 하면 반응,중립,100,0,0
77678,77679,77679,7,클로버,하자 마자 방에 들어오면 ' 클로버 ' 뉴스 알려줘 라고 하지요,긍정,100,0.14678569806006,1.2850756439962
77680,77681,77681,7,클로버,핸드폰으로는 클로버 앱을 설치한 후블루투스 연결해주기 업데이트,중립,100,0,0
77681,77682,77682,7,클로버,다른 거 틀어줘 나랑 놀아줘 클로버 심심해 오늘 뭐 할까 등등,긍정,100,0.06886189258312,1.1468860164512
77682,77683,77683,7,클로버,특히 ' 클로버 혼자있는 밤 틀어줘,중립,100,0,0
77683,77684,77684,7,클로버,' 나 클로버 팟캐스트 틀어줘 ' 라고 하면,중립,100,0,0
77684,77685,77685,7,클로버,에서 제공되는 AI 스피커 ( 클로버 ) 는 인공지능 스피커로써 음성으로,중립,100,0,0
77685,77686,77686,7,클로버,에서 제공되는 AI 스피커 ( 클로버 ) 는 휴대할 수 있다는,중립,100,0,0
77686,77687,77687,7,클로버,반환해주셔야 하지만 AI 스피커 ( 클로버 ) 는 1 년이 지난,중립,100,0,0
77687,77688,77688,7,클로버,LGU + AI 스피커 ( 클로버 ) > ☞,중립,100,0,0
77688,77689,77689,7,클로버,LGU + AI 스피커 ( 클로버 ) >,중립,100,0,0
77689,77690,77690,7,클로버,표와 같이 AI 스피커 ( 클로버 ) 는 셋탑박스가 아니기 때문에,중립,100,0,0
77690,77691,77691,7,클로버,클로버 ㅋㅋㅋㅋ 요즘 아침저녁으로 아이들이 클로버를,중립,100,0,0
77691,77692,77692,7,클로버,그리고 대한민국 대표 포털 네이버의 클로버 카카오의 카카오미니 이렇게 4 개,중립,100,0,0
77692,77693,77693,7,클로버,클로버 사용하는 지인이 있어서 테스트 해보았는데,중립,100,0,0
77693,77694,77694,7,클로버,현재까지 올레지니 클로버 카카오미니 세 종류의 AI 스피커를,중립,100,0,0
77695,77696,77696,7,클로버,클로버 오늘 날씨 알려줘,긍정,100,0.23908432147563,1.2139130434783
77696,77697,77697,7,클로버,클로버 원너원의 나야나 틀어줘,중립,100,0,0
77698,77699,77699,7,클로버,클로버 5 분뒤에 알람맞춰줘,긍정,100,0.15416666666667,1
77699,77700,77700,7,클로버,단지 가끔 클로버 하고 부르면 못알아 들을때가 가끔씩,중립,100,0,0
77700,77701,77701,7,클로버,부를수도 있답니다 최근에 질문했던 내용은 클로버 어플에서다시 확인할수도 있어요이틀간 사용한결과 인식하지못하는,중립,100,0,0
77701,77702,77702,7,클로버,불편한것같아요지금까지 이틀간사용한 요즘대세 ai 스피커 클로버 솔직후기였어요 이상 윤쌤이었어요,중립,100,0,0
77702,77703,77703,7,클로버,스마트폰과도 연동이 되고요 ' 네이버 클로버 ' 앱을구글플레이나 앱스토어에서 설치를 하시면,중립,100,0,0
77703,77704,77704,7,클로버,있게 알람으로 나를 깨워주고 ' 클로버 내일 6 시에 알람 해줘,중립,100,0,0
77704,77705,77705,7,클로버,스마트한 음악듣기 도구스마트스피커 네이버 ' 클로버 ' 받았습니다이전에 글 _ 듯이,중립,100,0,0
77705,77706,77706,7,클로버,클로버 발음이 좀 어렵기도 해서부르기가 조금은,부정,100,-0.037911877567741,-0.4742516914986
77706,77707,77707,7,클로버,ㅎㅎ 기존의 클로버 clover 스피커 입니다,중립,100,0,0
77707,77708,77708,7,클로버,있어요 인공지능 AI 플랫폼 ' 클로버 ' 가 탑재된 스마트 스피커,중립,100,0,0
77708,77709,77709,7,클로버,* 녹색불 : 클로버,중립,100,0,0
77709,77710,77710,7,클로버,) 클로버 앱을 보니 핸드폰에서 등록된 클로버가,중립,100,0,0
77710,77711,77711,7,클로버,30 분 이상 시간은 지났고 클로버 고객센터에 글 올리는중에 정상 작동됨,긍정,100,0.13594900636107,1.1527988209339
77711,77712,77712,7,클로버,클로버 아니고 클로바,부정,100,-0.12536528345996,-0.58620689655172
77712,77713,77713,7,클로버,' 네이버 클로버 ' 어플 접속하면 나오는 설명,중립,100,0,0
77713,77714,77714,7,클로버,나도 모르게 ㅎㅎㅎ ' 클로버 ' 라고 부르고 있다,부정,100,-0.049721385570273,-0.66364507793615
77714,77715,77715,7,클로버,( 클로버 ㄴㄴ ) Naver Clo (,중립,100,0,0
77715,77716,77716,7,클로버,다운받고블루투스와 와이파이를 연결해보니이 친구이름은 ' 클로버 ' 클로버,긍정,100,0.087288708586883,1.3630831643002
77716,77717,77717,7,클로버,연결해보니이 친구이름은 ' 클로버 ' 클로버,긍정,100,0.096461573135001,1.0689655172414
77717,77718,77718,7,클로버,' 클로버 ' 하고 부르면 녹색불이 들어오며내,중립,100,0,0
77718,77719,77719,7,클로버,설정하고영어로 대화도 하고 자세한 기능은 클로버 홈페이지를 통해 봐 주세요,부정,100,-0.0094671920218017,-0.51220923365085
77719,77720,77720,7,클로버,( 이미지 출처 : 네이버 클로버 서비스 ) 클로바 앱에주요 일정을,중립,100,0,0
77720,77721,77721,7,클로버,( 이미지 출처 : 네이버 클로버 서비스 ) 나만의 쥬크박스처럼 내,중립,100,0,0
77721,77722,77722,7,클로버,( 이미지 출처 : 네이버 클로버 서비스 ) 친구들혹은 가족들 말고,긍정,100,0.18018675780171,1.1991784037559
77722,77723,77723,7,클로버,연결할 핸드폰에 클로버 어플 설치,중립,100,0,0
77723,77724,77724,7,클로버,명령어 ' 클로버 ' 는 수정하여 본인이 정하면됩니다,긍정,100,0.18358974358974,1.4177777777778
77724,77725,77725,7,클로버,전 그냥 귀챦아서 클로버,중립,100,0,0
77725,77726,77726,7,클로버,귀챦아서 클로버,중립,100,0,0
77726,77727,77727,7,클로버,클로버가 우리집에 왔어요,중립,100,0,0
77727,77728,77728,7,클로버,클로버가 인사를 한다,중립,100,0,0
77728,77729,77729,7,클로버,이름은 ' 클로버 ' 이구요,중립,100,0,0
77729,77730,77730,7,클로버,ㅋㅋ ' 클로버 너 나이가 몇살이야,중립,100,0,0
77730,77731,77731,7,클로버,아웃 ㅋㅋㅋ 음악을 틀어준다해서 ' 클로버,부정,100,0.011949685534591,-0.31525157232704
77732,77733,77733,7,클로버,바로 지금 현재 날씨는 알려주는 클로버 얼마전 네이버뮤직에서이벤트로 인공지능 스피커 프렌즈를선물로,긍정,100,0.11508738717812,1.2259575644481
77733,77734,77734,7,클로버,대한다 요 며칠 클로버 덕분에우리집에 노래가 끊이질 않고 인공지능,중립,100,0.01551079910068,-0.014153608357318
77734,77735,77735,7,클로버,""" 클로버 이",NA,NA,NA,NA
77735,77736,77736,7,클로버,외관과 달리 사람 속 터지게하는 클로버,중립,100,0,0
77736,77737,77737,7,클로버,상품으로 1 년 음악 이용권과 클로버 이놈,중립,100,0,0
77738,77739,77739,7,클로버,""" "" 클로버 내일 날씨 어때",중립,100,0,0
77739,77740,77740,7,클로버,"( 우리 아이가 "" 클로버 "" "" 클러버 "" """,중립,100,0,0
77740,77741,77741,7,클로버,"목터져라 부르며 온 가족이 "" 클로버 "" 를 부르고 또 불러야",긍정,100,0.089277331607861,1.3594399827453
77741,77742,77742,7,클로버,인공지능 스피커 ] 얘 이름은 클로버,중립,100,0,0
77742,77743,77743,7,클로버,내가 하도 클로버 안예쁘다고 저런걸 어떻게 거실에 두고,긍정,100,0.14454779189353,1.1998605960178
