,Unnamed: 0,X,category,key,sentences,senti,score1,score2,score3
78465,78466,78466,7,네이버,인공지능 스피커 네이버 클로바 프렌즈 ( 브라운 ),중립,100,0,0
78466,78467,78467,7,네이버,일단 스토어에서 ' 네이버 클로바 ' 어플을 검색해서 다운로드를,중립,100,0,0
78467,78468,78468,7,네이버,' 어플을 검색해서 다운로드를 받고 네이버 아이디로 로그인을 했다,중립,100,0,0
78468,78469,78469,7,네이버,- 네이버 클로버앱을 사용하기 위해서 했던 사용자,중립,100,0,0
78469,78470,78470,7,네이버,을 위해서 네이버 프렌즈 브라운 스피커를 연결하는 과정이,중립,100,0,0
78470,78471,78471,7,네이버,★ 브라운 스피커 On - 네이버 클로바앱 설치 - 기기검색 등록,중립,100,0,0
78471,78472,78472,7,네이버,# 인공지능 # 스피커 # 네이버 # 클로바 # 사용 #,중립,100,0,0
78472,78473,78473,7,네이버,인공지능 스피커 네이버 웨이브 샐리가 도착하자마자 정말 많은걸,긍정,100,0.10191994071844,1.5365039632874
78473,78474,78474,7,네이버,초기 기동시 펌웨어 업데이트 및 네이버 클라우드에 접속하여 우리가 모르는 그,부정,100,-0.027668674172995,-0.79678362573099
78474,78475,78475,7,네이버,누구 인공지능스피커 에 이어 오늘은 네이버 클로바에 대해 포스팅 해볼까 합니다,중립,100,0,0
78475,78476,78476,7,네이버,네이버 클로바는 배터리가 내장되어 있어 충전이,중립,100,0,0
78476,78477,78477,7,네이버,네이버 클로버는 이렇게 휴대폰으로 클로버앱을 통해,중립,100,0,0
78477,78478,78478,7,네이버,망할 네이버,NA,NA,NA,NA
78478,78479,78479,7,네이버,정말 버라이어티하다카카오 인공지능으로 살껄 ㅠㅠㅠㅠㅠㅠㅠ 네이버 클로바 비추,중립,100,0,0
78479,78480,78480,7,네이버,멜론 등 여러 곳이 있지만 네이버 뮤직에서 1 년 이용권 99000,중립,100,0,0
78480,78481,78481,7,네이버,000 원이라고 하니 99000 원에 네이버 뮤직도 이용하고 스피커도 사용하시면 괜찮은,긍정,100,0.11071016651445,1.0639590661976
78481,78482,78482,7,네이버,현재 네이버 뮤직 1 년 구매하면 특별,긍정,100,0.15149297423888,1.0892857142857
78482,78483,78483,7,네이버,네이버 인공지능 스피커에서도 귀여운 모양의 프렌즈를,긍정,100,0.14067055393586,1.0204081632653
78483,78484,78484,7,네이버,네이버 인공지능스피커 웨이브의 이름은 샐리에요,중립,100,0,0
78484,78485,78485,7,네이버,네이버 인공지능스피커 웨이브를 작동시키려면 스마트폰 앱,중립,100,0,0
78485,78486,78486,7,네이버,목소리의 여성분이 ( 괴리감 ) 네이버 클로바 어플을 설치하라고 안내해줌,중립,100,0,0
78486,78487,78487,7,네이버,노래 때문임 ㅋㅋㅋㅋㅋ 살 때 네이버 1 개월권도 같이 주지만 난,중립,100,0,0
78487,78488,78488,7,네이버,오 ㅋㅋㅋ 확실히 네이버 기반이라 그런지 이것저것 대답을 굉장히,긍정,100,0.30203723217422,1.0641025641026
78488,78489,78489,7,네이버,많이 했었던 국내 인공지능 스피커인 네이버 웨이브는 현재 음악틀어주는 스피커 그,중립,100,0,0
78489,78490,78490,7,네이버,클로바의 행보가 매우 실망스럽기 때문에 네이버 웨이브에 대한 기대는 이제 접었다,부정,100,-0.037970331073779,-0.49361430395913
78490,78491,78491,7,네이버,셋팅 카카오미니는 네이버 웨이브와 다르게 전원이 공급되지 않으면,부정,100,-0.091506900064833,-1.1186440677966
78491,78492,78492,7,네이버,네이버 웨이브에 있는 기능과 동일하며 나에겐,중립,100,0,0
78492,78493,78493,7,네이버,노래듣기 네이버 웨이브는 음악이 나오는 동안 앱에서,긍정,100,0.13552340586532,1.4804136620169
78493,78494,78494,7,네이버,네이버 웨이브에 aux 단자가 있었으면 카카오미니를,중립,100,0,0
78494,78495,78495,7,네이버,네이버 웨이브는 상담원 카카오미니는 말괄량이 같은,중립,100,0,0
78495,78496,78496,7,네이버,앞세워서 인공지능 스피커를 출시하고 있고 네이버 역시 이 전쟁에 뛰어들었다,부정,100,-0.057638888888889,-0.83564814814815
78496,78497,78497,7,네이버,네이버 뮤직과 프로모션을 통해 네이버 뮤직,중립,100,0,0
78497,78498,78498,7,네이버,네이버 뮤직과 프로모션을 통해 네이버 뮤직 1 년 무제한 듣기,중립,100,0,0
78498,78499,78499,7,네이버,네이버 클로바 앱을 깔고 샐리 스피커까지,중립,100,0,0
78499,78500,78500,7,네이버,네이버 웨이브 ( wave ) 인공지능이라고,중립,100,0,0
78500,78501,78501,7,네이버,▲ 네이버 웨이브,중립,100,0,0
78501,78502,78502,7,네이버,▲ 이 웨이브를 사용하려면 네이버 클로바라는 어플을 다운받아야 한다,긍정,100,0.14636644149485,1.7810342371899
78502,78503,78503,7,네이버,저는 네이버 클로바로 선택했어요,중립,100,0,0
78504,78505,78505,7,네이버,핫한 요것 ^ ^ ♡ 네이버 프렌즈 인공지능스피커 사는 싸이트주소는 아래,긍정,100,0.040448283372812,0.91865079365079
78505,78506,78506,7,네이버,품질도 믿고사는 네이버 클로버라구,긍정,100,0.23405985686402,0.98214285714286
78506,78507,78507,7,네이버,나두 필요해서 찍어둠 ㅎ 네이버 인공지능스피커 프렌즈 클로버 세팅방법은 위와같고사용하는,부정,100,0.0018100906357565,-0.21888950033018
78507,78508,78508,7,네이버,# 네이버 # 라인 # 브라운덕후 의,중립,100,0,0
78508,78509,78509,7,네이버,정기권 구입하면스피커를 주는중인지라 ㅋㅋㅋ 전에 네이버 웨이브 스피커 이벤트할때카카오쪽 스피커랑 고민하다둘다,부정,100,-0.017527750494705,-0.72827478871301
78509,78510,78510,7,네이버,넘나 귀엽지 않나요흑흑 ( 사진출처 네이버 클로바 ) 스피커는 요렇게 브라운이랑,중립,100,0.064819408490064,0.291642314436
78514,78515,78515,7,네이버,스피커가 멜론의 스트리밍을 제시한 반면네이버는 네이버 뮤직을 이용한 마케팅을 펼치고 있습니다,중립,100,0,0
78515,78516,78516,7,네이버,중단의 절취선을 개봉하니드디어 네이버 WAVE 스피커가 보이네요,중립,100,0,0
78516,78517,78517,7,네이버,ㅎㅎ 네이버 웨이브 인공지능 스피커는스마트폰이나 음성으로 제어할,중립,100,0,0
78517,78518,78518,7,네이버,첨에 네이버 프렌즈 출시 되었을때 동생이 바로,중립,100,0,0
78518,78519,78519,7,네이버,참고있다가이번에 라인 프렌즈 스피커가 출시되면서 네이버 스피커도 할인을해서 구입했어요,중립,100,0,0
78519,78520,78520,7,네이버,하다보니까 샐리가 더 익숙해요 네이버 WAVE 클로바는 네이버 인공지능의 이름인가봐욤,중립,100,0,0
78520,78521,78521,7,네이버,더 익숙해요 네이버 WAVE 클로바는 네이버 인공지능의 이름인가봐욤 (,중립,100,0,0
78521,78522,78522,7,네이버,박스모습 ㅋㅋㅋ 스피커를 살 때 네이버 1 년 이용권을 같이 구입해야하는데전,중립,100,0,0
78522,78523,78523,7,네이버,전혀 생각 못했던게 ㅋㅋㅋㅋ 앞으로도 네이버 결제를 안하면 노래는 1 분,중립,100,0,0
78523,78524,78524,7,네이버,당연한건데 전혀 생각을 못했어요 ㅋㅋ 네이버 1 년 정기결제 끝나면 그,긍정,100,0.061655011655012,0.96095571095571
78524,78525,78525,7,네이버,지난 포스팅에서 네이버 인공지능 플랫폼인 클로바 ( Clova,중립,100,0,0
78525,78526,78526,7,네이버,네이버 인공지능 스피커 프렌즈를 사용하기 위해서는,중립,100,0,0
78526,78527,78527,7,네이버,프렌즈는 네이버 클로바를 기반으로 하는 인공지능 스피커이므로,긍정,100,0.13206309758034,1.4137931034483
78527,78528,78528,7,네이버,인공지능 스피커 프렌즈는 네이버 검색 기반과 뮤직을 사용하며 조금,중립,100,0,0
78528,78529,78529,7,네이버,다음 네이버 인공지능 스피커 프렌즈에서 스마트폰 없이도,부정,100,-0.065349002849003,-0.87799564270153
78529,78530,78530,7,네이버,한 캐릭터 상품이면서 클로버가 연결된 네이버 인공지능 스피커이면서 블루투스 연결로 외부에서도,중립,100,0,0
78530,78531,78531,7,네이버,사용하기 위해서는 초기설정이 필요한데 앱스토어에서 네이버 클로바앱을설치해야되요 앱을 설치하고 나면 와이파이,중립,100,0,0
78531,78532,78532,7,네이버,바로 네이버 웨이브 ( wave ) 입니다,중립,100,0,0
78532,78533,78533,7,네이버,꽤 도움이 되겠는데요 ^ ^ 네이버 웨이브는 일본에선 한 달 전,긍정,100,0.12292526004204,1.0192069790244
78533,78534,78534,7,네이버,네이버 웨이브 이후에는 라인 프렌즈 캐릭터가,중립,100,0,0
78534,78535,78535,7,네이버,네이버 웨이브 ( wave ) 의,중립,100,0,0
78535,78536,78536,7,네이버,블루투스 스피커인 WAVE 는 핸드폰에서 네이버 클로버 앱을 다운받은 다음 연동할,중립,100,0,0
78536,78537,78537,7,네이버,네이버 내부에서 프로젝트를 추진할 때 코드명이,중립,100,0,0
78537,78538,78538,7,네이버,| 네이버 AI 플랫폼인 클로버와 연결하기 WAVE,중립,100,0,0
78538,78539,78539,7,네이버,개봉하고 나서 음악을 듣기 위해서는 네이버 뮤직에 가입되어 있어야 합니다,중립,100,0,0
78539,78540,78540,7,네이버,요 며칠어디선가 기사로 광고로 본 네이버 인공지능 스피커 이걸 왜 사는건가,긍정,100,0.056111626628175,1.3153940759725
78540,78541,78541,7,네이버,국내 스마트싱큐앱으로 네이버 클로바 웨이브와 연동이 가능하다,긍정,100,0.16137131736475,1.4931581828134
78541,78542,78542,7,네이버,앞으로도 네이버 서비스를 기반으로 지속적인 콘텐츠 추가와,중립,100,0,0
78542,78543,78543,7,네이버,오늘은 네이버 웨이브를 들고 왔습니다,중립,100,0,0
78543,78544,78544,7,네이버,NAVER WAVE 네이버 웨이브를 선물해드렸습니다,중립,100,0,0
78544,78545,78545,7,네이버,앞면은 웨이브 기기의 사진과 함께 네이버 라고 써있네요 좌측은 웨이브의 스펙들이,중립,100,0,0
78545,78546,78546,7,네이버,오늘로써 네이버 인공지능 ( AI ) 스피커,중립,100,0,0
78546,78547,78547,7,네이버,사용후기를 마치구요 저의 집에 설치된 네이버 샐리 사진을 예쁘게 찍어봤어요혹시 샐리와,긍정,100,0.10005579243714,1.5443151474267
78547,78548,78548,7,네이버,' 네이버 뮤직 무제한 듣기 1 년,중립,100,0,0
78548,78549,78549,7,네이버,네이버 검색창에 내가 궁금하거나 검색할 것들을,중립,100,0,0
78549,78550,78550,7,네이버,포털 중 가장 먼저 선보인 네이버 웨이브,중립,100,0,0
78550,78551,78551,7,네이버,먼저 선보인 네이버 웨이브,중립,100,0,0
78551,78552,78552,7,네이버,플레이 스토어 혹은 앱 스토어에서 네이버 클로바 ( Clova ) 앱을,중립,100,0,0
78552,78553,78553,7,네이버,없으면 기본적인 사용조차 어려운 건 네이버 웨이브 프렌즈 카카오 미니 모두의,부정,100,-0.10127566787725,-0.82009631875798
78553,78554,78554,7,네이버,특히 네이버 웨이브는 5GHz Wifi 를 잡지,중립,100,0,0
78554,78555,78555,7,네이버,자체의 기능이 가장 강력하다는 점은 네이버 웨이브의 장점이다,중립,100,0,0
78555,78556,78556,7,네이버,일례로 네이버 클로바의 유희 기능 중 하나인,중립,100,0,0
78556,78557,78557,7,네이버,를 ' 샐리야 ' ( 네이버 클로바 호출명령 중 하나 ),중립,100,0,0
78557,78558,78558,7,네이버,이 버튼이 네이버 뮤직 메뉴에 국한돼 있는 점은,중립,100,0,0
78558,78559,78559,7,네이버,네이버 웨이브의 정가는 15 만원,중립,100,0,0
78559,78560,78560,7,네이버,네이버 뮤직 무제한 듣기 정기결제 이용권,중립,100,0,0
78560,78561,78561,7,네이버,네이버 뮤직을 지원할 때 의미가 있는,긍정,100,0.091357332849239,0.90454785827604
78561,78562,78562,7,네이버,네이버 프렌즈 ( Naver Friends ),중립,100,0,0
78562,78563,78563,7,네이버,Friends ) 는 웨이브와 마찬가지로 네이버 클로바를 탑재했다,긍정,100,0.21607098477788,1.9537931034483
78563,78564,78564,7,네이버,샐리와 브라운 2 종으로 출시한 네이버 프렌즈는 재생 버튼이 있어 노래를,중립,100,0,0
78564,78565,78565,7,네이버,네이버 웨이브와 네이버 프렌즈 모두 네이버,중립,100,0,0
78565,78566,78566,7,네이버,네이버 웨이브와 네이버 프렌즈 모두 네이버 서비스를 음성으로,중립,100,0,0
78566,78567,78567,7,네이버,네이버 웨이브와 네이버 프렌즈 모두 네이버 서비스를 음성으로 활용할 수 있다,중립,100,0,0
78567,78568,78568,7,네이버,네이버 캘린더 네이버 메모 등을 활용하고,중립,100,0,0
78568,78569,78569,7,네이버,네이버 캘린더 네이버 메모 등을 활용하고 있다면 이를,중립,100,0,0
78569,78570,78570,7,네이버,음악은 네이버 뮤직 서비스와 연계한다,중립,100,0,0
78570,78571,78571,7,네이버,네이버 뮤직 서비스와 연계한다,중립,100,0,0
78571,78572,78572,7,네이버,음원 데이터베이스 측면에선 다른 서비스보다 네이버 뮤직이 한 발 뒤쳐진다는 평이,중립,100,0,0
78572,78573,78573,7,네이버,다행히 네이버 클로바 앱에서는 어떤 명령어를 이용자가,중립,100,0,0
78573,78574,78574,7,네이버,해외 음원을 자주 듣는다면 네이버 뮤직이 불만족스러울 수 있다,중립,100,0,0
78574,78575,78575,7,네이버,네이버 뮤직이 아닌 다른 서비스와 연결하지,중립,100,0,0
78575,78576,78576,7,네이버,네이버 프렌즈의 정가는 12 만 9,중립,100,0,0
78576,78577,78577,7,네이버,네이버 웨이브와 마찬가지로 네이버 뮤직 무제한,중립,100,0,0
78577,78578,78578,7,네이버,네이버 웨이브와 마찬가지로 네이버 뮤직 무제한 듣기 정기결제 이용권과,중립,100,0,0
78578,78579,78579,7,네이버,네이버 웨이브가 정전식 터치 버튼이었다면 카카오,중립,100,0,0
78579,78580,78580,7,네이버,네이버 또한 배달 음식 주문 쇼핑,중립,100,0,0
78580,78581,78581,7,네이버,바로 음악을 틀 수 있는 네이버 웨이브를 방에 들여놨다,중립,100,0,0
78581,78582,78582,7,네이버,네이버 웨이브를 방에 들여놨다,중립,100,0,0
78583,78584,78584,7,네이버,설치했다면 네이버,중립,100,0,0
78585,78586,78586,7,네이버,뭐냐고 그랬더니요즘 네이버뮤직에서 밀고 있는 네이버 인공지능스피커 ' 웨이브 WAVE ',중립,100,0,0
78586,78587,78587,7,네이버,LG 인터넷으로 갈아탔는데 사은품이 네이버 클로바 스피커 ㅎㅎ 사실 친정에,중립,100,0,0
78587,78588,78588,7,네이버,놀러 온 줄 ㅋㅋ 이상 네이버 클로바 개봉기 끝 처음 일주일은,긍정,100,0.1324603855689,1.2549400354303
78588,78589,78589,7,네이버,맘에 들었는데실물도 너무 귀여웠어요 ㅎㅎ 네이버 인공지능 스피커 프렌즈 구성품은 간단했어요설명서,긍정,100,0.12850488021295,1.1130434782609
78589,78590,78590,7,네이버,' 네이버 인공지능 스피커 프렌즈 ' 옆에,중립,100,0,0
78590,78591,78591,7,네이버,하고 ; ; ; ; 네이버 웨이브 ( WAVE ) 는,중립,100,0,0
78591,78592,78592,7,네이버,어제 슈퍼뚜기가 네이버 스마트렌즈 기능에 대해서 포스팅했는데요,중립,100,0,0
78592,78593,78593,7,네이버,AI 스피커 ( 카카오 미니 네이버 웨이브 ) 를 두고양사가 판촉,중립,100,0,0
78593,78594,78594,7,네이버,- 네이버 뮤직 무제한 듣기 1 년,중립,100,0,0
78594,78595,78595,7,네이버,불안한 네이버,부정,100,-0.49324324324324,-1
78595,78596,78596,7,네이버,NAVER 뮤직 신청하면 네이버 웨이브 인공지능 AI 스피커를 준다고,중립,100,0,0
78596,78597,78597,7,네이버,네이버 웨이브 AI 스피커가,중립,100,0,0
78597,78598,78598,7,네이버,모습아주 잘 알아 듣고 실행한다 네이버 웨이브 인공지능 스피커,중립,100,0,0
78598,78599,78599,7,네이버,네이버 클로바 플렌즈 인공지능 스피커가 유난히,중립,100,0,0
78599,78600,78600,7,네이버,nhn 기본적으로 네이버 클로바 앱을 다운 받아서 설정을,중립,100,0,0
78601,78602,78602,7,네이버,팟캐스트 틀어줘 ' 라고 하면 네이버 뮤직에서 검색을 해서 노래를 틀어주거나,중립,100,0,0
78602,78603,78603,7,네이버,실제 제가 작업을 하면서 활용한 네이버 클로버의 기능을 활용하면서 작업을 한,중립,100,0,0
78603,78604,78604,7,네이버,바로 귀여운 네이버 클로바 AI 인공지능 스피커가 책상에,긍정,100,0.14495073891626,1.4852216748768
78604,78605,78605,7,네이버,와 AI 인공지능 스피커 ' 네이버 클로바 ' 의 콜라보 패키지가,중립,100,0,0
78605,78606,78606,7,네이버,게다가 이번에 능률 토마토크와 네이버 클로버의 패키지 구성이 나왔어요,중립,100,0,0
78606,78607,78607,7,네이버,게다가 귀여운 네이버 클로바와 함께 할 수 있다니,긍정,100,0.19686840253343,1.4137931034483
78607,78608,78608,7,네이버,토마토크 완전 패키지와 함께 네이버 클로바 구성이에요,중립,100,0,0
78608,78609,78609,7,네이버,☆ 마지막으로 화룡점정 네이버 클로바 AI 인공지능 스피커까지 완벽한,긍정,100,0.10502153425601,1.2208106473079
78609,78610,78610,7,네이버,잘 할 수 있는 토마토크 네이버 클로바 패키지 가격도 75 %,중립,100,0,0
78610,78611,78611,7,네이버,완전 1 년 동안 수강권에 네이버 클로바까지 구성으로 혼자서도 영어공부를 할,긍정,100,0.11047989024388,1.7219850980209
78611,78612,78612,7,네이버,서핑 중 WAVE 라고 하는 네이버 인공지능 스피커를 알게 되었어요그리고 인공지능,중립,100,0,0
78612,78613,78613,7,네이버,네이버 인공지능 스피커 wave 음질도 좋고,긍정,100,0.14285714285714,1
78613,78614,78614,7,네이버,3 네이버 웨이브 ( WAVE ) 저희,중립,100,0,0
78614,78615,78615,7,네이버,정기결제해서 듣는데 웨이브 발매 당시에 네이버 뮤직에서 이벤트로 1 년 정기결제하면,중립,100,0,0
78615,78616,78616,7,네이버,뮤직에서 이벤트로 1 년 정기결제하면 네이버 웨이브를 주는 행사를 했었어요,중립,100,0,0
78616,78617,78617,7,네이버,참고로 지금 링케 케이스들은 지금 네이버 스토어팜에서 얼리버드로 50 % 프로모션,중립,100,0,0
78617,78618,78618,7,네이버,오늘의 포스팅은 인공지능 네이버 스피커 프렌즈에 대해 써볼까 합니다,중립,100,0,0
78618,78619,78619,7,네이버,몇칠 전 네이버 뮤직 1 년 가입을 하면,중립,100,0,0
78619,78620,78620,7,네이버,1 년 가입을 하면 인공지능 네이버 스피커 프렌즈를 나눠주는 행사를 하여고민하다,부정,100,0.026131835068005,-0.16898467962298
78620,78621,78621,7,네이버,행사를 하여고민하다 멜론 자동결재를 중단시키고 네이버 뮤직으로 옮겼답니다,부정,100,-0.042562164765555,-0.85592467795858
78621,78622,78622,7,네이버,멜론보다 싸다는 생각에 그리고 인공지능 네이버 스피커 프렌즈에 현혹되어 ㅋㅋㅋ 일단,긍정,100,0.034235730285008,0.82202797202797
78622,78623,78623,7,네이버,본인의 핸드폰과 네이버 클로버가 연동되어 인공지능으로 검색으로 음악,중립,100,0,0
78623,78624,78624,7,네이버,인공지능 네이버 스피커 프렌즈 어떠세요,중립,100,0,0
78624,78625,78625,7,네이버,네이버 인공지능 스피커인 프렌즈 솔직한 사용기를,긍정,100,0.13013015479019,1.2503435639029
78625,78626,78626,7,네이버,네이버 CLOVA 앱에서 디바이스를 선택하고 설정,중립,100,0,0
78626,78627,78627,7,네이버,음악의 경우 네이버 뮤직 스트리밍 사용자만 전곡 듣기가,중립,100,0,0
78627,78628,78628,7,네이버,네이버 자사 서비스를 활용하기 때문에 견고한,긍정,100,0.14694835680751,1.2816901408451
78628,78629,78629,7,네이버,네이버 뮤직을 사용하지 않는 분도 오디오로,부정,100,-0.10053718625544,-0.89830508474576
78629,78630,78630,7,네이버,네이버 인공지능 스피커 프렌즈는 자사 서비스인,중립,100,0,0
78630,78631,78631,7,네이버,라인 캐릭터 덕후이거나 네이버 서비스를 좋아하는 분 인공지능 스피커가,긍정,100,0.11651728553137,1.2816901408451
78631,78632,78632,7,네이버,그래도 예전 음성인식 시스템에 비해선 네이버 스피커 클로버는 아주성능이 월등히 좋아졌다고,중립,100,0,0
78632,78633,78633,7,네이버,얼마전에 네이버 인공지능 스피커 웨이브를 소개해드렸는데요 ㅋㅋ,중립,100,0,0
78633,78634,78634,7,네이버,ㅋㅋ 사실 네이버 인공지능 스피커를 이미 하나 갖고,중립,100,0,0
78634,78635,78635,7,네이버,그러다 네이버 페이에 포인트가 꽤 있길래,긍정,100,0.16,1
78635,78636,78636,7,네이버,네이버 인공지능 스피커를 쓰게되면서 좋았던 점은하루종일,긍정,100,0.10762051734274,0.96858465608466
78636,78637,78637,7,네이버,꺅 넘나 귀여운 네이버 프렌즈 스피커 샐리,긍정,100,0.16196817710135,1.1694915254237
78637,78638,78638,7,네이버,( 이미지 출처 - 네이버 웨이브 ) 그에 맞추어 해외에서는,긍정,100,0.11949058693245,1.2197674418605
78638,78639,78639,7,네이버,WAVE 네이버 인공지능 스피커 네이버 웨이브는 우리나라의,중립,100,0,0
78639,78640,78640,7,네이버,WAVE 네이버 인공지능 스피커 네이버 웨이브는 우리나라의 가장 대표적인 포털사이트인,중립,100,0,0
78640,78641,78641,7,네이버,클로바 ( Clova ) 와 네이버 뮤직을 묶은 서비스 입니다,중립,100,0,0
78641,78642,78642,7,네이버,네이버 웨이브는 4 개의 마이크 시스템과,중립,100,0,0
78642,78643,78643,7,네이버,( 이미지 출처 - 네이버 웨이브 ) 1 ) 샐리야,중립,100,0,0
78643,78644,78644,7,네이버,( 이미지 출처 - 네이버 웨이브 ) 2 ) 샐리야,중립,100,0,0
78644,78645,78645,7,네이버,외출 준비만으로도 바쁜 당신을 위해 네이버 웨이브에서는 매일 아침날씨와 일정을 브리핑,중립,100,0,0
78645,78646,78646,7,네이버,( 이미지 출처 - 네이버 웨이브 ) 3 ) 샐리야,중립,100,0,0
78646,78647,78647,7,네이버,포털사이트인 네이버의 방대한 지식 정보를 네이버 웨이브를 통해서 그때 그때 검색하실,중립,100,0,0
78647,78648,78648,7,네이버,( 이미지 출처 - 네이버 웨이브 ) 4 ) 샐리야,중립,100,0,0
78648,78649,78649,7,네이버,네이버 웨이브의 가장 큰 특징이라고도 할,중립,100,0,0
78649,78650,78650,7,네이버,스마트폰 내 손안의 인공지능 비서 네이버 클로바 앱을 소개합니다,중립,100,0,0
78650,78651,78651,7,네이버,내 손안의 인공지능 비서 ' 네이버 클로바 ' 베타 버전,중립,100,0,0
78651,78652,78652,7,네이버,네이버 클로바앱은 음성 기반의 인공지능 비서,중립,100,0,0
78652,78653,78653,7,네이버,등생활에 필요한 다양한 서비스를 이제 네이버 클로바앱으로 사용해보세요,중립,100,0,0
78653,78654,78654,7,네이버,' 궁금할 때도 네이버 클로바앱에 말해주세요,중립,100,0,0
78654,78655,78655,7,네이버,대화하자 ' 점점 더 똑똑해지는 네이버 클로바앱을 기대하세요,긍정,100,0.30464026069309,1.3251105216622
78655,78656,78656,7,네이버,본격적으로 음성인식 스피커 시장에 뛰어들었는데요 네이버 웨이브가 테스트 형태의 제품이었따면 이제,중립,100,0,0
78656,78657,78657,7,네이버,네이버 프렌즈 스피커의 귀여운 점은 캐릭터,긍정,100,0.16071428571429,1
78657,78658,78658,7,네이버,네이버 프렌즈 스피커는 10 월 26,중립,100,0,0
78658,78659,78659,7,네이버,만 9 천원이나 웨이브와 마찬가지로 네이버 뮤직 1 년 이용권을 포함해,중립,100,0,0
78659,78660,78660,7,네이버,이후 온라인으로는 네이버 스토어 라인프렌즈 온라인 스토어를 통해,중립,100,0,0
78660,78661,78661,7,네이버,지금까지 곧 출시를 앞둔 네이버 프렌즈 스피커에 대해 알아보았습니다,중립,100,0,0
78661,78662,78662,7,네이버,기가지니 그리고 올 여름 공개될 네이버 - 라인의 클로바가 탑재된 ',중립,100,0,0
78662,78663,78663,7,네이버,네이버 - 라인의 합장 인공지능 클로바가,중립,100,0,0
78663,78664,78664,7,네이버,네이버 - 라인의 클로바에 비하면 아직까지,중립,100,0,0
78664,78665,78665,7,네이버,시장이 점점 커지고 있는 가운데 네이버 웨이브에 이어 카카오에서도 음성인식 스피커,중립,100,0,0
78665,78666,78666,7,네이버,SKT 누구나 네이버 웨이브의 프로모션 가격이 99000 원이었는데,중립,100,0,0
78666,78667,78667,7,네이버,이런저런 프로모션으로 기기를 판매하고 있습니다라인 네이버 뿐만 아니라 여러회사에서 그렇죠그 중에,중립,100,0.0080752926919224,0.11011652114156
78667,78668,78668,7,네이버,네이버 뮤직 1 년 이용권 구매하면,중립,100,0,0
78668,78669,78669,7,네이버,위해 구매한 네이버뮤직 이용권을 위해 네이버 뮤직앱도 갈아줬어요아 이건 좀 아닌,부정,100,-0.040504128639722,-0.69230769230769
