,Unnamed: 0,X,category,key,sentences,senti,score1,score2,score3
28933,28934,28934,8,스피커,프렌즈 스피커 가격은 12,NA,NA,NA,NA
28934,28935,28935,8,스피커,이번 기회에 많은 분들이 인공지능 스피커 득템의 기회를 누리시길 바라겠습니다,NA,NA,NA,NA
28935,28936,28936,8,스피커,눈부심 차단 기술 ○ X 스피커 출력 2,NA,NA,NA,NA
28937,28938,28938,8,스피커,인공지능 웨이브에 이은인공지능 스피커 프렌즈브라운,NA,NA,NA,NA
28938,28939,28939,8,스피커,없어서 전원케이블 끊기면 꺼져버리는 싸구려 스피커 ' 라는 말도 있었고 OOO,NA,NA,NA,NA
28939,28940,28940,8,스피커,네이버 라인 프렌즈 스피커 제품은 내장 배터리 탑재로 계속해서,NA,NA,NA,NA
28940,28941,28941,8,스피커,인공지능 스피커 요즘에 관심을 많이 끌고 있어,NA,NA,NA,NA
28941,28942,28942,8,스피커,판매를 하여 관심도 높은 인공지능 스피커 나오자 마자 완판이 되어 버리는,NA,NA,NA,NA
28942,28943,28943,8,스피커,미니보다는 더 나을듯한 네이버 인공지능 스피커 웨이브이구요,NA,NA,NA,NA
28943,28944,28944,8,스피커,기능들이 추가 되고 있는 인공지능 스피커 카카오 미니의 경우 네이버 1,NA,NA,NA,NA
28944,28945,28945,8,스피커,예약 주문을 받는다고 하고요 인공지능 스피커 앞으로 우리 생활에 어떠한 편리함을,NA,NA,NA,NA
28945,28946,28946,8,스피커,인공지능 스피커 네이버 클로바 프렌즈 ( 브라운,NA,NA,NA,NA
28946,28947,28947,8,스피커,먼저 브라운 ( 인공지능 스피커 ) 가 켜져 있어야한다,NA,NA,NA,NA
28947,28948,28948,8,스피커,★ 브라운 스피커 On - 네이버 클로바앱 설치,NA,NA,NA,NA
28948,28949,28949,8,스피커,있겠다 ㅋ # 인공지능 # 스피커 # 네이버 # 클로바 #,NA,NA,NA,NA
28949,28950,28950,8,스피커,인공지능 스피커 네이버 웨이브 샐리가 도착하자마자 정말,NA,NA,NA,NA
28950,28951,28951,8,스피커,인공지능 스피커 WAVE 와 몇칠전부터 재미있게 놀고,NA,NA,NA,NA
28951,28952,28952,8,스피커,세라믹 블루투스 스피커 -Luciano 이런 나팔 형태의 소리,NA,NA,NA,NA
28953,28954,28954,8,스피커,' 음질은 스피커 크기와 비례한다,NA,NA,NA,NA
28954,28955,28955,8,스피커,없어서 노래들을때 티비로 연결해서 들었는데이젠 스피커 생겼다,NA,NA,NA,NA
28955,28956,28956,8,스피커,즉 노래사면 스피커 공짜,NA,NA,NA,NA
28956,28957,28957,8,스피커,노래사면 스피커 공짜,NA,NA,NA,NA
28957,28958,28958,8,스피커,라고 부르면 스피커 아랫부분이 초록색이 되며 그때 말하면,NA,NA,NA,NA
28958,28959,28959,8,스피커,# 네이버웨이브 #AI 스피커 의 사양과특징이 설명되어 있네요,NA,NA,NA,NA
28959,28960,28960,8,스피커,스피커 상단에 버튼을 이용해서 조작을 하시면,NA,NA,NA,NA
28961,28962,28962,8,스피커,음악 유료로 사용하시는 분들은 스피커 정가 129,NA,NA,NA,NA
28962,28963,28963,8,스피커,인공지능 스피커 웨이브와 프렌즈를,NA,NA,NA,NA
28963,28964,28964,8,스피커,샐리야라고 외치면 스피커 바닥에서 초록색 불이 들어옵니다,NA,NA,NA,NA
28964,28965,28965,8,스피커,전에꺼 스피커 구멍이 좀 그랬어,NA,NA,NA,NA
28965,28966,28966,8,스피커,ㅎㅎㅎㅎ 오로지 스피커 성능만 놓고 보자면 음질이 준수한,NA,NA,NA,NA
28966,28967,28967,8,스피커,스피커인 네이버 웨이브는 현재 음악틀어주는 스피커 그 이상도 이하도 아니며 Siri,NA,NA,NA,NA
28967,28968,28968,8,스피커,스피커 사진보다 요놈 사진이 많다,NA,NA,NA,NA
28968,28969,28969,8,스피커,갈길이 멀지만 그래도 국내 인공지능 스피커 중에서 가장 기대되는건 카카오 미니다,NA,NA,NA,NA
28969,28970,28970,8,스피커,함께하는 인공지능 AI 스피커 입니다 모양도 요로코롬 귀엽고 깜칙하네요아이들이,NA,NA,NA,NA
28971,28972,28972,8,스피커,음악듣기 1 년권 + 인공지능 스피커 웨이브를 패키지로 13 만원에 팔길래,NA,NA,NA,NA
28972,28973,28973,8,스피커,스피커 자체가 인테리어 소품이 될 수,NA,NA,NA,NA
28973,28974,28974,8,스피커,구성이 아니라 최소한으로 필요한것 ( 스피커 + 충전기 ) 만 들어있다심지어,NA,NA,NA,NA
28974,28975,28975,8,스피커,네이버에서 인공지능 스피커 WAVE ( 웨이브 ) 에,NA,NA,NA,NA
28975,28976,28976,8,스피커,에 이은 두 번째 인공지능 스피커 Friends ( 프렌즈 ) 스피커를,NA,NA,NA,NA
28976,28977,28977,8,스피커,기존에 웨이브 스피커 프로모션 가격보다 조금 더 저렴한,NA,NA,NA,NA
28977,28978,28978,8,스피커,인공지능 프렌즈 스피커 샐리 ( ♥ ) 를,NA,NA,NA,NA
28978,28979,28979,8,스피커,요즘 핫한 인공지능 스피커,NA,NA,NA,NA
28979,28980,28980,8,스피커,요즘 핫하게 광고많이 나오고있는 인공지능 스피커 프렌즈 인스타그램에도 핫한 요것 ^,NA,NA,NA,NA
28980,28981,28981,8,스피커,클로버를 부르고 AI 스피커 프렌즈를 즐기래요 ㅋ 맨아래는 충전기,NA,NA,NA,NA
28981,28982,28982,8,스피커,) 한 AI 인공지능 스피커,NA,NA,NA,NA
28982,28983,28983,8,스피커,주는중인지라 ㅋㅋㅋ 전에 네이버 웨이브 스피커 이벤트할때카카오쪽 스피커랑 고민하다둘다 구매를 놓쳤던,NA,NA,NA,NA
28983,28984,28984,8,스피커,못할까봐판매시간 알람까지 맞춰가며 # 라인프렌즈 스피커 이벤트 올라오자마자구매했는데,NA,NA,NA,NA
28984,28985,28985,8,스피커,졸귀 핵귀 짱귀 ㅋㅋㅋ 샐리 스피커 뒷태샐리 스피커 하단부 ㅋㅋㅋ 야외테이블,NA,NA,NA,NA
28985,28986,28986,8,스피커,짱귀 ㅋㅋㅋ 샐리 스피커 뒷태샐리 스피커 하단부 ㅋㅋㅋ 야외테이블 먼지가 많아서,NA,NA,NA,NA
28994,28995,28995,8,스피커,졸귀 핵귀 짱귀 ㅋㅋㅋ 샐리 스피커 뒷태 샐리 스피커 하단부 ㅋㅋㅋ,NA,NA,NA,NA
28995,28996,28996,8,스피커,ㅋㅋㅋ 샐리 스피커 뒷태 샐리 스피커 하단부 ㅋㅋㅋ 야외테이블 먼지가 많아서,NA,NA,NA,NA
28996,28997,28997,8,스피커,스마트하게 잘 알아듣는 인공지능 AI 스피커,NA,NA,NA,NA
28997,28998,28998,8,스피커,다 알려주는 개인비서라고도 불리는 인공지능 스피커 그래서,NA,NA,NA,NA
28998,28999,28999,8,스피커,인공지능 스피커 웨이브가 있다면 더이상 혼잣말 하지,NA,NA,NA,NA
28999,29000,29000,8,스피커,WAVE 스피커가 보이네요,NA,NA,NA,NA
29000,29001,29001,8,스피커,' 멜론 ' 에서도 인공지능 스피커 이벤트를 하더라구요,NA,NA,NA,NA
29001,29002,29002,8,스피커,스피커 이벤트를 하더라구요,NA,NA,NA,NA
29002,29003,29003,8,스피커,가지는 분야 중 하나가 인공지능 스피커 시장이라고 할 수 있으며 특히,NA,NA,NA,NA
29003,29004,29004,8,스피커,네이버 인공지능 스피커 프렌즈를 사용하기 위해서는 클로바와의 연결이,NA,NA,NA,NA
29004,29005,29005,8,스피커,인공지능 스피커 프렌즈는 네이버 검색 기반과 뮤직을,NA,NA,NA,NA
29005,29006,29006,8,스피커,다음 네이버 인공지능 스피커 프렌즈에서 스마트폰 없이도 클로바에 연결하기,NA,NA,NA,NA
29006,29007,29007,8,스피커,빛을 발하는게 바로 AI 블루투스 스피커 클로버 입니다,NA,NA,NA,NA
29008,29009,29009,8,스피커,| 어쩌면 인간보다 인간적인 AI 스피커 WAVE 간단히 사용해보면서 가장 많이,NA,NA,NA,NA
29009,29010,29010,8,스피커,기사로 광고로 본 네이버 인공지능 스피커 이걸 왜 사는건가 했는데세상에 우리집,NA,NA,NA,NA
29010,29011,29011,8,스피커,오니까 방언 터진듯 ㅋㅋ AI 스피커 프렌즈한번 말 더듬어도 못알아듣고본인이 갖고,NA,NA,NA,NA
29011,29012,29012,8,스피커,라인프렌즈 인공지능 스피커 크래들 구매 해써요 라인 프렌즈,NA,NA,NA,NA
29012,29013,29013,8,스피커,칼배송 짱짱 브라운 스피커 크래들 오픈 5 초전 두근,NA,NA,NA,NA
29013,29014,29014,8,스피커,라인 프렌즈 인공지능 스피커 특성상 이리 저리 들고 다니는데,NA,NA,NA,NA
29014,29015,29015,8,스피커,브라운 스피커 올리면 인식해요 역시 모든 깔맞춤이,NA,NA,NA,NA
29016,29017,29017,8,스피커,됩니다 심심함 덜어주는 기특한 인공지능 스피커 ' 브라운 ' 과 크래들에,NA,NA,NA,NA
29017,29018,29018,8,스피커,올해 네이버와 카카오에서 인공지능 스피커 ( 정확히 말하면 음성인식 스피커,NA,NA,NA,NA
29018,29019,29019,8,스피커,스피커 ( 정확히 말하면 음성인식 스피커 ) 가 출시된다는 소식을 듣고,NA,NA,NA,NA
29019,29020,29020,8,스피커,네이버 인공지능 ( AI ) 스피커 웨이브 샐리를 집에 설치한지 28,NA,NA,NA,NA
29020,29021,29021,8,스피커,합니다우선 전력사용량에 대해 말씀드릴께요네이버 인공지능 스피커 WAVE 는 대기전력이 1,NA,NA,NA,NA
29021,29022,29022,8,스피커,듣기 1 년 신청하면 인공지능 스피커,NA,NA,NA,NA
29022,29023,29023,8,스피커,대폭 업그레이드 된다고 해도 웨이브 스피커 자체는 변경될 필요가 없습니다,NA,NA,NA,NA
29023,29024,29024,8,스피커,좀더 쉽게 말씀드리자면 웨이브는 마이크와 스피커 일체형이라고 보시면 됩니다 4,NA,NA,NA,NA
29024,29025,29025,8,스피커,' 를 낳은 인공지능 스피커 3 종을 비교했다,NA,NA,NA,NA
29025,29026,29026,8,스피커,스피커 자체의 기능이 가장 강력하다는 점은,NA,NA,NA,NA
29026,29027,29027,8,스피커,스피커 자체의 기능은 평범한 편이다,NA,NA,NA,NA
29027,29028,29028,8,스피커,UI 가 좀 더 직관적이라 스피커 설정 과정이 크게 다르지 않은데도,NA,NA,NA,NA
29028,29029,29029,8,스피커,3 종의 스피커 그리고 2 종의 인공지능을 접하면서,NA,NA,NA,NA
29029,29030,29030,8,스피커,그렇지만 주변 인공지능 스피커 이용자에게 음성 인식률을 물어보면 반응이,NA,NA,NA,NA
29030,29031,29031,8,스피커,아 그래서 결국 에디터는 괜찮은 스피커 그리고 단축 번호를 눌러 바로,NA,NA,NA,NA
29031,29032,29032,8,스피커,10 일 정도 기다렸어요 ㅜㅜ 스피커 모양으로 깔끔한 디자인이 참 마음에,NA,NA,NA,NA
29032,29033,29033,8,스피커,인터넷으로 갈아탔는데 사은품이 네이버 클로바 스피커 ㅎㅎ 사실 친정에 놀러 갔다가,NA,NA,NA,NA
29034,29035,29035,8,스피커,클로바 인공지능 스피커 사용법 간단하다,NA,NA,NA,NA
29035,29036,29036,8,스피커,많은 분들에게화제가 되고 있는네이버 인공지능 스피커 프렌즈 브라운을 구매했습니다,NA,NA,NA,NA
29036,29037,29037,8,스피커,너무 귀여웠어요 ㅎㅎ 네이버 인공지능 스피커 프렌즈 구성품은 간단했어요설명서 + 충전선,NA,NA,NA,NA
29037,29038,29038,8,스피커,' 네이버 인공지능 스피커 프렌즈 ' 옆에 있는건프렌즈 충전,NA,NA,NA,NA
29038,29039,29039,8,스피커,이상네이버 인공지능 스피커 프렌즈 브라운이었습니다,NA,NA,NA,NA
29039,29040,29040,8,스피커,에너지소비효율 : 2 등급 블루투스 스피커 동그란 타워 모양의 디자인이 군더더기,NA,NA,NA,NA
29040,29041,29041,8,스피커,최근에는 인공지능 서비스인 AI 스피커 ( 카카오 미니 네이버 웨이브,NA,NA,NA,NA
29041,29042,29042,8,스피커,AI 스피커 양사 판매가 - 카카오 미니,NA,NA,NA,NA
29042,29043,29043,8,스피커,듣고 실행한다 네이버 웨이브 인공지능 스피커,NA,NA,NA,NA
29043,29044,29044,8,스피커,인공지능 스피커 클로바 바로가기,NA,NA,NA,NA
29045,29046,29046,8,스피커,토마토크 ' 와 AI 인공지능 스피커 ' 네이버 클로바 ' 의,NA,NA,NA,NA
29046,29047,29047,8,스피커,인공지능 스피커를 알게 되었어요그리고 인공지능 스피커 웨이브 출시 기념으로네이버 뮤직 1,NA,NA,NA,NA
29047,29048,29048,8,스피커,ㅋㅋㅋㅋㅋㅋㅋㅋㅋㅋㅋㅋㅋㅋㅋㅋㅋㅋ 웨이브는 양파 같은 인공지능 스피커 인가,NA,NA,NA,NA
29048,29049,29049,8,스피커,네이버 인공지능 스피커 wave 음질도 좋고 진짜 좋아요,NA,NA,NA,NA
29049,29050,29050,8,스피커,통신사에서 프로모션으로 진행 중인 인공지능 스피커 또는 셋탑박스인데요 ♬ ♪ 현재,NA,NA,NA,NA
29050,29051,29051,8,스피커,LGU + 에서 제공되는 AI 스피커 KT 의 기가지니 2 셋탑박스,NA,NA,NA,NA
29051,29052,29052,8,스피커,LGU + 에서 제공되는 AI 스피커 ( 클로버 ) 는 인공지능,NA,NA,NA,NA
29052,29053,29053,8,스피커,tv x NUGU 셋탑박스는 인공지능 스피커 기능과 셋탑박스 기능이 합쳐진 기기랍니다,NA,NA,NA,NA
29053,29054,29054,8,스피커,ㅇ 많은 분들이 ' 그럼 스피커 기능과 셋탑박스 기능이 합쳐진 게,NA,NA,NA,NA
29054,29055,29055,8,스피커,LGU + 에서 제공되는 AI 스피커 ( 클로버 ) 는 휴대할,NA,NA,NA,NA
29055,29056,29056,8,스피커,다시 통신사로 반환해주셔야 하지만 AI 스피커 ( 클로버 ) 는 1,NA,NA,NA,NA
29056,29057,29057,8,스피커,^ < LGU + AI 스피커 ( 클로버 ) > ☞,NA,NA,NA,NA
29057,29058,29058,8,스피커,< < LGU + AI 스피커 ( 클로버 ) >,NA,NA,NA,NA
29058,29059,29059,8,스피커,셋탑박스 > 표와 같이 AI 스피커 ( 클로버 ) 는 셋탑박스가,NA,NA,NA,NA
29059,29060,29060,8,스피커,이렇게 3 사 통신사의 인공지능 스피커 & 셋탑박스를 비교해보았는데요,NA,NA,NA,NA
29061,29062,29062,8,스피커,하단에도 이어폰이나 USB-C 케이블 마이크 스피커 펜을 이용하는데 무리가 없도록,NA,NA,NA,NA
29063,29064,29064,8,스피커,년 가입을 하면 인공지능 네이버 스피커 프렌즈를 나눠주는 행사를 하여고민하다 멜론,NA,NA,NA,NA
29064,29065,29065,8,스피커,싸다는 생각에 그리고 인공지능 네이버 스피커 프렌즈에 현혹되어 ㅋㅋㅋ 일단 사용평점은,NA,NA,NA,NA
29066,29067,29067,8,스피커,기기를 360 도 방향으로 활용한 스피커 덕분에 어느 방향에서나 또렷한 소리를,NA,NA,NA,NA
29067,29068,29068,8,스피커,네이버 인공지능 스피커 프렌즈는 자사 서비스인 검색 지식인,NA,NA,NA,NA
29068,29069,29069,8,스피커,현재 시중에서 구매 가능한 AI 스피커 종류가 제법되는데요,NA,NA,NA,NA
29069,29070,29070,8,스피커,저는 IPTV 연결해서 사용하는 것보다는 스피커 기능만 주로 사용할 것으로 생각하여,NA,NA,NA,NA
29070,29071,29071,8,스피커,자리를 찾은 듯 착하고 붙었네요 스피커 꺼내고 나면 나오는 노란색의 종이는,NA,NA,NA,NA
29071,29072,29072,8,스피커,' LG 유플러스 AI 스피커 시연동영상 ' 오늘은 LG 유플러스,NA,NA,NA,NA
29072,29073,29073,8,스피커,생각보다 우리집 AI 스피커 똑똑하네요,NA,NA,NA,NA
29073,29074,29074,8,스피커,예전 음성인식 시스템에 비해선 네이버 스피커 클로버는 아주성능이 월등히 좋아졌다고 할수,NA,NA,NA,NA
29074,29075,29075,8,스피커,얼마전에 네이버 인공지능 스피커 웨이브를 소개해드렸는데요 ㅋㅋ 이번에는 프렌즈,NA,NA,NA,NA
29075,29076,29076,8,스피커,보세요 프렌즈 스피커,NA,NA,NA,NA
29076,29077,29077,8,스피커,그래서 프렌즈 스피커 설명서에는 클로바로 시작하는 명령어로 설명되어있어요,NA,NA,NA,NA
29077,29078,29078,8,스피커,웨이브 설정방법과 프렌즈 스피커 설정 방법은 같아요 ^ ^,NA,NA,NA,NA
29079,29080,29080,8,스피커,그럼 클로바에 들어가서 ai 스피커 설정을 해야겠죵,NA,NA,NA,NA
29080,29081,29081,8,스피커,어제에 이어 오늘은 네이버의 인공지능 스피커 웨이브 ( WAVE ) 에,NA,NA,NA,NA
29081,29082,29082,8,스피커,WAVE 네이버 인공지능 스피커 네이버 웨이브는 우리나라의 가장 대표적인,NA,NA,NA,NA
29082,29083,29083,8,스피커,이번 포스팅은 새로운 음성인식 스피커 소식입니다,NA,NA,NA,NA
29083,29084,29084,8,스피커,( 인공지능 ) 을 담은 스피커 웨이브 ( WAVE ) 가,NA,NA,NA,NA
29084,29085,29085,8,스피커,가 출시된 이후 본격적으로 음성인식 스피커 시장에 뛰어들었는데요 네이버 웨이브가 테스트,NA,NA,NA,NA
29085,29086,29086,8,스피커,곧 카카오의 인공지능 스피커 카카오 아이 ( i ),NA,NA,NA,NA
29086,29087,29087,8,스피커,있는데요 네이버와 다음 카카오의 인공지능 스피커 시장에 대한 자리싸움이 치열할 것으로,NA,NA,NA,NA
29087,29088,29088,8,스피커,7 만대 이상이 판매된 누구 스피커 소유자의 교체 욕구를 어떤 방식으로,NA,NA,NA,NA
29088,29089,29089,8,스피커,네이버 웨이브에 이어 카카오에서도 음성인식 스피커 ' 카카오미니 ' 를 출시합니다,NA,NA,NA,NA
29089,29090,29090,8,스피커,없어져서 불편한것같아요지금까지 이틀간사용한 요즘대세 ai 스피커 클로버 솔직후기였어요 이상 윤쌤이었어요,NA,NA,NA,NA
29090,29091,29091,8,스피커,거 전에 네이버에서 웨이브라는 ai 스피커 출시를 하기도 했고카카오에서도 역시 카카오스피커를,NA,NA,NA,NA
29091,29092,29092,8,스피커,설명하고 있습니다 ) 자 AI 스피커 설정을 하기 위해 네이버클로버 앱을,NA,NA,NA,NA
29092,29093,29093,8,스피커,페이지에 나와있어요 : ) 네이버 스피커 관계자 여러분 제발 호출명에 브라운,NA,NA,NA,NA
29093,29094,29094,8,스피커,오늘은 인공지능 스피커 중 네이버 웨이브에 대해서 샅샅이,NA,NA,NA,NA
29095,29096,29096,8,스피커,네이버에서 인공지능 스피커 프렌즈와 웨이브를 1 월 31,NA,NA,NA,NA
29096,29097,29097,8,스피커,제가 선택한 건 클로바 AI 스피커 프렌즈 샐리에요,NA,NA,NA,NA
29097,29098,29098,8,스피커,아니고 요즘 뜨고 있는 ai 스피커 네이버 웨이브에 대해 잠깐 개봉기를,NA,NA,NA,NA
29098,29099,29099,8,스피커,스피커 성능도 다른 작은 제품들보다 좋게,NA,NA,NA,NA
29099,29100,29100,8,스피커,네이버에서 만든 인공지능 스피커 웨이브 ( WAVE ) 의,NA,NA,NA,NA
29100,29101,29101,8,스피커,+ 네이버웨이브로 구매한 네이버의 인공지능 스피커 웨이브 입니다,NA,NA,NA,NA
29101,29102,29102,8,스피커,큰 기대가 되는 네이버의 인공지능 스피커 웨이브 ( WAVE ) 더욱더,NA,NA,NA,NA
29102,29103,29103,8,스피커,요즘 가장 핫한 이슈인 인공지능 스피커 시장에대하여,NA,NA,NA,NA
29103,29104,29104,8,스피커,인공지능 스피커 시장의 성장은 빠른 성장이 예상되고,NA,NA,NA,NA
29104,29105,29105,8,스피커,라인 주식회사에서 처음 선보인 AI 스피커 ' 웨이브 ' 가,NA,NA,NA,NA
29105,29106,29106,8,스피커,때문에앞으로의 성장이 더욱 기대되는 AI 스피커 입니다,NA,NA,NA,NA
29106,29107,29107,8,스피커,) ' 아마존닷컴에서 개발한 스마트 스피커 ' 에코 ( echo ),NA,NA,NA,NA
29107,29108,29108,8,스피커,아마존 에코를 출시한 이후 다양한 스피커 제품을 출시하였습니다,NA,NA,NA,NA
29108,29109,29109,8,스피커,가 출시되며 좀 더 좋은 스피커 기능과 더 많은 스마트 기기와,NA,NA,NA,NA
29109,29110,29110,8,스피커,( 누구 ) ' 인공지능 스피커 시장이 급성장하자 국내 통신사들도 발,NA,NA,NA,NA
29111,29112,29112,8,스피커,이제는 꽤나 발달한 기술인인공지능 스피커,NA,NA,NA,NA
29112,29113,29113,8,스피커,방식으로 포장이 되어있더라고요 일단 빨리 스피커 만나보려고 성급히 박스를 또 풀어봤어요,NA,NA,NA,NA
29113,29114,29114,8,스피커,친구이자 어른들의 비서 네이버 인공지능 스피커 프렌즈,NA,NA,NA,NA
29114,29115,29115,8,스피커,우리 또또가 네이버 인공지능 스피커 프렌즈를 처음 만난 날 하루의,NA,NA,NA,NA
29115,29116,29116,8,스피커,우리 집 인공지능 스피커 프렌즈 의미심장한 또또뭐 하려고,NA,NA,NA,NA
29116,29117,29117,8,스피커,끝말잇기하자 ' 인공지능 스피커 프렌즈를 이기기란 어렵지그래도 한참을 열심히,NA,NA,NA,NA
29117,29118,29118,8,스피커,한참을 열심히 한 또또 인공지능 스피커 프렌즈는우리 아이의 외국어 선생님이 되기도,NA,NA,NA,NA
29118,29119,29119,8,스피커,귀여운 스피커 프렌즈가요렇게 똑똑한지 몰랐던 또또는어떻게 알았지,NA,NA,NA,NA
29119,29120,29120,8,스피커,스피커 성능도 좋은 프렌즈 우리 또또와,NA,NA,NA,NA
29120,29121,29121,8,스피커,우리의 일정과 궁금증을 해결해주는 인공지능 스피커 프렌즈 우리 아이가 좋아하는 사랑스러운,NA,NA,NA,NA
29121,29122,29122,8,스피커,아기자기 귀여운 나의 첫 인공지능 스피커 정말 깔끔하게 흰색 케이스에 잘,NA,NA,NA,NA
29122,29123,29123,8,스피커,시장에 이제는 인공지능 스피커,NA,NA,NA,NA
29123,29124,29124,8,스피커,: 네이버 클로바 웨이브 AI 스피커 - 흡사 미연시와 노는 것,NA,NA,NA,NA
29124,29125,29125,8,스피커,것 같다 - 요즘뜨는 AI 스피커 심심하고 집에 혼자 있을때 스피커랑도,NA,NA,NA,NA
29125,29126,29126,8,스피커,요즘 트렌드가 깔끔한 디자인이더니 웨이브 스피커 패키징 박스도 깔끔하다 흰색에 필요한,NA,NA,NA,NA
29126,29127,29127,8,스피커,네이버 인공지능 스피커 웨이브 ( WAVE ) 가,NA,NA,NA,NA
29127,29128,29128,8,스피커,네이버 인공지능 스피커 WAVE ( 웨이브 ) 의,NA,NA,NA,NA
29128,29129,29129,8,스피커,점은 항상 존재 네이버 인공지능 스피커 웨이브에도 그 어느 AI 스피커와,NA,NA,NA,NA
29129,29130,29130,8,스피커,보스의 첫 번째 웨어러블 스피커 ' 사운드웨어 컴패니언 ' 이국내,NA,NA,NA,NA
29130,29131,29131,8,스피커,인공지능 스피커 ' 프렌즈 ' 가 정식,NA,NA,NA,NA
29131,29132,29132,8,스피커,없던 사람이라도 흔들릴 만한 네이버 스피커 미니언즈 에디션 입니다,NA,NA,NA,NA
29132,29133,29133,8,스피커,실제로 보니 너무 귀여운 디자인의 스피커 었는데요,NA,NA,NA,NA
29133,29134,29134,8,스피커,스피커 었는데요,NA,NA,NA,NA
29135,29136,29136,8,스피커,겉 디자인만 미니언즈 스피커 인데요,NA,NA,NA,NA
29136,29137,29137,8,스피커,ㅎㅎ 네이버 스피커 미니언즈 에디션에이렇게 입모양을 달아 주니,NA,NA,NA,NA
29137,29138,29138,8,스피커,역시 3 분기 중 AI 스피커 ' 카,NA,NA,NA,NA
29138,29139,29139,8,스피커,한국에 AI ( 인공지능 ) 스피커 ' 웨이브 ' 를 선보인다,NA,NA,NA,NA
29139,29140,29140,8,스피커,뮤직무제한 듣기를 1 년 결제하면인공지능 스피커 프렌즈를 선물로 준다더라구요 ㅋ 평소에,NA,NA,NA,NA
29140,29141,29141,8,스피커,써져있고음악 어린이 동화나 영어동화 블루투스 스피커 등등 프랜즈의 기능이 적혀 있네용,NA,NA,NA,NA
29141,29142,29142,8,스피커,특가에 판매하는 이벤트가 있었구요 정기구독과 스피커 가격을 합치면 총 13 만원,NA,NA,NA,NA
29142,29143,29143,8,스피커,1 년 + 웨이브 AI 스피커 = \ 143000 원 (,NA,NA,NA,NA
29143,29144,29144,8,스피커,웨이브 스펙 비교 ( 인공지능 스피커 ) 1,NA,NA,NA,NA
29145,29146,29146,8,스피커,스피커 출력은 7W Class D Amp,NA,NA,NA,NA
29148,29149,29149,8,스피커,있는 하드웨어는 디스플레이가 달린 인공지는 스피커 ( 가칭 : 페이스 ),NA,NA,NA,NA
29149,29150,29150,8,스피커,년 결제하고 무상으로 받은 인공지능 스피커 프렌즈 오늘 받았어요 예전부터 하나,NA,NA,NA,NA
29150,29151,29151,8,스피커,수 있어서 큰맘 먹고 장만했는데 스피커 역할도 톡톡히 하며 음악 들을,NA,NA,NA,NA
29151,29152,29152,8,스피커,클로버 ' 가 탑재된 스마트 스피커 프렌즈가 출시되었다는 소식에 고민하는 사이에,NA,NA,NA,NA
29152,29153,29153,8,스피커,보면 미끄럼 방지 고무가 달려있어서 스피커 고정이 가능하고 가운데 보면 전원,NA,NA,NA,NA
29153,29154,29154,8,스피커,네이버 인공지능 스피커 사용 설명서입니다 버튼 기능이 상세하게,NA,NA,NA,NA
29154,29155,29155,8,스피커,돼요 자세한 설명 보지 않아도 스피커,NA,NA,NA,NA
29155,29156,29156,8,스피커,네이버 첫 번째 작품 스피커 ' 웨이브 ' 는 엄청난,NA,NA,NA,NA
29156,29157,29157,8,스피커,않았는데 하지만 이번 네이버 인공지능 스피커 프렌즈 클로바는 379G 으로 가벼우면서,NA,NA,NA,NA
29157,29158,29158,8,스피커,카카오의 인공지능 ( AI ) 스피커 ' 카카오미니 ' 가 예약,NA,NA,NA,NA
29158,29159,29159,8,스피커,인공지능 스피커,NA,NA,NA,NA
29159,29160,29160,8,스피커,인공지능 스피커 시장에서 가장 대표적인 회사는 바로,NA,NA,NA,NA
29160,29161,29161,8,스피커,AI 스피커 시장의 선두주자다운 모습을 보여주고,NA,NA,NA,NA
29161,29162,29162,8,스피커,네이버와 라인이 공동 개발한 인공지능 스피커 ' 웨이브 ( WAVE ),NA,NA,NA,NA
29162,29163,29163,8,스피커,카카오의 인공지능 스피커 카카오미니는 카카오의 통합 인공지능 플랫폼,NA,NA,NA,NA
29163,29164,29164,8,스피커,스피커 출력이 웨이브가 20W 인데 반해,NA,NA,NA,NA
29164,29165,29165,8,스피커,시장조사업체 가트너가 전망한 글로벌 AI 스피커 시장 규모에 따르면 2015 년,NA,NA,NA,NA
29165,29166,29166,8,스피커,인공지능 스피커 나아가 인공지능 기술이 만들어갈 우리의,NA,NA,NA,NA
