,Unnamed: 0,X,category,key,sentences,senti,score1,score2,score3
61250,61251,61251,1,인공지능,그러나 인공지능 스피커의 성능을 결정하는것은 하드웨어가 아닌,중립,100,0,0
61251,61252,61252,1,인공지능,/ 적외선 센서 등이 있기때문에 인공지능 비서와 같은 느낌을 더 받으실,중립,100,0,0
61252,61253,61253,1,인공지능,물론 인공지능 스피커를 구매했다고 해서 그 기능이,긍정,100,0.093023255813954,1
61253,61254,61254,1,인공지능,인공지능 스피커는 그저 우리의 음성을 소프트웨어로,중립,100,0,0
61254,61255,61255,1,인공지능,인공지능 스피커 기기보다는 누가 더 빠르고,중립,100,0,0
61255,61256,61256,1,인공지능,카카오 미니는 생활 밀착형 인공지능 스피커 네이버 웨이브는 인공지능 비서,중립,100,0,0
61256,61257,61257,1,인공지능,밀착형 인공지능 스피커 네이버 웨이브는 인공지능 비서 같은 느낌을 받으실 것,중립,100,0,0
61257,61258,61258,1,인공지능,지난 18 일 카카오는 인공지능 AI 를 접목한 스피커 카카오,중립,100,0,0
61258,61259,61259,1,인공지능,네이버의 인공지능 스피커 웨이브 ( WAVE ),중립,100,0,0
61259,61260,61260,1,인공지능,지금까지 알려줬던 인공지능 스피커에 대해서는 큰 호기심이 없었지만,긍정,50.746268656716,0.10211440857993,0.46175811173276
61260,61261,61261,1,인공지능,주말을 맞아 적어보는 ' 인공지능 스피커 프렌즈 ' 구매 후기,부정,50.537374713199,0.083776633776634,0.28599537037037
61261,61262,61262,1,인공지능,' 구매 후기 주변에 이래저래 인공지능 스피커를 쓰는 사람이 많아호기심에 장만해보려,긍정,100,0.058672947081799,1.178132927448
61262,61263,61263,1,인공지능,동생이 너무 좋아한다 나와는 달리 인공지능 (,긍정,100,0.17733990147783,1.2413793103448
61263,61264,61264,1,인공지능,저도 드디어 인공지능스피커를보유하게 되었답니다수많은 인공지능 스피커가 많았고고민도 많이 했답니다원래는 카카오미니스피커,긍정,54.098360655738,0.027984682322582,0.24440293344403
61264,61265,61265,1,인공지능,네이버 뮤직 1 년권 + 인공지능 스피커를 무료로 줬기 때문이에요이런 정보에,중립,100,0,0
61266,61267,61267,1,인공지능,귀요미지만 똑똑한 # 인공지능스피커프렌즈 인공지능 스피커라고 딱딱할거란 생각은 버려,중립,100,0.038108510985869,0.034090909090909
61267,61268,61268,1,인공지능,AI 스피커 프렌즈는 다르댜규이렇게 귀여운 인공지능 스피커 본 적 있어,중립,100,0.0084503158587358,0.024011299435028
61268,61269,61269,1,인공지능,인공지능 스피커 프렌즈 Friends 는 10W,중립,100,0,0
61270,61271,61271,1,인공지능,이번에는 네이버의 인공지능 플랫폼인 ' Clova ' 를,중립,100,0,0
61271,61272,61272,1,인공지능,Clova ' 를 기본으로 한 인공지능 스피커 프렌즈를 만나볼 기회가 생겨,긍정,100,0.10121048502984,1.4795500914258
61272,61273,61273,1,인공지능,그동안 나온 인공지능 스피커들은 모양이 예쁘다고 말하기는 조금,긍정,100,0.10956146363549,1.029531433589
61273,61274,61274,1,인공지능,인공지능 스피커이기 때문에 음성으로 빠르게 정보,중립,100,0,0
61274,61275,61275,1,인공지능,되어 음악 플레이가 가능하며 ' 인공지능 스피커 ' 의 완전한 기능을,긍정,100,0.1185598767809,1.2264150943396
61275,61276,61276,1,인공지능,인공지능 스피커라고 하니 기능이 궁금하실 분들도,중립,100,0,0
61276,61277,61277,1,인공지능,전에는 교통 상황을 물어보기도 하고 인공지능 스피커의 활용은 무궁무진하다고 생각합니다,중립,100,0,0
61277,61278,61278,1,인공지능,네이버 인공지능 플랫폼인 클로버를 품은 프렌즈 스피커,중립,100,0,0
61279,61280,61280,1,인공지능,인공지능 브랜드 ' 씽큐 ( ThinQ,중립,100,0,0
61280,61281,61281,1,인공지능,TV 인 OLED TV 에 인공지능 ( AI ) 브랜드인 ',중립,100,0,0
61281,61282,61282,1,인공지능,' 를 적용한 2018 년형 인공지능 OLED TV 가 드디어 출시했다,중립,100,0,0
61282,61283,61283,1,인공지능,클리어 엔진을 적용하였으나 2018 년부터는 인공지능 기술인 알파 9 ( α9,중립,100,0,0
61283,61284,61284,1,인공지능,모드와 사운드까지 조정할 수 있는 인공지능 브랜드,중립,100,0,0
61284,61285,61285,1,인공지능,서라운드 돌비 애트모스 돌비 애트모스 인공지능 씽큐 X 웹 OS 버전,중립,100,0,0
61285,61286,61286,1,인공지능,엔진에는 LG 전자가 독자 개발한 인공지능 기술이 적용된 화질칩 알파 9,중립,100,0,0
61286,61287,61287,1,인공지능,그리고 LG 전자의 인공지능 브랜드인 ' 씽큐 ( ThinQ,중립,100,0,0
61287,61288,61288,1,인공지능,2018 년형 OLED TV 에서 인공지능 다음으로 주목할 점은 바로 테크니컬러의,중립,100,0,0
61288,61289,61289,1,인공지능,인공지능 ( Artificial Intelligence AI ),중립,100,0,0
61290,61291,61291,1,인공지능,이은인공지능 스피커 프렌즈브라운,중립,100,0,0
61291,61292,61292,1,인공지능,▲ 네이버 인공지능 스피커에는브라운과 샐리가 있는데우리는 브라운으로 선택,중립,100,0,0
61292,61293,61293,1,인공지능,인공지능 스피커인 카카오 미니를 오늘 28,중립,100,0,0
61293,61294,61294,1,인공지능,인공지능 스피커 요즘에 관심을 많이 끌고,긍정,100,0.072829131652661,1
61294,61295,61295,1,인공지능,함께 판매를 하여 관심도 높은 인공지능 스피커 나오자 마자 완판이 되어,긍정,100,0.096636346293029,1.5531958876547
61295,61296,61296,1,인공지능,카카오 미니보다는 더 나을듯한 네이버 인공지능 스피커 웨이브이구요,중립,100,0,0
61296,61297,61297,1,인공지능,인공지능 스피커인 만큼 점점더 다양한 기능들이,중립,100,0,0
61297,61298,61298,1,인공지능,다양한 기능들이 추가 되고 있는 인공지능 스피커 카카오 미니의 경우 네이버,중립,100,0,0
61298,61299,61299,1,인공지능,카카오에서 예약 주문을 받는다고 하고요 인공지능 스피커 앞으로 우리 생활에 어떠한,중립,100,0,0
61299,61300,61300,1,인공지능,인공지능 스피커 네이버 클로바 프렌즈 (,중립,100,0,0
61301,61302,61302,1,인공지능,음악틀 수 있겠다 ㅋ # 인공지능 # 스피커 # 네이버 #,중립,100,0,0
61302,61303,61303,1,인공지능,인공지능 스피커 네이버 웨이브 샐리가 도착하자마자,중립,100,0,0
61303,61304,61304,1,인공지능,이렇게 전기 소모량을 측정하기 전에는 인공지능 웨이브 샐리가 하단부에 열이 많이,중립,100,0,0
61304,61305,61305,1,인공지능,인공지능 스피커 WAVE 와 몇칠전부터 재미있게,중립,100,0,0
61305,61306,61306,1,인공지능,만나게 될 IT 신상품네이버와 라인의 인공지능 프로젝트 外,중립,100,0,0
61306,61307,61307,1,인공지능,알파고가 던져준 인공지능 ( AI ) 의 충격을,중립,100,0,0
61307,61308,61308,1,인공지능,특히 네이버와 라인이 선보인 인공지능 ( AI ) 프로젝트 (,중립,100,0,0
61308,61309,61309,1,인공지능,네이버와 라인이 만든 인공지능 - 클로바 / 페이스 /,중립,100,0,0
61309,61310,61310,1,인공지능,벗었던 네이버와 라인의 프로젝트 J 인공지능 플렛폼인 클로바 ( Clova ),중립,100,0,0
61310,61311,61311,1,인공지능,네이버와 라인이 공동 개발중이며 네이버랩스의 인공지능 아미카를 업그레이드 한 버전이죠 인간의,중립,100,0,0
61311,61312,61312,1,인공지능,한 버전이죠 인간의 오감을 활용한 인공지능 플렛폼으로 대화로 친구와 이야기 하듯이,긍정,100,0.11607617759748,1.6509578544061
61312,61313,61313,1,인공지능,기존의 음성위주의 인공지능 에서 한걸음 더 나아가 인간의,중립,100,0,0
61313,61314,61314,1,인공지능,런칭할 예정인데요디스플레이는 비서 페이스로 인공지능 스피커는 웨이브라는 이름으로 런칭 됩니다,중립,100,0,0
61314,61315,61315,1,인공지능,예를 들어 튜링테스트 ( 대화형 인공지능 테스트 ) 를 통과한유진의 경우,긍정,100,0.085790956196543,1.5031756848848
61315,61316,61316,1,인공지능,제대로 대답하지 않네요 인공지능 비서라는답변을 들을 수 있네요 답변이,부정,100,-0.036035439298124,-0.65543636019436
61316,61317,61317,1,인공지능,그것도 인공지능으로,중립,100,0,0
61318,61319,61319,1,인공지능,네이버 인공지능 스피커에서도 귀여운 모양의 프렌즈를 살까,긍정,100,0.18440748941086,0.99234693877551
61319,61320,61320,1,인공지능,클로바의 대답은 굉장히 잘 들리니 인공지능 측면에선 만족한다,긍정,100,0.19168150814703,1.9168150814703
61320,61321,61321,1,인공지능,기대를 많이 했었던 국내 인공지능 스피커인 네이버 웨이브는 현재 음악틀어주는,긍정,100,0.10234864715997,1.3700658879904
61321,61322,61322,1,인공지능,카카오미니가 갈길이 멀지만 그래도 국내 인공지능 스피커 중에서 가장 기대되는건 카카오,부정,50.632911392405,0.023094096586596,0.039093209657726
61322,61323,61323,1,인공지능,함께하는 인공지능 AI 스피커 입니다 모양도 요로코롬,긍정,100,0.093176664605236,1.0204081632653
61324,61325,61325,1,인공지능,네이버에서 음악듣기 1 년권 + 인공지능 스피커 웨이브를 패키지로 13 만원에,중립,100,0,0
61325,61326,61326,1,인공지능,인공지능 시장의 큰 흐름은 개인 비서,중립,100,0,0
61326,61327,61327,1,인공지능,) 기능을 포함한 인공지능 스피커다,중립,100,0,0
61327,61328,61328,1,인공지능,세계적인 기업들이 축척한 데이터를 앞세워서 인공지능 스피커를 출시하고 있고 네이버 역시,중립,100,0,0
61328,61329,61329,1,인공지능,이 인공지능 스피커로 무엇을 할 수 있는지,중립,100,0,0
61329,61330,61330,1,인공지능,인공지능 스피커에 대고 말을 했을때 얼마나,중립,100,0,0
61330,61331,61331,1,인공지능,네이버에서 인공지능 스피커 WAVE ( 웨이브 ),중립,100,0,0
61331,61332,61332,1,인공지능,) 에 이은 두 번째 인공지능 스피커 Friends ( 프렌즈 ),중립,100,0,0
61332,61333,61333,1,인공지능,< 샐리 > 모양을 한 인공지능 스피커랍니다,중립,100,0,0
61333,61334,61334,1,인공지능,약 10 만원 정도로 귀여운 인공지능 스피커를 사용할 수 있다는게 덤으로,긍정,100,0.12434531570125,1.2791674427268
61334,61335,61335,1,인공지능,인공지능 스피커와의 첫 만남,중립,100,0,0
61335,61336,61336,1,인공지능,인공지능 프렌즈 스피커 샐리 ( ♥,중립,100,0,0
61337,61338,61338,1,인공지능,요즘 핫하게 광고많이 나오고있는 인공지능 스피커 프렌즈 인스타그램에도 핫한 요것,중립,100,0,0
61338,61339,61339,1,인공지능,너이버라인프런즈 인공지능 스비커상세 제품안내는 아래와 같아요,중립,100,0,0
61342,61343,61343,1,인공지능,있죠나의 말을 스마트하게 잘 알아듣는 인공지능 AI 스피커,긍정,100,0.090186403508772,1.2214912280702
61343,61344,61344,1,인공지능,맨 처음으로 카카오에서 인공지능 AI 스피커를 선착순으로 발매를 했었죠저는,중립,100,0,0
61344,61345,61345,1,인공지능,네이버에서 클로바 앱과 연동하여 사용하는 인공지능 AI 프렌즈 스피커를 발매를하여한번 더,중립,100,0,0
61345,61346,61346,1,인공지능,AI 프렌즈 스피커를 발매를하여한번 더 인공지능 스피커의 강한 돌풍을 일으켰습니다,긍정,100,0.12160624147488,1.866682305106
61346,61347,61347,1,인공지능,인공지능 AI 스피커로 음악 재생하기 동영상,중립,100,0,0
61347,61348,61348,1,인공지능,모든것을 다 알려주는 개인비서라고도 불리는 인공지능 스피커 그래서,긍정,100,0.070301969336111,1.1011993896091
61348,61349,61349,1,인공지능,인공지능 스피커 웨이브가 있다면 더이상 혼잣말,긍정,100,0.056190476190476,0.85542168674699
61349,61350,61350,1,인공지능,알아서 척척 검색해서 알려주니 신통방통한 인공지능 스피커가 아닐 수 없네요 ^,긍정,50.37037037037,-0.0038158639853555,0.0098039215686275
61350,61351,61351,1,인공지능,요즘 인공지능 스피커가 화제입니다,중립,100,0,0
61351,61352,61352,1,인공지능,카카오 SK 등에서 다양한 인공지능 스피커를 출시하고 있는데요,중립,100,0,0
61352,61353,61353,1,인공지능,오늘 만나본 인공지능 스피커는그중 네이버에서 출시한 웨이브 WAVE,중립,100,0,0
61353,61354,61354,1,인공지능,피드백을 받아 볼 수 있는 인공지능 스피커지요,중립,100,0,0
61354,61355,61355,1,인공지능,ㅎㅎ 네이버 웨이브 인공지능 스피커는스마트폰이나 음성으로 제어할 수 있지만상단의,중립,100,0,0
61355,61356,61356,1,인공지능,요즘 인공지능 스피커가 핫하잖아요,중립,100,0,0
61356,61357,61357,1,인공지능,요즘 인공지능 스피커가 광고에도 많이나오고 각종 이벤트도,중립,100,0,0
61357,61358,61358,1,인공지능,이용하는 ' 멜론 ' 에서도 인공지능 스피커 이벤트를 하더라구요,중립,100,0,0
61358,61359,61359,1,인공지능,인공지능 스피커 이벤트를 하더라구요,중립,100,0,0
61359,61360,61360,1,인공지능,원래 가격이 다 책정되어 있던 인공지능 스피커가 음원스트리밍서비스를 이용하면 무료 또는,중립,100,0,0
61360,61361,61361,1,인공지능,교수님께서 그 이유를 말해주셨는데요그바로 사람들이 인공지능 스피커에 부담 없이 다가가도록 만들고낮은,부정,100,0.044905817902278,0.2008599958069
61361,61362,61362,1,인공지능,아직 인공지능 스피커의 기술력은 완전하지 않은 상태이기,부정,100,-0.069938481630409,-0.92452830188679
61362,61363,61363,1,인공지능,여러분은 인공지능 스피커를 사용해 보셨나요,중립,100,0,0
61363,61364,61364,1,인공지능,인공지능 스피커를 처음 사용해보았는데요운전 중에 조작을,중립,100,0,0
61364,61365,61365,1,인공지능,인공지능 스피커를 통해서 빅데이터가 형성되어더욱 편리해진,긍정,100,0.11680327868852,1
61365,61366,61366,1,인공지능,> 이코노믹 리뷰 『 귀여운 인공지능 스피커는 왜 공짜로 뿌려질까,긍정,100,0.1335968081903,0.91754850088183
61366,61367,61367,1,인공지능,관심을 가지는 분야 중 하나가 인공지능 스피커 시장이라고 할 수 있으며,긍정,100,0.10149611669928,1.5051572454242
61367,61368,61368,1,인공지능,지난 포스팅에서 네이버 인공지능 플랫폼인 클로바 ( Clova ),중립,100,0,0
61368,61369,61369,1,인공지능,네이버 인공지능 스피커 프렌즈를 사용하기 위해서는 클로바와의,중립,100,0,0
61369,61370,61370,1,인공지능,프렌즈는 네이버 클로바를 기반으로 하는 인공지능 스피커이므로 먼저 나의 계정으로 로그인을,중립,100,0,0
61370,61371,61371,1,인공지능,인공지능 스피커 프렌즈는 네이버 검색 기반과,중립,100,0,0
61371,61372,61372,1,인공지능,다음 네이버 인공지능 스피커 프렌즈에서 스마트폰 없이도 클로바에,중립,100,0,0
61372,61373,61373,1,인공지능,캐릭터 상품이면서 클로버가 연결된 네이버 인공지능 스피커이면서 블루투스 연결로 외부에서도 활용할,중립,100,0,0
61373,61374,61374,1,인공지능,여기에 항상 따라다니는 제품을 보면 인공지능 스피커가 있죠,중립,100,0,0
61374,61375,61375,1,인공지능,회사의 높은 인지도를 바탕으로 국내에 인공지능 스피커가 많이 확산되는 계기가 될,중립,100,0,0
61375,61376,61376,1,인공지능,며칠어디선가 기사로 광고로 본 네이버 인공지능 스피커 이걸 왜 사는건가 했는데세상에,긍정,100,0.063291113807662,1.4230863836648
61376,61377,61377,1,인공지능,라인프렌즈 인공지능 스피커 크래들 구매 해써요 라인,중립,100,0,0
61377,61378,61378,1,인공지능,라인 프렌즈 인공지능 스피커 특성상 이리 저리 들고,중립,100,0,0
61378,61379,61379,1,인공지능,구매 강추 인공지능 브라운 스피커 집은 제 책장,중립,100,0,0
61379,61380,61380,1,인공지능,돕게 됩니다 심심함 덜어주는 기특한 인공지능 스피커 ' 브라운 ' 과,중립,100,0,0
61380,61381,61381,1,인공지능,올해 네이버와 카카오에서 인공지능 스피커 ( 정확히 말하면 음성인식,긍정,100,0.11049804884675,1.1981861433244
61381,61382,61382,1,인공지능,우측면 네이버가 인공지능 플랫폼 ' 클로바 ' 로,중립,100,0,0
61382,61383,61383,1,인공지능,오늘로써 네이버 인공지능 ( AI ) 스피커 웨이브,중립,100,0,0
61383,61384,61384,1,인공지능,해보려고 합니다우선 전력사용량에 대해 말씀드릴께요네이버 인공지능 스피커 WAVE 는 대기전력이 1,중립,100,0,0
61384,61385,61385,1,인공지능,무제한 듣기 1 년 신청하면 인공지능 스피커,중립,100,0,0
61385,61386,61386,1,인공지능,인공지능 아마존 에코 스피커가 10 만원대입니다,중립,100,0,0
61386,61387,61387,1,인공지능,보편적으로 인공지능 스피커는 음악듣기를 많이 활용합니다,중립,100,0,0
61387,61388,61388,1,인공지능,그렇다 보니 인공지능 시스템 + 무제한 뮤직 1,긍정,100,0.13809523809524,1.1666666666667
61388,61389,61389,1,인공지능,자체의 성능이 중요한것이 아니라 중앙서버의 인공지능 ( AI ) 이 중요한것이고,중립,100,0,0
61389,61390,61390,1,인공지능,그 중심에는 인공지능 시스템이 자리잡고 있습니다,중립,100,0,0
61390,61391,61391,1,인공지능,wave ( 웨이브 ) 라는 인공지능 스피커이다,중립,100,0,0
61391,61392,61392,1,인공지능,뿐만 아니라 대화도 가능한 훌륭한 인공지능 ( AI ) 를 탑재한,긍정,66.666666666667,0.12726650683652,0.42068965517241
61392,61393,61393,1,인공지능,같지는 않지만 음성인식 인터페이스 기반의 인공지능 관련 제품을 쏟아내고 있다,부정,100,-0.053801086587972,-0.83309283309283
61393,61394,61394,1,인공지능,카카오 I ' 를 담은 인공지능 스피커가 속속 출시했다,중립,100,0,0
61394,61395,61395,1,인공지능,이제 소비자들은 이제 인공지능 스피커가 무엇인지 분명히 인지하기 시작했다,긍정,100,0.078903133903134,1.2351851851852
61396,61397,61397,1,인공지능,그렇지만 주변 인공지능 스피커 이용자에게 음성 인식률을 물어보면,중립,100,0,0
61397,61398,61398,1,인공지능,이동통신사의 인공지능 스피커도 조만간 새 제품을 선보일,중립,100,0,0
61398,61399,61399,1,인공지능,) 인공지능 덕분에 역설적으로 내가 인간임을 느낄,긍정,100,0.16679843980603,1.4150326797386
61400,61401,61401,1,인공지능,있음에도요즘 많은 분들에게화제가 되고 있는네이버 인공지능 스피커 프렌즈 브라운을 구매했습니다,긍정,100,0.053146853146853,1
61401,61402,61402,1,인공지능,들었는데실물도 너무 귀여웠어요 ㅎㅎ 네이버 인공지능 스피커 프렌즈 구성품은 간단했어요설명서 +,긍정,100,0.13838987099857,1.1130434782609
61402,61403,61403,1,인공지능,' 네이버 인공지능 스피커 프렌즈 ' 옆에 있는건프렌즈,중립,100,0,0
61404,61405,61405,1,인공지능,앱 등으로 웨이브 셋팅을하면 이제 인공지능 스피커를 맘껏사용할 수 있게 됩니다,중립,100,0,0
61405,61406,61406,1,인공지능,최근에는 인공지능 서비스인 AI 스피커 ( 카카오,중립,100,0,0
61407,61408,61408,1,인공지능,찾아보니까 인공지능 기능으로 TV 에서 설현이 ',중립,100,0,0
61408,61409,61409,1,인공지능,알아 듣고 실행한다 네이버 웨이브 인공지능 스피커,중립,100,0,0
61409,61410,61410,1,인공지능,득템한 기분이다 블루투스를 넘어 이제는 인공지능 스피커까지정말 참 편리한 세상이다 NAVER,긍정,100,0.11921865308447,1.61541626059
61410,61411,61411,1,인공지능,개인적으로 저도 업무를 위한 인공지능 프로그램 개발을 위한 준비를 하고,중립,100,0,0
61411,61412,61412,1,인공지능,최근 제가 즐겨 보는 프로그램에서 인공지능 스피커가 나와서 매우 반가운 것,긍정,100,0.20036112674734,1.2260914916669
61412,61413,61413,1,인공지능,네이버 클로바 플렌즈 인공지능 스피커가 유난히 눈에 띠고 있었습니다,중립,100,0,0
61413,61414,61414,1,인공지능,프랜즈 캐픽터를 사용한 인공지능 스피커입니다,중립,100,0,0
61414,61415,61415,1,인공지능,인테리어 소품뿐 아니라 인공지능 스마트한 스피커라고 할 수 있습니다,부정,100,-0.11440677966102,-1
61416,61417,61417,1,인공지능,연결이 끝이나는데 충전 방식의 휴대용 인공지능 스피커이지만 연결 할 때는 전원,중립,100,0,0
61418,61419,61419,1,인공지능,바로 귀여운 네이버 클로바 AI 인공지능 스피커가 책상에 땋,긍정,100,0.13177339901478,1.4852216748768
61419,61420,61420,1,인공지능,' 토마토크 ' 와 AI 인공지능 스피커 ' 네이버 클로바 ',중립,100,0,0
61420,61421,61421,1,인공지능,마지막으로 화룡점정 네이버 클로바 AI 인공지능 스피커까지 완벽한 구성이에요,긍정,100,0.096269739734677,1.2208106473079
61421,61422,61422,1,인공지능,AI 인공지능 스피커는 노래만 들을 수 있는게,중립,100,0,0
61422,61423,61423,1,인공지능,영어 공부를 할 수 있는 인공지능 학습이 가능해요,긍정,100,0.22502266955856,1.6159750134405
61423,61424,61424,1,인공지능,중 WAVE 라고 하는 네이버 인공지능 스피커를 알게 되었어요그리고 인공지능 스피커,중립,100,0,0
61424,61425,61425,1,인공지능,네이버 인공지능 스피커를 알게 되었어요그리고 인공지능 스피커 웨이브 출시 기념으로네이버 뮤직,긍정,100,0.047619047619048,1
61425,61426,61426,1,인공지능,박스가 ㅋㅋㅋㅋㅋㅋㅋㅋㅋㅋㅋㅋㅋㅋㅋㅋㅋㅋ 웨이브는 양파 같은 인공지능 스피커 인가,중립,100,0,0
61426,61427,61427,1,인공지능,네이버 인공지능 스피커 wave 음질도 좋고 진짜,긍정,100,0.175,1.4
61427,61428,61428,1,인공지능,맨 처음에는 인공지능 스피커가 싫고 ( 저는 기계를,부정,100,-0.092055485498108,-0.75283732660782
61428,61429,61429,1,인공지능,같이 갔던 김 오빠인데 평소 인공지능 스피커에 관심도 없다가 저희 집에,긍정,50.746268656716,0.046614997479247,0.32387871539679
61429,61430,61430,1,인공지능,사 통신사에서 프로모션으로 진행 중인 인공지능 스피커 또는 셋탑박스인데요 ♬ ♪,중립,100,0,0
61430,61431,61431,1,인공지능,스피커 ( 클로버 ) 는 인공지능 스피커로써 음성으로 노래 날씨 필요한,중립,100,0,0
61431,61432,61432,1,인공지능,B tv x NUGU 셋탑박스는 인공지능 스피커 기능과 셋탑박스 기능이 합쳐진,중립,100,0,0
61432,61433,61433,1,인공지능,오늘은 이렇게 3 사 통신사의 인공지능 스피커 & 셋탑박스를 비교해보았는데요,중립,100,0,0
61433,61434,61434,1,인공지능,오늘의 포스팅은 인공지능 네이버 스피커 프렌즈에 대해 써볼까,중립,100,0,0
61434,61435,61435,1,인공지능,뮤직 1 년 가입을 하면 인공지능 네이버 스피커 프렌즈를 나눠주는 행사를,중립,100,0,0
61435,61436,61436,1,인공지능,만원으로 멜론보다 싸다는 생각에 그리고 인공지능 네이버 스피커 프렌즈에 현혹되어 ㅋㅋㅋ,긍정,100,0.034235730285008,0.82202797202797
61437,61438,61438,1,인공지능,네이버 인공지능 스피커인 프렌즈 솔직한 사용기를 여러분께,긍정,100,0.11567124870239,1.2503435639029
61438,61439,61439,1,인공지능,네이버의 인공지능 플랫폼인 클로바 ( CLOVA ),중립,100,0,0
61439,61440,61440,1,인공지능,CLOVA 는 인공지능 기술 중에 하나인 머신 러닝을,중립,100,0,0
61440,61441,61441,1,인공지능,가장 처음에 나온 인공지능 스피커인 웨이브 ( WAVE ),중립,100,0,0
61441,61442,61442,1,인공지능,네이버 인공지능 스피커 프렌즈는 자사 서비스인 검색,중립,100,0,0
61442,61443,61443,1,인공지능,영어로 대화하자 ' 라고 시작해서 인공지능 스피커와 영어로 말을 주고받을 수,긍정,100,0.11810630638515,1.6272169100053
61443,61444,61444,1,인공지능,덕후이거나 네이버 서비스를 좋아하는 분 인공지능 스피커가 무엇인지 궁금한 분들에게 클로바를,긍정,100,0.19404534504731,1.4709300279438
61444,61445,61445,1,인공지능,얼마전에 네이버 인공지능 스피커 웨이브를 소개해드렸는데요 ㅋㅋ 이번에는,중립,100,0,0
61445,61446,61446,1,인공지능,ㅋㅋ 사실 네이버 인공지능 스피커를 이미 하나 갖고 있기,중립,100,0,0
61446,61447,61447,1,인공지능,인공지능 프렌즈 스피커를 하나 더 사게,중립,100,0,0
61447,61448,61448,1,인공지능,네이버 인공지능 스피커를 쓰게되면서 좋았던 점은하루종일 음악을,긍정,100,0.11949997504243,1.1949997504243
