,Unnamed: 0,X,category,key,sentences,senti,score1,score2,score3
76247,76248,76248,7,설정,네이버 클로바 ' 로 기능 설정 및 사용자 등록 주변기기 연결,중립,100,0,0
76248,76249,76249,7,설정,버튼 호출명 무드등 기기 위치까지 설정 및 수정 변경이 가능하게 도와주며,긍정,100,0.18069408404981,1.0388157894737
76249,76250,76250,7,설정,ㅎㅎ 웨이브의 초기 설정 이름은 셀리입니다,중립,100,0,0
76250,76251,76251,7,설정,이루어진다면 클로바 앱을 통한 예약 설정 등도 가능해진다면,긍정,100,0.16194350311716,1.5703947538609
76251,76252,76252,7,설정,샐리는 오전 9 시에 알람을 설정 해놓고 나를 기다리고 있다,중립,100,0,0
76252,76253,76253,7,설정,전원을 눌러 켜면 설정 준비 상태가 됩니다,중립,100,0,0
76253,76254,76254,7,설정,사용할 수 있는 여러 가지 설정 기능을 확인하세요,중립,100,0,0
76254,76255,76255,7,대화,설정 메모 기능 간단한 영어 대화 ( 단 연속적으로 대화가 이뤄지는,긍정,100,0.13517773260327,1.7430816738588
76255,76256,76256,7,대화,대화 (,NA,NA,NA,NA
76256,76257,76257,7,대화,그래서 저는 중국어 일어 대화 다되는줄 알았는데 영어만 되요,긍정,100,0.15392676984288,1.4889899163188
76257,76258,76258,7,대화,등등 상세히 써있네요 뒷면은 웨이브와 대화 하는 법 키워드들,중립,100,0,0
76258,76259,76259,7,대화,실전 대화 능력을 업그레이드 할 수 있어요,중립,100,0,0
76259,76260,76260,7,대화,영어 대화 부분은 꿀잼예상하니 궁금한 분들은 포스팅,중립,100,0,0
76260,76261,76261,7,대화,) 4 ) 샐리야 영어 대화 하자,중립,100,0,0
76261,76262,76262,7,대화,간단한 외국어번역이나 영어 대화 연습을 할 수 있다고 합니다,긍정,100,0.23884973993143,2.0632525273461
76262,76263,76263,7,대화,클로바브레인은 사람의 대화 뜻을 기계가 알아들을 수 있는,중립,100,0,0
76263,76264,76264,7,대화,긴장 타거나 꾸밈없는 평상시 대화 말투로 명령어를 뱉어주면 빠르게 반응해,중립,100,0,0
76264,76265,76265,7,대화,대화 명령 검색 주문 등이 가능한,긍정,100,0.17057999692276,1.0642963080672
76265,76266,76266,7,대화,돼서 음악 감상 / 일상 대화 / 날씨 알림 기능만을 탑재한,중립,100,0,0
76266,76267,76267,7,대화,통 · 번역 영어회화 감성 대화 등이 가능합니다,긍정,100,0.20856600152874,1.7093443387605
76267,76268,76268,7,대화,땐 샐리와 ' 대화 ' 를 시도해 보거나 무리한,부정,100,-0.063595545977012,-0.57126436781609
76268,76269,76269,7,대화,대화,NA,NA,NA,NA
76269,76270,76270,7,대화,주제는 대화 문맥에 대한 이해 + 아직,긍정,100,0.13594006568145,1.2819325289201
76270,76271,76271,7,대화,대화 문맥 이해결론부터 말씀드리면 굉장히 잘되어있습니다,긍정,100,0.39458128078818,1.0761203667829
76271,76272,76272,7,대화,대화 문맥이란예를 들어 1 번 질문,긍정,100,0.17096267655646,1.4994602698651
76272,76273,76273,7,대화,1 - 1 날씨정보 대화 문맥 이해 그럼 여기서 호출부터,긍정,100,0.21414750957854,1.1897361057299
76273,76274,76274,7,대화,대화 문맥을 잘이해함 - 발전한다면 사람처럼,긍정,100,0.35708045977011,1.205847216841
76275,76276,76276,7,대화,의 AI 보조 Cortana 와 대화 할 수 있습니다,중립,100,0,0
76276,76277,76277,7,대화,아이가 조금 더 큰다면 영어 대화 기능을 통해서 외국어 학습도 가능한다,긍정,100,0.20970592457811,2.3475814968899
76277,76278,76278,7,대화,[ 영어 대화 ] 어느 정도 영어학습을 한,중립,100,0,0
76278,76279,76279,7,기능,제가 자주 사용하는 기능 중 하나는 Pitch 라는 메뉴,중립,100,0,0
76279,76280,76280,7,기능,상자에는 간략한 기능 소개와 네이버 웨이브의 자랑거리들이 적혀있네요,중립,100,0,0
76280,76281,76281,7,기능,PLAY / Pause 키 그리고 기능 버튼을 볼 수 있습니다,중립,100,0,0
76281,76282,76282,7,기능,기능들을 살펴보니 단순 노래재생과 검색 기능 뿐만 아니라 iot 와 관련된,부정,100,-0.035551147974516,-0.51135953840606
76282,76283,76283,7,기능,귀찮아 결국은 보지않게 되었는데 이 기능 덕에 아주 편하게 짜투리 시간동안,부정,50.199203187251,0.01040856845929,-0.015853499869893
76283,76284,76284,7,기능,날씨 일기예보 알람 설정 메모 기능 간단한 영어 대화 ( 단,긍정,100,0.11297083605155,1.5210127083416
76284,76285,76285,7,기능,뉴스 그리고 아이 동화읽기와 자장가 기능 잘 쓰진 않을 것 같지만,부정,100,0.019812189157471,-0.077147886480929
76285,76286,76286,7,기능,기능,NA,NA,NA,NA
76287,76288,76288,7,기능,블루투스 스피커 기능 뿐아니라 FM 라디오 지원 자동,중립,100,-0.026004774854541,0.064486228813559
76289,76290,76290,7,기능,) 기능 ( 예 세상에서 누가 제일,긍정,100,0.25363088772588,1.035989010989
76291,76292,76292,7,기능,금융 사물 인터넷 등 다양한 기능 및 편의 기능이 추가될 예정이다,중립,100,0,0
76292,76293,76293,7,기능,않을까 라는 생각도 해보았다 외국어 기능 시현 영상이다,중립,100,0,0
76293,76294,76294,7,기능,클로바 켜져있을때 전원 끄라고 명령했더니그런 기능 없다며 와서 끄란 _ㅋㅋㅋㅋㅋㅋ 빵터짐,중립,100,0,0
76294,76295,76295,7,기능,- 그리고 내가 가장 좋아하는 기능 ' 음성전송 ' 클로바가 켜져있으면,긍정,100,0.1954719609892,1.7592476489028
76295,76296,76296,7,기능,참 제일 중요한 기능 스피커 성능입니다,긍정,100,0.19032351729047,0.92797619047619
76296,76297,76297,7,기능,가까이 인식을 했고 지원하지 않는 기능 이거나 제대로 알아듣지 못한 경우에는,긍정,66.666666666667,0.034732077318326,0.33333333333333
76297,76298,76298,7,기능,일례로 네이버 클로바의 유희 기능 중 하나인 ' 가을 노래,중립,100,0,0
76298,76299,76299,7,기능,들었던 블루투스 기능,중립,100,0,0
76299,76300,76300,7,기능,사용해 보고 느낀 사용기와 자세한 기능 소개 사용방법들 보여드릴게요 ^ ^,중립,100,0,0
76300,76301,76301,7,기능,처음으로 카톡을 실행시켜보고 앱 실행 기능 또한 괜찮구나 생각을 하고 갤러리를,긍정,100,0.08210246960247,1.0527972027972
76301,76302,76302,7,기능,기능들을 사용해보았습니다,중립,100,0,0
76302,76303,76303,7,기능,정확한 음성 인식 기능 대화형 자연어 처리 기능 빅데이터,긍정,100,0.1175961402015,1.2620689655172
76303,76304,76304,7,기능,인식 기능 대화형 자연어 처리 기능 빅데이터 및 기계학습에 기반을 둔,중립,100,0,0
76304,76305,76305,7,기능,기능주위의 환경을 센서로 인식하는 사물 기능 등 최첨단 기술의 집합체입니다,중립,100,0,0
76305,76306,76306,7,기능,거듭 발전할 수록 좋아졌지만 간단한 기능 외에는 잘 안써먹었다 사실 밖에서,긍정,100,0.16678251731608,1.2763472778095
76306,76307,76307,7,기능,' 네이버 클로바 ' 로 기능 설정 및 사용자 등록 주변기기,중립,100,0,0
76307,76308,76308,7,기능,위한 동요 및 동화책 읽기 기능 등입니다,중립,100,0,0
76308,76309,76309,7,기능,스피커들에 대해 일반적으로 기대하는 기본적인 기능 수준입니다,긍정,100,0.11607294735625,1.1157085106557
76309,76310,76310,7,기능,종종 사용하는 기능인데그날의 뉴스 브리핑 기능 ' 셀리야 뉴스 알려줘 ',긍정,100,0.086504201216491,1.2091219709572
76310,76311,76311,7,기능,스피커 제품은 사용할 수록 정확도와 기능 개선 등의 업그레이드가 이루어지는 만큼,긍정,100,0.096922846102726,1.1790545329364
76311,76312,76312,7,기능,음악 감상 기능일 것 같은데이 기능 하나 만으로도 충,중립,100,0,0
76313,76314,76314,7,기능,제품의 기본 기능 * 스피커로서 기능 디자인 *,중립,100,0,0
76314,76315,76315,7,기능,제품의 기본 기능 * 스피커로서 기능 디자인 * 웨이브 Wave 이후로,중립,100,0,0
76315,76316,76316,7,기능,네이버 뮤직과 연동되는 음악 재생 기능 위주이고 알람 설정과 검색 등에서,중립,100,0,0
76316,76317,76317,7,기능,점 * 스피커 블루투스 아웃 기능 부재 * 블루투스를 지원하면서도 외부,긍정,53.333333333333,0.0052238805970149,0.0625
76317,76318,76318,7,기능,네이버의 웨이브는 사용자 경험보다는 인공지능 기능 실험과 시범 서비스 목적이라는 생각,중립,100,0,0
76318,76319,76319,7,기능,ㅜㅜ 이 기능 완전 진짜,중립,100,0,0
76320,76321,76321,7,기능,2 번 추가가 필요한 기능 2 - 1 라디오 서비스,중립,100,0,0
76323,76324,76324,7,기능,인보크 ' 공개음악재생 · 조명조절 기능 글로벌 시장에 ' 인공지능 (,중립,100,0,0
76326,76327,76327,7,기능,지오펜싱과 타이머 기능 등이 지원되기 시작합니다,긍정,100,0.16377250578021,1.0201612903226
76327,76328,76328,7,기능,메시지 보내기 보안 카메라 피드보기 기능 추가 지원이 추가 될 수,중립,100,0,0
76328,76329,76329,7,기능,AI 스피커의 기능 중에서도 음악 재생 기능은 핵심적인,중립,100,0,0
76329,76330,76330,7,기능,추천 서비스 적용 쇼핑 추천 기능 등을 선보이며 AI 기술의 활용성을,중립,100,0,0
76330,76331,76331,7,기능,웨이브 뉴스기사 보러가기 ] 웨이브 기능 1,중립,100,0,0
76331,76332,76332,7,기능,음성인식 기능 만큼은좋아졌다고 생각이 들어요추후 업데이트를 통해,중립,100,0,0
76332,76333,76333,7,기능,음악 틀어줘 ' ㅡ 알람 기능 ' 30 분 후에 음악,중립,100,0,0
76333,76334,76334,7,기능,웨이브가 프랜즈 보다는 반응 및 기능 면에서 조금 부족한 것을 알,부정,100,-0.10738357843137,-1.1510416666667
76334,76335,76335,7,기능,영어 스피킹 기능,중립,100,0,0
76335,76336,76336,7,기능,- 영어동화 기능 / 자장가 틀어줘 기능이 매우,중립,100,0,0
76337,76338,76338,7,기능,하루가 되지 않았고위 포스팅에서 알아본 기능,부정,100,-0.10706967213115,-0.9375
76338,76339,76339,7,기능,마이크 on / off 음성명령 기능 사용 / 차단 bluetooth3 초,중립,100,0,0
76339,76340,76340,7,핸드폰,잠자리 들기 전 책을 보거나 핸드폰 사용하면서자세가 불편해 뒤치락 거린 적도,부정,100,-0.021711900817167,-0.30108335034654
76340,76341,76341,7,핸드폰,실행시켜 프렌즈 스피커와 연결하면 추후 핸드폰 없이 계속 사용이 가능하다,긍정,100,0.093848943539401,1.073154705464
76341,76342,76342,7,핸드폰,그래도 동요나 동화도 들려주고손가락운동도 귀찮고 핸드폰 들여다 보기조차 버거울때 ㅋㅋㅋ 혹은,중립,100,0,0
76344,76345,76345,7,핸드폰,WAVE 는 단순히 핸드폰 연결 뿐만 아니라 집안의 IOT,부정,100,-0.036220819457561,-0.41073313782991
76345,76346,76346,7,핸드폰,위해 내보내는 ) 알림음 크기 핸드폰 스피커에서 발생된 ' 알림음 (,중립,100,0,0
76346,76347,76347,7,핸드폰,핸드폰 스피커에서 발생된 ' 알림음 (,중립,100,0,0
76349,76350,76350,7,핸드폰,빨리 없어져서 계속 충전해놓고 쓰면 핸드폰 뜨겁고,부정,100,-0.049450034561591,-0.77677225150051
76350,76351,76351,7,핸드폰,기반 검색을 중점으로 둔 비서이기에 핸드폰 기기 설정 부분까지는 아직 접근을,중립,100,0,0
76351,76352,76352,7,핸드폰,이 문제는 현재로서 핸드폰 기기의 음량을 줄이는 방법이 답인,중립,100,0,0
76352,76353,76353,7,핸드폰,기능을 활용할 수 있더라구요 ㅋ 핸드폰 제어 뉴스 집에서 쓰는 기계들,중립,100,0,0
76353,76354,76354,7,핸드폰,ㅋㅋ 핸드폰 알람 설정이나 메모 등등도 간단하게,긍정,100,0.12994577885882,1.170979020979
76354,76355,76355,7,핸드폰,와이파이 문제인가 싶었지만집 와이파이는 컴퓨터 핸드폰 아주 정상적이였다,긍정,50.793650793651,0.032838096122342,0.056146356942585
76355,76356,76356,7,핸드폰,클로바프렌즈 스피커를 켜두고 핸드폰 블루투스도 켜놓고,중립,100,0,0
76356,76357,76357,7,핸드폰,그래서 저는 핸드폰 불빛을 이용하곤 해요,중립,100,0,0
76357,76358,76358,7,핸드폰,처음에 핸드폰 처럼 상자형태 인줄 알았는데 위로,긍정,100,0.13581002331002,1.3440559440559
76358,76359,76359,7,재생,오늘 날씨부터 뉴스 상식질문 노래 재생 영어회화 등등 웬만한 것은 다,중립,100,0,0
76359,76360,76360,7,재생,때부터 소리가 안 들린다 싶었더니 재생 장치 쪽에서 뭘 만져서 헤드셋을,중립,100,0,0
76360,76361,76361,7,재생,마이크와 오디오 재생 / 일시정지 등등 버튼으로 가능하고,긍정,100,0.12302295918367,1.025
76361,76362,76362,7,재생,태교 동화 재생 3,중립,100,0,0
76362,76363,76363,7,재생,재생 3,NA,NA,NA,NA
76363,76364,76364,7,재생,등 상황을 반영해 이용자별 음악 재생 및 추천도 해준다,중립,100,0,0
76364,76365,76365,7,재생,특히 카카오톡 연동으로 음성으로 전송하기 재생 중인 음악 공유 뉴스 등을,중립,100,0,0
76365,76366,76366,7,재생,명령을 할 수도 있고 오디오 재생 / 일시정지도 할 수 있었습니다,중립,100,0,0
76366,76367,76367,7,재생,가장 많이 사용한 기능은 음악 재생 기능이었습니다,중립,100,0,0
76369,76370,76370,7,재생,버튼 음소거 버튼이 있고 상단에 재생 음량 조절 버튼과 기능을 지정할,중립,100,0,0
76370,76371,76371,7,재생,2 종으로 출시한 네이버 프렌즈는 재생 버튼이 있어 노래를 일시 정지할,중립,100,0,0
76371,76372,76372,7,재생,카카오톡을 보낼 수도 있고 지금 재생 중인 노래를 보낼 수도 있다,중립,100,0,0
76372,76373,76373,7,재생,버튼을 짧게 누를 경우에는 오디오가 재생 또는 일시정지됩니다,중립,100,0,0
76374,76375,76375,7,재생,누르면 오디오 재생 일시정시 또는 1 초 이상,긍정,100,0.043847517730496,0.81286849525763
76375,76376,76376,7,재생,입은 버튼으로 되어 있어 오디오 재생 / 일시정지 음성명령 등을 실행할,중립,100,0,0
76376,76377,76377,7,재생,단축 ( 앱에서 지정한 오디오 재생 ) 터치패널이라서 좋다 스테인레스같은 맨들맨들해서,긍정,100,0.094155844155844,1.1298701298701
76377,76378,76378,7,재생,재생 / 일시정지 볼륨조절 ( 볼륨증가볼륨감소,중립,100,0,0
76378,76379,76379,7,재생,브라운의 코를 한번 누르면 오디오 재생 / 일시정지 1 초 이상,긍정,100,0.038526290046466,0.84735125387832
76379,76380,76380,7,재생,스피커에서 나온 시그널을 수음하여 블루투스의 재생 성능을 측정합니다,중립,100,0,0
76380,76381,76381,7,재생,볼륨이 올라갈 수록 재생 대역폭이 좁아지는 형태입니다,부정,100,-0.01593137254902,-0.59803921568627
76381,76382,76382,7,재생,볼륨이 올라갈수록 재생 대역폭이 좁아지는 것을 확인했습니다,부정,100,0.01677813982736,-0.3531412565026
76382,76383,76383,7,재생,윗부분 가운데에는 재생 / 일시정지그리고 좌우에는 소리줄임 /,중립,100,0,0
76383,76384,76384,7,재생,MUTE 세가지가 있답니다 윗부분 가운데에는 재생 / 일시정지그리고 좌우에는 소리줄임 /,중립,100,0,0
76384,76385,76385,7,재생,아무래도 네이버 뮤직과 연동되는 음악 재생 기능 위주이고 알람 설정과 검색,중립,100,0,0
76385,76386,76386,7,재생,샐리는 입 부분을 클릭하면 오디오 재생 또는 일시정지와 1 초이상 길게,중립,100,0,0
76386,76387,76387,7,재생,호출 단축키 볼륨조절 일시정지 / 재생 조작을 할 수 있는 터치,중립,100,0,0
76387,76388,76388,7,재생,/ 교통상황 검색 네이버 뮤직 재생 날씨나 뉴스 알리미 등이 매우,중립,100,0,0
76388,76389,76389,7,재생,재생,NA,NA,NA,NA
76389,76390,76390,7,재생,애매한 장르 재생시켜보기필자는 예시로 흑인음악 재생 명령을 했습니다,중립,100,0,0
76390,76391,76391,7,재생,AI 스피커의 기능 중에서도 음악 재생 기능은 핵심적인 부분인데요 그래서 국내,중립,100,0,0
76391,76392,76392,7,재생,역시 멜론과의 제휴를 통해 음악 재생 기능을 탑재하고 있습니다,중립,100,0,0
76392,76393,76393,7,재생,쓸모 있는 기능은 무엇보다도 음악 재생 기능이었다,중립,100,0,0
76393,76394,76394,7,재생,구글 어시스턴트는 음원 재생 서비스 유튜브 레드와 연동되어 있으며,중립,100,0,0
76394,76395,76395,7,재생,는정보 검색 장소 추천 음악 재생 일정 브리핑등의 기능을 제공하고 있는데요,중립,100,0,0
76395,76396,76396,7,재생,누르면오디오 재생 / 일시정지 1 초 이상,긍정,100,0.050111448834853,0.81286849525763
76396,76397,76397,7,재생,: 네이버 뮤직 앱에 있는 재생 목록 틀어줘,중립,100,0,0
76397,76398,76398,7,재생,* _ * ) 노래 재생 목록도 바꿀 수 있고띠별 별자리별,중립,100,0,0
76398,76399,76399,7,답변,다나와 가전에서누구보다 빠르게 답변 드리겠습니다,중립,100,0,0
76399,76400,76400,7,답변,답변 또한 기계음이 아닌 자연스러운 음성,부정,50.588235294118,-0.031476997578692,-0.011627906976744
76400,76401,76401,7,답변,구글 어시스턴트 : … ( 답변 대신 스마트폰 액정에,중립,100,0,0
76401,76402,76402,7,답변,기존에 개발진들이 AI 에 정형화된 답변 내용을 저장한 인상을 지울 수,중립,100,0,0
76402,76403,76403,7,답변,구동되는 디바이스에서 사용한 음성명령과 간단한 답변 내용이 시간 순으로 저장되어 있습니다,긍정,100,0.051024610777743,1.003599677159
76403,76404,76404,7,답변,빈번하고 1 차원적인 질문에 대해서는 답변 가능하다,긍정,100,0.17391156462585,1.0842857142857
76404,76405,76405,7,우리,때 친구처럼 음성으로 대화하는 건 우리 집 아이가 주로 해요 ^,긍정,100,0.13793382224389,1.8695343008703
76405,76406,76406,7,우리,여전히 변함없이 좋은 나의 클로버는 우리 집 일상에서 이젠 자리 잡혔어요,긍정,100,0.10369488054015,1.2443385664818
76406,76407,76407,7,우리,하지만어떤 방식으로든 AI 의발전은 우리 생활에 편리한 방향으로 발전 될,긍정,100,0.27473693901393,1.7038400498225
76407,76408,76408,7,우리,우리 집 거실,NA,NA,NA,NA
76408,76409,76409,7,우리,조명 등도 기기에 따라 가능했으나 우리 집에 있는 모델과는 호환이 되지,긍정,100,0.18288231153666,1.6867571303606
76409,76410,76410,7,우리,집에서 봤는데 너무 부러움 가득이었는데 우리 집에 입성이라니 기분 좋음 가득,긍정,100,0.13265856950067,1.7245614035088
76410,76411,76411,7,우리,지금도 제가 걸스데이 노래 틀어달라해서 우리 클로버는 열일 중 ㅎㅎㅎㅎ ),중립,100,0,0
76411,76412,76412,7,우리,우리 아들 맘을 사로잡은 비결이 뭐야,중립,100,0,0
76412,76413,76413,7,우리,걸 스피커 프렌즈 Friends 이름처럼 우리 또또의 친구가 되어준다,긍정,100,0.064307715423334,1.0689655172414
76413,76414,76414,7,우리,' 하는클로바 보다 더 기특한 우리 아들 이게 끝이냐고,중립,100,0,0
76414,76415,76415,7,우리,아래는 우리 아씨들이 샐리에게질문하고 정보를 얻는 실화입니다,긍정,100,0.070611111111111,1.1061111111111
76415,76416,76416,7,우리,뮤직 무제한 듣기 14 만원으로 우리 집에샐리가 가족으로 들어 온 날,긍정,100,0.066304347826087,1.2623188405797
76416,76417,76417,7,우리,웨이브 샐리야는한국말을 기본으로 해서 만들어진기기라 우리 말을 잘 알아 듣는똑똑한 아이라고,긍정,100,0.13030654005001,1.8502655866742
76417,76418,76418,7,우리,지능 스피커가 아닌인공 지능 로봇이 우리 가정에있게 되는 건 아닌지 모르겠네요,부정,100,-0.1937838140722,-1.3829365079365
76418,76419,76419,7,우리,받는다고 하고요 인공지능 스피커 앞으로 우리 생활에 어떠한 편리함을 줄지 기대가,긍정,100,0.229812724502,1.4188722546223
76419,76420,76420,7,우리,ㅋㅋㅋ 완전 신기 _ㅋㅋㅋㅋ 아직 우리 부모님은 이 기능을 모르고 있기때문에내일,부정,100,0.027470643107989,-0.19005310457516
76420,76421,76421,7,우리,우리 와이프는 스피커들이 응답하는 것을 싫어했었기,부정,100,-0.15789473684211,-0.98214285714286
76421,76422,76422,7,우리,저때만 해도 우리 클로버 똑순이라고 좋아했는데좀 쓰다보니 바부팅이,긍정,100,0.085722819593787,0.94295101553166
76422,76423,76423,7,우리,이러면 재생이되니전 오히려 우리보다는 우리 부모님들한테 정말 좋겠다,긍정,100,0.18494221082929,1.4795376866343
76423,76424,76424,7,우리,며칠 전 공급물량이 풀려서 우리 직원이 어렵게 구매한 놈이다,부정,100,-0.033419218622794,-0.47172963856181
76424,76425,76425,7,우리,씁쓸한 기분이 들었는데정말 인공지능이 이제는 우리 실생활에 정말 가깝게 다가온 것,중립,100,0,0
76425,76426,76426,7,우리,"있는데 1 절 말미에 "" 우리 두 사람 서로의 쉴 곳이",중립,100,0,0
76426,76427,76427,7,우리,이제 공기청정기가 우리 집 공기는 물론 사운드까지 책임지고,긍정,100,0.1461952293629,1.5183990442055
76427,76428,76428,7,우리,이던데 그래도 우리 집은 위닉스 공기청정기 추천 TOWER,중립,100,0,0
76428,76429,76429,7,우리,보는 분들이 많지만 사실 상당히 우리 곁에 있는 기술입니다,긍정,100,0.13507800622118,1.6310866713752
76429,76430,76430,7,우리,우리 조카 일주일에 세 번 정도,중립,100,0,0
76430,76431,76431,7,우리,페스타 때 큰맘 먹고 구입한 우리 아반떼에요,중립,100,0,0
76431,76432,76432,7,우리,우리 나라 최대의 포털사이트인 네이버의 방대한,긍정,100,0.085770750988142,0.99469696969697
76432,76433,76433,7,우리,바로 이것저것 말을 걸었죠 ㅋㅋㅋㅋ 우리 브라운 공부 열심히 해,중립,100,0,0
76433,76434,76434,7,우리,우리 샐리 옷을 입혔는데 정말 귀여워요,긍정,100,0.21386186053369,1.3188854489164
76434,76435,76435,7,우리,또 공기청정기에서 노래가 나오니 우리 쏘율양,중립,100,0,0
76435,76436,76436,7,우리,우리 또또가 네이버 인공지능 스피커 프렌즈를,중립,100,0,0
76436,76437,76437,7,우리,알려주는 귀여운 비서 클로바 때로는 우리 아이를 자장가로 재워주고분유 먹을 시간도,긍정,100,0.21865422914848,1.5678975111101
76437,76438,76438,7,우리,우리 집 인공지능 스피커 프렌즈 의미심장한,중립,100,0,0
76438,76439,76439,7,우리,우리 아이 학습 도우미는 바로 너닷,중립,100,0,0
76439,76440,76440,7,우리,스피커 성능도 좋은 프렌즈 우리 또또와 뚜뚜의 꿈나라도 책임진다,긍정,100,0.11111111111111,1
76440,76441,76441,7,우리,궁금증을 해결해주는 인공지능 스피커 프렌즈 우리 아이가 좋아하는 사랑스러운 인공지능 스피커내일은,긍정,100,0.24471815209135,1.2119526836158
76441,76442,76442,7,우리,대고 말로 하는 세상 이미 우리 삶에 가깝게 다가왔다 하겠는데요,중립,100,0,0
76442,76443,76443,7,우리,국내외 인공지능 스피커들을 살펴보고 더불어 우리 생활 속으로 성큼 다가온 인공지능,중립,100,0,0
76443,76444,76444,7,우리,다음엔 인공지능이 우리 삶에 미치는 영향들을 분야별로 세부적으로,부정,100,-0.056365740740741,-0.81917211328976
76444,76445,76445,7,우리,우리 와이픈는 예쁜 천재다,긍정,100,0.43533296642818,1
76445,76446,76446,7,우리,우리 집에서 강남역까지 얼마나 걸리지,부정,100,-0.063333333333333,-0.8
76446,76447,76447,7,우리,웨이브를 사용하고 나서는 놀라울 정도로 우리 가적은 쉽게 적응해 버렸습니다아침에 시간을,중립,100,0,0
76447,76448,76448,7,우리,몇가지 아쉬운 점이 있지만 우리 삶의 작은 변화를 만들어 낸건,중립,100,0,0
76448,76449,76449,7,우리,신기함 ㅋㅋ 음악과 함께 반짝반짝 우리 막내에겐 취향저격샤오미큐브와비교 사알짝 큰크기 오렌지에,중립,100,0,0
76449,76450,76450,7,우리,막내를 위해서 레이빔을 구매하면서 같이구매힌 우리 태희 장난감 2 종 세트,중립,100,0,0
76452,76453,76453,7,우리,신기함 ㅋㅋ 음악과 함께 반짝반짝 우리 막내에겐 취향저격 샤오미큐브와비교 사알짝 큰크기,중립,100,0,0
76454,76455,76455,7,우리,과연 우리 생활이 어떻게 바뀌게 될까요,중립,100,0,0
76455,76456,76456,7,우리,우리 엄마생각이 나네,긍정,100,0.19117085209202,1.2294721407625
76456,76457,76457,7,우리,"( 우리 아이가 "" 클로버 "" """,중립,100,0,0
76457,76458,76458,7,우리,""" 이미 우리 생활 속으로 들어온 AI 기술은",중립,100,0,0
76458,76459,76459,7,우리,웨이브 : 우리 둘의 생각이 통했네요,중립,100,0,0
76459,76460,76460,7,우리,우리 친구해요,긍정,100,0.16993464052288,1
76460,76461,76461,7,우리,우리 잘 지내봐요,중립,100,0,0
76461,76462,76462,7,우리,우리 애마 넘 빨리 달려서 사진이,긍정,100,0.11424149537204,1.1694915254237
76462,76463,76463,7,우리,다 정리 되어가고 해서 오늘은 우리 농부님들 많이 오셨을 것 같아요,중립,100,0,0
76463,76464,76464,7,우리,우리 농가들 걱정을 많이 해주셨어요,부정,100,-0.14181818181818,-0.97560975609756
