,Unnamed: 0,X,category,key,sentences,senti,score1,score2,score3
26921,26922,26922,8,사운드,심플하면서 깔끔한 디자인이 돋보이는 아이리버 사운드 웨이브 시즌 2 블루투스 스피커,NA,NA,NA,NA
26922,26923,26923,8,사운드,지원 자동 주파수 검색과 음성안내와 사운드 웨이브 시즌 2 는 FM,NA,NA,NA,NA
26923,26924,26924,8,사운드,사운드 웨이브 시즌 2 는 여러,NA,NA,NA,NA
26924,26925,26925,8,사운드,시즌 2 는 여러 번의 사운드 튜닝을 거쳐 완벽한 밸런스의 사운드를,NA,NA,NA,NA
26925,26926,26926,8,사운드,육안으로 확인이 가능한 사운드 웨이브 시즌 2 만의 Clear-Sound,NA,NA,NA,NA
26926,26927,26927,8,사운드,아이리버 사운드 웨이브 시즌 2 로 특수,NA,NA,NA,NA
26927,26928,26928,8,사운드,지나고 청량해진 가을하늘 아래서 아이리버 사운드 웨이브 시즌 2 와 함께,NA,NA,NA,NA
26928,26929,26929,8,사운드,더 발전된 돌비 애트모스 입체 사운드 기술을 구현할 수 있다,NA,NA,NA,NA
26929,26930,26930,8,사운드,상품 더보기 ] < 사운드 전달까지 고려한 웨이브 스탠드 디자인,NA,NA,NA,NA
26930,26931,26931,8,사운드,좋을 수가 없어요 ^ ^ 사운드 직접 들려드리고 싶어 동영상으로 담아봤는데,NA,NA,NA,NA
26931,26932,26932,8,사운드,직접 들려드리고 싶어 동영상으로 담아봤는데 사운드 괜찮죠,NA,NA,NA,NA
26932,26933,26933,8,사운드,제가 생각했을 때 사운드 출력에 대한,NA,NA,NA,NA
26933,26934,26934,8,사운드,네이버 뮤직과는 상관 없는 앱의 사운드 재생을 부탁하기도 합니다,NA,NA,NA,NA
26934,26935,26935,8,사운드,풍성해진 출력 360 도 왜곡없는 사운드 음성으로 손쉽게 제어 - 라고,NA,NA,NA,NA
26935,26936,26936,8,사운드,사운드,NA,NA,NA,NA
26936,26937,26937,8,사운드,와이드 ( BTS-D5W ) 와 사운드 웨이브 시즌 2 ( BTS-SP01,NA,NA,NA,NA
26937,26938,26938,8,사운드,는 작은 사이즈에도 깜짝 놀랄만한 사운드 퍼포먼스를 자랑한다,NA,NA,NA,NA
26938,26939,26939,8,사운드,보기 확대 보기 ▲ 블랭크 사운드 웨이브 시즌 2 ( BTS-SP01,NA,NA,NA,NA
26939,26940,26940,8,사운드,2 ( BTS-SP01 S2 ) 사운드 웨이브 시즌 2 는 FM,NA,NA,NA,NA
26940,26941,26941,8,사운드,기본적인 능력인 짱짱한 출력을 가진 사운드 성능도 갖추고 있습니다,NA,NA,NA,NA
26941,26942,26942,8,사운드,사이 인공지능 스피커 중 최고 사운드 ^ ^ 와 고급스러운 디자인,NA,NA,NA,NA
26942,26943,26943,8,사운드,풍성하고 왜곡없는 사운드,NA,NA,NA,NA
26943,26944,26944,8,아침,경우는 아침에 일어나서 ' 클로버 아침 음악 틀어줘 ' 라고 자주,NA,NA,NA,NA
26944,26945,26945,8,아침,저의 경우는 아침에 일어나서 아침 음악을 틀어 달라고 한다던지 그날의,NA,NA,NA,NA
26945,26946,26946,8,아침,부모님은 이 기능을 모르고 있기때문에내일 아침 골려줄 예정이다 후후후후 25 일부터는,NA,NA,NA,NA
26946,26947,26947,8,아침,알려줘 뉴스 브리핑 읽어줘 바쁜 아침 외출 준비만으로도 바쁜 당신을 위해,NA,NA,NA,NA
26947,26948,26948,8,아침,배터리가 똑 떨어져서 파스타 할때나 아침 알람으로 잘 사용중이고출근할때마다 ' 클로바,NA,NA,NA,NA
26948,26949,26949,8,아침,비트빠른 음악 나오고 말로 낼 아침 몇시몇분에 깨워달라하면 알아서 알람 울려주고,NA,NA,NA,NA
26950,26951,26951,8,아침,라면 끓이기나 요리시 타이머는 물론 아침 알람과 메모 기능까지 있어서제 곁에,NA,NA,NA,NA
26951,26952,26952,8,아침,' 샐리야 내일 아침 9 시에,NA,NA,NA,NA
26952,26953,26953,8,아침,매일 아침 일곱시에 알람울려줘,NA,NA,NA,NA
26953,26954,26954,8,아침,아침 출근 준비나 외출 준비 중,NA,NA,NA,NA
26954,26955,26955,8,아침,등 ) 특히 ' 내일 아침 7 시에 음악 틀어줘 ',NA,NA,NA,NA
26955,26956,26956,8,아침,인공지능 스피커 ) 요즘 저희집 아침 일상이예요 : ) 일단 영상부터,NA,NA,NA,NA
26956,26957,26957,8,아침,저희집에 입양된 짱구비서 - 매일 아침 8 시에 알람맞춰 깨워 준,NA,NA,NA,NA
27094,27095,27095,8,선택,더 좋은 웨이브 스피커를 스피커를 선택 하였습니다 저는 웨이브 스피커를 멜론,NA,NA,NA,NA
27095,27096,27096,8,선택,나오고 소리도 좋더라구요오 역시 인공지능스피커네이버프렌즈스피커로 선택 잘한거 같아요전원버튼은 아래쪽에있다는사실브라운스피커 코를누르면 일시정지,NA,NA,NA,NA
27096,27097,27097,8,선택,인공지능 스피커에는브라운과 샐리가 있는데우리는 브라운으로 선택,NA,NA,NA,NA
27097,27098,27098,8,선택,종 3 가지 종류 중 선택,NA,NA,NA,NA
27098,27099,27099,8,선택,내껀 브라운 브라운에 어울리는 다크레드를 선택 왔다 택배,NA,NA,NA,NA
27100,27101,27101,8,선택,나는 브라운으로 선택,NA,NA,NA,NA
27113,27114,27114,8,기존,기존,NA,NA,NA,NA
27114,27115,27115,8,기존,번째 스피커도 좋고 펌웨어 업그레이드로 기존 제품을 바꿀 수 있다면 더욱,NA,NA,NA,NA
27115,27116,27116,8,기존,기존 15 만 원에서 2 만,NA,NA,NA,NA
27116,27117,27117,8,기존,을 적용하였으며 HDR 규격 역시 기존 돌비비전 HDR10 HLG 규격에 할리우드의,NA,NA,NA,NA
27117,27118,27118,8,기존,등을 개선해 선명한 이미지를 표현하고 기존 제품 대비 노이즈를 절반으로 줄여,NA,NA,NA,NA
27118,27119,27119,8,기존,스티커가 있는데요 이 스티커가 나중에 기존 스위치를 분리하시기 전 전기선이 어디와,NA,NA,NA,NA
27119,27120,27120,8,기존,기존 10 만원 가격대를 달리고 있는,NA,NA,NA,NA
27120,27121,27121,8,기존,( 웨이브 ) 의 등장은 기존 서비스에 부족했던 음성인식률과 네이버만의 광대한,NA,NA,NA,NA
27121,27122,27122,8,기존,하지만 호출자의 말을 인식하는 정도는 기존 어느 기기를 가져다 놔도 손색없는,NA,NA,NA,NA
27122,27123,27123,8,기존,기존 제품과 다른 부분은 아무래도 높은,NA,NA,NA,NA
27123,27124,27124,8,기존,새로운 스마트 인코딩 방식을 언급하며 기존 라이브러리를 변환하기 위해 머신 러닝,NA,NA,NA,NA
27124,27125,27125,8,기존,아니죠 프렌즈가 두 번째 작품인데 기존 스피커하고,NA,NA,NA,NA
27125,27126,27126,8,기존,들고 다니기 편하게 만들었어요 그리고 기존 밋밋한 디자인에서 귀여운 캐릭터로 디자인으로,NA,NA,NA,NA
27126,27127,27127,8,기존,기존 마샬스텐모어 스피커는 거의 사용하지 않게되네요,NA,NA,NA,NA
27127,27128,27128,8,기존,기존 아미카가 주로 음성인식 서비스를 했던,NA,NA,NA,NA
27128,27129,27129,8,기존,가지고 있는 음악을 재생하는 기능으로 기존 모든 인공지능 스피커는 이 기능을,NA,NA,NA,NA
27129,27130,27130,8,기존,기존 인공지능 스피커 모델과 달라진 점이,NA,NA,NA,NA
27130,27131,27131,8,기존,기존 웨이브로 대표되던 네이버 인공지능 스피커가,NA,NA,NA,NA
27131,27132,27132,8,기존,기존 네이버 스피커 ' 웨이브 ',NA,NA,NA,NA
27133,27134,27134,8,기존,또한 기존 검색 추천 데이터 커넥션 담당,NA,NA,NA,NA
27136,27137,27137,8,기존,문맥 이해 그럼 여기서 호출부터 기존 자료없이 질문을 한다면,NA,NA,NA,NA
27137,27138,27138,8,기존,경쟁에 나서고 있는 가운데 국내시장에서도 기존 통신업체와 인터넷업체간 시장 주도권 다툼이,NA,NA,NA,NA
27141,27142,27142,8,기존,웨이브는 기존 SK KT 같은 이동통신사가 아닌,NA,NA,NA,NA
27142,27143,27143,8,기존,기존 공유기의 커버리지가 작거나 속도가 떨어져,NA,NA,NA,NA
27143,27144,27144,8,버튼,뒷쪽에 보시면 음소거 블루투스 활성화 버튼 그리고 음량 조절 버튼이 있습니다,NA,NA,NA,NA
27144,27145,27145,8,버튼,등등 버튼으로 가능하고 음성으로도 가능하니 버튼 누르기 귀찮을 때는 음성으로 사용하면,NA,NA,NA,NA
27145,27146,27146,8,버튼,옆면을 보시면 전원버튼 마이크정지 버튼 전원 연결과 충전을 할 수,NA,NA,NA,NA
27146,27147,27147,8,버튼,수 있는 전원 단자와 전원 버튼 음소거 버튼이 있고 상단에 재생,NA,NA,NA,NA
27147,27148,27148,8,버튼,단축 버튼 3 가지도 생각보다 유용하다,NA,NA,NA,NA
27148,27149,27149,8,버튼,아쉬우나 입조차 떼기 싫을 때 버튼 하나만으로 음악을 재생할 수 있는,NA,NA,NA,NA
27149,27150,27150,8,버튼,양 사이드 버튼 주변이 뚫려있는 구조로 버튼 조작시,NA,NA,NA,NA
27150,27151,27151,8,버튼,사이드 버튼 주변이 뚫려있는 구조로 버튼 조작시 조작감을 극대화하였고 무게도 줄일,NA,NA,NA,NA
27151,27152,27152,8,버튼,느낌이에요 ㅋㅋ 뒷면에는 엘이디 마이크 버튼 블루투스 버튼 볼륨버튼이 있어요,NA,NA,NA,NA
27152,27153,27153,8,버튼,뒷면에는 엘이디 마이크 버튼 블루투스 버튼 볼륨버튼이 있어요,NA,NA,NA,NA
27153,27154,27154,8,버튼,어플을 깔아야하는데 어플을 깔면 굳이 버튼 누를 필요도 없어서 편하더라고요,NA,NA,NA,NA
27154,27155,27155,8,버튼,그 알림음을 끌 수 있는 버튼 따윈 보이지 않습니다,NA,NA,NA,NA
27155,27156,27156,8,버튼,블루투스 연결 방해금지 리모컨 단축 버튼 호출명 무드등 기기 위치까지 설정,NA,NA,NA,NA
27156,27157,27157,8,버튼,있어요 사용하지 않을 때 전원 버튼 3 초 동안 누르면 꺼집니다,NA,NA,NA,NA
27157,27158,27158,8,버튼,네이버 인공지능 스피커 사용 설명서입니다 버튼 기능이 상세하게 나와있으니 참고하시면 돼요,NA,NA,NA,NA
27158,27159,27159,8,버튼,자연스럽게 기능을 알게 되는데 특별하게 버튼 사용은 안 하게 되네요,NA,NA,NA,NA
27159,27160,27160,8,버튼,수동버튼 둘레의 조명때문에 어두운 곳에서는 버튼 식별이 어려움 - 스마트싱스 등의,NA,NA,NA,NA
27160,27161,27161,8,버튼,상단 버튼은 터치 버튼 형식입니다,NA,NA,NA,NA
27161,27162,27162,8,버튼,ㅋㅋㅋㅋ 맨위는 음성인식 기능을 끄는 버튼 두번째는 블루투스 연결버튼 세번째 네번째는,NA,NA,NA,NA
27162,27163,27163,8,버튼,그리고 하단 후면에 작은 버튼 두개와 전원선을 연결하여 충전할 수,NA,NA,NA,NA
27163,27164,27164,8,버튼,앞면 옆면 아래쪽에 여러 버튼 들이 있는데요,NA,NA,NA,NA
27164,27165,27165,8,버튼,두번째는 사실 잘 안보이는데 블루투스 버튼 같아요,NA,NA,NA,NA
27167,27168,27168,8,와이파이,와이파이,NA,NA,NA,NA
27168,27169,27169,8,와이파이,2 / 와이파이 802,NA,NA,NA,NA
27170,27171,27171,8,와이파이,최초 실행시 와이파이 설정이 되어야한다,NA,NA,NA,NA
27171,27172,27172,8,와이파이,기본적으로 와이파이 + 블루투스 스피커 기능을 가지고,NA,NA,NA,NA
27172,27173,27173,8,와이파이,앞서 말씀 드렸지만 와이파이 블루투스로 연결이 되어 음악 플레이가,NA,NA,NA,NA
27173,27174,27174,8,와이파이,가능한 것도 장점이지만 기본적인 블루투스 와이파이 스피커 기능이 있어 좋고요,NA,NA,NA,NA
27174,27175,27175,8,와이파이,설치 - 기기검색 등록 - 와이파이 연결 - 브라운 연결 완료,NA,NA,NA,NA
27175,27176,27176,8,와이파이,# 설정 # 연결 # 와이파이 #clova # 어플,NA,NA,NA,NA
27176,27177,27177,8,와이파이,있어야한답니다 ^ ^ 앱을 설치하고 와이파이 연결을 하년 네이버웨이브를 사용할 준비,NA,NA,NA,NA
27177,27178,27178,8,와이파이,와이파이 연결해주면됩니당여기서 주의할점이있는데 박스모습 ㅋㅋㅋ 스피커를,NA,NA,NA,NA
27178,27179,27179,8,와이파이,네이버 클로바앱을설치해야되요 앱을 설치하고 나면 와이파이 연결등 몇 가지만 시키는대로 눌러주면,NA,NA,NA,NA
27179,27180,27180,8,와이파이,와이파이 모듈을 구입해서 설치한 후기를 올렸다,NA,NA,NA,NA
27180,27181,27181,8,와이파이,후 인터넷 연결 등을 위해서 와이파이 설정을 하는 것으로 연결이 끝이나는데,NA,NA,NA,NA
27181,27182,27182,8,와이파이,켜면 자동으로 연결을 진행하고 무선 와이파이 연결도 진행합니다,NA,NA,NA,NA
27182,27183,27183,8,와이파이,378g 으로 역시 가벼운편이며 블루투스 와이파이 그리고 USB- 타입 C 단자를,NA,NA,NA,NA
27183,27184,27184,8,와이파이,스마트 스위치를 사용하기 위해서는 집안에 와이파이 연결이 가능한 공유기가 있어야 하며,NA,NA,NA,NA
27184,27185,27185,8,와이파이,저는 처음에 와이파이 비밀번호를 틀려서 좀 고생했어요,NA,NA,NA,NA
27185,27186,27186,8,와이파이,할 수 있는 기능들 ( 와이파이 블루투스 GPS ) 같은 명령어,NA,NA,NA,NA
27186,27187,27187,8,와이파이,스마트폰을 통해서 와이파이 설정 및 펌웨어 업데이트가 가능하며,NA,NA,NA,NA
27187,27188,27188,8,와이파이,하지만 와이파이 전용이라 블루투스 스피커로서의 음악 재생은,NA,NA,NA,NA
27188,27189,27189,8,와이파이,된것을확인할 수 있어요 블루투스와 연동할 와이파이 등록하면 연동이 되요,NA,NA,NA,NA
27189,27190,27190,8,와이파이,뒷면에는 볼륨 컨트롤 블루투스 페어링 와이파이 연결이 가능한 버튼이 나란히 배치되어,NA,NA,NA,NA
27190,27191,27191,8,와이파이,간단합니다 앱 다운로드해서 약관의 동의하고 와이파이 연결하면 바로 브라운 연결 끝이라고,NA,NA,NA,NA
27191,27192,27192,8,와이파이,보니 핸드폰에서 등록된 클로버가 없어서 와이파이 문제인가 싶었지만집 와이파이는 컴퓨터 핸드폰,NA,NA,NA,NA
27192,27193,27193,8,와이파이,검색해서 기기블루투스 연결하라허믄 연결하믄되고 그러고나서 와이파이 연결하라고하믄 사용하고있는 와이파이 접속해서 연결하면,NA,NA,NA,NA
27193,27194,27194,8,와이파이,연결하믄되고 그러고나서 와이파이 연결하라고하믄 사용하고있는 와이파이 접속해서 연결하면 끝,NA,NA,NA,NA
27194,27195,27195,8,와이파이,한 가지 단점으로는 와이파이 연결 방법이 다소 불편하다는 점이,NA,NA,NA,NA
27195,27196,27196,8,와이파이,5 초 이상 길게 누르면 와이파이 또는 스마트폰 재 설정도 가능하며,NA,NA,NA,NA
27196,27197,27197,8,와이파이,Wi-Fi 이건 그냥 와이파이 연결을 해제하거나 연결할때,NA,NA,NA,NA
27197,27198,27198,8,와이파이,4GHz 와 5GHz 2 개의 와이파이 주파수를 지원합니다,NA,NA,NA,NA
27198,27199,27199,8,와이파이,그러면 웨이브에 와이파이 연결할 수 있고 그러면 끝입니다,NA,NA,NA,NA
27199,27200,27200,8,와이파이,같은것을사용하는 분들은 사용하기에 익숙한 느낌이었습니다 와이파이 연결을 통해 네이버 웨이브와도연결이 가능하며,NA,NA,NA,NA
27201,27202,27202,8,와이파이,와이파이 접속을 계속 시도하고 그것이 성공해야,NA,NA,NA,NA
27202,27203,27203,8,와이파이,되더니 갑자기 말을 인식 못하고 와이파이 네트워크가 연결이 안 되었다고 해서,NA,NA,NA,NA
27203,27204,27204,8,와이파이,지직 거리는 경우가 있는 폰 와이파이 주위환경 스피커 중에 무슨 문제인지,NA,NA,NA,NA
27204,27205,27205,8,와이파이,AI 스피커와 달리 네이버 웨이브는 와이파이 연결이 되지 않으면 블루투스 스피커로도,NA,NA,NA,NA
27206,27207,27207,8,와이파이,만 가입자 돌파 기념으로 기가 와이파이 웨이브 2 화이트 에디션이 출시되었어요,NA,NA,NA,NA
27207,27208,27208,8,와이파이,싶어요 + _ + 기가 와이파이 웨이브 2 는 더 멀리,NA,NA,NA,NA
27208,27209,27209,8,와이파이,기가 와이파이 웨이브 2 의 또 다른,NA,NA,NA,NA
27209,27210,27210,8,와이파이,기술력 덕분에 KT 공유기가 통신사 와이파이 만족도 1 위를 하는 거겠죠,NA,NA,NA,NA
27210,27211,27211,8,와이파이,쏙 들어하실듯 : ) 기가 와이파이 웨이브 2 를 사용하면 두개의,NA,NA,NA,NA
27211,27212,27212,8,와이파이,스마트 라이프를 즐길 수 있는 와이파이 속도 여러명이 써도 느려지지 않는,NA,NA,NA,NA
27228,27229,27229,8,구성,스타터 킷의 기본 구성,NA,NA,NA,NA
27229,27230,27230,8,구성,박스는 이렇게 포장되어 있고 안에 구성 물품은 본체 충전기 충전케이블 이렇게,NA,NA,NA,NA
27230,27231,27231,8,구성,| 요즘 대세인 심플한 박스 구성 박스를 당겨서 오픈하면 먼저 사용,NA,NA,NA,NA
27231,27232,27232,8,구성,본체 / 어댑터박스 구성 되어있습니다,NA,NA,NA,NA
27232,27233,27233,8,구성,버튼이 있답니다 본체 / 어댑터박스 구성 되어있습니다 네이버 클로바앱을 미리 설치합니다,NA,NA,NA,NA
27236,27237,27237,8,전원,전원,NA,NA,NA,NA
27237,27238,27238,8,전원,x 45mm Passive Radiator 사용 전원 : 5V 통신 : 블루투스,NA,NA,NA,NA
27238,27239,27239,8,전원,후 _ 에는 전원 버튼과 마이크와 새로운 연결을 하고,NA,NA,NA,NA
27239,27240,27240,8,전원,어떨 때는 전원 새로 켜고 어플 새로 연셜하면,NA,NA,NA,NA
27240,27241,27241,8,전원,최대 5 시간까지 어느 곳에서도 전원 없이 웨이브를 사용할 수 있답니다,NA,NA,NA,NA
27241,27242,27242,8,전원,ㅎㅎ 전원,NA,NA,NA,NA
27242,27243,27243,8,전원,전원버튼은 궁뎅이에 있지롱여담이지만 클로바 켜져있을때 전원 끄라고 명령했더니그런 기능 없다며 와서,NA,NA,NA,NA
27243,27244,27244,8,전원,옆면을 보시면 전원버튼 마이크정지 버튼 전원 연결과 충전을 할 수 있는,NA,NA,NA,NA
27244,27245,27245,8,전원,클로버 밑부분에 전원 장치가 있는데 그걸 누르면 켜진다,NA,NA,NA,NA
27245,27246,27246,8,전원,전원 버튼은 하단에 있습니다,NA,NA,NA,NA
27246,27247,27247,8,전원,사실 첨에 전원 버튼이 따로 없는 줄알고,NA,NA,NA,NA
27247,27248,27248,8,전원,전원 케이블을 이용하여 충전이 가능하며 5000mAh,NA,NA,NA,NA
27248,27249,27249,8,전원,전원 버튼을 눌러 전원을 켜니 하단에,NA,NA,NA,NA
27249,27250,27250,8,전원,전원 연결선때문에 요 아이를 어디에 둘지,NA,NA,NA,NA
27250,27251,27251,8,전원,구성품은 WAVE 본체와 충전 케이블 전원 어댑터가 전부입니다,NA,NA,NA,NA
27251,27252,27252,8,전원,있습니다 ㅎㅎㅎ 웨이브를 들어올리면 밑에 전원 어댑터까지전원어댑터를 찍지는 못했지만 케이블 잘,NA,NA,NA,NA
27252,27253,27253,8,전원,개봉하면 아무것도 들어있지 않고 스피커와 전원 어답터만이 들어있다,NA,NA,NA,NA
27253,27254,27254,8,전원,한쪽에는 전원을 연결할 수 있는 전원 단자와 전원 버튼 음소거 버튼이,NA,NA,NA,NA
27254,27255,27255,8,전원,연결할 수 있는 전원 단자와 전원 버튼 음소거 버튼이 있고 상단에,NA,NA,NA,NA
27255,27256,27256,8,전원,( 5000mAh ) 를 탑재해 전원 코드 길이에 제약을 받지 않는다는,NA,NA,NA,NA
27256,27257,27257,8,전원,마련하지 않았다는 게 카카오의 설명이지만 전원 플러그가 빠지면 그 즉시 움직임을,NA,NA,NA,NA
27258,27259,27259,8,전원,위닉스 타워 Q300S 제품 상부에 전원 / 필터 교환 / 블루투스,NA,NA,NA,NA
27259,27260,27260,8,전원,인공지능 스피커이지만 연결 할 때는 전원 케이블이 연결되어있어야 합니다,NA,NA,NA,NA
27260,27261,27261,8,전원,웨이브의 경우엔 전원 버튼이 기기 후면에 위치해 있어,NA,NA,NA,NA
27261,27262,27262,8,전원,프렌즈의 경우엔 전원 버튼이 기기의 하단에 숨어있습니다,NA,NA,NA,NA
27262,27263,27263,8,전원,기기 하단부의 전원 버튼을 길게 눌러서 기기를 끄거나,NA,NA,NA,NA
27263,27264,27264,8,전원,젤 바닥에는 전원 연결을 위한 어댑터가 있습니다,NA,NA,NA,NA
27264,27265,27265,8,전원,클로버와 가장 큰 차이점이 카카오미니는 전원 연결이 되어야 작동한다는 거에요,NA,NA,NA,NA
27266,27267,27267,8,전원,같아요 ^ ^ 다만 프렌즈의 전원 버튼은 하단에 달려 있다는 것,NA,NA,NA,NA
27267,27268,27268,8,전원,이렇게 뒤집어 보면 하단 중앙에 전원 버튼이 있어요 ^ ^ 휴대하고,NA,NA,NA,NA
27268,27269,27269,8,전원,뒷면은 간단한 제품정보와 전원 단자가 위치하고 있습니다,NA,NA,NA,NA
27269,27270,27270,8,전원,구 2 구 3 구 전원 ' 이라고 프린팅 된 스티커가,NA,NA,NA,NA
27270,27271,27271,8,전원,뒤쪽으로는 제품의 전원 및 마이크 기능을 끌 수,NA,NA,NA,NA
27271,27272,27272,8,전원,기능을 끌 수 있으며 하단에는 전원 AC 단자가 위치해 있습니다,NA,NA,NA,NA
27272,27273,27273,8,전원,전원 / / 필터교환 / /,NA,NA,NA,NA
27273,27274,27274,8,전원,할때쓰는 버튼이라고 하네요 ㅋ 아래에는 전원 버튼이 있네요 ㅋ 왜 밑에,NA,NA,NA,NA
27274,27275,27275,8,전원,스피커 고정이 가능하고 가운데 보면 전원 버튼이 있어요 사용하지 않을 때,NA,NA,NA,NA
27275,27276,27276,8,전원,버튼이 있어요 사용하지 않을 때 전원 버튼 3 초 동안 누르면,NA,NA,NA,NA
27276,27277,27277,8,전원,뒷면에는 충전단자와 전원 / 음소거 키가 있습니다,NA,NA,NA,NA
27277,27278,27278,8,전원,본체 바닥에 전원 장치가 있어서 약간 불편하긴 하는데,NA,NA,NA,NA
27278,27279,27279,8,전원,전원 껐다가 켜보기 2 차,NA,NA,NA,NA
27279,27280,27280,8,전원,전원 아답터와 케이블선이 있다,NA,NA,NA,NA
27280,27281,27281,8,전원,전원 음소거 버튼과 전원선을 꼽는 홈이,NA,NA,NA,NA
27281,27282,27282,8,전원,로지텍하모니처럼 세밀하게 학습시키는건 아니고 전원 온 / 오프 사운드조절 정도를,NA,NA,NA,NA
27284,27285,27285,8,전원,후면에는 마이크 On / Off 전원 스위치가 있고 상단에는 호출 단축키,NA,NA,NA,NA
27285,27286,27286,8,전원,내장 ) 전원,NA,NA,NA,NA
27288,27289,27289,8,전원,외에도 완충 1 회 후 전원 연결 없이 최대 5 시간,NA,NA,NA,NA
27289,27290,27290,8,전원,대의 무게로 휴대성이 좋아서 야외에서도 전원 케이블 없이 사용할 수 있다는,NA,NA,NA,NA
27290,27291,27291,8,전원,바닥에는 전원버튼이 있습니다,NA,NA,NA,NA
27291,27292,27292,8,전원,스피커와 함께 전원 어댑터 전원 케이블 간단 설명서가,NA,NA,NA,NA
27293,27294,27294,8,전원,스피커 뒤쪽으로 전원 버튼과 음소거 버튼이 있지만 블루투스,NA,NA,NA,NA
27295,27296,27296,8,전원,전원 버튼은 뒤쪽에 쏙 숨어 있고그,NA,NA,NA,NA
27362,27363,27363,8,이야기,이렇게 이야기 하면 못 알아들으니 직관적으로 명령해야,NA,NA,NA,NA
27363,27364,27364,8,이야기,일단 제가 사용해본 결과를 이야기 드릴게요,NA,NA,NA,NA
27364,27365,27365,8,이야기,또한 저같이 외로운 중년들에게는 가끔 이야기 상대가 되어주기도 해서 더욱 바람직하다고,NA,NA,NA,NA
27365,27366,27366,8,이야기,활용한 인공지능 플렛폼으로 대화로 친구와 이야기 하듯이 명령을 하고 또 소통이,NA,NA,NA,NA
27366,27367,27367,8,이야기,이러한 인식률보다 놀라운 것은 재밌는 이야기 좀 해달라는 저의 무리한 부탁에,NA,NA,NA,NA
27367,27368,27368,8,이야기,등을 이야기 학습해주네요,NA,NA,NA,NA
27368,27369,27369,8,이야기,우리끼리 하는 이야기 중간에 불쑥 끼어들어 뜬금 없이,NA,NA,NA,NA
27369,27370,27370,8,이야기,끼어들어 뜬금 없이 노래를 튼다거나 이야기 중에 가게 이름이라도 나오면 주소를,NA,NA,NA,NA
27370,27371,27371,8,이야기,- _ - ; 아이들에게 이야기 합니다,NA,NA,NA,NA
27371,27372,27372,8,이야기,결론부터 이야기 하자면 네이버 뮤직 웹사이트에서 네이버,NA,NA,NA,NA
27372,27373,27373,8,이야기,네이버를 연동해서 이야기 하는것이기 때문에 당연하겠지,NA,NA,NA,NA
27373,27374,27374,8,박스,육아를 마치고 박스를 개봉해보았다,NA,NA,NA,NA
27374,27375,27375,8,박스,▲ 애플을 연상시키는 깔끔한 박스,NA,NA,NA,NA
27375,27376,27376,8,박스,▲ 박스 오픈을 하고,NA,NA,NA,NA
27376,27377,27377,8,박스,이러한 고급스러움은 박스 포장에서도 드러납니다,NA,NA,NA,NA
27377,27378,27378,8,박스,| 요즘 대세인 심플한 박스 구성 박스를 당겨서 오픈하면 먼저,NA,NA,NA,NA
27378,27379,27379,8,박스,설명도 쓰여있고요일단 불안해서 계속 촬영하며 박스 개봉을 해볼게요상세 설명서가 있네요,NA,NA,NA,NA
27379,27380,27380,8,박스,박스 옆면에는 제품 정보가 나타나있습니다,NA,NA,NA,NA
27380,27381,27381,8,박스,이렇게 박스 손잡이를 만들어 들어주면 네이버 웨이브가,NA,NA,NA,NA
27381,27382,27382,8,박스,또 박스,NA,NA,NA,NA
27382,27383,27383,8,박스,요즘은 박스 패키징도 이렇게 하나보다 로지텍도 그렇더니,NA,NA,NA,NA
27383,27384,27384,8,박스,우왕 굳 ㅋ 박스에 박스에 박스,NA,NA,NA,NA
27385,27386,27386,8,박스,Wave ) 스마트 스피커 제품 박스 구성은 꽤 디자인이 잘 된,NA,NA,NA,NA
27386,27387,27387,8,박스,원뿔형 모양의 제품인 만큼 박스 패키지를 오픈한 뒤 아래와 같이,NA,NA,NA,NA
27387,27388,27388,8,박스,박스 한번만 사진찍자고 해도 자기꺼라 안된다고,NA,NA,NA,NA
27388,27389,27389,8,박스,브라운이 더 귀엽더라구요 ㅎㅎ 브라운이들어있는 박스 뒷면을 보게되면,NA,NA,NA,NA
27389,27390,27390,8,박스,큰 박스안에 얌전히 들어있는 박스,NA,NA,NA,NA
