,Unnamed: 0,X,category,key,sentences,senti,score1,score2,score3
61916,61917,61917,1,만큼,원뿔형 모양의 제품인 만큼 박스 패키지를 오픈한 뒤 아래와,중립,100,0,0
61917,61918,61918,1,만큼,무게도 1kg 을 약간 넘는 만큼 묵직하게 느껴진다,중립,100,0,0
61918,61919,61919,1,만큼,그 만큼 기대감도 크고 불안감도 만만치 않은,부정,50.632911392405,0.059912365309144,0.2142238622454
61919,61920,61920,1,만큼,' 라인 ' 이 대세인 만큼 웨이브를 이용한 문자 발송과 문자,긍정,100,0.08276364962173,0.9622641509434
61920,61921,61921,1,만큼,그 만큼 두 회사는 앞으로도 끝없는 경쟁을,중립,100,0,0
61925,61926,61926,1,만큼,AI 기술이 총집결된 통합 플랫폼인 만큼 다양한 기능을 이용할 수 있다,중립,100,0,0
61926,61927,61927,1,만큼,차량용 AI 비서로 카카오를 선택할 만큼 카카오의 AI 기술은 음성인식에 탁월한,긍정,100,0.096145328672568,1.2306670209939
61932,61933,61933,1,만큼,가끔은 불을 켜놓고 나갔나 착각할 만큼 현관문을 열면 환하게 켜져 있는,긍정,100,0.16672129457844,1.8172129457844
61933,61934,61934,1,만큼,추천을 위해 사용 데이터가 필수인 만큼 이미 멜론을 사용하던 경우라면 카카오,중립,100,0,0
61934,61935,61935,1,만큼,반복 학습하는 과정에서 성능이 발전하는 만큼 데이터를 사전에 확보한 기업은 더욱,긍정,100,0.11105878683923,1.3816466552316
61935,61936,61936,1,만큼,비슷했고 웨이브가 크기가 더 큰 만큼 더 큰 박스에 담겨져 왔습니다,중립,100,0,0
61936,61937,61937,1,결제,뮤직 무제한 듣기 1 년 결제 시 ( 9 만 9000,중립,100,0,0
61937,61938,61938,1,결제,스피커를 멜론 1 년 장기 결제 을 통하여 3 만 원,중립,100,0,0
61938,61939,61939,1,결제,1 년 이용권 참 필요없다했는데이용권 결제 안한 아이디랑 웨이브를 연동시키면 노래가,중립,100,0,0
61939,61940,61940,1,결제,의미가 있는 제품이니만큼 1 년단위 결제 프로모션을 이용하는 게 좋다,긍정,100,0.10812684010952,1.0812684010952
61940,61941,61941,1,결제,출시 기념으로네이버 뮤직 1 년 결제 시 스피커를 제공한다는 엄청난 이벤트를,긍정,100,0.074643493761141,1.1544117647059
61941,61942,61942,1,결제,다운받는데네이버 뮤직을 결제하면 겹칠일이없을것 같아서 결제,부정,100,-0.019139683845566,-0.54660045836516
61942,61943,61943,1,결제,주는 행사를 진행중이네요 ㅋ 혹시 결제 하려던 분 이나 결제 하실,중립,100,0,0
61943,61944,61944,1,결제,혹시 결제 하려던 분 이나 결제 하실 생각이 있으신 분은둘러 보심,중립,100,0,0
61944,61945,61945,1,결제,무제한 듣기 1 년 정기권 결제 시,중립,100,0,0
61945,61946,61946,1,결제,결제 3 일만에 우리집에 입성한 브라운을,중립,100,0,0
61946,61947,61947,1,결제,… 네이버 웨이브 음악서비스 건당 결제 ] 카카오 미니 출시가 추석,중립,100,0,0
61947,61948,61948,1,결제,않은 경우 네이버 뮤직이 건당 결제 등을 지원해 알뜰 사용자에게 더,중립,100,-0.0013015845895727,0.069180898165718
61948,61949,61949,1,결제,쇼핑 및 카카오 페이를 활용한 결제 서비스도 사용이 가능하도록 할 예정이다,긍정,100,0.18472282277766,1.8880445543072
61949,61950,61950,1,결제,7500 원 해서 90000 원을 결제 했습니다,중립,100,0,0
61950,61951,61951,1,결제,유료 스트리밍 결제 시에만 활용 가능하다,긍정,100,0.18559923969588,1.1544117647059
61951,61952,61952,1,기업,다양한 장소 ( 기업 학교 관공서 교회 등 ),중립,100,0,0
61952,61953,61953,1,기업,메신저 기업 라인주식회사도 인공지능 비서 ' 클로바,중립,100,0,0
61953,61954,61954,1,기업,) 스피커 시장 경쟁에 인터넷 기업 네이버와 카카오가 가세한다,중립,100,0,0
61956,61957,61957,1,기업,관한 법이 시행됐지만 실제 복귀 기업 수와 지원 내용은 미미한 것으로,긍정,100,0.057305580226588,1.1354281567489
61957,61958,61958,1,생각,네이버 웨이브가 써보고 싶으시다면 그 생각 고이 접어두세요,중립,100,0,0
61958,61959,61959,1,생각,흔들리는 것이남편과 다시 상담받을까 싶은 생각 들더라고요 기존에 motion bed 본,중립,100,0,0
61959,61960,61960,1,생각,위 설명에 덧붙이자면당연한건데 저는 전혀 생각 못했던게 ㅋㅋㅋㅋ 앞으로도 네이버 결제를,긍정,100,0.13001317523057,1.7061923583663
61960,61961,61961,1,생각,구입할까 생각 중이다,중립,100,0,0
61961,61962,61962,1,생각,일단 사용평점은 처음 그냥 스피커랑 생각 했는데,중립,100,0,0
61962,61963,61963,1,생각,깜찍한 버튼이 코에 있을 거라고는 생각 못했을 겁니다 정말 귀여워요 ㅋ,중립,100,0,0
61963,61964,61964,1,생각,이후에 장기적인 제품지원은 고려하지 않는다는 생각,중립,100,-0.0025156607613177,0.067534800743756
61964,61965,61965,1,생각,기능 실험과 시범 서비스 목적이라는 생각,중립,100,0,0
61965,61966,61966,1,성능,집중되어서 정작 성능 면에서는 아직 이슈가 덜 된,중립,100,0,0
61966,61967,61967,1,성능,Naver Wave ) 와 하드웨어 성능 스펙을 비교해봤습니다이제 IT 기업에서 차세대,중립,100,0,0
61967,61968,61968,1,성능,원래는 비슷한 크기인 카카오미니와 성능 비교 테스트를 진행하려 했지만 카카오미니가,중립,100,0,0
61968,61969,61969,1,성능,성능,NA,NA,NA,NA
61969,61970,61970,1,성능,스마트폰 노트북의 성능 개선이 아무리 급속히 이뤄져도 데스크톱에,중립,100,0,0
61970,61971,61971,1,음질,디자인도 깔끔하고 음질 수준도 들을만하며 인공지능 아니어도 미래먹거리,부정,100,-0.01558485108475,-0.25617912464412
61971,61972,61972,1,음질,카드가 호환이 가능해 스마트폰이 없어도 음질 좋은 노래를 들을 수 있습니다,긍정,67.326732673267,0.16677662868333,0.45112633115147
61972,61973,61973,1,음질,웨이브 스탠드는 슬림해진 디자인으로 자칫 음질 성능이 떨어지는 것을 막을 수,부정,100,-0.053475935828877,-0.82352941176471
61973,61974,61974,1,음질,아이패드 프로로 재생하는 노래가 더 음질 짱짱하고 선명하게 들린다,긍정,100,0.11263804405599,1.355205811138
61974,61975,61975,1,음질,음질 중요하게 여기시는 분이면 클로바 웨이브가,긍정,100,0.17736018744231,1.435069699193
61975,61976,61976,1,음질,음질 부분에서는 소리가 커질수록 조금 찢어지는,중립,100,0,0
61976,61977,61977,1,음질,듣는 편인데 인공지능 스피커로 들으니 음질 최고네요,긍정,100,0.15375159107657,1.2481945467944
61977,61978,61978,1,음질,음질 테스트이제 내가 웨이브를 기다렸던 가장,중립,100,0,0
61978,61979,61979,1,음질,그래서 음질 최저인 에코닷이라도 비교해봐야겠다,중립,100,0,0
61979,61980,61980,1,음질,블루투스로 연결하여 노래를 틀었을때 에코닷의 음질,중립,100,0,0
61980,61981,61981,1,음질,아이패드로 녹화한거라 음질 전달은 당연히 잘 안되지만 만족스럽다,긍정,100,0.068763213530655,1.0249295278365
61981,61982,61982,1,음질,음질 만큼은 네이버 웨이브가 가장 나은,중립,100,0,0
61982,61983,61983,1,음질,음질,NA,NA,NA,NA
61983,61984,61984,1,공개,인공지능 스피커라 불리는 AI 스피커의 공개 및 출시가 이어지고 있는데요 카카오도,중립,100,0,0
61984,61985,61985,1,공개,미니라는 이름을 갖게 됐는지는 모르겠지만 공개 영상으로 본 모습으로는 크기가 작아,부정,100,0.010528722211913,-0.34894359132401
61985,61986,61986,1,공개,AI 기능은 핸드폰을 통해 먼저 공개 되었습니다,중립,100,0,0
61986,61987,61987,1,공개,개발 오픈스택 ' 타코 ' 공개 예정 인프라 운영 주도권 확보,중립,100,0,0
61987,61988,61988,1,공개,스피커 ' 프렌즈 ' 를 공개 - 정식 가격은 12 만,중립,100,0,0
61988,61989,61989,1,일본,메신저 라인의 주 활동 무대인 일본 문화를 겨냥한 제품출시와 협력까지 성사돼,중립,100,0,0
61989,61990,61990,1,일본,판매가는 정해지지 않았지만웨이브 스피커 일본 출고가는 15 만원 상당 입니다,부정,100,-0.039370644944002,-0.76752970654113
61990,61991,61991,1,일본,하지 못합니다 지금이 웨이브 스피커는 일본 현지에서 일본 라인 본사에 개발로,중립,100,0,0
61991,61992,61992,1,일본,지금이 웨이브 스피커는 일본 현지에서 일본 라인 본사에 개발로 동일한 모델이,중립,100,0,0
61992,61993,61993,1,일본,때문에 한국 시장의 세 배인 일본 시장에서 먼저 입지를 굳히고 한국으로,중립,100,0,0
61993,61994,61994,1,일본,그 외에도 소니 일본 최대 장난감 제조사인 다카라 토미,긍정,100,0.051970746580935,0.99977992957746
61994,61995,61995,1,일본,웨이브 ( WAVE ) ' 일본 라인 주식회사에서 처음 선보인 AI,중립,100,0,0
61995,61996,61996,1,일본,웨이브의 일본 정식 출고가는 1 만 5,중립,100,0,0
61996,61997,61997,1,일본,웨이브 가격은 아직 알려지지 않았습니다만 일본 가격과 크게 다르지 않을 것으로,부정,100,-0.11602537240555,-1.8664430308873
61997,61998,61998,1,일본,라인 메신저는 일본 시장에서 우리나라에서의 카카오톡 수준의 국민,중립,100,0,0
61998,61999,61999,1,일본,그런지 네이버의 스마트 디바이스들은 우선 일본 시장을 겨냥해서 개발되고 있습니다,긍정,100,0.077070854244239,0.89363768819815
61999,62000,62000,1,일본,가격은 15 만원으로 일본 가격 ( 1 만 5000,중립,100,0,0
62000,62001,62001,1,일본,단위 투자네이버는 지난 3 월 일본 메신저 자회사 라인과 함께 개발한,중립,100,0,0
62001,62002,62002,1,일본,끄는 투자처는 자회사 라인이 인수한 일본 인공지능 벤처 윈클이다,중립,100,0,0
62002,62003,62003,1,일본,일본,NA,NA,NA,NA
62004,62005,62005,1,일본,9 일 업계에 따르면 네이버는 일본 자회사 라인과 함께,중립,100,0,0
62005,62006,62006,1,일본,라인이 일본 시장에 먼저 선보이고 한국에서는 네이버가,중립,100,0,0
62010,62011,62011,1,에코,그리고 간단하게 에코 효과도 넣었습니다,긍정,100,0.26350498393337,1.4453242835596
62011,62012,62012,1,에코,등 파트너를 점차 넓혀 클로바 에코 시스템을 구축하겠다는 것이다,중립,100,0,0
62012,62013,62013,1,에코,스피커 시장점유율 1 위인 아마존의 에코 시리즈만 보더라도 일단 최대 경쟁력은,긍정,100,0.054605747973471,1.0261299435028
62013,62014,62014,1,에코,' 홈팟 ' 아마존의 ' 에코 ' 구글의 ' 구글 홈,중립,100,0,0
62014,62015,62015,1,에코,인공지능 아마존 에코 스피커가 10 만원대입니다 웨이브는 특가,중립,100,0,0
62015,62016,62016,1,에코,아마존과 구글에서 인공지능 스피커인 알렉사와 에코 홈닷을 출시해 해외 시장을 선점하고,중립,100,0,0
62016,62017,62017,1,에코,SK 누구 ' ' 아마존 에코 ' ' 네이버 웨이브 ',중립,100,0,0
62017,62018,62018,1,에코,다양한 콘텐츠 서비스 디바이스 파트너와의 에코 시스템을 구축하고 플랫폼을 확장해나갈 방침이라고,긍정,100,0.10407846690278,1.7156082695
62018,62019,62019,1,에코,아마존 ' 에코 ( echo ) ' 아마존닷컴에서,중립,100,0,0
62019,62020,62020,1,에코,아마존닷컴에서 개발한 스마트 스피커 ' 에코 ( echo ) ' 는,중립,100,0,0
62020,62021,62021,1,에코,최근 에코 2 세대인 ' 에코 플러스,중립,100,0,0
62021,62022,62022,1,에코,최근 에코 2 세대인 ' 에코 플러스 ' 가 출시되며 좀,중립,100,0,0
62022,62023,62023,1,에코,에코 ( echo ) 라는 AI,중립,100,0,0
62023,62024,62024,1,에코,에코 출시 이후에도 휴대용 버전인 ',중립,100,0,0
62024,62025,62025,1,에코,( echo dot ) ' 에코 탭 ( echo tap ),중립,100,0,0
62025,62026,62026,1,에코,5 월 아마존이 공개한 ' 에코 쇼 ' 의 영상을 함께,중립,100,0,0
62026,62027,62027,1,에코,아마존 에코 구글 홈 애플 홈팟과같은 글로벌,중립,100,0,0
62027,62028,62028,1,에코,에코,NA,NA,NA,NA
62028,62029,62029,1,에코,' 에코 ' 가,NA,NA,NA,NA
62029,62030,62030,1,에코,구글 홈 ' 아마존의 ' 에코 ' SK 텔레콤의 ' 누구,중립,100,0,0
62032,62033,62033,1,에코,미국 아마존의 AI 스피커 ' 에코 ' 처럼 이용자의 음성을 듣고,중립,100,0,0
62033,62034,62034,1,에코,가장 대표적인 제품으로는 아마존의 에코 구글의 홈 등이 있다,중립,100,0,0
62034,62035,62035,1,에코,스피커의 원조 격인 아마존 ' 에코 ' 에 맞서 새로운 기능으로,긍정,100,0.11656746031746,1.015873015873
62035,62036,62036,1,에코,스피커 시장은 아마존의 에코 알파벳 ( 구글 모회사 ),중립,100,0,0
62040,62041,62041,1,국내,AI ) 서비스가 본격화 되면서 국내 업체들은 업종을 뛰어넘어 시장 선점을,중립,100,0,0
62041,62042,62042,1,국내,국내 업체들은 그동안 축적한 한국어 데이터가있기,중립,100,0,0
62042,62043,62043,1,국내,해결 시기가 언제쯤이 될 지도 국내 기업들의 시장 주도권을 가질 수,긍정,100,0.14936176195502,1.6700882077855
62043,62044,62044,1,국내,국내 / 외기업들의 AI 에 대한,중립,100,0,0
62044,62045,62045,1,국내,^ ^ ) 그야말로 국내 AI 스피커 시장의 춘추전국시대가 열리지,중립,100,0,0
62045,62046,62046,1,국내,' 생태계 ' 선점 ' 국내 인공지능 ( AI ) 플랫폼,중립,100,0,0
62046,62047,62047,1,국내,하는 시장 ' 이라면서 ' 국내 대표 ICT 기업들의 인공지능과 생태계,중립,100,0,0
62047,62048,62048,1,국내,; ; ) 특히 네이버는 국내 최대의 데이타 베이스를 가지고 있는,긍정,100,0.079660849847185,1.0376984126984
62048,62049,62049,1,국내,웨이브 ' 카카오 미니와 더불어 국내 AI 스마트 스피커로 주목을 받는,중립,100,0,0
62049,62050,62050,1,국내,웨이브는 국내 최대 포털사이트 네이버에서 선보인 만큼,긍정,100,0.096584964046395,1.2527521761393
62050,62051,62051,1,국내,주요 통신사 위주로 움직이고 있었던 국내 AI 시장이 스마트 스피커를 통한,중립,100,0,0
62051,62052,62052,1,국내,네이버와 카카오 등의 국내 IT 기업들의 도전이 더욱 거세질,중립,100,0,0
62053,62054,62054,1,국내,' 구글홈 ' 이 조만간 국내 출시를 앞두고 있기 때문으로 보입니다,중립,100,0,0
62054,62055,62055,1,국내,' 웨이브 ' 는 아직 국내 출시를 목표로 하고 있지는 않지만,부정,100,0.043622305355326,0.01027417027417
62055,62056,62056,1,국내,IT 기업들이 분주하고 있는 가운데 국내 기업들도 동참하고 있습니다,중립,100,0,0
62056,62057,62057,1,국내,올초 CES2017 에서 혁신상을 수상하며 국내 판매를 시작 했다,긍정,100,0.090096104612234,1.1669226830517
62057,62058,62058,1,국내,같은 해인 2007 년 탄생한 국내 1 위 안마의자 브랜드 바디,중립,100,0,0
62058,62059,62059,1,국내,기대를 많이 했었던 국내 인공지능 스피커인 네이버 웨이브는 현재,긍정,100,0.099935558268892,1.1436507936508
62059,62060,62060,1,국내,아직은 카카오미니가 갈길이 멀지만 그래도 국내 인공지능 스피커 중에서 가장 기대되는건,부정,50.632911392405,0.023094096586596,0.039093209657726
62060,62061,62061,1,국내,국내 검색서비스의 대표주자 격인 naver 에서,중립,100,0,0
62061,62062,62062,1,국내,국내 스마트싱큐앱으로 네이버 클로바 웨이브와 연동이,중립,100,0,0
62062,62063,62063,1,국내,국내 스마트 씽큐앱은 구글홈과는 현재 연동이,중립,100,0,0
62063,62064,62064,1,국내,GiGA Genie ) 에 이어 국내 양대 포털도 가세했다,중립,100,0,0
62064,62065,62065,1,국내,그러나 국내 음원을 주로 듣는다면 유의미한 차이를,중립,100,0,0
62065,62066,62066,1,국내,국내,NA,NA,NA,NA
62067,62068,62068,1,국내,국내 인터넷 포털업체를 대표하는 카카오 와,중립,100,0,0
62068,62069,62069,1,국내,카카오의 주가가 고공행진하는 데는모바일메신저 국내 1 위 카톡을 기반으로 다양한,중립,100,0,0
62069,62070,62070,1,국내,( Soft Wave 2018 ) 국내 최대 소프트웨어 전시회 < 소프트웨이브,긍정,100,0.069703243616287,1.0376984126984
62070,62071,62071,1,국내,' Made in Korea ' 국내 생산품입니다,중립,100,0,0
62071,62072,62072,1,국내,국내 인공지능 시장에 포문을 열었던 SKT,중립,100,0,0
62072,62073,62073,1,국내,앞으로 국내 인공지능 시장은 누가 더 다양하고,중립,100,0,0
62074,62075,62075,1,국내,국내 인공지능 기반 음성인식 스피커의 시장이,중립,100,0,0
62075,62076,62076,1,국내,' 인공지능 스피커 시장이 급성장하자 국내 통신사들도 발 빠르게 대응하고 있습니다,중립,100,0,0
62076,62077,62077,1,국내,국내 AI 스피커의 장점은 한국어 인식이,긍정,100,0.20871281117183,1.2760863908405
62077,62078,62078,1,국내,부쩍 많이 오르내리는 주제인 인공지능의 국내 수준을 확인해 보고 관련 어플리케이션의,중립,100,0,0
62078,62079,62079,1,국내,소개된 영역이지만 이번 MWC 에서 국내 SK 텔레콤은 ' 누구 ',중립,100,0,0
62080,62081,62081,1,국내,가능 ( mbc 제외 ) 국내 스마트 스피커의 시작 누구 NUGU,긍정,100,0.16126589459923,1.0396825396825
62081,62082,62082,1,국내,과 비슷할 것으로 예정이 되며 국내 판매는 아직 미정입니다,중립,100,0,0
62082,62083,62083,1,국내,스피커중에서 네이버의 웨이브를 선택한 이유는 국내 제일의 포털로써 가지고 있는 풍부한,긍정,100,0.081403300314327,1.2255756762799
62083,62084,62084,1,국내,아직 국내 판매 계획은 확정되지 못했지만 8,중립,100,0,0
62086,62087,62087,1,국내,국내에 최적화된 검색엔진 기술 등이 국내 이용자에게 좀 더 최적화 돼,중립,100,0,0
62087,62088,62088,1,국내,일단 네이버는 국내 사용자들이 가장 많이 찾는 검색,중립,100,0,0
62088,62089,62089,1,국내,검색 결과의 일부 불만들도 있지만 국내 사용자에게 최적화된 정보들이 가장 많은,중립,100,-0.015503471271168,0.13017495133647
62089,62090,62090,1,국내,2010 년 국내 최초로 모바일 음성검색 서비스를 도입했고,중립,100,0,0
62090,62091,62091,1,국내,또 ▲ 국내 음악 서비스 1 위 ',중립,100,0,0
62091,62092,62092,1,국내,바꾼 ' 카카오택시 ' ▲ 국내 2 위 모바일 내비게이션 ',중립,100,0,0
62092,62093,62093,1,국내,내비게이션 ' 카카오내비 ' ▲ 국내 2 위 검색포털 ' 다음,중립,100,0,0
62093,62094,62094,1,국내,경쟁을 펼치듯 AI 비서 시장에서는 국내 인터넷 업계의 두 강자가 어떤,중립,100,0,0
62112,62113,62113,1,국내,국내 대표적인 인터넷 기업인 네이버와 카카오가,중립,100,0,0
62113,62114,62114,1,국내,음원 자회사 멜론 등을 통해 국내 이용자들에 대한 방대한 데이터를 확보하고,중립,100,0,0
62114,62115,62115,1,국내,것 ' 이라며 ' 앞으로 국내 시장을 놓고 네이버 · 카카오가,중립,100,0,0
62115,62116,62116,1,국내,( WAVE ) 를 예정으로 국내 AI 스피커 경쟁이 진행될 예정,중립,100,0,0
62117,62118,62118,1,국내,KT 등 통신업체가 주도하고 있는 국내 인공지능 ( AI ) 스피커,중립,100,0,0
62118,62119,62119,1,국내,모바일 메신저 카카오톡 라인 등으로 국내 인터넷 업계 대표주자로 꼽히는 네이버와,중립,100,0,0
62119,62120,62120,1,국내,3 · 4 분기 중으로 국내 시장 AI 스피커를 선보일 계획이다,중립,100,0,0
62120,62121,62121,1,국내,웨이브 ' 日 선출시 … 국내 상륙도 초읽기 7 월 31,중립,100,0,0
62121,62122,62122,1,국내,4 분기 중으로 AI 스피커를 국내 이용자들에게 선보일 예정이다,중립,100,0,0
62122,62123,62123,1,국내,곧 국내 시장에도 ' 웨이브 ' 를,중립,100,0,0
62135,62136,62136,1,국내,스피커를 잇달아 내놓은 데 이어 국내,중립,100,0,0
62136,62137,62137,1,국내,' 누구 ' 를 출시하며 국내 시장에서 가장 빠르게 가입자를 확대하고,중립,100,0,0
62144,62145,62145,1,국내,국내 IT 업체들이 앞다투어 개발하고 선보이고,부정,100,-0.049975198412698,-0.58730158730159
62145,62146,62146,1,국내,재생 기능은 핵심적인 부분인데요 그래서 국내 IT 기업들은 음원업체와의 제휴를 통해,중립,100,0,0
62146,62147,62147,1,국내,기가지니 ' 를 개발해 출시했는데요 국내 1 위인 IPTV 와 연계된,중립,100,0,0
62147,62148,62148,1,국내,출시가 추석 연휴 이후로 예고되면서 국내 인터넷 서비스 투톱 간 AI,긍정,100,0.085889488471582,1.4353504109233
62148,62149,62149,1,국내,야심작인 ' 웨이브 ' 를 국내 출시한다,중립,100,0,0
62149,62150,62150,1,국내,주문 기능을 선보일 계획 VS 국내 1 위 배달앱인 배달의 민족과,중립,100,0,0
62150,62151,62151,1,국내,년 ' 해외 진출 기업의 국내 복귀 지원에 관한 법이 시행됐지만,긍정,100,0.12638817881363,1.0934341851411
62339,62340,62340,1,가격,역시 가격 앞에는 장사가 없습니다,부정,100,-0.00282955140098,-0.3693513769144
62340,62341,62341,1,가격,시작 … 네이버 크기 · 가격 대폭 낮춘 ' 프렌즈 ',긍정,100,0.10583018035289,1.1869651086241
62341,62342,62342,1,가격,카카오미니와의 가격 차도 1 만 원으로 좁혀진,중립,100,0,0
62342,62343,62343,1,가격,가격 역시 다르게 책정되어 있으니 만약,중립,100,0,0
62343,62344,62344,1,가격,미니에 비해 무게가 나가는 것과 가격 면에서 비싸다는 점이 다소 아쉬워,부정,100,-0.043583248719596,-0.73365302405115
62346,62347,62347,1,가격,) 정확한 가격 참고하시길 바래요아 참 이 패키지는,긍정,100,0.10130149281935,1.0141156462585
62347,62348,62348,1,가격,등 작은 SUV 차를 보다가 가격 대비 실내가 그리 넓은 편이,중립,100,0,0
62348,62349,62349,1,가격,넓은 편이 아니라 소나타를 보다가 가격 면에서 아반테로 협상,부정,100,-0.020585679644305,-0.29060255915492
62349,62350,62350,1,가격,돈 걱정만 하면 어떡하지 했는데 가격 대비 만족이에요,부정,100,-0.027049970705986,-0.42881867124257
62350,62351,62351,1,가격,여기서 주목해야할 점은 ' 가격 ' 입니다,부정,100,-0.022340754483612,-0.53066106825505
62351,62352,62352,1,가격,모르겠지만 카카오의 브랜드 파워와 저렴한 가격 그리고 멜론 1 년 이용권,부정,100,-0.042779300775036,-0.84977324263039
62352,62353,62353,1,가격,발등에 불떨어진 네이버에서도 가격 이벤트를 진행할지 미지수 입니다,부정,100,-0.085496690258595,-0.95128839414554
62353,62354,62354,1,가격,일어 중국어 지원 ) 주식 가격 및 환율 정보 교통정보 미세먼지,긍정,100,0.092795690943346,1.4685137944067
62354,62355,62355,1,가격,미니 ( KAKAO MINI ) 가격 \ 59000 원,중립,100,0,0
62355,62356,62356,1,가격,' 카카오미니 ' 보다 비싼 가격 메신저와 연동할 수 있는 기능이,부정,100,-0.0507385628451,-0.7108843537415
62356,62357,62357,1,가격,가격은 15 만원으로 일본 가격 ( 1 만 5000 엔,중립,100,0,0
62357,62358,62358,1,가격,가격,NA,NA,NA,NA
62358,62359,62359,1,가격,네이버 웨이브에 비해 절반도 안되는 가격 ( 특판 예구 기준 ),중립,100,0,0
62360,62361,62361,1,가격,- 가격 차이는 웨이브가 만원이 더 비싸지만,부정,100,-0.12022549132647,-0.97559023609444
62361,62362,62362,1,선택,더 좋은 웨이브 스피커를 스피커를 선택 하였습니다 저는 웨이브 스피커를 멜론,긍정,100,0.10985915492958,1.0985915492958
62362,62363,62363,1,선택,나오고 소리도 좋더라구요오 역시 인공지능스피커네이버프렌즈스피커로 선택 잘한거 같아요전원버튼은 아래쪽에있다는사실브라운스피커 코를누르면 일시정지,긍정,100,0.10798857043158,1.3140446633608
62363,62364,62364,1,선택,인공지능 스피커에는브라운과 샐리가 있는데우리는 브라운으로 선택,중립,100,0,0
62364,62365,62365,1,선택,종 3 가지 종류 중 선택,중립,100,0,0
62365,62366,62366,1,선택,내껀 브라운 브라운에 어울리는 다크레드를 선택 왔다 택배,긍정,100,0.11708413792262,1.2389424264888
62366,62367,62367,1,선택,샐리와 브라운인데 난 브라운 선택,중립,100,0,0
62367,62368,62368,1,선택,나는 브라운으로 선택,중립,100,0,0
62371,62372,62372,1,프렌즈,프렌즈 스피커의 보다 자세하고 일목요연한 기능은,중립,100,0,0
62373,62374,62374,1,프렌즈,프렌즈,NA,NA,NA,NA
62374,62375,62375,1,프렌즈,전에 개봉기를 올렸던 네이버 클로바 프렌즈 브라운 스피커,중립,100,0,0
62375,62376,62376,1,프렌즈,일단 네이버 프렌즈 클로바 프렌즈 스피커를 네트워크에 등록시키려면,중립,100,0,0
62376,62377,62377,1,프렌즈,일단 네이버 프렌즈 클로바 프렌즈 스피커를 네트워크에 등록시키려면 스마트폰에 클로바,중립,100,0,0
62377,62378,62378,1,프렌즈,어찌 되었든 와이파이가 연결된 상태에서 프렌즈 스피커가 켜진 상태로 어플이 하라는,중립,100,0,0
